user_input,retrieved_contexts,response,reference,faithfulness,answer_relevancy,context_precision,context_recall,answer_correctness
Bệnh bang có thể dùng vị thuốc hoặc bài thuốc nào để chữa?,"['[{""ChuThe"": ""Bệnh Băng huyết"", ""QuanHe"": ""Được chữa bằng (ViThuoc)"", ""DoiTuong"": ""Vị thuốc Sim"", ""LieuDung"": ""Quả sim tươi hoặc khô $12-20g$"", ""CachDung"": ""Sắc uống"", ""GhiChu"": ""Sản hậu""}, {""ChuThe"": ""Bệnh Băng huyết"", ""QuanHe"": ""Được chữa bằng (ViThuoc)"", ""DoiTuong"": ""Vị thuốc Củ nâu"", ""LieuDung"": ""Tham khảo liều dùng chung của vị thuốc"", ""CachDung"": ""Chỉ định lâm sàng theo kinh nghiệm"", ""GhiChu"": ""CT_VT_VN_T456""}, {""ChuThe"": ""Kinh Túc thái dương bàng quang"", ""QuanHe"": ""Được chữa bằng (ViThuoc)"", ""DoiTuong"": ""Vị thuốc Khiên ngưu"", ""LieuDung"": ""Tham khảo liều dùng chung của vị thuốc"", ""CachDung"": ""Không ghi rõ"", ""GhiChu"": ""CT_VT_VN_T460""}, {""ChuThe"": ""Bệnh Nóng trong bàng quang"", ""QuanHe"": ""Được chữa bằng (ViThuoc)"", ""DoiTuong"": ""Vị thuốc Dưa hấu"", ""LieuDung"": ""Vỏ quả giữa hay vỏ quả ngoài (tây qua bì) $10-40g$"", ""CachDung"": ""Sắc với nửa lít nước, đun sôi $15$ phút, uống thay nước trong ngày"", ""GhiChu"": ""CT_VT_VN_T946""}, {""ChuThe"": ""Triệu chứng Băng lậu"", ""QuanHe"": ""Được chữa bằng (ViThuoc)"", ""DoiTuong"": ""Vị thuốc Lộc nhung (mã nhung)"", ""LieuDung"": ""Tham khảo liều dùng chung của vị thuốc"", ""CachDung"": ""Tham khảo cách dùng chung của vị thuốc"", ""GhiChu"": ""Mọi trường hợp hư tổn trong cơ thể, nam giới hư hao, tinh kém, hoa mắt, hoạt tinh; nữ giới bàng lậu, đới hạ""}, {""ChuThe"": ""Bệnh Băng huyết"", ""QuanHe"": ""Được chữa bằng (ViThuoc)"", ""DoiTuong"": ""Vị thuốc A giao (Minh giao)"", ""LieuDung"": ""Tham khảo liều dùng chung của vị thuốc"", ""CachDung"": ""Chỉ định lâm sàng theo kinh nghiệm"", ""GhiChu"": """"}, {""ChuThe"": ""Bệnh Băng lậu"", ""QuanHe"": ""Được chữa bằng (ViThuoc)"", ""DoiTuong"": ""Vị thuốc A giao (Minh giao)"", ""LieuDung"": ""Tham khảo liều dùng chung của vị thuốc"", ""CachDung"": ""Chỉ định lâm sàng theo kinh nghiệm"", ""GhiChu"": """"}, {""ChuThe"": ""Bệnh Băng trung"", ""QuanHe"": ""Được chữa bằng (ViThuoc)"", ""DoiTuong"": ""Vị thuốc Mộc tặc"", ""LieuDung"": ""Tham khảo liều dùng chung của vị thuốc"", ""CachDung"": ""Chỉ định lâm sàng theo kinh nghiệm"", ""GhiChu"": ""Mắt đau chảy nước mắt, trĩ, huyết lỵ, băng trung | Mộc tặc | Chỉ định lâm sàng theo kinh nghiệm | [Nguồn]: CT_VT_VN_T258""}, {""ChuThe"": ""Bệnh Viêm bàng quang"", ""QuanHe"": ""Được chữa bằng (ViThuoc)"", ""DoiTuong"": ""Vị thuốc Thạch vĩ"", ""LieuDung"": ""$6-12g$ mỗi ngày"", ""CachDung"": ""Sắc uống"", ""GhiChu"": ""CT_VT_VN_T265""}, {""ChuThe"": ""Bệnh Băng huyết"", ""QuanHe"": ""Được chữa bằng (ViThuoc)"", ""DoiTuong"": ""Vị thuốc Mẫu lệ"", ""LieuDung"": ""Tham khảo liều dùng chung của vị thuốc"", ""CachDung"": ""Dùng ngoài để chữa mụn nhọt, lở loét."", ""GhiChu"": ""Chỉ định lâm sàng theo kinh nghiệm | [Nguồn]: CT_VT_VN_T501, Vỏ hầu | Dùng ngoài để chữa mụn nhọt, lở loét. Chỉ định lâm sàng theo kinh nghiệm | [Nguồn]: CT_VT_VN_T501, Đau dạ dày thừa nước chua, bồi bổ cơ thể suy nhược, mồ hôi trộm, băng huyết | Vỏ hầu | Dùng ngoài để chữa mụn nhọt, lở loét. Chỉ định lâm sàng theo kinh nghiệm | [Nguồn]: CT_VT_VN_T501, Thuốc bổ, chữa bệnh có nhiều mồ hôi | Mẫu lệ $10g$, hoàng kỳ $4g$, ma hoàng căn $4g$, cám $10g$ | Sắc với nước $600ml$ còn $200ml$, chia làm nhiều lần uống trong ngày | [Nguồn]: CT_VT_VN_T501, Thuốc chữa khí hư, bạch đới | Hoa hoè $40g$, mẫu lệ (nung rồi tán nhỏ) $40g$ | Chỉ định lâm sàng (không ghi rõ liều) | [Nguồn]: CT_VT_VN_T501, Mụn nhọt mới sưng, chưa thành mủ | Phấn mẫu lệ | Hoà nước mà bôi, khô lại bởi | [Nguồn]: CT_VT_VN_T502""}, {""ChuThe"": ""Bệnh Tích bụng bằng"", ""QuanHe"": ""Được chữa bằng (ViThuoc)"", ""DoiTuong"": ""Vị thuốc Cói"", ""LieuDung"": ""Tham khảo liều dùng chung của vị thuốc"", ""CachDung"": ""Chỉ định lâm sàng theo kinh nghiệm"", ""GhiChu"": ""CT_VT_VN_T271""}, {""ChuThe"": ""Bệnh Băng huyết"", ""QuanHe"": ""Được chữa bằng (ViThuoc)"", ""DoiTuong"": ""Vị thuốc Quy bản và Cao quy bản"", ""LieuDung"": ""Tham khảo liều dùng chung của vị thuốc"", ""CachDung"": ""Chỉ định lâm sàng theo kinh nghiệm"", ""GhiChu"": ""[Nguồn]: CT_VT_VN_T1018""}, {""ChuThe"": ""Bệnh Băng lậu"", ""QuanHe"": ""Được chữa bằng (ViThuoc)"", ""DoiTuong"": ""Vị thuốc Quy bản và Cao quy bản"", ""LieuDung"": ""Tham khảo liều dùng chung của vị thuốc"", ""CachDung"": ""Chỉ định lâm sàng theo kinh nghiệm"", ""GhiChu"": ""[Nguồn]: CT_VT_VN_T1018""}, {""ChuThe"": ""Bệnh Viêm bàng quang"", ""QuanHe"": ""Được chữa bằng (ViThuoc)"", ""DoiTuong"": ""Vị thuốc Rau dừa nước"", ""LieuDung"": ""$100g$ khô"", ""CachDung"": ""Sắc uống liên tục từ 5 đến 10 ngày"", ""GhiChu"": ""không do sỏi, lao bàng quang, lao thận. CT_VT_VN_T274""}, {""ChuThe"": ""Bệnh Băng huyết"", ""QuanHe"": ""Được chữa bằng (ViThuoc)"", ""DoiTuong"": ""Vị thuốc Tàm sa"", ""LieuDung"": ""$15$g"", ""CachDung"": ""Uống mỗi ngày, có thể dùng rượu chiêu thuốc"", ""GhiChu"": ""Tầm sa sao vàng tán nhỏ""}, {""ChuThe"": ""Bệnh Bang"", ""QuanHe"": ""Được chữa bằng (ViThuoc)"", ""DoiTuong"": ""Vị thuốc Sài đất"", ""LieuDung"": ""Tham khảo liều dùng chung của vị thuốc"", ""CachDung"": ""Chỉ định lâm sàng theo kinh nghiệm"", ""GhiChu"": ""CT_VT_VN_T102"", ""sort_weight"": 3.0}, {""ChuThe"": ""Bệnh Viêm bàng quang"", ""QuanHe"": ""Được chữa bằng (ViThuoc)"", ""DoiTuong"": ""Vị thuốc Sài đất"", ""LieuDung"": ""Tham khảo liều dùng chung của vị thuốc"", ""CachDung"": ""Chỉ định lâm sàng theo kinh nghiệm"", ""GhiChu"": ""CT_VT_VN_T102""}, {""ChuThe"": ""Bệnh Bàng quang"", ""QuanHe"": ""Được chữa bằng (ViThuoc)"", ""DoiTuong"": ""Vị thuốc Kim tiền thảo"", ""LieuDung"": ""$10-30g$"", ""CachDung"": ""Dạng thuốc sắc. Dùng riêng hay phối hợp với nhiều vị thuốc khác"", ""GhiChu"": ""[Nguồn]: CT_VT_VN_T283""}, {""ChuThe"": ""Bệnh Sỏi bàng quang"", ""QuanHe"": ""Được chữa bằng (ViThuoc)"", ""DoiTuong"": ""Vị thuốc Lá tiết dê"", ""LieuDung"": ""Tham khảo liều dùng chung của vị thuốc"", ""CachDung"": ""Chưa ghi nhận"", ""GhiChu"": ""CT_VT_VN_T288""}, {""ChuThe"": ""Bệnh Viêm bàng quang"", ""QuanHe"": ""Được chữa bằng (ViThuoc)"", ""DoiTuong"": ""Vị thuốc Lá tiết dê"", ""LieuDung"": ""Tham khảo liều dùng chung của vị thuốc"", ""CachDung"": ""Chưa ghi nhận"", ""GhiChu"": ""CT_VT_VN_T288""}, {""ChuThe"": ""Bệnh Băng huyết"", ""QuanHe"": ""Được chữa bằng (ViThuoc)"", ""DoiTuong"": ""Vị thuốc Huyết dụ"", ""LieuDung"": ""Tham khảo liều dùng chung của vị thuốc"", ""CachDung"": ""Lá cây huyết dụ"", ""GhiChu"": ""sau khi đẻ vì rò tử cung hoặc trong những trường hợp nhau tiền đạo, thai và nhau ra rồi còn băng huyết | Chỉ định lâm sàng theo kinh nghiệm | [Nguồn]: CT_VT_VN_T302""}, {""ChuThe"": ""Bệnh Băng huyết"", ""QuanHe"": ""Được chữa bằng (ViThuoc)"", ""DoiTuong"": ""Vị thuốc Nhàu"", ""LieuDung"": ""Tham khảo liều dùng chung của vị thuốc"", ""CachDung"": ""Ăn với muối"", ""GhiChu"": ""Quả nhàu""}, {""ChuThe"": ""Triệu chứng Băng huyết"", ""QuanHe"": ""Được chữa bằng (ViThuoc)"", ""DoiTuong"": ""Vị thuốc Trúc như"", ""LieuDung"": ""Tham khảo liều dùng chung của vị thuốc"", ""CachDung"": ""Tẩm nước gừng sao"", ""GhiChu"": ""Sốt, buồn bực, nôn mửa, nôn ra máu, chảy máu cam, băng huyết""}, {""ChuThe"": ""Triệu chứng Báng bụng"", ""QuanHe"": ""Được chữa bằng (ViThuoc)"", ""DoiTuong"": ""Vị thuốc Xạ can"", ""LieuDung"": ""Tham khảo liều dùng chung của vị thuốc"", ""CachDung"": ""Giã nhỏ, vắt lấy nước uống, hễ thấy lợi tiểu tiện thì thôi"", ""GhiChu"": """"}, {""ChuThe"": ""Bệnh Băng huyết"", ""QuanHe"": ""Được chữa bằng (ViThuoc)"", ""DoiTuong"": ""Vị thuốc Đơn trăng (Hé mọ)"", ""LieuDung"": ""$10-20g$"", ""CachDung"": ""Dùng dưới dạng thuốc sắc hay giã nát, đắp"", ""GhiChu"": ""[Nguồn]: CT_VT_VN_T220""}, {""ChuThe"": ""Bệnh Băng huyết"", ""QuanHe"": ""Được chữa bằng (ViThuoc)"", ""DoiTuong"": ""Vị thuốc Phục long can"", ""LieuDung"": ""Tham khảo liều dùng chung của vị thuốc"", ""CachDung"": ""Không rõ"", ""GhiChu"": ""CT_VT_VN_T1063""}, {""ChuThe"": ""Bệnh Băng huyết"", ""QuanHe"": ""Được chữa bằng (ViThuoc)"", ""DoiTuong"": ""Vị thuốc Vị thuốc"", ""LieuDung"": ""7 quả"", ""CachDung"": ""Thiêu tồn tính, tán nhỏ, chia làm ba lần uống trong ngày. Dùng nước cơm để chiêu thuốc"", ""GhiChu"": """"}, {""ChuThe"": ""Bệnh Băng huyết"", ""QuanHe"": ""Được chữa bằng (ViThuoc)"", ""DoiTuong"": ""Vị thuốc Đu đủ"", ""LieuDung"": ""Tham khảo liều dùng chung của vị thuốc"", ""CachDung"": ""Rễ đu đủ sắc uống"", ""GhiChu"": ""Người""}, {""ChuThe"": ""Bệnh Băng huyết"", ""QuanHe"": ""Được chữa bằng (ViThuoc)"", ""DoiTuong"": ""Vị thuốc Dâu"", ""LieuDung"": ""Tang bạch bì $6-18g$"", ""CachDung"": ""Dưới dạng thuốc sắc hay thuốc bột"", ""GhiChu"": ""CT_VT_VN_T739""}, {""ChuThe"": ""Bệnh Băng huyết"", ""QuanHe"": ""Được chữa bằng (ViThuoc)"", ""DoiTuong"": ""Vị thuốc Mướp"", ""LieuDung"": ""Tham khảo liều dùng chung của vị thuốc"", ""CachDung"": ""Uống"", ""GhiChu"": ""Xơ mướp đốt tồn tính""}]']","Dựa trên y văn, **Sài đất** có thể được dùng để chữa bệnh bang. Liều dùng và cách dùng của vị thuốc này nên được chỉ định lâm sàng theo kinh nghiệm.

**Thông tin tham khảo thêm:**

*   **Kim tiền thảo**: Có thể dùng để chữa bệnh bàng quang với liều dùng 10-30g dưới dạng thuốc sắc, dùng riêng hoặc phối hợp với nhiều vị thuốc khác.
*   **Lá tiết dê**: Có thể dùng để chữa bệnh sỏi bàng quang và viêm bàng quang. Liều dùng và cách dùng của vị thuốc này cần tham khảo liều dùng chung.
*   **Rau dừa nước**: Có thể dùng để chữa bệnh viêm bàng quang (không do sỏi, lao bàng quang, lao thận) với liều dùng 100g khô, sắc uống liên tục từ 5 đến 10 ngày.
*   **Sài đất**: Có thể dùng để chữa bệnh viêm bàng quang. Liều dùng và cách dùng của vị thuốc này nên được chỉ định lâm sàng theo kinh nghiệm.
*   **Thạch vĩ**: Có thể dùng để chữa bệnh viêm bàng quang với liều dùng 6-12g mỗi ngày, sắc uống.
*   **Dưa hấu**: Vỏ quả giữa hay vỏ quả ngoài (tây qua bì) có thể dùng để chữa bệnh nóng trong bàng quang với liều dùng 10-40g, sắc với nửa lít nước, đun sôi 15 phút, uống thay nước trong ngày.
*   **Cói**: Có thể dùng để chữa bệnh tích bụng bằng. Liều dùng và cách dùng của vị thuốc này nên được chỉ định lâm sàng theo kinh nghiệm.","Bỏng Xương rồng, Sài đất",1.0,0.45201444711556577,0.9999999999,0.0,0.36733111562970017
"Để chữa bệnh thủy đậu, vị thuốc bách thảo sương được dùng với liều lượng và cách thức như thế nào?","['[{""ChuThe"": ""Vị thuốc Bách thảo sương"", ""QuanHe"": ""CHU_TRI_BENH"", ""DoiTuong"": ""Bệnh Thủy đậu"", ""LieuDung"": ""Chưa ghi nhận"", ""CachDung"": ""Trộn với mỡ lợn bôi vào nơi chốc đã rửa sạch."", ""GhiChu"": ""[Nguồn]: CT_VT_VN_T308"", ""sort_weight"": 3.0}]']","Để chữa bệnh thủy đậu, **Bách thảo sương** được dùng như sau:

*   **Liều dùng:** Chưa ghi nhận.
*   **Cách dùng:** Trộn với mỡ lợn bôi vào nơi chốc đã rửa sạch.","Để chữa bệnh thủy đậu, vị thuốc bách thảo sương có liều dùng: Theo chỉ định và cách dùng: Trộn với mỡ lợn bôi vào nơi chốc đã rửa sạch.",1.0,0.0,0.9999999999,1.0,0.4554050765256147
Vị thuốc gừng tươi có chứa hoạt chất cnidium không?,['Không có dữ liệu'],"Không. Dựa trên dữ liệu y văn hiện tại, không có ghi nhận nào cho thấy gừng tươi có liên quan hoặc tác dụng tới cnidium.","Không, vị thuốc gừng tươi không chứa hoạt chất cnidium",0.0,0.8456259768106998,0.0,0.0,0.7413851424653322
Thuốc nào vừa có tính ôn vừa trực tiếp chữa bệnh lở loét?,"['[{""ChuThe"": ""Vị thuốc Ké đầu ngựa"", ""QuanHe"": ""Thỏa mãn đồng thời"", ""DoiTuong"": ""Ôn và Bệnh Lở loét"", ""LieuDung"": ""Chưa ghi nhận"", ""CachDung"": ""Chưa ghi nhận"", ""GhiChu"": """"}, {""ChuThe"": ""Vị thuốc Tía tô dại"", ""QuanHe"": ""Thỏa mãn đồng thời"", ""DoiTuong"": ""Ôn và Bệnh Lở loét"", ""LieuDung"": ""Chưa ghi nhận"", ""CachDung"": ""Chưa ghi nhận"", ""GhiChu"": """"}, {""ChuThe"": ""Vị thuốc Sâm cau"", ""QuanHe"": ""Thỏa mãn đồng thời"", ""DoiTuong"": ""Ôn và Bệnh Lở loét"", ""LieuDung"": ""Chưa ghi nhận"", ""CachDung"": ""Chưa ghi nhận"", ""GhiChu"": """"}, {""ChuThe"": ""Vị thuốc Dã Vôi"", ""QuanHe"": ""Thỏa mãn đồng thời"", ""DoiTuong"": ""Ôn và Bệnh Lở loét"", ""LieuDung"": ""Chưa ghi nhận"", ""CachDung"": ""Chưa ghi nhận"", ""GhiChu"": """"}, {""ChuThe"": ""Vị thuốc Hoàng kỳ"", ""QuanHe"": ""Thỏa mãn đồng thời"", ""DoiTuong"": ""Ôn và Bệnh Lo loét mạn tính"", ""LieuDung"": ""Chưa ghi nhận"", ""CachDung"": ""Chưa ghi nhận"", ""GhiChu"": """"}]']","Hệ thống y văn hiện tại ghi nhận các vị thuốc có tính ôn và có tác dụng với bệnh lở loét như sau:

*   **Ké đầu ngựa**
*   **Tía tô dại**
*   **Sâm cau**
*   **Dã Vôi**

Lưu ý: Liều dùng và cách dùng của các vị thuốc trên chưa được ghi nhận.

Thông tin tham khảo thêm:

*   Đối với bệnh lở loét mạn tính, có thể tham khảo vị thuốc **Hoàng kỳ**. Liều dùng và cách dùng của vị thuốc này chưa được ghi nhận.","Dã Vôi, Ké đầu ngựa, Sâm cau, Tía tô dại",1.0,0.44784315004670683,0.9999999999,1.0,0.5102458023923623
Thuốc nào vừa có tính ôn vừa trực tiếp chữa bệnh ho có đờm?,['Không có dữ liệu'],Hệ thống y văn hiện tại chưa ghi nhận dữ liệu về vấn đề này.,"Dâu, Tắc kè",1.0,0.0,0.0,0.0,0.2287710198942301
Vị thuốc trám có công năng gì?,"['[{""ChuThe"": ""Vị thuốc Trám"", ""QuanHe"": ""CO_VI"", ""DoiTuong"": ""Vị ngọt"", ""LieuDung"": ""Chưa ghi nhận"", ""CachDung"": ""Chưa ghi nhận"", ""GhiChu"": """"}, {""ChuThe"": ""Vị thuốc Trám"", ""QuanHe"": ""CO_VI"", ""DoiTuong"": ""Vị chua"", ""LieuDung"": ""Chưa ghi nhận"", ""CachDung"": ""Chưa ghi nhận"", ""GhiChu"": """"}, {""ChuThe"": ""Vị thuốc Trám"", ""QuanHe"": ""CO_TINH"", ""DoiTuong"": ""Bình"", ""LieuDung"": ""Chưa ghi nhận"", ""CachDung"": ""Chưa ghi nhận"", ""GhiChu"": """"}, {""ChuThe"": ""Vị thuốc Trám"", ""QuanHe"": ""QUY_KINH"", ""DoiTuong"": ""Phe"", ""LieuDung"": ""Chưa ghi nhận"", ""CachDung"": ""Chưa ghi nhận"", ""GhiChu"": """"}, {""ChuThe"": ""Vị thuốc Trám"", ""QuanHe"": ""CO_CHUA_HOAT_CHAT"", ""DoiTuong"": ""Pinen"", ""LieuDung"": ""Chưa ghi nhận"", ""CachDung"": ""Chưa ghi nhận"", ""GhiChu"": ""Không tìm thấy""}, {""ChuThe"": ""Vị thuốc Trám"", ""QuanHe"": ""CO_CHUA_HOAT_CHAT"", ""DoiTuong"": ""Sabinen"", ""LieuDung"": ""Chưa ghi nhận"", ""CachDung"": ""Chưa ghi nhận"", ""GhiChu"": ""Không tìm thấy""}, {""ChuThe"": ""Vị thuốc Trám"", ""QuanHe"": ""CO_CHUA_HOAT_CHAT"", ""DoiTuong"": ""Hoạt chất Tecpineol"", ""LieuDung"": ""Chưa ghi nhận"", ""CachDung"": ""Chưa ghi nhận"", ""GhiChu"": ""Không tìm thấy""}, {""ChuThe"": ""Vị thuốc Trám"", ""QuanHe"": ""CO_CHUA_HOAT_CHAT"", ""DoiTuong"": ""Hoạt chất Tecpinen"", ""LieuDung"": ""Chưa ghi nhận"", ""CachDung"": ""Chưa ghi nhận"", ""GhiChu"": ""Không tìm thấy""}, {""ChuThe"": ""Vị thuốc Trám"", ""QuanHe"": ""CHU_TRI_BENH"", ""DoiTuong"": ""Bệnh Ngộ độc"", ""LieuDung"": ""Tham khảo liều dùng chung của vị thuốc"", ""CachDung"": ""Không ghi"", ""GhiChu"": ""Giải độc, say rượu, nọc cá độc, nọc con dải""}, {""ChuThe"": ""Vị thuốc Trám"", ""QuanHe"": ""CHU_TRI_BENH"", ""DoiTuong"": ""Bệnh Hóc xương cá"", ""LieuDung"": ""5 quả"", ""CachDung"": ""Ngậm quả trám, nuốt lấy nước. Hoặc sắc 5 quả trám, lấy nước cho ngậm và nuốt"", ""GhiChu"": """"}, {""ChuThe"": ""Vị thuốc Trám"", ""QuanHe"": ""CHU_TRI_BENH"", ""DoiTuong"": ""Bệnh Ngộ độc do ăn cá độc"", ""LieuDung"": ""3 quả"", ""CachDung"": ""Sắc lấy nước uống"", ""GhiChu"": """"}, {""ChuThe"": ""Vị thuốc Trám"", ""QuanHe"": ""CHU_TRI_TRIEU_CHUNG"", ""DoiTuong"": ""Triệu chứng yết hầu sưng đau"", ""LieuDung"": ""Tham khảo liều dùng chung của vị thuốc"", ""CachDung"": ""Không ghi"", ""GhiChu"": ""Họ nhiều đờm""}, {""ChuThe"": ""Vị thuốc Trám"", ""QuanHe"": ""CO_CONG_NANG"", ""DoiTuong"": ""Công năng Cổ họng sưng đau"", ""LieuDung"": ""Ngày dùng 2-3 lần, mỗi lần $2-3g$"", ""CachDung"": ""Thêm nước nấu đặc thành cao lỏng, sau thêm phèn chua cô đặc lại lần nữa"", ""GhiChu"": """", ""sort_weight"": 3.0}, {""ChuThe"": ""Vị thuốc Trám"", ""QuanHe"": ""CO_CONG_NANG"", ""DoiTuong"": ""Công năng Lợi yết hầu"", ""LieuDung"": ""Chưa ghi nhận"", ""CachDung"": ""Chưa ghi nhận"", ""GhiChu"": """", ""sort_weight"": 3.0}, {""ChuThe"": ""Vị thuốc Trám"", ""QuanHe"": ""CO_CONG_NANG"", ""DoiTuong"": ""Công năng Sinh tân chỉ khát"", ""LieuDung"": ""Chưa ghi nhận"", ""CachDung"": ""Chưa ghi nhận"", ""GhiChu"": """", ""sort_weight"": 3.0}, {""ChuThe"": ""Vị thuốc Trám"", ""QuanHe"": ""CO_CONG_NANG"", ""DoiTuong"": ""Công năng Không độc"", ""LieuDung"": ""Chưa ghi nhận"", ""CachDung"": ""Chưa ghi nhận"", ""GhiChu"": """", ""sort_weight"": 3.0}, {""ChuThe"": ""Vị thuốc Trám"", ""QuanHe"": ""CO_CONG_NANG"", ""DoiTuong"": ""Công năng Giải độc"", ""LieuDung"": ""Chưa ghi nhận"", ""CachDung"": ""Chưa ghi nhận"", ""GhiChu"": """", ""sort_weight"": 3.0}]']","**Vị thuốc Trám** có các công năng sau:

*   Cổ họng sưng đau: Ngày dùng 2-3 lần, mỗi lần 2-3g. Thêm nước nấu đặc thành cao lỏng, sau thêm phèn chua cô đặc lại lần nữa.
*   Lợi yết hầu
*   Sinh tân chỉ khát
*   Không độc
*   Giải độc","Cổ họng sưng đau, Giải độc, Không độc, Lợi yết hầu, Sinh tân chỉ khát",1.0,0.5013527928612147,0.9999999999,1.0,0.7538523286533987
"Để chữa bệnh trẻ con đau mắt, vị thuốc dâu được dùng với liều lượng và cách thức như thế nào?",['Không có dữ liệu'],Hệ thống y văn hiện tại chưa ghi nhận dữ liệu về vấn đề này.,"Để chữa bệnh trẻ con đau mắt, vị thuốc dâu có liều dùng: Tham khảo liều dùng chung của vị thuốc và cách dùng: Cả con sâu nướng ăn hoặc ngâm rượu",1.0,0.0,0.0,0.0,0.22363721701773942
"Để chữa bệnh ho, vị thuốc ho khan, thở hổn hển lâu ngày mạch môn đông được dùng với liều lượng và cách thức như thế nào?",['Không có dữ liệu'],Hệ thống y văn hiện tại chưa ghi nhận dữ liệu về vấn đề này.,"Để chữa bệnh ho, vị thuốc ho khan, thở hổn hển lâu ngày mạch môn đông có liều dùng: Theo chỉ định và cách dùng: Nước 600ml. Sắc còn 200ml. Chia làm 3 lần uống trong ngày",1.0,0.0,0.0,0.0,0.20122660114695745
Vị thuốc rượu tà có chứa hoạt chất saponozit không?,['Không có dữ liệu'],"Không. Dựa trên dữ liệu y văn hiện tại, không có ghi nhận nào cho thấy rượu tà có liên quan hoặc tác dụng tới saponozit.","Không, vị thuốc rượu tà không chứa hoạt chất saponozit",0.0,0.7862752632131532,0.0,1.0,0.8445334443962501
Thuốc nào vừa có tính bình vừa trực tiếp chữa bệnh rắn độc cắn?,"['[{""ChuThe"": ""Vị thuốc Bảy lá một hoa"", ""QuanHe"": ""Thỏa mãn đồng thời"", ""DoiTuong"": ""Bình và Bệnh Rắn độc cắn"", ""LieuDung"": ""Chưa ghi nhận"", ""CachDung"": ""Chưa ghi nhận"", ""GhiChu"": """"}, {""ChuThe"": ""Vị thuốc Bán"", ""QuanHe"": ""Thỏa mãn đồng thời"", ""DoiTuong"": ""Bình và Bệnh Rắn độc cắn"", ""LieuDung"": ""Chưa ghi nhận"", ""CachDung"": ""Chưa ghi nhận"", ""GhiChu"": """"}]']","Hệ thống y văn hiện tại ghi nhận các vị thuốc có tính bình và được dùng để chữa trị rắn độc cắn như sau:

**Thông tin tham khảo thêm:**

*   **Vị thuốc Bảy lá một hoa**: Thỏa mãn đồng thời tính bình và chữa bệnh rắn độc cắn. Liều dùng và cách dùng chưa được ghi nhận.
*   **Vị thuốc Bán**: Thỏa mãn đồng thời tính bình và chữa bệnh rắn độc cắn. Liều dùng và cách dùng chưa được ghi nhận.","Bán, Bảy lá một hoa",0.4,0.42918298282062906,0.9999999999,1.0,0.64117119061737
Vị thuốc nhục thung dung có vị gì?,"['[{""ChuThe"": ""Vị thuốc Nhục thung dung"", ""QuanHe"": ""CO_VI"", ""DoiTuong"": ""Vị ngọt"", ""LieuDung"": ""Chưa ghi nhận"", ""CachDung"": ""Chưa ghi nhận"", ""GhiChu"": """", ""sort_weight"": 3.0}, {""ChuThe"": ""Vị thuốc Nhục thung dung"", ""QuanHe"": ""CO_VI"", ""DoiTuong"": ""Vị chua"", ""LieuDung"": ""Chưa ghi nhận"", ""CachDung"": ""Chưa ghi nhận"", ""GhiChu"": """", ""sort_weight"": 3.0}]']","Dựa trên y văn, vị thuốc **Nhục thung dung** có vị ngọt và vị chua.","Vị chua, Vị ngọt",1.0,0.6173155907120941,0.9999999999,1.0,0.9771602680337208
Thuốc nào vừa có tính hàn vừa trực tiếp chữa bệnh ho lâu ngày?,['Không có dữ liệu'],Hệ thống y văn hiện tại chưa ghi nhận dữ liệu về vấn đề này.,"Dâu, Quy bản và Cao quy bản",1.0,0.0,0.0,0.0,0.2244702556166987
Thuốc nào vừa có tính ôn vừa trực tiếp chữa bệnh cảm cúm?,"['[{""ChuThe"": ""Vị thuốc Gừng"", ""QuanHe"": ""Thỏa mãn đồng thời"", ""DoiTuong"": ""Ôn và Bệnh Cảm cúm"", ""LieuDung"": ""Chưa ghi nhận"", ""CachDung"": ""Chưa ghi nhận"", ""GhiChu"": """"}, {""ChuThe"": ""Vị thuốc Gừng"", ""QuanHe"": ""Thỏa mãn đồng thời"", ""DoiTuong"": ""Công năng Ôn trung và Bệnh Cảm cúm"", ""LieuDung"": ""Chưa ghi nhận"", ""CachDung"": ""Chưa ghi nhận"", ""GhiChu"": """"}, {""ChuThe"": ""Vị thuốc Tía tô"", ""QuanHe"": ""Thỏa mãn đồng thời"", ""DoiTuong"": ""Ôn và Bệnh Cảm cúm"", ""LieuDung"": ""Chưa ghi nhận"", ""CachDung"": ""Chưa ghi nhận"", ""GhiChu"": """"}, {""ChuThe"": ""Vị thuốc Long Não"", ""QuanHe"": ""Thỏa mãn đồng thời"", ""DoiTuong"": ""Ôn và Bệnh Cảm cúm"", ""LieuDung"": ""Chưa ghi nhận"", ""CachDung"": ""Chưa ghi nhận"", ""GhiChu"": """"}]']","Hệ thống y văn hiện tại ghi nhận các vị thuốc có tính ôn và được dùng trong điều trị bệnh cảm cúm như sau:

*   **Gừng**: Thỏa mãn đồng thời tính ôn và bệnh cảm cúm. Công năng ôn trung cũng có liên quan đến bệnh cảm cúm.
*   **Tía tô**: Thỏa mãn đồng thời tính ôn và bệnh cảm cúm.
*   **Long Não**: Thỏa mãn đồng thời tính ôn và bệnh cảm cúm.

Lưu ý: Liều dùng và cách dùng của các vị thuốc trên chưa được ghi nhận trong dữ liệu hiện tại.","Gừng, Long Não, Tía tô",1.0,0.42595422098855834,0.9999999999,1.0,0.7073123596382842
Thuốc nào vừa có tính hàn vừa trực tiếp chữa bệnh di tinh?,"['[{""ChuThe"": ""Vị thuốc Quy bản và Cao quy bản"", ""QuanHe"": ""Thỏa mãn đồng thời"", ""DoiTuong"": ""Hàn và Bệnh Di tinh"", ""LieuDung"": ""Chưa ghi nhận"", ""CachDung"": ""Chưa ghi nhận"", ""GhiChu"": """"}]']",Hệ thống y văn hiện tại chưa ghi nhận dữ liệu về vấn đề này.,"Dâu, Sen",1.0,0.0,0.0,0.0,0.20079572020937425
Thành phần hóa học của hồng đậu khấu gồm những gì?,"['[{""ChuThe"": ""Vị thuốc Hồng đậu khấu"", ""QuanHe"": ""CO_CHUA_HOAT_CHAT"", ""DoiTuong"": ""Hoạt chất Tinh dầu"", ""LieuDung"": ""Chưa ghi nhận"", ""CachDung"": ""Chưa ghi nhận"", ""GhiChu"": ""[CT_VT_VN_T420]"", ""sort_weight"": 3.0}, {""ChuThe"": ""Vị thuốc Hồng đậu khấu"", ""QuanHe"": ""CO_CHUA_HOAT_CHAT"", ""DoiTuong"": ""Hoạt chất tinh bột"", ""LieuDung"": ""Chưa ghi nhận"", ""CachDung"": ""Chưa ghi nhận"", ""GhiChu"": ""[CT_VT_VN_T420]"", ""sort_weight"": 3.0}, {""ChuThe"": ""Vị thuốc Hồng đậu khấu"", ""QuanHe"": ""CO_CHUA_HOAT_CHAT"", ""DoiTuong"": ""Hoạt chất Protit"", ""LieuDung"": ""Chưa ghi nhận"", ""CachDung"": ""Chưa ghi nhận"", ""GhiChu"": ""[CT_VT_VN_T420]"", ""sort_weight"": 3.0}]']","Thành phần hóa học của **Hồng đậu khấu** bao gồm:

*   Hoạt chất Tinh dầu
*   Hoạt chất tinh bột
*   Hoạt chất Protit","Protit, Tinh dầu, Tinh bột",1.0,0.45739349795960493,0.9999999999,1.0,0.9740846208577494
Thuốc nào vừa có tính hàn vừa trực tiếp chữa bệnh đau lưng?,['Không có dữ liệu'],Hệ thống y văn hiện tại chưa ghi nhận dữ liệu về vấn đề này.,"Dâu, Miết giáp",1.0,0.0,0.0,0.0,0.2298763099322103
Vị thuốc bạch thược có chứa hoạt chất izoquexitrin không?,['Không có dữ liệu'],"Không. Dựa trên dữ liệu y văn hiện tại, không có ghi nhận nào cho thấy bạch thược có liên quan hoặc tác dụng tới izoquexitrin.","Không, vị thuốc bạch thược không chứa hoạt chất izoquexitrin",0.0,0.8176587835410314,0.0,1.0,0.6176382368541714
Bệnh viêm phế quản cấp có thể dùng vị thuốc hoặc bài thuốc nào để chữa?,"['[{""ChuThe"": ""Bệnh Viêm phế quản cấp tính"", ""QuanHe"": ""Được chữa bằng (ViThuoc)"", ""DoiTuong"": ""Vị thuốc Đơn tướng quân"", ""LieuDung"": ""Tham khảo liều dùng chung của vị thuốc"", ""CachDung"": ""Sắc uống hoặc chế cao làm viên mà dùng"", ""GhiChu"": ""[Nguồn]: CT_VT_VN_T146""}]']","Dựa trên y văn hiện có, **Đơn tướng quân** có thể được dùng để chữa bệnh viêm phế quản cấp tính. Về liều dùng và cách dùng, bạn có thể tham khảo liều dùng chung của vị thuốc này, sắc uống hoặc chế cao làm viên mà dùng.",Đơn tướng quân,1.0,0.6315740775253544,0.9999999999,1.0,0.5206244187338738
Vị thuốc rễ cây vòi voi tham gia vào bài thuốc để chữa những bệnh gì?,"['[{""ChuThe"": ""Vị thuốc Rễ cây vòi voi"", ""QuanHe"": ""Tham gia bài thuốc [Bài thuốc Đau nhức chân tay lá lốt] để chữa"", ""DoiTuong"": ""Bệnh Đau nhức chân tay"", ""LieuDung"": ""Chưa ghi nhận"", ""CachDung"": ""Sắc với $600ml$ nước, cô còn $200ml$, chia 3 lần uống trong ngày"", ""GhiChu"": """", ""sort_weight"": 3.0}]']","Vị thuốc **Rễ cây vòi voi** được ghi nhận tham gia vào bài thuốc **Bài thuốc Đau nhức chân tay lá lốt** để chữa bệnh Đau nhức chân tay. Cách dùng như sau: Sắc với 600ml nước, cô còn 200ml, chia 3 lần uống trong ngày.",Đau nhức chân tay,1.0,0.5049199988494982,0.9999999999,1.0,0.5823297875159226
Vị thuốc cúc liên chi dại chứa hoạt chất gì?,"['[{""ChuThe"": ""Vị thuốc Cúc liên chi dại"", ""QuanHe"": ""CO_CHUA_HOAT_CHAT"", ""DoiTuong"": ""Hoạt chất Pacthenixin"", ""LieuDung"": ""Chưa ghi nhận"", ""CachDung"": ""Chưa ghi nhận"", ""GhiChu"": ""dưới dạng tinh thể không màu, bóng và đắng."", ""sort_weight"": 3.0}, {""ChuThe"": ""Vị thuốc Cúc liên chi dại"", ""QuanHe"": ""CO_CHUA_HOAT_CHAT"", ""DoiTuong"": ""Hoạt chất Parthenin"", ""LieuDung"": ""Chưa ghi nhận"", ""CachDung"": ""Chưa ghi nhận"", ""GhiChu"": ""dưới dạng vảy mỏng, đen, rất đắng, tan trong nước."", ""sort_weight"": 3.0}]']","Vị thuốc **Cúc liên chi dại** chứa các hoạt chất sau:

*   Hoạt chất **Pacthenixin** dưới dạng tinh thể không màu, bóng và đắng.
*   Hoạt chất **Parthenin** dưới dạng vảy mỏng, đen, rất đắng, tan trong nước.","Pacthenixin, Parthenin",1.0,0.5715601067570438,0.9999999999,1.0,0.5296544554421753
Vị thuốc xuyên sơn giáp có tính gì?,"['[{""ChuThe"": ""Vị thuốc Xuyên sơn giáp"", ""QuanHe"": ""CO_TINH"", ""DoiTuong"": ""Hàn"", ""LieuDung"": ""Chưa ghi nhận"", ""CachDung"": ""Chưa ghi nhận"", ""GhiChu"": """", ""sort_weight"": 3.0}, {""ChuThe"": ""Vị thuốc Xuyên sơn giáp"", ""QuanHe"": ""CO_TINH"", ""DoiTuong"": ""Lương"", ""LieuDung"": ""Chưa ghi nhận"", ""CachDung"": ""Chưa ghi nhận"", ""GhiChu"": """", ""sort_weight"": 3.0}]']","Dựa trên y văn, vị thuốc **Xuyên sơn giáp** có tính hàn và tính lương.","Hàn, Lương",1.0,0.6358366135471084,0.9999999999,1.0,0.9577465762297392
Vị thuốc nhục đậu khấu có quy kinh dai trang không?,"['[{""ChuThe"": ""Vị thuốc Nhục đậu khấu"", ""QuanHe"": ""Xác nhận: QUY_KINH"", ""DoiTuong"": ""Dai Trang"", ""LieuDung"": ""Chưa ghi nhận"", ""CachDung"": ""Chưa ghi nhận"", ""GhiChu"": """", ""sort_weight"": 3.0}]']","Dựa trên y văn, vị thuốc **Nhục đậu khấu** có quy kinh Đại Tràng.","Có, vị thuốc nhục đậu khấu có quy kinh dai trang",1.0,0.6127661487056066,0.9999999999,1.0,0.9868844331280487
Vị thuốc niệt gió có vị vị đắng không?,"['[{""ChuThe"": ""Vị thuốc Niệt gió"", ""QuanHe"": ""Xác nhận: CO_VI"", ""DoiTuong"": ""Vị đắng"", ""LieuDung"": ""Chưa ghi nhận"", ""CachDung"": ""Chưa ghi nhận"", ""GhiChu"": """", ""sort_weight"": 3.0}]']","Dựa trên y văn, vị thuốc **Niệt gió** có vị đắng.","Có, vị thuốc niệt gió có vị vị đắng",1.0,0.6092609376150623,0.9999999999,1.0,0.9867761424666651
Vị thuốc bồ ngọt tham gia vào bài thuốc để chữa những bệnh gì?,"['[{""ChuThe"": ""Vị thuốc bồ ngọt"", ""QuanHe"": ""Tham gia bài thuốc [Bài thuốc trị người gầy xanh xao giun đất] để chữa"", ""DoiTuong"": ""Bệnh Bạch đới khí hư"", ""LieuDung"": ""Chưa ghi nhận"", ""CachDung"": ""Chưa ghi nhận"", ""GhiChu"": """", ""sort_weight"": 3.0}, {""ChuThe"": ""Vị thuốc bồ ngọt"", ""QuanHe"": ""Tham gia bài thuốc [Bài thuốc trị người gầy xanh xao giun đất] để chữa"", ""DoiTuong"": ""Bệnh Phu Toan Than"", ""LieuDung"": ""Chưa ghi nhận"", ""CachDung"": ""Chưa ghi nhận"", ""GhiChu"": """", ""sort_weight"": 3.0}, {""ChuThe"": ""Vị thuốc bồ ngọt"", ""QuanHe"": ""Tham gia bài thuốc [Bài thuốc trị người gầy xanh xao giun đất] để chữa"", ""DoiTuong"": ""Bệnh Phù thận"", ""LieuDung"": ""Chưa ghi nhận"", ""CachDung"": ""Chưa ghi nhận"", ""GhiChu"": """", ""sort_weight"": 3.0}, {""ChuThe"": ""Vị thuốc bồ ngọt"", ""QuanHe"": ""Tham gia bài thuốc [Bài thuốc trị người gầy xanh xao giun đất] để chữa"", ""DoiTuong"": ""Bệnh bụng báng trướng nước"", ""LieuDung"": ""Chưa ghi nhận"", ""CachDung"": ""Chưa ghi nhận"", ""GhiChu"": """", ""sort_weight"": 3.0}, {""ChuThe"": ""Vị thuốc bồ ngọt"", ""QuanHe"": ""Tham gia bài thuốc [Bài thuốc trị người gầy xanh xao giun đất] để chữa"", ""DoiTuong"": ""Bệnh đột ngột phát điên"", ""LieuDung"": ""Chưa ghi nhận"", ""CachDung"": ""Chưa ghi nhận"", ""GhiChu"": """", ""sort_weight"": 3.0}, {""ChuThe"": ""Vị thuốc bồ ngọt"", ""QuanHe"": ""Tham gia bài thuốc [Bài thuốc trị người gầy xanh xao giun đất] để chữa"", ""DoiTuong"": ""Bệnh não bộ xuất huyết"", ""LieuDung"": ""Chưa ghi nhận"", ""CachDung"": ""Chưa ghi nhận"", ""GhiChu"": """", ""sort_weight"": 3.0}, {""ChuThe"": ""Vị thuốc bồ ngọt"", ""QuanHe"": ""Tham gia bài thuốc [Bài thuốc trị người gầy xanh xao giun đất] để chữa"", ""DoiTuong"": ""Bệnh phù tim"", ""LieuDung"": ""Chưa ghi nhận"", ""CachDung"": ""Chưa ghi nhận"", ""GhiChu"": """", ""sort_weight"": 3.0}, {""ChuThe"": ""Vị thuốc bồ ngọt"", ""QuanHe"": ""Tham gia bài thuốc [Bài thuốc trị người gầy xanh xao giun đất] để chữa"", ""DoiTuong"": ""Triệu chứng bí đại tiểu tiện"", ""LieuDung"": ""Chưa ghi nhận"", ""CachDung"": ""Chưa ghi nhận"", ""GhiChu"": """", ""sort_weight"": 3.0}, {""ChuThe"": ""Vị thuốc bồ ngọt"", ""QuanHe"": ""Tham gia bài thuốc [Bài thuốc trị người gầy xanh xao giun đất] để chữa"", ""DoiTuong"": ""Triệu chứng bí trung tiện"", ""LieuDung"": ""Chưa ghi nhận"", ""CachDung"": ""Chưa ghi nhận"", ""GhiChu"": """", ""sort_weight"": 3.0}, {""ChuThe"": ""Vị thuốc bồ ngọt"", ""QuanHe"": ""Tham gia bài thuốc [Bài thuốc trị người gầy xanh xao giun đất] để chữa"", ""DoiTuong"": ""Triệu chứng cửu khiếu xuất huyết"", ""LieuDung"": ""Chưa ghi nhận"", ""CachDung"": ""Chưa ghi nhận"", ""GhiChu"": """", ""sort_weight"": 3.0}, {""ChuThe"": ""Vị thuốc bồ ngọt"", ""QuanHe"": ""Tham gia bài thuốc [Bài thuốc trị người gầy xanh xao giun đất] để chữa"", ""DoiTuong"": ""Triệu chứng hôn mê bất tỉnh"", ""LieuDung"": ""Chưa ghi nhận"", ""CachDung"": ""Chưa ghi nhận"", ""GhiChu"": """", ""sort_weight"": 3.0}, {""ChuThe"": ""Vị thuốc bồ ngọt"", ""QuanHe"": ""Tham gia bài thuốc [Bài thuốc trị người gầy xanh xao giun đất] để chữa"", ""DoiTuong"": ""Triệu chứng người gầy xanh xao"", ""LieuDung"": ""Chưa ghi nhận"", ""CachDung"": ""Chưa ghi nhận"", ""GhiChu"": """", ""sort_weight"": 3.0}, {""ChuThe"": ""Vị thuốc bồ ngọt"", ""QuanHe"": ""Tham gia bài thuốc [Bài thuốc trị người gầy xanh xao giun đất] để chữa"", ""DoiTuong"": ""Triệu chứng ngũ tạng lục phủ xuất huyết"", ""LieuDung"": ""Chưa ghi nhận"", ""CachDung"": ""Chưa ghi nhận"", ""GhiChu"": """", ""sort_weight"": 3.0}]']","Vị thuốc **bồ ngọt** tham gia bài thuốc **[Bài thuốc trị người gầy xanh xao giun đất]** để chữa các bệnh sau:

*   Bệnh Bạch đới khí hư
*   Bệnh Phu Toan Than
*   Bệnh Phù thận
*   Bệnh bụng báng trướng nước
*   Bệnh đột ngột phát điên
*   Bệnh não bộ xuất huyết
*   Bệnh phù tim
*   Triệu chứng bí đại tiểu tiện
*   Triệu chứng bí trung tiện
*   Triệu chứng cửu khiếu xuất huyết
*   Triệu chứng hôn mê bất tỉnh
*   Triệu chứng người gầy xanh xao
*   Triệu chứng ngũ tạng lục phủ xuất huyết

Lưu ý: Liều dùng và cách dùng của vị thuốc **bồ ngọt** trong bài thuốc này chưa được ghi nhận.","Bạch đới khí hư, Phu Toan Than, Phù thận, Bụng báng trướng nước, Não bộ xuất huyết, Phù tim, Đột ngột phát điên, Bí trung tiện, Bí đại tiểu tiện, Cửu khiếu xuất huyết, Hôn mê bất tỉnh, Ngũ tạng lục phủ xuất huyết, Người gầy xanh xao",1.0,0.5633108800898853,0.9999999999,1.0,0.9464946075608208
Vị thuốc cốt toái bổ chứa hoạt chất gì?,"['[{""ChuThe"": ""Vị thuốc Cốt toái bổ"", ""QuanHe"": ""CO_CHUA_HOAT_CHAT"", ""DoiTuong"": ""Hoạt chất Hesperidin"", ""LieuDung"": ""Chưa ghi nhận"", ""CachDung"": ""Chưa ghi nhận"", ""GhiChu"": ""Drynaria fortunei"", ""sort_weight"": 3.0}]']",Vị thuốc **Cốt toái bổ** (Drynaria fortunei) chứa hoạt chất Hesperidin.,Hesperidin,1.0,0.5210351526355259,0.9999999999,1.0,0.9228117106340141
"Để chữa bệnh táo bón, vị thuốc ô môi được dùng với liều lượng và cách thức như thế nào?","['[{""ChuThe"": ""Vị thuốc Ô môi"", ""QuanHe"": ""CHU_TRI_TRIEU_CHUNG"", ""DoiTuong"": ""Triệu chứng Táo bón"", ""LieuDung"": ""$4-6g$ | $10-20g$"", ""CachDung"": ""Dùng làm thuốc nhuận tràng | Dùng làm thuốc tẩy"", ""GhiChu"": ""Quả ô môi sống"", ""sort_weight"": 3.0}]']","Để chữa táo bón, **Ô môi** có thể được dùng theo hướng dẫn sau:

*   Liều dùng:
    *   4-6g nếu dùng làm thuốc nhuận tràng.
    *   10-20g nếu dùng làm thuốc tẩy.
*   Cách dùng: Dùng quả ô môi sống.","Để chữa bệnh táo bón, vị thuốc ô môi có liều dùng: 4-6g | 10-20g và cách dùng: Dùng làm thuốc nhuận tràng | Dùng làm thuốc tẩy",1.0,0.5596910539680348,0.9999999999,1.0,0.6930894954963599
Vị thuốc xương khô có hoạt chất friedelan-3-beta-ol không?,['Không có dữ liệu'],"Không. Dựa trên dữ liệu y văn hiện tại, không có ghi nhận nào cho thấy xương khô có liên quan hoặc tác dụng tới friedelan-3-beta-ol.","Có, vị thuốc xương khô có hoạt chất friedelan-3-beta-ol",0.0,0.8683701145205843,0.0,0.0,0.2417939174856793
Cơ chế tác dụng của thương lục là gì?,"['[{""ChuThe"": ""Vị thuốc Thương lục"", ""QuanHe"": ""CO_VI"", ""DoiTuong"": ""Vị đắng"", ""LieuDung"": ""Chưa ghi nhận"", ""CachDung"": ""Chưa ghi nhận"", ""GhiChu"": """"}, {""ChuThe"": ""Vị thuốc Thương lục"", ""QuanHe"": ""CO_TINH"", ""DoiTuong"": ""Hàn"", ""LieuDung"": ""Chưa ghi nhận"", ""CachDung"": ""Chưa ghi nhận"", ""GhiChu"": """"}, {""ChuThe"": ""Vị thuốc Thương lục"", ""QuanHe"": ""QUY_KINH"", ""DoiTuong"": ""Than"", ""LieuDung"": ""Chưa ghi nhận"", ""CachDung"": ""Chưa ghi nhận"", ""GhiChu"": """"}, {""ChuThe"": ""Vị thuốc Thương lục"", ""QuanHe"": ""CO_CHUA_HOAT_CHAT"", ""DoiTuong"": ""Hoạt chất Tanin"", ""LieuDung"": ""Chưa ghi nhận"", ""CachDung"": ""Chưa ghi nhận"", ""GhiChu"": ""trong rễ cây Phytolacca decandra""}, {""ChuThe"": ""Vị thuốc Thương lục"", ""QuanHe"": ""CO_CHUA_HOAT_CHAT"", ""DoiTuong"": ""Hoạt chất Anthoxyanozit"", ""LieuDung"": ""Chưa ghi nhận"", ""CachDung"": ""Chưa ghi nhận"", ""GhiChu"": ""trong quả""}, {""ChuThe"": ""Vị thuốc Thương lục"", ""QuanHe"": ""CO_CHUA_HOAT_CHAT"", ""DoiTuong"": ""Hoạt chất Saponozit"", ""LieuDung"": ""Chưa ghi nhận"", ""CachDung"": ""Chưa ghi nhận"", ""GhiChu"": ""trong rễ thương lục""}, {""ChuThe"": ""Vị thuốc Thương lục"", ""QuanHe"": ""CO_CHUA_HOAT_CHAT"", ""DoiTuong"": ""Hoạt chất Glucozit"", ""LieuDung"": ""Chưa ghi nhận"", ""CachDung"": ""Chưa ghi nhận"", ""GhiChu"": ""trong rễ cây Phytolacca decandra""}, {""ChuThe"": ""Vị thuốc Thương lục"", ""QuanHe"": ""CO_CHUA_HOAT_CHAT"", ""DoiTuong"": ""Oxymiristinic"", ""LieuDung"": ""Chưa ghi nhận"", ""CachDung"": ""Chưa ghi nhận"", ""GhiChu"": ""trong rễ thương lục""}, {""ChuThe"": ""Vị thuốc Thương lục"", ""QuanHe"": ""CO_CHUA_HOAT_CHAT"", ""DoiTuong"": ""Phytolaccatoxin"", ""LieuDung"": ""Chưa ghi nhận"", ""CachDung"": ""Chưa ghi nhận"", ""GhiChu"": ""trong rễ thương lục""}, {""ChuThe"": ""Vị thuốc Thương lục"", ""QuanHe"": ""CO_CHUA_HOAT_CHAT"", ""DoiTuong"": ""Phytolacxic"", ""LieuDung"": ""Chưa ghi nhận"", ""CachDung"": ""Chưa ghi nhận"", ""GhiChu"": ""trong quả""}, {""ChuThe"": ""Vị thuốc Thương lục"", ""QuanHe"": ""CO_CHUA_HOAT_CHAT"", ""DoiTuong"": ""Phytolacxin"", ""LieuDung"": ""Chưa ghi nhận"", ""CachDung"": ""Chưa ghi nhận"", ""GhiChu"": ""trong rễ cây Phytolacca decandra""}, {""ChuThe"": ""Vị thuốc Thương lục"", ""QuanHe"": ""CHU_TRI_TRIEU_CHUNG"", ""DoiTuong"": ""Triệu chứng Đau đớn"", ""LieuDung"": ""Tham khảo liều dùng chung của vị thuốc"", ""CachDung"": ""Giã rễ thương lục tươi, vắt lấy nước tẩm vào bông hễ thấy lạnh lại thay. Đắp liên tiếp cho đến khi khỏi"", ""GhiChu"": ""[Nguồn]: CT_VT_VN_T292""}, {""ChuThe"": ""Vị thuốc Thương lục"", ""QuanHe"": ""CHU_TRI_TRIEU_CHUNG"", ""DoiTuong"": ""Triệu chứng Ngực bụng đầy trướng"", ""LieuDung"": ""$3-4g$"", ""CachDung"": ""Dạng thuốc sắc, dùng một vị hay phối hợp với các vị thuốc khác"", ""GhiChu"": ""[Nguồn]: CT_VT_VN_T291""}, {""ChuThe"": ""Vị thuốc Thương lục"", ""QuanHe"": ""CHU_TRI_TRIEU_CHUNG"", ""DoiTuong"": ""Triệu chứng Phù nề"", ""LieuDung"": ""$3-4g$"", ""CachDung"": ""Dạng thuốc sắc, dùng một vị hay phối hợp với các vị thuốc khác"", ""GhiChu"": ""[Nguồn]: CT_VT_VN_T291""}, {""ChuThe"": ""Vị thuốc Thương lục"", ""QuanHe"": ""CHU_TRI_TRIEU_CHUNG"", ""DoiTuong"": ""Triệu chứng Đau cổ họng"", ""LieuDung"": ""Tham khảo liều dùng chung của vị thuốc"", ""CachDung"": ""Dùng rễ thương lục nướng nóng, bọc vải chườm vào cổ"", ""GhiChu"": ""[Nguồn]: CT_VT_VN_T292""}, {""ChuThe"": ""Vị thuốc Thương lục"", ""QuanHe"": ""CO_CONG_NANG"", ""DoiTuong"": ""Công năng Cố đậu"", ""LieuDung"": ""$3-4g$"", ""CachDung"": ""Dạng thuốc sắc, dùng một vị hay phối hợp với các vị thuốc khác"", ""GhiChu"": ""[Nguồn]: CT_VT_VN_T291""}, {""ChuThe"": ""Vị thuốc Thương lục"", ""QuanHe"": ""CO_CONG_NANG"", ""DoiTuong"": ""Công năng Đại tả"", ""LieuDung"": ""Chưa ghi nhận"", ""CachDung"": ""Chưa ghi nhận"", ""GhiChu"": """"}, {""ChuThe"": ""Vị thuốc Thương lục"", ""QuanHe"": ""CO_CONG_NANG"", ""DoiTuong"": ""Công năng Khổ thổ"", ""LieuDung"": ""$3-4g$"", ""CachDung"": ""Dạng thuốc sắc, dùng một vị hay phối hợp với các vị thuốc khác"", ""GhiChu"": ""[Nguồn]: CT_VT_VN_T291""}, {""ChuThe"": ""Vị thuốc Thương lục"", ""QuanHe"": ""CO_CONG_NANG"", ""DoiTuong"": ""Công năng Lợi tiểu"", ""LieuDung"": ""Chưa ghi nhận"", ""CachDung"": ""Chưa ghi nhận"", ""GhiChu"": """"}, {""ChuThe"": ""Vị thuốc Thương lục"", ""QuanHe"": ""CO_TAC_DUNG_DUOC_LY"", ""DoiTuong"": ""Dược lý Độc tính"", ""LieuDung"": ""Chưa ghi nhận"", ""CachDung"": ""Chưa ghi nhận"", ""GhiChu"": """", ""sort_weight"": 3.0}]']",Hệ thống y văn hiện tại ghi nhận **Thương lục** có tác dụng dược lý liên quan đến độc tính.,Dược lý Độc,1.0,0.4718437315332722,0.9999999999,1.0,0.9846893755505683
Vị thuốc kha tử có công năng gì?,"['[{""ChuThe"": ""Bài thuốc Ho Kha tử"", ""QuanHe"": ""CHU_TRI_BENH"", ""DoiTuong"": ""Bệnh Ho"", ""LieuDung"": ""Chưa ghi nhận"", ""CachDung"": ""Chưa ghi nhận"", ""GhiChu"": """"}, {""ChuThe"": ""Bài thuốc Ho Kha tử"", ""QuanHe"": ""BAO_GOM_VI_THUOC"", ""DoiTuong"": ""Vị thuốc Kha tử"", ""LieuDung"": ""$4$"", ""CachDung"": ""Chưa ghi nhận"", ""GhiChu"": """"}, {""ChuThe"": ""Bài thuốc Ho Kha tử"", ""QuanHe"": ""BAO_GOM_VI_THUOC"", ""DoiTuong"": ""Vị thuốc Đảng sâm"", ""LieuDung"": ""$4$"", ""CachDung"": ""Chưa ghi nhận"", ""GhiChu"": """"}, {""ChuThe"": ""Bài thuốc Xích bạch lỵ Kha tử"", ""QuanHe"": ""CHU_TRI_BENH"", ""DoiTuong"": ""Bệnh Lỵ"", ""LieuDung"": ""Chưa ghi nhận"", ""CachDung"": ""Chưa ghi nhận"", ""GhiChu"": """"}, {""ChuThe"": ""Bài thuốc Xích bạch lỵ Kha tử"", ""QuanHe"": ""BAO_GOM_VI_THUOC"", ""DoiTuong"": ""Vị thuốc Kha tử"", ""LieuDung"": ""12 quả"", ""CachDung"": ""6 quả để sống, 6 quả nướng bỏ hạt, sao vàng và tán nhỏ"", ""GhiChu"": ""Nếu lỵ ra máu thì dùng nước sắc cam thảo mà chiêu thuốc, nếu lỵ ra mũi khổng, dùng nước sắc cam thảo trích""}, {""ChuThe"": ""Vị thuốc Kha tử"", ""QuanHe"": ""CO_CHUA_HOAT_CHAT"", ""DoiTuong"": ""Hoạt chất Axit Galic"", ""LieuDung"": ""Chưa ghi nhận"", ""CachDung"": ""Chưa ghi nhận"", ""GhiChu"": ""trong tanin""}, {""ChuThe"": ""Vị thuốc Kha tử"", ""QuanHe"": ""CO_CHUA_HOAT_CHAT"", ""DoiTuong"": ""Axit Chebulinic"", ""LieuDung"": ""Chưa ghi nhận"", ""CachDung"": ""Chưa ghi nhận"", ""GhiChu"": """"}, {""ChuThe"": ""Vị thuốc Kha tử"", ""QuanHe"": ""CO_CHUA_HOAT_CHAT"", ""DoiTuong"": ""Axit Elagic"", ""LieuDung"": ""Chưa ghi nhận"", ""CachDung"": ""Chưa ghi nhận"", ""GhiChu"": ""trong tanin""}, {""ChuThe"": ""Vị thuốc Kha tử"", ""QuanHe"": ""CO_CHUA_HOAT_CHAT"", ""DoiTuong"": ""Axit Luteolic"", ""LieuDung"": ""Chưa ghi nhận"", ""CachDung"": ""Chưa ghi nhận"", ""GhiChu"": ""trong tanin""}, {""ChuThe"": ""Vị thuốc Kha tử"", ""QuanHe"": ""CHU_TRI_BENH"", ""DoiTuong"": ""Bệnh Trĩ"", ""LieuDung"": ""$3-6$g"", ""CachDung"": ""Liều cầm đi ỉa"", ""GhiChu"": ""còn dùng chữa họ mất tiếng, di tinh, mồ hôi trộm, trĩ, lòi dom, xích bạch đới""}, {""ChuThe"": ""Vị thuốc Kha tử"", ""QuanHe"": ""CHU_TRI_BENH"", ""DoiTuong"": ""Bệnh Mồ hôi trộm"", ""LieuDung"": ""$3-6$g"", ""CachDung"": ""Liều cầm đi ỉa"", ""GhiChu"": ""còn dùng chữa họ mất tiếng, di tinh, mồ hôi trộm, trĩ, lòi dom, xích bạch đới""}, {""ChuThe"": ""Vị thuốc Kha tử"", ""QuanHe"": ""CHU_TRI_BENH"", ""DoiTuong"": ""Bệnh Xích Bạch đới"", ""LieuDung"": ""$3-6$g"", ""CachDung"": ""Liều cầm đi ỉa"", ""GhiChu"": ""còn dùng chữa họ mất tiếng, di tinh, mồ hôi trộm, trĩ, lòi dom, xích bạch đới""}, {""ChuThe"": ""Vị thuốc Kha tử"", ""QuanHe"": ""CHU_TRI_BENH"", ""DoiTuong"": ""Bệnh Đi ị ra máu"", ""LieuDung"": ""$3-6$g"", ""CachDung"": ""Liều cầm đi ỉa"", ""GhiChu"": ""còn dùng chữa họ mất tiếng, di tinh, mồ hôi trộm, trĩ, lòi dom, xích bạch đới""}, {""ChuThe"": ""Vị thuốc Kha tử"", ""QuanHe"": ""CHU_TRI_BENH"", ""DoiTuong"": ""Bệnh Ho"", ""LieuDung"": ""$3-6$g"", ""CachDung"": ""Liều cầm đi ỉa"", ""GhiChu"": ""còn dùng chữa họ mất tiếng, di tinh, mồ hôi trộm, trĩ, lòi dom, xích bạch đới""}, {""ChuThe"": ""Vị thuốc Kha tử"", ""QuanHe"": ""CHU_TRI_BENH"", ""DoiTuong"": ""Bệnh Di tinh"", ""LieuDung"": ""$3-6$g"", ""CachDung"": ""Liều cầm đi ỉa"", ""GhiChu"": ""còn dùng chữa họ mất tiếng, di tinh, mồ hôi trộm, trĩ, lòi dom, xích bạch đới""}, {""ChuThe"": ""Vị thuốc Kha tử"", ""QuanHe"": ""CHU_TRI_BENH"", ""DoiTuong"": ""Bệnh Ly kinh niên"", ""LieuDung"": ""$3-6$g"", ""CachDung"": ""Liều cầm đi ỉa"", ""GhiChu"": ""còn dùng chữa họ mất tiếng, di tinh, mồ hôi trộm, trĩ, lòi dom, xích bạch đới""}, {""ChuThe"": ""Vị thuốc Kha tử"", ""QuanHe"": ""CO_CONG_NANG"", ""DoiTuong"": ""Công năng Lợi đờm"", ""LieuDung"": ""$3-6$g"", ""CachDung"": ""Liều cầm đi ỉa"", ""GhiChu"": ""còn dùng chữa họ mất tiếng, di tinh, mồ hôi trộm, trĩ, lòi dom, xích bạch đới"", ""sort_weight"": 3.0}]']","Vị thuốc **Kha tử** có công năng lợi đờm. Liều dùng 3-6g, dùng liều này để cầm đi ỉa. Ngoài ra, còn dùng chữa họ mất tiếng, di tinh, mồ hôi trộm, trĩ, lòi dom, xích bạch đới.",Lợi đờm,1.0,0.5091389200329538,0.9999999999,1.0,0.34491414251327
Cho tôi biết vị của lộc nhung (mã nhung).,"['[{""ChuThe"": ""Vị thuốc Lộc nhung (mã nhung)"", ""QuanHe"": ""CO_VI"", ""DoiTuong"": ""Vị ngọt"", ""LieuDung"": ""Chưa ghi nhận"", ""CachDung"": ""Chưa ghi nhận"", ""GhiChu"": """"}]']","Dựa trên y văn, **Lộc nhung (mã nhung)** có vị ngọt.",Vị ngọt,1.0,0.6750289203984133,0.9999999999,1.0,0.9734612336382984
Vị thuốc khiếm thực tham gia vào bài thuốc để chữa những bệnh gì?,"['[{""ChuThe"": ""Vị thuốc Khiếm thực"", ""QuanHe"": ""Tham gia bài thuốc [Bài thuốc Viêm ruột mạn tính Khiếm thực] để chữa"", ""DoiTuong"": ""Bệnh Lỵ mạn tính"", ""LieuDung"": ""Ngày uống 3 lần, mỗi lần $3-5g$."", ""CachDung"": ""Tán nhỏ, thêm mật làm thành viên. Uống với nước nóng."", ""GhiChu"": ""CT_VT_VN_T864"", ""sort_weight"": 3.0}, {""ChuThe"": ""Vị thuốc Khiếm thực"", ""QuanHe"": ""Tham gia bài thuốc [Bài thuốc Viêm ruột mạn tính Khiếm thực] để chữa"", ""DoiTuong"": ""Bệnh Viêm ruột mãn tính"", ""LieuDung"": ""Ngày uống 3 lần, mỗi lần $3-5g$."", ""CachDung"": ""Tán nhỏ, thêm mật làm thành viên. Uống với nước nóng."", ""GhiChu"": ""CT_VT_VN_T864"", ""sort_weight"": 3.0}, {""ChuThe"": ""Vị thuốc Khiếm thực"", ""QuanHe"": ""Tham gia bài thuốc [Bài thuốc Viêm ruột mạn tính Khiếm thực] để chữa"", ""DoiTuong"": ""Bệnh di mộng tinh"", ""LieuDung"": ""Ngày uống 3 lần, mỗi lần $3-5g$."", ""CachDung"": ""Tán nhỏ, thêm mật làm thành viên. Uống với nước nóng."", ""GhiChu"": ""CT_VT_VN_T864"", ""sort_weight"": 3.0}, {""ChuThe"": ""Vị thuốc Khiếm thực"", ""QuanHe"": ""Tham gia bài thuốc [Bài thuốc Viêm ruột mạn tính Khiếm thực] để chữa"", ""DoiTuong"": ""Bệnh Suy nhược thần kinh"", ""LieuDung"": ""Ngày uống 3 lần, mỗi lần $3-5g$."", ""CachDung"": ""Tán nhỏ, thêm mật làm thành viên. Uống với nước nóng."", ""GhiChu"": ""CT_VT_VN_T864"", ""sort_weight"": 3.0}, {""ChuThe"": ""Vị thuốc Khiếm thực"", ""QuanHe"": ""Tham gia bài thuốc [Bài thuốc Bạch đới Kim Anh] để chữa"", ""DoiTuong"": ""Bệnh Bạch đới"", ""LieuDung"": ""Chưa ghi nhận"", ""CachDung"": ""Chưa ghi nhận"", ""GhiChu"": ""Thủy lục nhị tiên đơn - Di mộng tinh, phụ nữ khí hư, bạch đới. [Nguồn]: CT_VT_VN_T911"", ""sort_weight"": 3.0}, {""ChuThe"": ""Vị thuốc Khiếm thực"", ""QuanHe"": ""Tham gia bài thuốc [Bài thuốc Bạch đới Kim Anh] để chữa"", ""DoiTuong"": ""Bệnh Khí hư"", ""LieuDung"": ""Chưa ghi nhận"", ""CachDung"": ""Chưa ghi nhận"", ""GhiChu"": ""Thủy lục nhị tiên đơn - Di mộng tinh, phụ nữ khí hư, bạch đới. [Nguồn]: CT_VT_VN_T911"", ""sort_weight"": 3.0}, {""ChuThe"": ""Vị thuốc Khiếm thực"", ""QuanHe"": ""Tham gia bài thuốc [Bài thuốc Bạch đới Kim Anh] để chữa"", ""DoiTuong"": ""Triệu chứng Di mộng tinh"", ""LieuDung"": ""Chưa ghi nhận"", ""CachDung"": ""Chưa ghi nhận"", ""GhiChu"": ""Thủy lục nhị tiên đơn - Di mộng tinh, phụ nữ khí hư, bạch đới. [Nguồn]: CT_VT_VN_T911"", ""sort_weight"": 3.0}, {""ChuThe"": ""Vị thuốc Khiếm thực"", ""QuanHe"": ""Tham gia bài thuốc [Bài thuốc Lưng đau gối mỏi Tỏa dương] để chữa"", ""DoiTuong"": ""Bệnh Di tinh"", ""LieuDung"": ""Chưa ghi nhận"", ""CachDung"": ""Chưa ghi nhận"", ""GhiChu"": """", ""sort_weight"": 3.0}, {""ChuThe"": ""Vị thuốc Khiếm thực"", ""QuanHe"": ""Tham gia bài thuốc [Bài thuốc Lưng đau gối mỏi Tỏa dương] để chữa"", ""DoiTuong"": ""Bệnh Liệt dương"", ""LieuDung"": ""Chưa ghi nhận"", ""CachDung"": ""Chưa ghi nhận"", ""GhiChu"": """", ""sort_weight"": 3.0}, {""ChuThe"": ""Vị thuốc Khiếm thực"", ""QuanHe"": ""Tham gia bài thuốc [Bài thuốc Lưng đau gối mỏi Tỏa dương] để chữa"", ""DoiTuong"": ""Triệu chứng Lưng đầu gối mỏi"", ""LieuDung"": ""Chưa ghi nhận"", ""CachDung"": ""Chưa ghi nhận"", ""GhiChu"": """", ""sort_weight"": 3.0}]']","Vị thuốc **Khiếm thực** tham gia vào các bài thuốc để chữa các bệnh sau:

*   Tham gia bài thuốc **Viêm ruột mạn tính Khiếm thực** để chữa bệnh Lỵ mạn tính, Viêm ruột mãn tính, di mộng tinh, Suy nhược thần kinh. Liều dùng: Ngày uống 3 lần, mỗi lần 3-5g. Cách dùng: Tán nhỏ, thêm mật làm thành viên. Uống với nước nóng.
*   Tham gia bài thuốc **Bạch đới Kim Anh** để chữa bệnh Bạch đới, Khí hư, triệu chứng Di mộng tinh.
*   Tham gia bài thuốc **Lưng đau gối mỏi Tỏa dương** để chữa bệnh Di tinh, Liệt dương, triệu chứng Lưng đầu gối mỏi.","Bạch đới, Di tinh, Khí hư, Liệt dương, Lỵ mạn, Suy nhược thần kinh, Viêm ruột mãn, Di mộng tinh, Di mộng tinh, Lưng đầu gối mỏi",1.0,0.5327682046236121,0.9999999999,1.0,0.83331778202988
Thuốc nào vừa có tính ôn vừa trực tiếp chữa bệnh tê thấp?,"['[{""ChuThe"": ""Vị thuốc Hạt gấc"", ""QuanHe"": ""Thỏa mãn đồng thời"", ""DoiTuong"": ""Ôn và Bệnh Tê thấp"", ""LieuDung"": ""Chưa ghi nhận"", ""CachDung"": ""Chưa ghi nhận"", ""GhiChu"": """"}, {""ChuThe"": ""Vị thuốc Tế Tân"", ""QuanHe"": ""Thỏa mãn đồng thời"", ""DoiTuong"": ""Ôn và Bệnh Tê thấp"", ""LieuDung"": ""Chưa ghi nhận"", ""CachDung"": ""Chưa ghi nhận"", ""GhiChu"": """"}]']","Hệ thống y văn hiện tại ghi nhận các vị thuốc có tính ôn và được dùng cho bệnh tê thấp như sau:

**Thông tin tham khảo thêm:**

*   **Hạt gấc** có tính ôn và được dùng cho bệnh tê thấp. Liều dùng và cách dùng chưa được ghi nhận.
*   **Tế Tân** có tính ôn và được dùng cho bệnh tê thấp. Liều dùng và cách dùng chưa được ghi nhận.","Thiên niên kiện, Xương hổ",1.0,0.4294373130486873,0.0,0.0,0.21461874274705983
Bệnh nào có thể chữa bằng bài thuốc chứa kỷ tử?,"['[{""ChuThe"": ""Vị thuốc Câu kỷ tử"", ""QuanHe"": ""Tham gia bài thuốc [Bệnh Ung thư tử cung hoàng cung] để chữa"", ""DoiTuong"": ""Bệnh Ung thư tử cung"", ""LieuDung"": ""Tuần đầu uống $4$ thang bổ thận cùng với $7$ ngày uống nước sắc Trinh nữ hoàng cung. $2$ tuần tiếp theo, khi uống Trinh nữ hoàng cung thì mỗi tuần kết hợp uống $3$ thang bổ thận."", ""CachDung"": ""Chưa ghi nhận"", ""GhiChu"": ""Phối hợp Trinh nữ hoàng cung với đơn thuốc Bổ thận (chữa u xơ, ung thư)""}, {""ChuThe"": ""Vị thuốc Câu kỷ tử"", ""QuanHe"": ""Tham gia bài thuốc [Bệnh Ung thư tử cung hoàng cung] để chữa"", ""DoiTuong"": ""Bệnh U xơ tử cung"", ""LieuDung"": ""Tuần đầu uống $4$ thang bổ thận cùng với $7$ ngày uống nước sắc Trinh nữ hoàng cung. $2$ tuần tiếp theo, khi uống Trinh nữ hoàng cung thì mỗi tuần kết hợp uống $3$ thang bổ thận."", ""CachDung"": ""Chưa ghi nhận"", ""GhiChu"": ""Phối hợp Trinh nữ hoàng cung với đơn thuốc Bổ thận (chữa u xơ, ung thư)""}, {""ChuThe"": ""Vị thuốc Câu kỷ tử"", ""QuanHe"": ""Tham gia bài thuốc [Bài thuốc Hư lao Thạch hộc] để chữa"", ""DoiTuong"": ""Bệnh Hư lao"", ""LieuDung"": ""Chưa ghi nhận"", ""CachDung"": ""Chưa ghi nhận"", ""GhiChu"": """"}, {""ChuThe"": ""Vị thuốc Câu kỷ tử"", ""QuanHe"": ""Tham gia bài thuốc [Bài thuốc Chân phù nhược dương] để chữa"", ""DoiTuong"": ""Bệnh Người già yếu suy nhược"", ""LieuDung"": ""Chưa ghi nhận"", ""CachDung"": ""Chưa ghi nhận"", ""GhiChu"": """"}, {""ChuThe"": ""Vị thuốc Câu kỷ tử"", ""QuanHe"": ""Tham gia bài thuốc [Bài thuốc Chân phù nhược dương] để chữa"", ""DoiTuong"": ""Triệu chứng Chân phù"", ""LieuDung"": ""Chưa ghi nhận"", ""CachDung"": ""Chưa ghi nhận"", ""GhiChu"": """"}, {""ChuThe"": ""Vị thuốc Kỷ tử"", ""QuanHe"": ""Tham gia bài thuốc [Bài thuốc Đại tháo đường Trạch tả] để chữa"", ""DoiTuong"": ""Bệnh Tiểu đường"", ""LieuDung"": ""Chưa ghi nhận"", ""CachDung"": ""Chưa ghi nhận"", ""GhiChu"": """", ""sort_weight"": 3.0}, {""ChuThe"": ""Vị thuốc Kỷ tử"", ""QuanHe"": ""Tham gia bài thuốc [Bài thuốc Di tinh kỷ tử] để chữa"", ""DoiTuong"": ""Bệnh Di tinh"", ""LieuDung"": ""Chưa ghi nhận"", ""CachDung"": ""Chưa ghi nhận"", ""GhiChu"": """", ""sort_weight"": 3.0}, {""ChuThe"": ""Vị thuốc Kỷ tử"", ""QuanHe"": ""Tham gia bài thuốc [Bài thuốc Gầy yếu khỏi từ] để chữa"", ""DoiTuong"": ""Bệnh Đại đường"", ""LieuDung"": ""Chưa ghi nhận"", ""CachDung"": ""Chưa ghi nhận"", ""GhiChu"": """", ""sort_weight"": 3.0}, {""ChuThe"": ""Vị thuốc Kỷ tử"", ""QuanHe"": ""Tham gia bài thuốc [Bài thuốc Gầy yếu khỏi từ] để chữa"", ""DoiTuong"": ""Bệnh Viêm phổi"", ""LieuDung"": ""Chưa ghi nhận"", ""CachDung"": ""Chưa ghi nhận"", ""GhiChu"": """", ""sort_weight"": 3.0}, {""ChuThe"": ""Vị thuốc Kỷ tử"", ""QuanHe"": ""Tham gia bài thuốc [Bài thuốc Gầy yếu khỏi từ] để chữa"", ""DoiTuong"": ""Bệnh Hư lao"", ""LieuDung"": ""Chưa ghi nhận"", ""CachDung"": ""Chưa ghi nhận"", ""GhiChu"": """", ""sort_weight"": 3.0}, {""ChuThe"": ""Vị thuốc Kỷ tử"", ""QuanHe"": ""Tham gia bài thuốc [Bài thuốc Gầy yếu khỏi từ] để chữa"", ""DoiTuong"": ""Triệu chứng Mệt mỏi"", ""LieuDung"": ""Chưa ghi nhận"", ""CachDung"": ""Chưa ghi nhận"", ""GhiChu"": """", ""sort_weight"": 3.0}, {""ChuThe"": ""Vị thuốc Kỷ tử"", ""QuanHe"": ""Tham gia bài thuốc [Bài thuốc Gầy yếu khỏi từ] để chữa"", ""DoiTuong"": ""Triệu chứng Gầy yếu"", ""LieuDung"": ""Chưa ghi nhận"", ""CachDung"": ""Chưa ghi nhận"", ""GhiChu"": """", ""sort_weight"": 3.0}, {""ChuThe"": ""Vị thuốc Kỷ tử"", ""QuanHe"": ""Tham gia bài thuốc [Bài thuốc Ho khan hen suyễn kỷ tử] để chữa"", ""DoiTuong"": ""Bệnh Ho khan"", ""LieuDung"": ""Chưa ghi nhận"", ""CachDung"": ""Chưa ghi nhận"", ""GhiChu"": """", ""sort_weight"": 3.0}, {""ChuThe"": ""Vị thuốc Kỷ tử"", ""QuanHe"": ""Tham gia bài thuốc [Bài thuốc Ho khan hen suyễn kỷ tử] để chữa"", ""DoiTuong"": ""Bệnh Hen suyễn"", ""LieuDung"": ""Chưa ghi nhận"", ""CachDung"": ""Chưa ghi nhận"", ""GhiChu"": """", ""sort_weight"": 3.0}, {""ChuThe"": ""Vị thuốc Kỷ tử"", ""QuanHe"": ""Tham gia bài thuốc [Bài thuốc Liệt dương kỷ tử] để chữa"", ""DoiTuong"": ""Bệnh Mỏi gối"", ""LieuDung"": ""Chưa ghi nhận"", ""CachDung"": ""Chưa ghi nhận"", ""GhiChu"": """", ""sort_weight"": 3.0}, {""ChuThe"": ""Vị thuốc Kỷ tử"", ""QuanHe"": ""Tham gia bài thuốc [Bài thuốc Liệt dương kỷ tử] để chữa"", ""DoiTuong"": ""Bệnh Di tinh"", ""LieuDung"": ""Chưa ghi nhận"", ""CachDung"": ""Chưa ghi nhận"", ""GhiChu"": """", ""sort_weight"": 3.0}, {""ChuThe"": ""Vị thuốc Kỷ tử"", ""QuanHe"": ""Tham gia bài thuốc [Bài thuốc Liệt dương kỷ tử] để chữa"", ""DoiTuong"": ""Bệnh Đau lưng"", ""LieuDung"": ""Chưa ghi nhận"", ""CachDung"": ""Chưa ghi nhận"", ""GhiChu"": """", ""sort_weight"": 3.0}, {""ChuThe"": ""Vị thuốc Kỷ tử"", ""QuanHe"": ""Tham gia bài thuốc [Bài thuốc Liệt dương kỷ tử] để chữa"", ""DoiTuong"": ""Bệnh Liệt dương"", ""LieuDung"": ""Chưa ghi nhận"", ""CachDung"": ""Chưa ghi nhận"", ""GhiChu"": """", ""sort_weight"": 3.0}, {""ChuThe"": ""Vị thuốc Kỷ tử"", ""QuanHe"": ""Tham gia bài thuốc [Bài thuốc Liệt dương kỷ tử] để chữa"", ""DoiTuong"": ""Triệu chứng Đau vàng"", ""LieuDung"": ""Chưa ghi nhận"", ""CachDung"": ""Chưa ghi nhận"", ""GhiChu"": """", ""sort_weight"": 3.0}, {""ChuThe"": ""Vị thuốc Kỷ tử"", ""QuanHe"": ""Tham gia bài thuốc [Bài thuốc Liệt dương kỷ tử] để chữa"", ""DoiTuong"": ""Triệu chứng Mắt hoa"", ""LieuDung"": ""Chưa ghi nhận"", ""CachDung"": ""Chưa ghi nhận"", ""GhiChu"": """", ""sort_weight"": 3.0}, {""ChuThe"": ""Vị thuốc Kỷ tử"", ""QuanHe"": ""Tham gia bài thuốc [Bài thuốc Mắt mờ thị lực giảm kỷ tử] để chữa"", ""DoiTuong"": ""Triệu chứng Mắt mờ"", ""LieuDung"": ""Chưa ghi nhận"", ""CachDung"": ""Chưa ghi nhận"", ""GhiChu"": """", ""sort_weight"": 3.0}, {""ChuThe"": ""Vị thuốc Kỷ tử"", ""QuanHe"": ""Tham gia bài thuốc [Bài thuốc Mắt mờ thị lực giảm kỷ tử] để chữa"", ""DoiTuong"": ""Triệu chứng Thị lực giảm"", ""LieuDung"": ""Chưa ghi nhận"", ""CachDung"": ""Chưa ghi nhận"", ""GhiChu"": """", ""sort_weight"": 3.0}, {""ChuThe"": ""Vị thuốc Kỷ tử"", ""QuanHe"": ""Tham gia bài thuốc [Bệnh Lưng lạnh gối mỏi (Sâm cau)] để chữa"", ""DoiTuong"": ""Bệnh Di tinh"", ""LieuDung"": ""Chưa ghi nhận"", ""CachDung"": ""Sắc uống"", ""GhiChu"": ""CT_VT_VN_T928"", ""sort_weight"": 3.0}, {""ChuThe"": ""Vị thuốc Kỷ tử"", ""QuanHe"": ""Tham gia bài thuốc [Bệnh Lưng lạnh gối mỏi (Sâm cau)] để chữa"", ""DoiTuong"": ""Bệnh Liệt dương"", ""LieuDung"": ""Chưa ghi nhận"", ""CachDung"": ""Sắc uống"", ""GhiChu"": ""CT_VT_VN_T928"", ""sort_weight"": 3.0}, {""ChuThe"": ""Vị thuốc Kỷ tử"", ""QuanHe"": ""Tham gia bài thuốc [Bệnh Lưng lạnh gối mỏi (Sâm cau)] để chữa"", ""DoiTuong"": ""Bệnh Yếu sinh lý"", ""LieuDung"": ""Chưa ghi nhận"", ""CachDung"": ""Sắc uống"", ""GhiChu"": ""CT_VT_VN_T928"", ""sort_weight"": 3.0}, {""ChuThe"": ""Vị thuốc Kỷ tử"", ""QuanHe"": ""Tham gia bài thuốc [Bệnh Lưng lạnh gối mỏi (Sâm cau)] để chữa"", ""DoiTuong"": ""Triệu chứng Lưng lạnh gối mỏi"", ""LieuDung"": ""Chưa ghi nhận"", ""CachDung"": ""Sắc uống"", ""GhiChu"": ""CT_VT_VN_T928"", ""sort_weight"": 3.0}, {""ChuThe"": ""Vị thuốc Kỷ tử"", ""QuanHe"": ""Tham gia bài thuốc [Bài thuốc Bạch đới chim sẻ] để chữa"", ""DoiTuong"": ""Bệnh Bạch đới"", ""LieuDung"": ""Chưa ghi nhận"", ""CachDung"": ""Chưa ghi nhận"", ""GhiChu"": """", ""sort_weight"": 3.0}, {""ChuThe"": ""Vị thuốc Kỷ tử"", ""QuanHe"": ""Tham gia bài thuốc [Bài thuốc Bạch đới chim sẻ] để chữa"", ""DoiTuong"": ""Bệnh Di tinh"", ""LieuDung"": ""Chưa ghi nhận"", ""CachDung"": ""Chưa ghi nhận"", ""GhiChu"": """", ""sort_weight"": 3.0}, {""ChuThe"": ""Vị thuốc Kỷ tử"", ""QuanHe"": ""Tham gia bài thuốc [Bài thuốc Bạch đới chim sẻ] để chữa"", ""DoiTuong"": ""Bệnh Đau lưng"", ""LieuDung"": ""Chưa ghi nhận"", ""CachDung"": ""Chưa ghi nhận"", ""GhiChu"": """", ""sort_weight"": 3.0}, {""ChuThe"": ""Vị thuốc Kỷ tử"", ""QuanHe"": ""Tham gia bài thuốc [Bài thuốc Bạch đới chim sẻ] để chữa"", ""DoiTuong"": ""Bệnh Gói mỏi"", ""LieuDung"": ""Chưa ghi nhận"", ""CachDung"": ""Chưa ghi nhận"", ""GhiChu"": """", ""sort_weight"": 3.0}]']","Dựa trên y văn, vị thuốc **Kỷ tử** có thể được dùng trong các bài thuốc để chữa các bệnh và triệu chứng sau:

*   Bệnh Tiểu đường (trong bài thuốc **Đại tháo đường Trạch tả**)
*   Bệnh Di tinh (trong bài thuốc **Di tinh kỷ tử**, **Liệt dương kỷ tử**, **Bệnh Lưng lạnh gối mỏi (Sâm cau)**, **Bạch đới chim sẻ**)
*   Bệnh Đại đường, Viêm phổi, Hư lao, triệu chứng Mệt mỏi, Gầy yếu (trong bài thuốc **Gầy yếu khỏi từ**)
*   Bệnh Ho khan, Hen suyễn (trong bài thuốc **Ho khan hen suyễn kỷ tử**)
*   Bệnh Mỏi gối, Đau lưng, Liệt dương, triệu chứng Đau vàng, Mắt hoa (trong bài thuốc **Liệt dương kỷ tử**)
*   Triệu chứng Mắt mờ, Thị lực giảm (trong bài thuốc **Mắt mờ thị lực giảm kỷ tử**)
*   Bệnh Yếu sinh lý, triệu chứng Lưng lạnh gối mỏi (trong bài thuốc **Bệnh Lưng lạnh gối mỏi (Sâm cau)**, cách dùng: Sắc uống)
*   Bệnh Bạch đới, Gói mỏi (trong bài thuốc **Bạch đới chim sẻ**)

**Thông tin tham khảo thêm:**

Vị thuốc **Câu kỷ tử** có thể tham gia vào bài thuốc để chữa:

*   Bệnh Ung thư tử cung, U xơ tử cung (trong bài thuốc **Bệnh Ung thư tử cung hoàng cung**). Liều dùng: Tuần đầu uống 4 thang bổ thận cùng với 7 ngày uống nước sắc Trinh nữ hoàng cung. 2 tuần tiếp theo, khi uống Trinh nữ hoàng cung thì mỗi tuần kết hợp uống 3 thang bổ thận.
*   Bệnh Hư lao (trong bài thuốc **Hư lao Thạch hộc**)
*   Bệnh Người già yếu suy nhược, triệu chứng Chân phù (trong bài thuốc **Chân phù nhược dương**)","Bạch đới, Di tinh, Gói mỏi, Hen suyễn, Ho khan, Hư lao, Liệt dương, Mỏi gối, Tiểu đường, Viêm phổi, Yếu sinh lý, Đau lưng, Đại đường, Chóng mặt, Gầy yếu, Lưng lạnh gối mỏi, Mắt hoa, Mắt mờ, Mệt mỏi, Thị lực giảm, Đau vàng",1.0,0.4394155378266181,0.9999999999,1.0,0.771100067475496
Thành phần hóa học của bòng nước gồm những gì?,"['[{""ChuThe"": ""Vị thuốc Bòng nước"", ""QuanHe"": ""CO_CHUA_HOAT_CHAT"", ""DoiTuong"": ""Hoạt chất Saponin"", ""LieuDung"": ""Chưa ghi nhận"", ""CachDung"": ""Chưa ghi nhận"", ""GhiChu"": ""Không có thông tin"", ""sort_weight"": 3.0}, {""ChuThe"": ""Vị thuốc Bòng nước"", ""QuanHe"": ""CO_CHUA_HOAT_CHAT"", ""DoiTuong"": ""Hoạt chất Lawsone"", ""LieuDung"": ""Chưa ghi nhận"", ""CachDung"": ""Chưa ghi nhận"", ""GhiChu"": ""Không có thông tin"", ""sort_weight"": 3.0}, {""ChuThe"": ""Vị thuốc Bòng nước"", ""QuanHe"": ""CO_CHUA_HOAT_CHAT"", ""DoiTuong"": ""Hoạt chất Cafeic"", ""LieuDung"": ""Chưa ghi nhận"", ""CachDung"": ""Chưa ghi nhận"", ""GhiChu"": ""Không có thông tin"", ""sort_weight"": 3.0}, {""ChuThe"": ""Vị thuốc Bòng nước"", ""QuanHe"": ""CO_CHUA_HOAT_CHAT"", ""DoiTuong"": ""Hoạt chất Quexetin"", ""LieuDung"": ""Chưa ghi nhận"", ""CachDung"": ""Chưa ghi nhận"", ""GhiChu"": ""Không có thông tin"", ""sort_weight"": 3.0}, {""ChuThe"": ""Vị thuốc Bòng nước"", ""QuanHe"": ""CO_CHUA_HOAT_CHAT"", ""DoiTuong"": ""Hoạt chất Balsaminasterol"", ""LieuDung"": ""Chưa ghi nhận"", ""CachDung"": ""Chưa ghi nhận"", ""GhiChu"": ""Không có thông tin"", ""sort_weight"": 3.0}, {""ChuThe"": ""Vị thuốc Bòng nước"", ""QuanHe"": ""CO_CHUA_HOAT_CHAT"", ""DoiTuong"": ""Hoạt chất Cyanidin"", ""LieuDung"": ""Chưa ghi nhận"", ""CachDung"": ""Chưa ghi nhận"", ""GhiChu"": ""Không có thông tin"", ""sort_weight"": 3.0}, {""ChuThe"": ""Vị thuốc Bòng nước"", ""QuanHe"": ""CO_CHUA_HOAT_CHAT"", ""DoiTuong"": ""Hoạt chất Delphindin"", ""LieuDung"": ""Chưa ghi nhận"", ""CachDung"": ""Chưa ghi nhận"", ""GhiChu"": ""Không có thông tin"", ""sort_weight"": 3.0}, {""ChuThe"": ""Vị thuốc Bòng nước"", ""QuanHe"": ""CO_CHUA_HOAT_CHAT"", ""DoiTuong"": ""Hoạt chất Ferulic"", ""LieuDung"": ""Chưa ghi nhận"", ""CachDung"": ""Chưa ghi nhận"", ""GhiChu"": ""Không có thông tin"", ""sort_weight"": 3.0}, {""ChuThe"": ""Vị thuốc Bòng nước"", ""QuanHe"": ""CO_CHUA_HOAT_CHAT"", ""DoiTuong"": ""Hoạt chất Gentisic"", ""LieuDung"": ""Chưa ghi nhận"", ""CachDung"": ""Chưa ghi nhận"", ""GhiChu"": ""Không có thông tin"", ""sort_weight"": 3.0}, {""ChuThe"": ""Vị thuốc Bòng nước"", ""QuanHe"": ""CO_CHUA_HOAT_CHAT"", ""DoiTuong"": ""Hoạt chất Kaempferol"", ""LieuDung"": ""Chưa ghi nhận"", ""CachDung"": ""Chưa ghi nhận"", ""GhiChu"": ""Không có thông tin"", ""sort_weight"": 3.0}, {""ChuThe"": ""Vị thuốc Bòng nước"", ""QuanHe"": ""CO_CHUA_HOAT_CHAT"", ""DoiTuong"": ""Hoạt chất Kaempferol 3 Arabinozit"", ""LieuDung"": ""Chưa ghi nhận"", ""CachDung"": ""Chưa ghi nhận"", ""GhiChu"": ""Không có thông tin"", ""sort_weight"": 3.0}, {""ChuThe"": ""Vị thuốc Bòng nước"", ""QuanHe"": ""CO_CHUA_HOAT_CHAT"", ""DoiTuong"": ""Hoạt chất Kaempferol 3 Glucozit"", ""LieuDung"": ""Chưa ghi nhận"", ""CachDung"": ""Chưa ghi nhận"", ""GhiChu"": ""Không có thông tin"", ""sort_weight"": 3.0}, {""ChuThe"": ""Vị thuốc Bòng nước"", ""QuanHe"": ""CO_CHUA_HOAT_CHAT"", ""DoiTuong"": ""Hoạt chất Parinaric"", ""LieuDung"": ""Chưa ghi nhận"", ""CachDung"": ""Chưa ghi nhận"", ""GhiChu"": ""Không có thông tin"", ""sort_weight"": 3.0}, {""ChuThe"": ""Vị thuốc Bòng nước"", ""QuanHe"": ""CO_CHUA_HOAT_CHAT"", ""DoiTuong"": ""Hoạt chất Pelargonidin"", ""LieuDung"": ""Chưa ghi nhận"", ""CachDung"": ""Chưa ghi nhận"", ""GhiChu"": ""Không có thông tin"", ""sort_weight"": 3.0}, {""ChuThe"": ""Vị thuốc Bòng nước"", ""QuanHe"": ""CO_CHUA_HOAT_CHAT"", ""DoiTuong"": ""Hoạt chất P Cumaric"", ""LieuDung"": ""Chưa ghi nhận"", ""CachDung"": ""Chưa ghi nhận"", ""GhiChu"": ""Không có thông tin"", ""sort_weight"": 3.0}, {""ChuThe"": ""Vị thuốc Bòng nước"", ""QuanHe"": ""CO_CHUA_HOAT_CHAT"", ""DoiTuong"": ""Hoạt chất P Hydroxybenzoic"", ""LieuDung"": ""Chưa ghi nhận"", ""CachDung"": ""Chưa ghi nhận"", ""GhiChu"": ""Không có thông tin"", ""sort_weight"": 3.0}, {""ChuThe"": ""Vị thuốc Bòng nước"", ""QuanHe"": ""CO_CHUA_HOAT_CHAT"", ""DoiTuong"": ""Hoạt chất Scopoletin"", ""LieuDung"": ""Chưa ghi nhận"", ""CachDung"": ""Chưa ghi nhận"", ""GhiChu"": ""Không có thông tin"", ""sort_weight"": 3.0}, {""ChuThe"": ""Vị thuốc Bòng nước"", ""QuanHe"": ""CO_CHUA_HOAT_CHAT"", ""DoiTuong"": ""Hoạt chất Sinapic"", ""LieuDung"": ""Chưa ghi nhận"", ""CachDung"": ""Chưa ghi nhận"", ""GhiChu"": ""Không có thông tin"", ""sort_weight"": 3.0}, {""ChuThe"": ""Vị thuốc Bòng nước"", ""QuanHe"": ""CO_CHUA_HOAT_CHAT"", ""DoiTuong"": ""Hoạt chất Sipinaterol"", ""LieuDung"": ""Chưa ghi nhận"", ""CachDung"": ""Chưa ghi nhận"", ""GhiChu"": ""Không có thông tin"", ""sort_weight"": 3.0}, {""ChuThe"": ""Vị thuốc Bòng nước"", ""QuanHe"": ""CO_CHUA_HOAT_CHAT"", ""DoiTuong"": ""Hoạt chất Xinnamic"", ""LieuDung"": ""Chưa ghi nhận"", ""CachDung"": ""Chưa ghi nhận"", ""GhiChu"": ""Không có thông tin"", ""sort_weight"": 3.0}]']","Thành phần hóa học của vị thuốc **Bòng nước** bao gồm các hoạt chất sau:

*   Saponin
*   Lawsone
*   Cafeic
*   Quexetin
*   Balsaminasterol
*   Cyanidin
*   Delphindin
*   Ferulic
*   Gentisic
*   Kaempferol
*   Kaempferol 3 Arabinozit
*   Kaempferol 3 Glucozit
*   Parinaric
*   Pelargonidin
*   P Cumaric
*   P Hydroxybenzoic
*   Scopoletin
*   Sinapic
*   Sipinaterol
*   Xinnamic","Balsaminasterol, Cafeic, Cyanidin, Delphindin, Ferulic, Gentisic, Kaempferol, Kaempferol 3 Arabinozit, Kaempferol 3 Glucozit, Lawsone, P Cumaric, P Hydroxybenzoic, Parinaric, Pelargonidin, Quexetin, Saponin, Scopoletin, Sinapic, Sipinaterol, Xinnamic",1.0,0.6036036384517692,0.9999999999,1.0,0.9742259159616644
Bệnh nào có thể chữa bằng bài thuốc chứa kha tử?,"['[{""ChuThe"": ""Vị thuốc Kha tử"", ""QuanHe"": ""Tham gia bài thuốc [Bệnh Sốt rét Thảo quả] để chữa"", ""DoiTuong"": ""Bệnh Sốt"", ""LieuDung"": ""Chưa ghi nhận"", ""CachDung"": ""Chưa ghi nhận"", ""GhiChu"": """", ""sort_weight"": 3.0}, {""ChuThe"": ""Vị thuốc Kha tử"", ""QuanHe"": ""Tham gia bài thuốc [Bệnh Sốt rét Thảo quả] để chữa"", ""DoiTuong"": ""Bệnh Sốt rét"", ""LieuDung"": ""Chưa ghi nhận"", ""CachDung"": ""Chưa ghi nhận"", ""GhiChu"": """", ""sort_weight"": 3.0}, {""ChuThe"": ""Vị thuốc Kha tử"", ""QuanHe"": ""Tham gia bài thuốc [Bài thuốc Ho Kha tử] để chữa"", ""DoiTuong"": ""Bệnh Ho"", ""LieuDung"": ""Chưa ghi nhận"", ""CachDung"": ""Chưa ghi nhận"", ""GhiChu"": """", ""sort_weight"": 3.0}, {""ChuThe"": ""Vị thuốc Kha tử"", ""QuanHe"": ""Tham gia bài thuốc [Bài thuốc Xích bạch lỵ Kha tử] để chữa"", ""DoiTuong"": ""Bệnh Lỵ"", ""LieuDung"": ""Chưa ghi nhận"", ""CachDung"": ""Chưa ghi nhận"", ""GhiChu"": """", ""sort_weight"": 3.0}]']","Dựa trên y văn, **Kha tử** được ghi nhận tham gia vào các bài thuốc chữa các bệnh sau:

*   Bài thuốc **Bệnh Sốt rét Thảo quả** để chữa bệnh Sốt và Sốt rét.
*   Bài thuốc **Bài thuốc Ho Kha tử** để chữa bệnh Ho.
*   Bài thuốc **Bài thuốc Xích bạch lỵ Kha tử** để chữa bệnh Lỵ.","Ho, Lỵ, Sốt, Sốt rét",1.0,0.5689730697541461,0.9999999999,1.0,0.8356118366242004
Vị thuốc xuyên ô chế có chứa hoạt chất asterasponin không?,['Không có dữ liệu'],"Không. Dựa trên dữ liệu y văn hiện tại, không có ghi nhận nào cho thấy xuyên ô chế có liên quan hoặc tác dụng tới asterasponin.","Không, vị thuốc xuyên ô chế không chứa hoạt chất asterasponin",0.0,0.8516819416540599,0.0,1.0,0.7434590409221769
Bệnh trẻ con chậm biết đi có thể dùng vị thuốc hoặc bài thuốc nào để chữa?,"['[{""ChuThe"": ""Bệnh Trẻ con chậm biết đi"", ""QuanHe"": ""Được chữa bằng (ViThuoc)"", ""DoiTuong"": ""Vị thuốc Ngũ gia bì"", ""LieuDung"": ""Tham khảo liều dùng chung của vị thuốc"", ""CachDung"": ""Làm mạnh gân cốt, tăng trí nhớ, ngâm rượu uống rất tốt."", ""GhiChu"": ""Đau bụng, yếu chân, trẻ con lên 3 tuổi chưa biết đi, con trai âm suy (dương sự bất cử), con gái ngứa âm hộ, đau lưng, tê chân | Ngũ gia bì | Làm mạnh gân cốt, tăng trí nhớ, ngâm rượu uống rất tốt. | [Nguồn]: CT_VT_VN_T396"", ""sort_weight"": 3.0}]']","**Vị thuốc điều trị bệnh trẻ con chậm biết đi:**

Theo y văn, vị thuốc **Ngũ gia bì** có thể được dùng để chữa bệnh trẻ con chậm biết đi.

*   **Liều dùng và cách dùng:** Tham khảo liều dùng chung của vị thuốc. Có thể dùng **Ngũ gia bì** để làm mạnh gân cốt, tăng trí nhớ, ngâm rượu uống rất tốt.

**Lưu ý:** Bài thuốc này còn được dùng cho các trường hợp đau bụng, yếu chân, trẻ con lên 3 tuổi chưa biết đi, con trai âm suy (dương sự bất cử), con gái ngứa âm hộ, đau lưng, tê chân.",Ngũ gia bì,1.0,0.46049882097863526,0.9999999999,1.0,0.40180105909008357
Thuốc nào vừa có tính bình vừa trực tiếp chữa bệnh nôn mửa?,['Không có dữ liệu'],Hệ thống y văn hiện tại chưa ghi nhận dữ liệu về vấn đề này.,"Hương phụ, Đảng sâm",1.0,0.0,0.0,0.0,0.22680628251667095
Thành phần hóa học của a giao (minh giao) gồm những gì?,"['[{""ChuThe"": ""Vị thuốc A giao (Minh giao)"", ""QuanHe"": ""CO_CHUA_HOAT_CHAT"", ""DoiTuong"": ""Hoạt chất Collagen"", ""LieuDung"": ""Chưa ghi nhận"", ""CachDung"": ""Chưa ghi nhận"", ""GhiChu"": ""Không tìm thấy"", ""sort_weight"": 3.0}]']",Thành phần hóa học của **A giao (Minh giao)** có chứa hoạt chất Collagen. Liều dùng và cách dùng của hoạt chất này hiện chưa được ghi nhận.,Collagen,1.0,0.6434526138655113,0.9999999999,1.0,0.6495140604136079
"Để chữa bệnh scocbut, vị thuốc chanh được dùng với liều lượng và cách thức như thế nào?","['[{""ChuThe"": ""Vị thuốc Chanh"", ""QuanHe"": ""CHU_TRI_BENH"", ""DoiTuong"": ""Bệnh Scocbut"", ""LieuDung"": ""Dịch quả chanh"", ""CachDung"": ""Chỉ định lâm sàng"", ""GhiChu"": ""Bệnh scocbut của trẻ em mới đẻ, ở cả người lớn | [Nguồn]: CT_VT_VN_T783"", ""sort_weight"": 3.0}]']","Để chữa bệnh scocbut, **Chanh** được dùng như sau:

*   **Liều dùng và cách dùng:** Dùng dịch quả chanh theo chỉ định lâm sàng. Áp dụng cho bệnh scocbut của trẻ em mới đẻ và người lớn.","Để chữa bệnh scocbut, vị thuốc chanh có liều dùng: Dịch quả chanh và cách dùng: Chỉ định lâm sàng",1.0,0.4411003822795474,0.9999999999,1.0,0.6692493983876172
Kinh mạch nào liên quan đến nhện?,"['[{""ChuThe"": ""Vị thuốc Nhện"", ""QuanHe"": ""QUY_KINH"", ""DoiTuong"": ""Can"", ""LieuDung"": ""Chưa ghi nhận"", ""CachDung"": ""Chưa ghi nhận"", ""GhiChu"": """", ""sort_weight"": 3.0}]']","Dựa trên y văn, vị thuốc **Nhện** quy kinh Can.",Can,1.0,0.6208249885338888,0.9999999999,1.0,0.6682648980377326
Thuốc nào vừa có tính bình vừa trực tiếp chữa bệnh mẩn ngứa?,"['[{""ChuThe"": ""Vị thuốc Khế"", ""QuanHe"": ""Thỏa mãn đồng thời"", ""DoiTuong"": ""Bình và Bệnh Mẩn ngứa"", ""LieuDung"": ""Chưa ghi nhận"", ""CachDung"": ""Chưa ghi nhận"", ""GhiChu"": """"}, {""ChuThe"": ""Vị thuốc Rau má"", ""QuanHe"": ""Thỏa mãn đồng thời"", ""DoiTuong"": ""Bình và Bệnh Mẩn ngứa"", ""LieuDung"": ""Chưa ghi nhận"", ""CachDung"": ""Chưa ghi nhận"", ""GhiChu"": """"}]']","Hệ thống y văn hiện tại ghi nhận thông tin về các vị thuốc có tính bình và có tác dụng với bệnh mẩn ngứa như sau:

*   **Khế**: Thỏa mãn đồng thời tính bình và bệnh mẩn ngứa.
*   **Rau má**: Thỏa mãn đồng thời tính bình và bệnh mẩn ngứa.

Lưu ý: Liều dùng và cách dùng của các vị thuốc này chưa được ghi nhận trong dữ liệu hiện tại.","Khế, Rau má",0.25,0.4304985294677085,0.9999999999,1.0,0.710281294227061
Vị thuốc trinh nữ hoàng cung chứa hoạt chất gì?,"['[{""ChuThe"": ""Vị thuốc Trinh nữ hoàng cung"", ""QuanHe"": ""CO_CHUA_HOAT_CHAT"", ""DoiTuong"": ""Lycorin"", ""LieuDung"": ""Chưa ghi nhận"", ""CachDung"": ""Chưa ghi nhận"", ""GhiChu"": """", ""sort_weight"": 3.0}, {""ChuThe"": ""Vị thuốc Trinh nữ hoàng cung"", ""QuanHe"": ""CO_CHUA_HOAT_CHAT"", ""DoiTuong"": ""Hoạt chất 2 Epilycorin"", ""LieuDung"": ""Chưa ghi nhận"", ""CachDung"": ""Chưa ghi nhận"", ""GhiChu"": """", ""sort_weight"": 3.0}, {""ChuThe"": ""Vị thuốc Trinh nữ hoàng cung"", ""QuanHe"": ""CO_CHUA_HOAT_CHAT"", ""DoiTuong"": ""Hoạt chất 2 Epipancrassidin"", ""LieuDung"": ""Chưa ghi nhận"", ""CachDung"": ""Chưa ghi nhận"", ""GhiChu"": """", ""sort_weight"": 3.0}, {""ChuThe"": ""Vị thuốc Trinh nữ hoàng cung"", ""QuanHe"": ""CO_CHUA_HOAT_CHAT"", ""DoiTuong"": ""Hoạt chất Ambelin"", ""LieuDung"": ""Chưa ghi nhận"", ""CachDung"": ""Chưa ghi nhận"", ""GhiChu"": """", ""sort_weight"": 3.0}, {""ChuThe"": ""Vị thuốc Trinh nữ hoàng cung"", ""QuanHe"": ""CO_CHUA_HOAT_CHAT"", ""DoiTuong"": ""Hoạt chất Crinafolidin"", ""LieuDung"": ""Chưa ghi nhận"", ""CachDung"": ""Chưa ghi nhận"", ""GhiChu"": """", ""sort_weight"": 3.0}, {""ChuThe"": ""Vị thuốc Trinh nữ hoàng cung"", ""QuanHe"": ""CO_CHUA_HOAT_CHAT"", ""DoiTuong"": ""Hoạt chất Crinafolin"", ""LieuDung"": ""Chưa ghi nhận"", ""CachDung"": ""Chưa ghi nhận"", ""GhiChu"": """", ""sort_weight"": 3.0}, {""ChuThe"": ""Vị thuốc Trinh nữ hoàng cung"", ""QuanHe"": ""CO_CHUA_HOAT_CHAT"", ""DoiTuong"": ""Latisodin"", ""LieuDung"": ""Chưa ghi nhận"", ""CachDung"": ""Chưa ghi nhận"", ""GhiChu"": ""Ghosal phân lập được"", ""sort_weight"": 3.0}, {""ChuThe"": ""Vị thuốc Trinh nữ hoàng cung"", ""QuanHe"": ""CO_CHUA_HOAT_CHAT"", ""DoiTuong"": ""Latisolin"", ""LieuDung"": ""Chưa ghi nhận"", ""CachDung"": ""Chưa ghi nhận"", ""GhiChu"": ""Ghosal phân lập được"", ""sort_weight"": 3.0}, {""ChuThe"": ""Vị thuốc Trinh nữ hoàng cung"", ""QuanHe"": ""CO_CHUA_HOAT_CHAT"", ""DoiTuong"": ""Pratorimin"", ""LieuDung"": ""Chưa ghi nhận"", ""CachDung"": ""Chưa ghi nhận"", ""GhiChu"": """", ""sort_weight"": 3.0}, {""ChuThe"": ""Vị thuốc Trinh nữ hoàng cung"", ""QuanHe"": ""CO_CHUA_HOAT_CHAT"", ""DoiTuong"": ""Hoạt chất Pratosin"", ""LieuDung"": ""Chưa ghi nhận"", ""CachDung"": ""Chưa ghi nhận"", ""GhiChu"": """", ""sort_weight"": 3.0}]']","Vị thuốc **Trinh nữ hoàng cung** chứa các hoạt chất sau:

*   Lycorin
*   Hoạt chất 2 Epilycorin
*   Hoạt chất 2 Epipancrassidin
*   Hoạt chất Ambelin
*   Hoạt chất Crinafolidin
*   Hoạt chất Crinafolin
*   Latisodin (Ghosal phân lập được)
*   Latisolin (Ghosal phân lập được)
*   Pratorimin
*   Hoạt chất Pratosin","2 Epilycorin, 2 Epipancrassidin, Ambelin, Crinafolidin, Crinafolin, Pratosin, Latisodin, Latisolin, Lycorin, Pratorimin",1.0,0.5409256807788367,0.9999999999,1.0,0.9653383461443146
"Để chữa bệnh cảm cúm, vị thuốc chanh được dùng với liều lượng và cách thức như thế nào?","['[{""ChuThe"": ""Vị thuốc Chanh"", ""QuanHe"": ""CHU_TRI_BENH"", ""DoiTuong"": ""Bệnh Cảm cúm"", ""LieuDung"": ""Lá chanh, ngọn chanh"", ""CachDung"": ""Nấu nước xông"", ""GhiChu"": ""Cảm cúm | [Nguồn]: CT_VT_VN_T784"", ""sort_weight"": 3.0}]']","Để chữa bệnh cảm cúm, **Chanh** được dùng như sau:

*   **Liều dùng:** Lá chanh, ngọn chanh
*   **Cách dùng:** Nấu nước xông","Để chữa bệnh cảm cúm, vị thuốc chanh có liều dùng: Lá chanh, ngọn chanh và cách dùng: Nấu nước xông",1.0,0.4288174643450408,0.9999999999,1.0,0.993030690851714
Tác dụng dược lý của vối ra sao?,"['[{""ChuThe"": ""Vị thuốc Vối"", ""QuanHe"": ""CO_CHUA_HOAT_CHAT"", ""DoiTuong"": ""Hoạt chất Tinh dầu"", ""LieuDung"": ""Chưa ghi nhận"", ""CachDung"": ""Chưa ghi nhận"", ""GhiChu"": ""Hoạt chất khác chưa rõ.""}, {""ChuThe"": ""Vị thuốc Vối"", ""QuanHe"": ""CO_CHUA_HOAT_CHAT"", ""DoiTuong"": ""Hoạt chất Ancaloit"", ""LieuDung"": ""Chưa ghi nhận"", ""CachDung"": ""Chưa ghi nhận"", ""GhiChu"": ""Hoạt chất khác chưa rõ.""}, {""ChuThe"": ""Vị thuốc Vối"", ""QuanHe"": ""CO_CHUA_HOAT_CHAT"", ""DoiTuong"": ""Hoạt chất Tanin"", ""LieuDung"": ""Chưa ghi nhận"", ""CachDung"": ""Chưa ghi nhận"", ""GhiChu"": ""Hoạt chất khác chưa rõ.""}, {""ChuThe"": ""Vị thuốc Vối"", ""QuanHe"": ""CHU_TRI_BENH"", ""DoiTuong"": ""Bệnh Ghẻ"", ""LieuDung"": ""Tham khảo liều dùng chung của vị thuốc"", ""CachDung"": ""Sắc đặc để rửa"", ""GhiChu"": ""[Nguồn]: CT_VT_VN_T438""}, {""ChuThe"": ""Vị thuốc Vối"", ""QuanHe"": ""CHU_TRI_BENH"", ""DoiTuong"": ""Bệnh Đường ruột"", ""LieuDung"": ""Tham khảo liều dùng chung của vị thuốc"", ""CachDung"": ""Dùng dưới dạng thuốc sắc, thuốc cao hay thuốc viên, hoặc chế dưới dạng muối natri"", ""GhiChu"": ""[Nguồn]: CT_VT_VN_T438""}, {""ChuThe"": ""Vị thuốc Vối"", ""QuanHe"": ""CHU_TRI_BENH"", ""DoiTuong"": ""Bệnh Viêm họng"", ""LieuDung"": ""Tham khảo liều dùng chung của vị thuốc"", ""CachDung"": ""Dùng dưới dạng thuốc sắc, thuốc cao hay thuốc viên, hoặc chế dưới dạng muối natri"", ""GhiChu"": ""[Nguồn]: CT_VT_VN_T438""}, {""ChuThe"": ""Vị thuốc Vối"", ""QuanHe"": ""CHU_TRI_BENH"", ""DoiTuong"": ""Bệnh Mụn nhọt"", ""LieuDung"": ""Tham khảo liều dùng chung của vị thuốc"", ""CachDung"": ""Sắc đặc để rửa"", ""GhiChu"": ""[Nguồn]: CT_VT_VN_T438""}, {""ChuThe"": ""Vị thuốc Vối"", ""QuanHe"": ""CHU_TRI_BENH"", ""DoiTuong"": ""Bệnh Lở loét"", ""LieuDung"": ""Tham khảo liều dùng chung của vị thuốc"", ""CachDung"": ""Sắc đặc để rửa"", ""GhiChu"": ""[Nguồn]: CT_VT_VN_T438""}, {""ChuThe"": ""Vị thuốc Vối"", ""QuanHe"": ""CO_CONG_NANG"", ""DoiTuong"": ""Công năng Ăn uống khó tiêu"", ""LieuDung"": ""Tham khảo liều dùng chung của vị thuốc"", ""CachDung"": ""Nấu với nước để uống"", ""GhiChu"": ""[Nguồn]: CT_VT_VN_T438""}, {""ChuThe"": ""Vị thuốc Vối"", ""QuanHe"": ""CO_TAC_DUNG_DUOC_LY"", ""DoiTuong"": ""Dược lý Khaáng Sinh"", ""LieuDung"": ""Chưa ghi nhận"", ""CachDung"": ""Chưa ghi nhận"", ""GhiChu"": ""Nghiên cứu năm 1968 của Nguyễn Đức Minh."", ""sort_weight"": 3.0}, {""ChuThe"": ""Vị thuốc Vối"", ""QuanHe"": ""CO_TAC_DUNG_DUOC_LY"", ""DoiTuong"": ""Dược lý Độc tính"", ""LieuDung"": ""Chưa ghi nhận"", ""CachDung"": ""Chưa ghi nhận"", ""GhiChu"": """", ""sort_weight"": 3.0}]']","Dược lý của **Vối** được ghi nhận như sau:

*   **Dược lý Kháng sinh:** Nghiên cứu năm 1968 của Nguyễn Đức Minh.
*   **Dược lý Độc tính:** Chưa ghi nhận.","Dược lý Khaáng Sinh, Dược lý Độc",0.6666666666666666,0.5277277828057549,0.9999999999,1.0,0.5233205033414023
Vị thuốc dưa hấu có hoạt chất cucurbitaxin e không?,['Không có dữ liệu'],"Không. Dựa trên dữ liệu y văn hiện tại, không có ghi nhận nào cho thấy dưa hấu có liên quan hoặc tác dụng tới cucurbitaxin e.","Có, vị thuốc dưa hấu có hoạt chất cucurbitaxin e",0.0,0.8583746561828224,0.0,0.0,0.24366272936158245
Vị thuốc bối mẫu tham gia vào bài thuốc để chữa những bệnh gì?,"['[{""ChuThe"": ""Vị thuốc Bối mẫu"", ""QuanHe"": ""Tham gia bài thuốc [Bài thuốc Viêm niêm mạc dạ dày cấp tính Ba đậu] để chữa"", ""DoiTuong"": ""Bệnh Viêm niêm mạc dạ dày cấp tính"", ""LieuDung"": ""Mỗi lần uống $0,20g$, dùng nước ấm mà chiêu."", ""CachDung"": ""Chưa ghi nhận"", ""GhiChu"": """", ""sort_weight"": 3.0}, {""ChuThe"": ""Vị thuốc Bối mẫu"", ""QuanHe"": ""Tham gia bài thuốc [Bài thuốc Đờm không tiết ra được Tiền hồ] để chữa"", ""DoiTuong"": ""Bệnh viêm khí quản"", ""LieuDung"": ""Chưa ghi nhận"", ""CachDung"": ""Chưa ghi nhận"", ""GhiChu"": """", ""sort_weight"": 3.0}, {""ChuThe"": ""Vị thuốc Bối mẫu"", ""QuanHe"": ""Tham gia bài thuốc [Bài thuốc Đờm không tiết ra được Tiền hồ] để chữa"", ""DoiTuong"": ""Triệu chứng Đờm không tiết ra được"", ""LieuDung"": ""Chưa ghi nhận"", ""CachDung"": ""Chưa ghi nhận"", ""GhiChu"": """", ""sort_weight"": 3.0}, {""ChuThe"": ""Vị thuốc Bối mẫu"", ""QuanHe"": ""Tham gia bài thuốc [Bài thuốc Viêm khí quản mạn tính (Tự Uyển)] để chữa"", ""DoiTuong"": ""Bệnh Viêm khí quản mạn tính"", ""LieuDung"": ""Nước $600ml$ sắc còn $200ml$"", ""CachDung"": ""Chia làm 3 lần uống trong ngày"", ""GhiChu"": """", ""sort_weight"": 3.0}, {""ChuThe"": ""Vị thuốc Bối mẫu"", ""QuanHe"": ""Tham gia bài thuốc [Bài thuốc Hổ khoán đằng hòa] để chữa"", ""DoiTuong"": ""Triệu chứng Ho"", ""LieuDung"": ""$6-12g$ hỗn hợp"", ""CachDung"": ""Thêm nước $500ml$, đun sôi. Giữ sôi trong $3$ phút. Chia nhiều lần uống trong ngày"", ""GhiChu"": ""CT_VT_VN_T795"", ""sort_weight"": 3.0}, {""ChuThe"": ""Vị thuốc Bối mẫu"", ""QuanHe"": ""Tham gia bài thuốc [Bài thuốc Bạch Đới Duyên Hoắc Sắc] để chữa"", ""DoiTuong"": ""Bệnh Bạch đới"", ""LieuDung"": ""Chưa ghi nhận"", ""CachDung"": ""Ngày uống $4$g chia làm $2$ lần. Uống với nước cơm"", ""GhiChu"": """", ""sort_weight"": 3.0}, {""ChuThe"": ""Vị thuốc Bối mẫu"", ""QuanHe"": ""Tham gia bài thuốc [Bài thuốc Ho khan hen suyễn kỷ tử] để chữa"", ""DoiTuong"": ""Bệnh Ho khan"", ""LieuDung"": ""Chưa ghi nhận"", ""CachDung"": ""Chưa ghi nhận"", ""GhiChu"": """", ""sort_weight"": 3.0}, {""ChuThe"": ""Vị thuốc Bối mẫu"", ""QuanHe"": ""Tham gia bài thuốc [Bài thuốc Ho khan hen suyễn kỷ tử] để chữa"", ""DoiTuong"": ""Bệnh Hen suyễn"", ""LieuDung"": ""Chưa ghi nhận"", ""CachDung"": ""Chưa ghi nhận"", ""GhiChu"": """", ""sort_weight"": 3.0}, {""ChuThe"": ""Vị thuốc Xuyên bối mẫu"", ""QuanHe"": ""Tham gia bài thuốc [Bài thuốc Rắn cắn] để chữa"", ""DoiTuong"": ""Bệnh Răng cắn"", ""LieuDung"": ""Ngày $50ml$ rượu hội này, sau đó cứ cách 5 đến 10 phút lại uống 1 lần. Một ngày tối đa uống $150ml$ đến $200ml$."", ""CachDung"": ""Tất cả các vị thuốc tán nhỏ, ngâm với $1,5$ lít rượu $35-40$° trong 10 ngày, lấy ra cho uống. Nếu cần ngay có thể đun cách thủy trong 4 giờ, hoặc nếu cấp cứu thì nấu sôi trong bình có ống lạnh thẳng đứng trong 1 giờ là đem ra dùng được. Ngoài việc uống rượu hội còn dùng bông thấm rượu hội xoa và băng nhẹ vào vết cắn để lấy nọc ra. Tiếp tục ngày nào cũng uống cho đến khi hết đau nhức"", ""GhiChu"": """"}]']","Vị thuốc **Bối mẫu** tham gia vào các bài thuốc để chữa các bệnh sau:

*   Bệnh Viêm niêm mạc dạ dày cấp tính: Tham gia bài thuốc **Viêm niêm mạc dạ dày cấp tính Ba đậu**. Liều dùng mỗi lần 0,20g, dùng nước ấm mà chiêu.
*   Bệnh viêm khí quản và triệu chứng Đờm không tiết ra được: Tham gia bài thuốc **Đờm không tiết ra được Tiền hồ**.
*   Bệnh Viêm khí quản mạn tính: Tham gia bài thuốc **Viêm khí quản mạn tính (Tự Uyển)**. Liều dùng nước 600ml sắc còn 200ml, chia làm 3 lần uống trong ngày.
*   Triệu chứng Ho: Tham gia bài thuốc **Hổ khoán đằng hòa**. Liều dùng 6-12g hỗn hợp, thêm nước 500ml, đun sôi. Giữ sôi trong 3 phút. Chia nhiều lần uống trong ngày.
*   Bệnh Bạch đới: Tham gia bài thuốc **Bạch Đới Duyên Hoắc Sắc**. Ngày uống 4g chia làm 2 lần. Uống với nước cơm.
*   Bệnh Ho khan và bệnh Hen suyễn: Tham gia bài thuốc **Ho khan hen suyễn kỷ tử**.

**Thông tin tham khảo thêm:**

*   Đối với bệnh Răng cắn: Vị thuốc **Xuyên bối mẫu** tham gia bài thuốc **Rắn cắn**. Liều dùng ngày 50ml rượu hội này, sau đó cứ cách 5 đến 10 phút lại uống 1 lần. Một ngày tối đa uống 150ml đến 200ml. Cách dùng: Tất cả các vị thuốc tán nhỏ, ngâm với 1,5 lít rượu 35-40° trong 10 ngày, lấy ra cho uống. Nếu cần ngay có thể đun cách thủy trong 4 giờ, hoặc nếu cấp cứu thì nấu sôi trong bình có ống lạnh thẳng đứng trong 1 giờ là đem ra dùng được. Ngoài việc uống rượu hội còn dùng bông thấm rượu hội xoa và băng nhẹ vào vết cắn để lấy nọc ra. Tiếp tục ngày nào cũng uống cho đến khi hết đau nhức.","Bạch đới, Hen suyễn, Ho khan, Viêm khí quản mạn, Viêm niêm mạc dạ dày cấp, Viêm khí quản, Ho, Đờm không tiết ra được",1.0,0.5480608048416084,0.9999999999,1.0,0.49156385482787746
Vị thuốc mật lợn có hoạt chất glycocholat không?,['Không có dữ liệu'],"Không. Dựa trên dữ liệu y văn hiện tại, không có ghi nhận nào cho thấy mật lợn có liên quan hoặc tác dụng tới glycocholat.","Có, vị thuốc mật lợn có hoạt chất glycocholat",0.0,0.8264139003105077,0.0,0.0,0.24231969576119958
"Để chữa bệnh gân xương đau nhức, vị thuốc lộc giác được dùng với liều lượng và cách thức như thế nào?","['[{""ChuThe"": ""Vị thuốc Lộc giác"", ""QuanHe"": ""CHU_TRI_BENH"", ""DoiTuong"": ""Bệnh Gân xương đau nhức"", ""LieuDung"": ""Ngày uống 2 lần, mỗi lần $4$ g"", ""CachDung"": ""Tán nhỏ"", ""GhiChu"": ""Lộc giác thiên tồn tính (ra than còn màu đen)"", ""sort_weight"": 3.0}]']","Để chữa bệnh gân xương đau nhức, bạn có thể dùng vị thuốc **Lộc giác** theo hướng dẫn sau:

*   **Liều dùng:** Ngày uống 2 lần, mỗi lần 4 g.
*   **Cách dùng:** Tán nhỏ.
*   **Lưu ý:** Nên dùng Lộc giác thiên tồn tính (ra than còn màu đen).","Để chữa bệnh gân xương đau nhức, vị thuốc lộc giác có liều dùng: Ngày uống 2 lần, mỗi lần 4 g và cách dùng: Tán nhỏ",1.0,0.5925401498324353,0.9999999999,1.0,0.8815472928763065
Vị thuốc tục tùy tử chứa hoạt chất gì?,"['[{""ChuThe"": ""Vị thuốc Tục Tùy Tử"", ""QuanHe"": ""CO_CHUA_HOAT_CHAT"", ""DoiTuong"": ""Hoạt chất Aesculin"", ""LieuDung"": ""Chưa ghi nhận"", ""CachDung"": ""Chưa ghi nhận"", ""GhiChu"": """", ""sort_weight"": 3.0}, {""ChuThe"": ""Vị thuốc Tục Tùy Tử"", ""QuanHe"": ""CO_CHUA_HOAT_CHAT"", ""DoiTuong"": ""Hoạt chất Biaesculetin"", ""LieuDung"": ""Chưa ghi nhận"", ""CachDung"": ""Chưa ghi nhận"", ""GhiChu"": """", ""sort_weight"": 3.0}, {""ChuThe"": ""Vị thuốc Tục Tùy Tử"", ""QuanHe"": ""CO_CHUA_HOAT_CHAT"", ""DoiTuong"": ""Hoạt chất Daphnetin"", ""LieuDung"": ""Chưa ghi nhận"", ""CachDung"": ""Chưa ghi nhận"", ""GhiChu"": """", ""sort_weight"": 3.0}, {""ChuThe"": ""Vị thuốc Tục Tùy Tử"", ""QuanHe"": ""CO_CHUA_HOAT_CHAT"", ""DoiTuong"": ""Hoạt chất Daphnin"", ""LieuDung"": ""Chưa ghi nhận"", ""CachDung"": ""Chưa ghi nhận"", ""GhiChu"": """", ""sort_weight"": 3.0}, {""ChuThe"": ""Vị thuốc Tục Tùy Tử"", ""QuanHe"": ""CO_CHUA_HOAT_CHAT"", ""DoiTuong"": ""Hoạt chất Euphorbiasteroit"", ""LieuDung"": ""Chưa ghi nhận"", ""CachDung"": ""Chưa ghi nhận"", ""GhiChu"": """", ""sort_weight"": 3.0}]']","Vị thuốc **Tục Tùy Tử** chứa các hoạt chất sau:

*   Aesculin
*   Biaesculetin
*   Daphnetin
*   Daphnin
*   Euphorbiasteroit","Aesculin, Biaesculetin, Daphnetin, Daphnin, Euphorbiasteroit",1.0,0.5749840220633387,0.9999999999,1.0,0.9773248751315198
Thuốc nào vừa có tính hàn vừa trực tiếp chữa bệnh viêm dạ dày?,"['[{""ChuThe"": ""Vị thuốc Hoàng liên"", ""QuanHe"": ""Thỏa mãn đồng thời"", ""DoiTuong"": ""Hàn và Bệnh Viêm dạ dày"", ""LieuDung"": ""Chưa ghi nhận"", ""CachDung"": ""Chưa ghi nhận"", ""GhiChu"": """"}, {""ChuThe"": ""Vị thuốc Cung cộng"", ""QuanHe"": ""Thỏa mãn đồng thời"", ""DoiTuong"": ""Hàn và Bệnh Viêm dạ dày"", ""LieuDung"": ""Chưa ghi nhận"", ""CachDung"": ""Chưa ghi nhận"", ""GhiChu"": """"}]']","Hệ thống y văn hiện tại ghi nhận các vị thuốc có tính hàn và được dùng cho bệnh viêm dạ dày như sau:

**Dữ liệu chính xác:**

Hiện tại y văn chưa ghi nhận phương án trực tiếp về vị thuốc vừa có tính hàn vừa trực tiếp chữa bệnh viêm dạ dày. Tuy nhiên, đối với các trường hợp liên quan, bạn có thể tham khảo các vị thuốc sau:

**Thông tin tham khảo thêm:**

*   **Vị thuốc Hoàng liên**: Thỏa mãn đồng thời tính hàn và bệnh viêm dạ dày.
*   **Vị thuốc Cung cộng**: Thỏa mãn đồng thời tính hàn và bệnh viêm dạ dày.

Lưu ý: Liều dùng và cách dùng của các vị thuốc trên chưa được ghi nhận trong dữ liệu y văn hiện tại. Bạn nên tham khảo ý kiến của thầy thuốc trước khi sử dụng.","Cung cộng, Hoàng liên",0.7142857142857143,0.0,0.9999999999,1.0,0.4268836831561708
Thuốc nào vừa có tính ôn vừa trực tiếp chữa bệnh sốt?,"['[{""ChuThe"": ""Vị thuốc Thạch tín"", ""QuanHe"": ""Thỏa mãn đồng thời"", ""DoiTuong"": ""Ôn và Công năng Trị sốt rét"", ""LieuDung"": ""Chưa ghi nhận"", ""CachDung"": ""Chưa ghi nhận"", ""GhiChu"": """"}, {""ChuThe"": ""Vị thuốc Sơn thù du"", ""QuanHe"": ""Thỏa mãn đồng thời"", ""DoiTuong"": ""Ôn và Bệnh Sốt rét"", ""LieuDung"": ""Chưa ghi nhận"", ""CachDung"": ""Chưa ghi nhận"", ""GhiChu"": """"}, {""ChuThe"": ""Vị thuốc Hạt sen"", ""QuanHe"": ""Thỏa mãn đồng thời"", ""DoiTuong"": ""Ôn và Bệnh Sốt"", ""LieuDung"": ""Chưa ghi nhận"", ""CachDung"": ""Chưa ghi nhận"", ""GhiChu"": """"}, {""ChuThe"": ""Vị thuốc Hạt sen"", ""QuanHe"": ""Thỏa mãn đồng thời"", ""DoiTuong"": ""Công năng Ôn trung và Bệnh Sốt"", ""LieuDung"": ""Chưa ghi nhận"", ""CachDung"": ""Chưa ghi nhận"", ""GhiChu"": """"}, {""ChuThe"": ""Vị thuốc Riềng"", ""QuanHe"": ""Thỏa mãn đồng thời"", ""DoiTuong"": ""Ôn và Bệnh Sốt"", ""LieuDung"": ""Chưa ghi nhận"", ""CachDung"": ""Chưa ghi nhận"", ""GhiChu"": """"}, {""ChuThe"": ""Vị thuốc Riềng"", ""QuanHe"": ""Thỏa mãn đồng thời"", ""DoiTuong"": ""Công năng Ôn trung tán hàn và Bệnh Sốt"", ""LieuDung"": ""Chưa ghi nhận"", ""CachDung"": ""Chưa ghi nhận"", ""GhiChu"": """"}, {""ChuThe"": ""Vị thuốc Tía tô"", ""QuanHe"": ""Thỏa mãn đồng thời"", ""DoiTuong"": ""Ôn và Bệnh Sốt"", ""LieuDung"": ""Chưa ghi nhận"", ""CachDung"": ""Chưa ghi nhận"", ""GhiChu"": """"}, {""ChuThe"": ""Vị thuốc Kinh giới"", ""QuanHe"": ""Thỏa mãn đồng thời"", ""DoiTuong"": ""Ôn và Triệu chứng Phát sốt"", ""LieuDung"": ""Chưa ghi nhận"", ""CachDung"": ""Chưa ghi nhận"", ""GhiChu"": """"}, {""ChuThe"": ""Vị thuốc Thỏ ty tử"", ""QuanHe"": ""Thỏa mãn đồng thời"", ""DoiTuong"": ""Ôn và Bệnh Sốt khát nước"", ""LieuDung"": ""Chưa ghi nhận"", ""CachDung"": ""Chưa ghi nhận"", ""GhiChu"": """"}, {""ChuThe"": ""Vị thuốc Ngải cứu"", ""QuanHe"": ""Thỏa mãn đồng thời"", ""DoiTuong"": ""Ôn và Bệnh Sốt rét"", ""LieuDung"": ""Chưa ghi nhận"", ""CachDung"": ""Chưa ghi nhận"", ""GhiChu"": """"}, {""ChuThe"": ""Vị thuốc Ngải cứu"", ""QuanHe"": ""Thỏa mãn đồng thời"", ""DoiTuong"": ""Công năng Ôn khí huyết và Bệnh Sốt rét"", ""LieuDung"": ""Chưa ghi nhận"", ""CachDung"": ""Chưa ghi nhận"", ""GhiChu"": """"}]']","Dựa trên y văn, các vị thuốc có tính ôn và được dùng để chữa bệnh sốt bao gồm:

*   **Sơn thù du**: Ôn và trị bệnh sốt rét.
*   **Hạt sen**: Ôn và trị bệnh sốt.
*   **Riềng**: Ôn và trị bệnh sốt.
*   **Tía tô**: Ôn và trị bệnh sốt.
*   **Thỏ ty tử**: Ôn và trị bệnh sốt khát nước.
*   **Ngải cứu**: Ôn và trị bệnh sốt rét.

Lưu ý: Liều dùng và cách dùng của các vị thuốc này chưa được ghi nhận trong dữ liệu y văn hiện tại.","Hạt sen, Riềng, Tía tô",1.0,0.6429564908712944,0.9999999999,1.0,0.6155378778108234
Bệnh nào có thể chữa bằng bài thuốc chứa nhân trần?,"['[{""ChuThe"": ""Vị thuốc Nhân trần"", ""QuanHe"": ""Tham gia bài thuốc [Bài thuốc Hoàng đản tiểu tiện khó khăn dành dành] để chữa"", ""DoiTuong"": ""Bệnh Hoàng đản"", ""LieuDung"": ""Chưa ghi nhận"", ""CachDung"": ""Chưa ghi nhận"", ""GhiChu"": """", ""sort_weight"": 3.0}, {""ChuThe"": ""Vị thuốc Nhân trần"", ""QuanHe"": ""Tham gia bài thuốc [Bài thuốc Vàng mật dành dành] để chữa"", ""DoiTuong"": ""Bệnh Vàng da"", ""LieuDung"": ""Chưa ghi nhận"", ""CachDung"": ""Chưa ghi nhận"", ""GhiChu"": """", ""sort_weight"": 3.0}, {""ChuThe"": ""Vị thuốc Nhân trần"", ""QuanHe"": ""Tham gia bài thuốc [Bài thuốc Vàng mật dành dành] để chữa"", ""DoiTuong"": ""Bệnh Viêm gan"", ""LieuDung"": ""Chưa ghi nhận"", ""CachDung"": ""Chưa ghi nhận"", ""GhiChu"": """", ""sort_weight"": 3.0}, {""ChuThe"": ""Vị thuốc Nhân trần"", ""QuanHe"": ""Tham gia bài thuốc [Bài thuốc Vàng mật dành dành] để chữa"", ""DoiTuong"": ""Triệu chứng Vàng mắt"", ""LieuDung"": ""Chưa ghi nhận"", ""CachDung"": ""Chưa ghi nhận"", ""GhiChu"": """", ""sort_weight"": 3.0}, {""ChuThe"": ""Vị thuốc Nhân trần"", ""QuanHe"": ""Tham gia bài thuốc [Bài thuốc Viêm gan truyền nhiễm dành dành] để chữa"", ""DoiTuong"": ""Bệnh Viêm gan truyền nhiễm"", ""LieuDung"": ""Chưa ghi nhận"", ""CachDung"": ""Chưa ghi nhận"", ""GhiChu"": """", ""sort_weight"": 3.0}, {""ChuThe"": ""Vị thuốc Nhân trần"", ""QuanHe"": ""Tham gia bài thuốc [Bài thuốc Viêm gan mạn tính (Sim)] để chữa"", ""DoiTuong"": ""Bệnh Viêm gan mạn tính"", ""LieuDung"": ""Chưa ghi nhận"", ""CachDung"": ""Chưa ghi nhận"", ""GhiChu"": """", ""sort_weight"": 3.0}, {""ChuThe"": ""Vị thuốc Nhân trần"", ""QuanHe"": ""Tham gia bài thuốc [Bài thuốc Bụng Đầy Vàng Da] để chữa"", ""DoiTuong"": ""Bệnh Sốt Vàng Da"", ""LieuDung"": ""Chưa ghi nhận"", ""CachDung"": ""Chưa ghi nhận"", ""GhiChu"": """", ""sort_weight"": 3.0}, {""ChuThe"": ""Vị thuốc Nhân trần"", ""QuanHe"": ""Tham gia bài thuốc [Bài thuốc Bụng Đầy Vàng Da] để chữa"", ""DoiTuong"": ""Triệu chứng Miệng khô"", ""LieuDung"": ""Chưa ghi nhận"", ""CachDung"": ""Chưa ghi nhận"", ""GhiChu"": """", ""sort_weight"": 3.0}, {""ChuThe"": ""Vị thuốc Nhân trần"", ""QuanHe"": ""Tham gia bài thuốc [Bài thuốc Bụng Đầy Vàng Da] để chữa"", ""DoiTuong"": ""Triệu chứng Bụng đầy"", ""LieuDung"": ""Chưa ghi nhận"", ""CachDung"": ""Chưa ghi nhận"", ""GhiChu"": """", ""sort_weight"": 3.0}, {""ChuThe"": ""Vị thuốc Nhân trần"", ""QuanHe"": ""Tham gia bài thuốc [Bệnh Hoàng đản (Sâm cau)] để chữa"", ""DoiTuong"": ""Bệnh Hoàng đản"", ""LieuDung"": ""Chưa ghi nhận"", ""CachDung"": ""Sắc uống"", ""GhiChu"": ""CT_VT_VN_T928"", ""sort_weight"": 3.0}]']","Dựa trên y văn, vị thuốc **Nhân trần** có thể tham gia vào các bài thuốc để chữa các bệnh sau:

*   Bệnh Hoàng đản (trong bài thuốc **Hoàng đản tiểu tiện khó khăn dành dành** và bài thuốc **Bệnh Hoàng đản (Sâm cau)**, cách dùng: Sắc uống, CT\_VT\_VN\_T928).
*   Bệnh Vàng da (trong bài thuốc **Vàng mật dành dành**).
*   Bệnh Viêm gan (trong bài thuốc **Vàng mật dành dành**).
*   Triệu chứng Vàng mắt (trong bài thuốc **Vàng mật dành dành**).
*   Bệnh Viêm gan truyền nhiễm (trong bài thuốc **Viêm gan truyền nhiễm dành dành**).
*   Bệnh Viêm gan mạn tính (trong bài thuốc **Viêm gan mạn tính (Sim)**).
*   Bệnh Sốt Vàng Da (trong bài thuốc **Bụng Đầy Vàng Da**).
*   Triệu chứng Miệng khô (trong bài thuốc **Bụng Đầy Vàng Da**).
*   Triệu chứng Bụng đầy (trong bài thuốc **Bụng Đầy Vàng Da**).","Hoàng đản, Sốt Vàng Da, Viêm gan, Viêm gan mạn, Viêm gan truyền nhiễm, Vàng da, Bụng đầy, Miệng khô, Vàng mắt",1.0,0.6198438522747715,0.9999999999,1.0,0.895313240509147
Bệnh nào có thể chữa bằng bài thuốc chứa sắn dây?,"['[{""ChuThe"": ""Vị thuốc Sắn dây"", ""QuanHe"": ""Tham gia bài thuốc [Bài thuốc Cảm mạo sốt Sắn dây] để chữa"", ""DoiTuong"": ""Triệu chứng Cảm mạo sốt"", ""LieuDung"": ""Chưa ghi nhận"", ""CachDung"": ""Chưa ghi nhận"", ""GhiChu"": """", ""sort_weight"": 3.0}, {""ChuThe"": ""Vị thuốc Sắn dây"", ""QuanHe"": ""Tham gia bài thuốc [Bài thuốc Ho tía tô dại] để chữa"", ""DoiTuong"": ""Triệu chứng Ho"", ""LieuDung"": ""Chưa ghi nhận"", ""CachDung"": ""Sắc uống"", ""GhiChu"": """", ""sort_weight"": 3.0}, {""ChuThe"": ""Vị thuốc Sắn dây"", ""QuanHe"": ""Tham gia bài thuốc [Bài thuốc Ho tía tô dại] để chữa"", ""DoiTuong"": ""Cam Cum"", ""LieuDung"": ""Chưa ghi nhận"", ""CachDung"": ""Sắc uống"", ""GhiChu"": """", ""sort_weight"": 3.0}, {""ChuThe"": ""Vị thuốc Sắn dây"", ""QuanHe"": ""Tham gia bài thuốc [Bài thuốc Ho tía tô dại] để chữa"", ""DoiTuong"": ""Triệu chứng Sốt"", ""LieuDung"": ""Chưa ghi nhận"", ""CachDung"": ""Sắc uống"", ""GhiChu"": """", ""sort_weight"": 3.0}]']","Dựa trên y văn, **Sắn dây** có thể được dùng trong các bài thuốc để chữa:

*   Triệu chứng Cảm mạo sốt (trong bài thuốc **Cảm mạo sốt Sắn dây**)
*   Triệu chứng Ho, cảm cúm, triệu chứng Sốt (trong bài thuốc **Ho tía tô dại**, sắc uống).","Cam Cum, Cảm mạo sốt, Ho, Sốt",1.0,0.6357734665635614,0.9999999999,1.0,0.6950044684311945
Bệnh băng trung có thể dùng vị thuốc hoặc bài thuốc nào để chữa?,"['[{""ChuThe"": ""Bệnh Băng trung"", ""QuanHe"": ""Được chữa bằng (ViThuoc)"", ""DoiTuong"": ""Vị thuốc Mộc tặc"", ""LieuDung"": ""Tham khảo liều dùng chung của vị thuốc"", ""CachDung"": ""Chỉ định lâm sàng theo kinh nghiệm"", ""GhiChu"": ""Mắt đau chảy nước mắt, trĩ, huyết lỵ, băng trung | Mộc tặc | Chỉ định lâm sàng theo kinh nghiệm | [Nguồn]: CT_VT_VN_T258"", ""sort_weight"": 3.0}]']","Dựa trên y văn, đối với bệnh băng trung, có thể sử dụng **Mộc tặc** để điều trị.

*   **Vị thuốc:** **Mộc tặc**.
    *   **Liều dùng:** Tham khảo liều dùng chung của vị thuốc.
    *   **Cách dùng:** Chỉ định lâm sàng theo kinh nghiệm.
    *   **Chỉ định:** Mắt đau chảy nước mắt, trĩ, huyết lỵ, băng trung.",Mộc tặc,1.0,0.4379860453665719,0.9999999999,1.0,0.7151747011857799
Thuốc nào vừa có tính hàn vừa trực tiếp chữa bệnh bướu cổ?,"['[{""ChuThe"": ""Vị thuốc Rong mỡ"", ""QuanHe"": ""Thỏa mãn đồng thời"", ""DoiTuong"": ""Hàn và Bệnh Bướu cổ"", ""LieuDung"": ""Chưa ghi nhận"", ""CachDung"": ""Chưa ghi nhận"", ""GhiChu"": """"}, {""ChuThe"": ""Vị thuốc Côn bố"", ""QuanHe"": ""Thỏa mãn đồng thời"", ""DoiTuong"": ""Hàn và Bệnh Bướu cổ"", ""LieuDung"": ""Chưa ghi nhận"", ""CachDung"": ""Chưa ghi nhận"", ""GhiChu"": """"}]']","Hệ thống y văn hiện tại ghi nhận các vị thuốc có tính hàn và được dùng cho bệnh bướu cổ như sau:

*   **Rong mỡ**: Chưa ghi nhận liều dùng và cách dùng cụ thể.
*   **Côn bố**: Chưa ghi nhận liều dùng và cách dùng cụ thể.","Côn bố, Rong mỡ",1.0,0.0,0.9999999999,1.0,0.6499221142960228
Vị thuốc quy bản và cao quy bản tham gia vào bài thuốc để chữa những bệnh gì?,"['[{""ChuThe"": ""Vị thuốc Quy bản"", ""QuanHe"": ""Tham gia bài thuốc [Bài thuốc Tim Yếu Tắc Kè] để chữa"", ""DoiTuong"": ""Bệnh Tim yếu"", ""LieuDung"": ""Ngày uống 3 lần, mỗi lần 1 đến 2 viên"", ""CachDung"": ""Tắc kè một đôi bỏ đầu, chân, sấy khô tán nhỏ, đảng sâm $20g$, quy bản nướng tán bột $20g$, bắc sa nhân $20g$ tán bột. Tất cả trộn đều. Thêm vị táo đỏ và giã nát làm thành viên, mỗi viên nặng $1g$. Ngày uống 3 lần, mỗi lần 1 đến 2 viên, nhai và dùng nước mà chiêu thuốc"", ""GhiChu"": ""Ho lao, già mà ho nhiều đờm, tim yếu. CT_VT_VN_T971"", ""sort_weight"": 3.0}, {""ChuThe"": ""Vị thuốc Quy bản"", ""QuanHe"": ""Tham gia bài thuốc [Bài thuốc Tim Yếu Tắc Kè] để chữa"", ""DoiTuong"": ""Bệnh Hư lao"", ""LieuDung"": ""Ngày uống 3 lần, mỗi lần 1 đến 2 viên"", ""CachDung"": ""Tắc kè một đôi bỏ đầu, chân, sấy khô tán nhỏ, đảng sâm $20g$, quy bản nướng tán bột $20g$, bắc sa nhân $20g$ tán bột. Tất cả trộn đều. Thêm vị táo đỏ và giã nát làm thành viên, mỗi viên nặng $1g$. Ngày uống 3 lần, mỗi lần 1 đến 2 viên, nhai và dùng nước mà chiêu thuốc"", ""GhiChu"": ""Ho lao, già mà ho nhiều đờm, tim yếu. CT_VT_VN_T971"", ""sort_weight"": 3.0}, {""ChuThe"": ""Vị thuốc Quy bản"", ""QuanHe"": ""Tham gia bài thuốc [Bài thuốc Tim Yếu Tắc Kè] để chữa"", ""DoiTuong"": ""Triệu chứng Ho nhiều đờm"", ""LieuDung"": ""Ngày uống 3 lần, mỗi lần 1 đến 2 viên"", ""CachDung"": ""Tắc kè một đôi bỏ đầu, chân, sấy khô tán nhỏ, đảng sâm $20g$, quy bản nướng tán bột $20g$, bắc sa nhân $20g$ tán bột. Tất cả trộn đều. Thêm vị táo đỏ và giã nát làm thành viên, mỗi viên nặng $1g$. Ngày uống 3 lần, mỗi lần 1 đến 2 viên, nhai và dùng nước mà chiêu thuốc"", ""GhiChu"": ""Ho lao, già mà ho nhiều đờm, tim yếu. CT_VT_VN_T971"", ""sort_weight"": 3.0}, {""ChuThe"": ""Vị thuốc Quy bản và Cao quy bản"", ""QuanHe"": ""Tham gia bài thuốc [Bài thuốc Ho lâu ngày quy bản] để chữa"", ""DoiTuong"": ""Triệu chứng Ho lâu ngày"", ""LieuDung"": ""Chưa ghi nhận"", ""CachDung"": ""Hai vị trộn đều, ngày uống 3 lần mỗi lần $1-2g$"", ""GhiChu"": ""[Nguồn]: CT_VT_VN_T1019""}, {""ChuThe"": ""Vị thuốc Quy bản và Cao quy bản"", ""QuanHe"": ""Tham gia bài thuốc [Bài thuốc Sốt rét lâu ngày quy bản] để chữa"", ""DoiTuong"": ""Bệnh Sốt rét lâu ngày"", ""LieuDung"": ""Chưa ghi nhận"", ""CachDung"": ""Trộn đều thêm mật ong làm thành viên $0,30g$. Ngày uống $5-10g$ chia 3 lần uống trong ngày"", ""GhiChu"": ""[Nguồn]: CT_VT_VN_T1019""}]']","Vị thuốc **Quy bản** và **Cao quy bản** tham gia vào bài thuốc để chữa:

*   Triệu chứng **Ho lâu ngày**: dùng bài thuốc **Ho lâu ngày quy bản**, hai vị trộn đều, ngày uống 3 lần mỗi lần 1-2g.
*   Bệnh **Sốt rét lâu ngày**: dùng bài thuốc **Sốt rét lâu ngày quy bản**, trộn đều thêm mật ong làm thành viên 0,30g. Ngày uống 5-10g chia 3 lần uống trong ngày.","Sốt rét lâu ngày, Ho lâu ngày",1.0,0.5393192176940366,0.9999999999,1.0,0.47090522289762793
Vị thuốc củ gió có hoạt chất palmatin không?,['Không có dữ liệu'],"Không. Dựa trên dữ liệu y văn hiện tại, không có ghi nhận nào cho thấy củ gió có liên quan hoặc tác dụng tới palmatin.","Có, vị thuốc củ gió có hoạt chất palmatin",0.0,0.858528104842039,0.0,0.0,0.24018543423776584
"Để chữa bệnh trĩ, vị thuốc mướp được dùng với liều lượng và cách thức như thế nào?","['[{""ChuThe"": ""Vị thuốc Mướp"", ""QuanHe"": ""CHU_TRI_BENH"", ""DoiTuong"": ""Bệnh Trĩ"", ""LieuDung"": ""$2$g"", ""CachDung"": ""Mỗi lần cho uống $2$g, ngày 3 lần"", ""GhiChu"": ""Xơ mướp thiêu tồn tính, tán bột"", ""sort_weight"": 3.0}]']","Để chữa bệnh trĩ, bạn có thể sử dụng **Mướp** theo hướng dẫn sau:

*   **Liều dùng:** Mỗi lần uống 2g.
*   **Cách dùng:** Ngày uống 3 lần.
*   **Lưu ý:** Sử dụng xơ mướp thiêu tồn tính, tán bột.","Để chữa bệnh trĩ, vị thuốc mướp có liều dùng: 2g và cách dùng: Mỗi lần cho uống 2g, ngày 3 lần",1.0,0.45493001935122956,0.9999999999,1.0,0.8682108485028223
Bệnh nào có thể chữa bằng bài thuốc chứa rễ bưởi bung?,"['[{""ChuThe"": ""Vị thuốc Rễ bưởi bung"", ""QuanHe"": ""Tham gia bài thuốc [Bài thuốc Đau nhức chân tay lá lốt] để chữa"", ""DoiTuong"": ""Bệnh Đau nhức chân tay"", ""LieuDung"": ""Chưa ghi nhận"", ""CachDung"": ""Sắc với $600ml$ nước, cô còn $200ml$, chia 3 lần uống trong ngày"", ""GhiChu"": """", ""sort_weight"": 3.0}]']","**Rễ bưởi bung** tham gia bài thuốc **Bài thuốc Đau nhức chân tay lá lốt** để chữa bệnh đau nhức chân tay. Cách dùng như sau: Sắc với 600ml nước, cô còn 200ml, chia 3 lần uống trong ngày.",Đau nhức chân tay,1.0,0.6459708337432248,0.9999999999,1.0,0.5060403628643861
Vị thuốc huyền hồ sách có chứa hoạt chất epo betulinic axit 3 o b d glucopyranozit không?,['Không có dữ liệu'],"Không. Dựa trên dữ liệu y văn hiện tại, không có ghi nhận nào cho thấy huyền hồ sách có liên quan hoặc tác dụng tới epo betulinic axit 3 o b d glucopyranozit.","Không, vị thuốc huyền hồ sách không chứa hoạt chất epo betulinic axit 3 o b d glucopyranozit",0.5,0.9097414154067905,0.9999999999,1.0,0.7452531820646083
"Để chữa bệnh băng huyết, vị thuốc phục long can được dùng với liều lượng và cách thức như thế nào?","['[{""ChuThe"": ""Vị thuốc Phục long can"", ""QuanHe"": ""CHU_TRI_BENH"", ""DoiTuong"": ""Bệnh Băng huyết"", ""LieuDung"": ""Tham khảo liều dùng chung của vị thuốc"", ""CachDung"": ""Không rõ"", ""GhiChu"": ""CT_VT_VN_T1063"", ""sort_weight"": 3.0}]']","Để chữa bệnh băng huyết, **Phục long can** được dùng với liều lượng tham khảo liều dùng chung của vị thuốc. Cách dùng của vị thuốc này hiện chưa được ghi nhận.","Để chữa bệnh băng huyết, vị thuốc phục long can có liều dùng: Tham khảo liều dùng chung của vị thuốc và cách dùng: Không rõ",1.0,0.0,0.9999999999,1.0,0.9808034129046103
"Để chữa bệnh chai chân, vị thuốc chai chân cỏ trói gà được dùng với liều lượng và cách thức như thế nào?","['[{""ChuThe"": ""Bài thuốc Chai chân Cỏ trói gà"", ""QuanHe"": ""CHU_TRI_BENH"", ""DoiTuong"": ""Bệnh Chai chân"", ""LieuDung"": ""Cây [Cỏ trói gà] ngâm trong $3phần$ rượu"", ""CachDung"": ""Chưa ghi nhận"", ""GhiChu"": ""Chỉ định lâm sàng theo kinh nghiệm | [Nguồn]: CT_VT_VN_T725"", ""sort_weight"": 3.0}]']","Để chữa bệnh chai chân, bạn có thể tham khảo bài thuốc sau:

*   **Bài thuốc Chai chân Cỏ trói gà**: Sử dụng cây **Cỏ trói gà** ngâm trong 3 phần rượu. Đây là chỉ định lâm sàng theo kinh nghiệm được ghi nhận trong y văn.","Để chữa bệnh chai chân, vị thuốc chai chân cỏ trói gà có liều dùng: Cây [Cỏ trói gà] ngâm trong 3phần rượu và cách dùng: Theo chỉ định",1.0,0.5271755299509266,0.9999999999,1.0,0.8004392026743165
Vị thuốc tô mộc có vị gì?,"['[{""ChuThe"": ""Vị thuốc Tô mộc"", ""QuanHe"": ""CO_VI"", ""DoiTuong"": ""Vị ngọt"", ""LieuDung"": ""Chưa ghi nhận"", ""CachDung"": ""Chưa ghi nhận"", ""GhiChu"": """", ""sort_weight"": 3.0}]']","Dựa trên y văn, **Tô mộc** có vị ngọt. Liều dùng và cách dùng của vị thuốc này chưa được ghi nhận.",Vị ngọt,1.0,0.0,0.9999999999,1.0,0.7212927063057895
Bệnh đinh nhọt có thể dùng vị thuốc hoặc bài thuốc nào để chữa?,"['[{""ChuThe"": ""Bệnh Đinh nhọt"", ""QuanHe"": ""Được chữa bằng (ViThuoc)"", ""DoiTuong"": ""Vị thuốc Vòi voi"", ""LieuDung"": ""Tham khảo liều dùng chung của vị thuốc"", ""CachDung"": ""Dùng ngoài để đắp theo kinh nghiệm cổ truyền"", ""GhiChu"": ""đinh nhọt giai đoạn chưa có mủ"", ""sort_weight"": 3.0}, {""ChuThe"": ""Bệnh Đinh nhọt"", ""QuanHe"": ""Được chữa bằng (ViThuoc)"", ""DoiTuong"": ""Vị thuốc Ngưu hoàng"", ""LieuDung"": ""Chỉ định lâm sàng theo kinh nghiệm"", ""CachDung"": ""Chỉ định lâm sàng theo kinh nghiệm"", ""GhiChu"": """", ""sort_weight"": 3.0}, {""ChuThe"": ""Bệnh Mọc mụn đầu đinh"", ""QuanHe"": ""Được chữa bằng (BaiThuoc)"", ""DoiTuong"": ""Bài thuốc Mọc mụn đầu đinh Hy Thiêm"", ""LieuDung"": ""Chưa ghi nhận"", ""CachDung"": ""Giã nát, dội chén rượu nóng vào, vắt lấy nước uống"", ""GhiChu"": """"}]']","Bệnh đinh nhọt có thể được chữa bằng các vị thuốc sau:

*   **Vị thuốc Vòi voi**: Tham khảo liều dùng chung của vị thuốc, dùng ngoài để đắp theo kinh nghiệm cổ truyền cho đinh nhọt giai đoạn chưa có mủ.
*   **Vị thuốc Ngưu hoàng**: Chỉ định lâm sàng và cách dùng theo kinh nghiệm.

Thông tin tham khảo thêm:

Đối với bệnh mọc mụn đầu đinh, bạn có thể tham khảo bài thuốc sau:

*   **Bài thuốc Mọc mụn đầu đinh Hy Thiêm**: Giã nát, dội chén rượu nóng vào, vắt lấy nước uống. Liều dùng chưa được ghi nhận.","Ngưu hoàng, Vòi voi",1.0,0.4233828799180399,0.9999999999,1.0,0.49177947053565224
Bệnh lở ngứa có thể dùng vị thuốc hoặc bài thuốc nào để chữa?,"['[{""ChuThe"": ""Triệu chứng Lở ngứa"", ""QuanHe"": ""Được chữa bằng (ViThuoc)"", ""DoiTuong"": ""Vị thuốc Đơn trăng (Hé mọ)"", ""LieuDung"": ""lượng vừa đủ"", ""CachDung"": ""Giã nát đắp lên mụn nhọt"", ""GhiChu"": ""[Nguồn]: CT_VT_VN_T221""}, {""ChuThe"": ""Triệu chứng Lở ngứa"", ""QuanHe"": ""Được chữa bằng (ViThuoc)"", ""DoiTuong"": ""Vị thuốc Chút chít"", ""LieuDung"": ""$1-3g$ (nhuận tràng), $4-6g$ (tẩy)"", ""CachDung"": ""Dạng thuốc sắc, thuốc pha hay thuốc bột, dùng riêng hay phối hợp với các vị thuốc khác"", ""GhiChu"": """"}, {""ChuThe"": ""Triệu chứng Lở ngứa"", ""QuanHe"": ""Được chữa bằng (ViThuoc)"", ""DoiTuong"": ""Vị thuốc Hà thủ ô đỏ"", ""LieuDung"": ""Tuỳ tiện"", ""CachDung"": ""Đun nước tắm và rửa, liều lượng tuỳ tiện. Có thể phối hợp nấu với lá ngải"", ""GhiChu"": ""Lở ngứa""}, {""ChuThe"": ""Bệnh khe ngón chân lở ngứa"", ""QuanHe"": ""Được chữa bằng (ViThuoc)"", ""DoiTuong"": ""Vị thuốc Long nhãn"", ""LieuDung"": ""Tham khảo liều dùng chung của vị thuốc"", ""CachDung"": ""Hạt nhãn bỏ vỏ đen, thái mỏng, phơi khô, tán nhỏ, rắc vào"", ""GhiChu"": ""CT_VT_VN_T808""}, {""ChuThe"": ""Bệnh Lở ngứa"", ""QuanHe"": ""Được chữa bằng (ViThuoc)"", ""DoiTuong"": ""Vị thuốc Ké hoa vàng"", ""LieuDung"": ""lượng vừa đủ"", ""CachDung"": ""Sao qua, tán nhỏ, rắc lên nơi mụn nhọt lở ngứa"", ""GhiChu"": ""CT_VT_VN_T117"", ""sort_weight"": 3.0}, {""ChuThe"": ""Bệnh Lở ngứa"", ""QuanHe"": ""Được chữa bằng (ViThuoc)"", ""DoiTuong"": ""Vị thuốc Thanh cao"", ""LieuDung"": ""Tham khảo liều dùng chung của vị thuốc"", ""CachDung"": ""Dùng ngoài da có tính chất sát trùng"", ""GhiChu"": ""CT_VT_VN_T660"", ""sort_weight"": 3.0}, {""ChuThe"": ""Bệnh Lở ngứa"", ""QuanHe"": ""Được chữa bằng (ViThuoc)"", ""DoiTuong"": ""Vị thuốc Táo rừng"", ""LieuDung"": ""Lá táo rừng tươi"", ""CachDung"": ""Nấu nước tắm ngày một lần, liên tục trong $5$ ngày"", ""GhiChu"": ""dùng lá tươi nấu nước tắm"", ""sort_weight"": 3.0}, {""ChuThe"": ""Bệnh Lở ngứa"", ""QuanHe"": ""Được chữa bằng (ViThuoc)"", ""DoiTuong"": ""Vị thuốc Hoàng liên gai"", ""LieuDung"": ""Tham khảo liều dùng chung của vị thuốc"", ""CachDung"": ""Giã nát đắp lên nơi mụn nhọt"", ""GhiChu"": """", ""sort_weight"": 3.0}, {""ChuThe"": ""Bệnh Lở ngứa"", ""QuanHe"": ""Được chữa bằng (ViThuoc)"", ""DoiTuong"": ""Vị thuốc Bạch đồng nữ"", ""LieuDung"": ""Tham khảo liều dùng chung của vị thuốc"", ""CachDung"": ""Giã nhỏ đắp lên mụn nhọt. Ngày thay $2$-$3$ lần."", ""GhiChu"": ""Chữa mụn nhọt, lở ngứa. Lá bạch đồng nữ tươi. Nguồn: CT_VT_VN_T55."", ""sort_weight"": 3.0}, {""ChuThe"": ""Bệnh Lở ngứa"", ""QuanHe"": ""Được chữa bằng (ViThuoc)"", ""DoiTuong"": ""Vị thuốc Ích mẫu"", ""LieuDung"": ""Tham khảo liều dùng chung của vị thuốc"", ""CachDung"": ""Thân và quả ích mẫu giã đắp hoặc sắc lấy nước rửa"", ""GhiChu"": ""Chỉ định lâm sàng theo kinh nghiệm"", ""sort_weight"": 3.0}, {""ChuThe"": ""Bệnh Lở ngứa"", ""QuanHe"": ""Được chữa bằng (ViThuoc)"", ""DoiTuong"": ""Vị thuốc Lộc mại"", ""LieuDung"": ""Tham khảo liều dùng chung của vị thuốc"", ""CachDung"": ""Nấu đặc rửa"", ""GhiChu"": ""[Nguồn]: CT_VT_VN_T490"", ""sort_weight"": 3.0}, {""ChuThe"": ""Bệnh Lở ngứa"", ""QuanHe"": ""Được chữa bằng (ViThuoc)"", ""DoiTuong"": ""Vị thuốc Tía tô"", ""LieuDung"": ""Chưa ghi nhận"", ""CachDung"": ""Giã nát đắp lên mụn nhọt"", ""GhiChu"": """", ""sort_weight"": 3.0}, {""ChuThe"": ""Bệnh Lở ngứa"", ""QuanHe"": ""Được chữa bằng (ViThuoc)"", ""DoiTuong"": ""Vị thuốc Thanh cao hoa vàng"", ""LieuDung"": ""$6-12g$"", ""CachDung"": ""Dùng riêng hay phối hợp vị khác."", ""GhiChu"": """", ""sort_weight"": 3.0}, {""ChuThe"": ""Bệnh Lở ngứa"", ""QuanHe"": ""Được chữa bằng (ViThuoc)"", ""DoiTuong"": ""Vị thuốc Hồ vĩ"", ""LieuDung"": ""Tham khảo liều dùng chung của vị thuốc"", ""CachDung"": ""Giã nát đắp ngoài"", ""GhiChu"": ""CT_VT_VN_T776"", ""sort_weight"": 3.0}, {""ChuThe"": ""Bệnh Lở ngứa"", ""QuanHe"": ""Được chữa bằng (ViThuoc)"", ""DoiTuong"": ""Vị thuốc Dâu rượu"", ""LieuDung"": ""Tham khảo liều dùng chung của vị thuốc"", ""CachDung"": ""Sắc nước rửa nơi lở ngứa"", ""GhiChu"": ""CT_VT_VN_T924"", ""sort_weight"": 3.0}, {""ChuThe"": ""Bệnh Lở ngứa"", ""QuanHe"": ""Được chữa bằng (ViThuoc)"", ""DoiTuong"": ""Vị thuốc Sài đất"", ""LieuDung"": ""$30-100g$"", ""CachDung"": ""Sắc uống thay nước trong ngày. Có thể dùng tươi giã nát đắp lên nơi mụn nhọt"", ""GhiChu"": ""CT_VT_VN_T103"", ""sort_weight"": 3.0}]']","Dựa trên y văn, bệnh lở ngứa có thể được chữa bằng các vị thuốc sau:

*   **Ké hoa vàng**: Sao qua, tán nhỏ, rắc lên nơi mụn nhọt lở ngứa với lượng vừa đủ.
*   **Thanh cao**: Dùng ngoài da có tính chất sát trùng. Liều dùng tham khảo liều dùng chung của vị thuốc.
*   **Táo rừng**: Dùng lá táo rừng tươi nấu nước tắm ngày một lần, liên tục trong 5 ngày.
*   **Hoàng liên gai**: Giã nát đắp lên nơi mụn nhọt. Liều dùng tham khảo liều dùng chung của vị thuốc.
*   **Bạch đồng nữ**: Giã nhỏ đắp lên mụn nhọt. Ngày thay 2-3 lần. Liều dùng tham khảo liều dùng chung của vị thuốc.
*   **Ích mẫu**: Thân và quả ích mẫu giã đắp hoặc sắc lấy nước rửa. Liều dùng tham khảo liều dùng chung của vị thuốc.
*   **Lộc mại**: Nấu đặc rửa. Liều dùng tham khảo liều dùng chung của vị thuốc.
*   **Tía tô**: Giã nát đắp lên mụn nhọt.
*   **Thanh cao hoa vàng**: Dùng riêng hay phối hợp vị khác với liều 6-12g.
*   **Hồ vĩ**: Giã nát đắp ngoài. Liều dùng tham khảo liều dùng chung của vị thuốc.
*   **Dâu rượu**: Sắc nước rửa nơi lở ngứa. Liều dùng tham khảo liều dùng chung của vị thuốc.
*   **Sài đất**: Sắc uống thay nước trong ngày với liều 30-100g. Có thể dùng tươi giã nát đắp lên nơi mụn nhọt.

Thông tin tham khảo thêm:

*   Đối với triệu chứng lở ngứa, có thể dùng **Đơn trăng (Hé mọ)** giã nát đắp lên mụn nhọt với lượng vừa đủ.
*   Đối với triệu chứng lở ngứa, có thể dùng **Chút chít** dạng thuốc sắc, thuốc pha hay thuốc bột, dùng riêng hay phối hợp với các vị thuốc khác với liều 1-3g (nhuận tràng), 4-6g (tẩy).
*   Đối với triệu chứng lở ngứa, có thể dùng **Hà thủ ô đỏ** đun nước tắm và rửa, liều lượng tuỳ tiện. Có thể phối hợp nấu với lá ngải.
*   Đối với bệnh khe ngón chân lở ngứa, có thể dùng **Long nhãn**. Hạt nhãn bỏ vỏ đen, thái mỏng, phơi khô, tán nhỏ, rắc vào. Liều dùng tham khảo liều dùng chung của vị thuốc.","Bạch đồng nữ, Dâu rượu, Hoàng liên gai, Hồ vĩ, Ké hoa vàng, Lộc mại, Sài đất, Thanh cao, Thanh cao hoa vàng, Táo rừng, Tía tô, Ích mẫu",1.0,0.4461269428906701,0.9999999999,1.0,0.5223056079474611
Tính chất của hoa hòe là gì?,"['[{""ChuThe"": ""Vị thuốc Hoa hòe"", ""QuanHe"": ""CO_TINH"", ""DoiTuong"": ""Bình"", ""LieuDung"": ""Chưa ghi nhận"", ""CachDung"": ""Chưa ghi nhận"", ""GhiChu"": """", ""sort_weight"": 3.0}, {""ChuThe"": ""Vị thuốc Hoa hòe"", ""QuanHe"": ""CO_TINH"", ""DoiTuong"": ""Hàn"", ""LieuDung"": ""Chưa ghi nhận"", ""CachDung"": ""Chưa ghi nhận"", ""GhiChu"": """", ""sort_weight"": 3.0}]']","Dựa trên y văn, **Hoa hòe** có tính bình và hàn.","Bình, Hàn",1.0,0.634213535776013,0.9999999999,1.0,0.9577373149811154
Bệnh rụng lông mày có thể dùng vị thuốc hoặc bài thuốc nào để chữa?,"['[{""ChuThe"": ""Triệu chứng Rụng lông mày"", ""QuanHe"": ""Được chữa bằng (ViThuoc)"", ""DoiTuong"": ""Vị thuốc Hùng hoàng và Thư hoàng"", ""LieuDung"": ""Tham khảo liều dùng chung của vị thuốc"", ""CachDung"": ""Hùng hoàng tán nhỏ, hòa với dấm bôi vào"", ""GhiChu"": ""[Nguồn]: CT_VT_VN_T1058""}]']","Dựa trên y văn, đối với triệu chứng rụng lông mày, bạn có thể tham khảo thông tin sau:

**Thông tin tham khảo thêm:**

*   **Vị thuốc Hùng hoàng và Thư hoàng:** Hùng hoàng tán nhỏ, hòa với dấm bôi vào. Về liều dùng, bạn có thể tham khảo liều dùng chung của vị thuốc. [Nguồn: CT\_VT\_VN\_T1058]",Hùng hoàng và Thư hoàng,1.0,0.44188361014613087,0.9999999999,1.0,0.7169685520728061
Bệnh phong tý thống có thể dùng vị thuốc hoặc bài thuốc nào để chữa?,"['[{""ChuThe"": ""Bệnh Phong tý thống"", ""QuanHe"": ""Được chữa bằng (ViThuoc)"", ""DoiTuong"": ""Vị thuốc Quảng phòng kỷ"", ""LieuDung"": ""Tham khảo liều dùng chung của vị thuốc"", ""CachDung"": ""Chỉ định lâm sàng theo kinh nghiệm"", ""GhiChu"": ""[Nguồn]: CT_VT_VN_T532"", ""sort_weight"": 3.0}]']","Dựa trên y văn, đối với bệnh phong tý thống, có thể sử dụng:

*   **Vị thuốc Quảng phòng kỷ**: Tham khảo liều dùng chung của vị thuốc và chỉ định lâm sàng theo kinh nghiệm.",Quảng phòng kỷ,1.0,0.4560808657131642,0.9999999999,1.0,0.6007454011032027
Vị thuốc thóc tham gia vào bài thuốc để chữa những bệnh gì?,"['[{""ChuThe"": ""Vị thuốc Thóc"", ""QuanHe"": ""Tham gia bài thuốc [Bệnh Giun sán quản tử] để chữa"", ""DoiTuong"": ""Bệnh Giun"", ""LieuDung"": ""Chưa ghi nhận"", ""CachDung"": ""Chưa ghi nhận"", ""GhiChu"": """", ""sort_weight"": 3.0}, {""ChuThe"": ""Vị thuốc Thóc"", ""QuanHe"": ""Tham gia bài thuốc [Bệnh Giày gỗ trâu bò ngựa chân bau] để chữa"", ""DoiTuong"": ""Bệnh Giày gỗ"", ""LieuDung"": ""Không rõ"", ""CachDung"": ""Uống nước sắc hoặc thóc ngâm cây dây ký ninh"", ""GhiChu"": ""CT_VT_VN_T185"", ""sort_weight"": 3.0}, {""ChuThe"": ""Vị thuốc Thóc lép"", ""QuanHe"": ""Tham gia bài thuốc [Bài thuốc Phù thũng thóc lép] để chữa"", ""DoiTuong"": ""Bệnh Phù thũng"", ""LieuDung"": ""Chưa ghi nhận"", ""CachDung"": ""Chưa ghi nhận"", ""GhiChu"": ""Phù thũng | Rễ thóc lép $12g$, lá cối xay $8g$ | Thêm $300ml$ nước. Đun sôi, giữ sôi $30$ phút, chia làm $3$ lần uống trong ngày | [Nguồn]: CT_VT_VN_T160""}, {""ChuThe"": ""Vị thuốc Thóc lép"", ""QuanHe"": ""Tham gia bài thuốc [Bài thuốc Rắn cắn thóc lép] để chữa"", ""DoiTuong"": ""Bệnh Răng cắn"", ""LieuDung"": ""Chưa ghi nhận"", ""CachDung"": ""Chưa ghi nhận"", ""GhiChu"": ""Rắn cắn | Rễ thóc lép tươi $20g$, gãi nát vắt lấy nước uống. Bã đắp lên nơi rắn cắn. Ngày dùng $2$ lần | Chỉ định lâm sàng | [Nguồn]: CT_VT_VN_T160""}, {""ChuThe"": ""Vị thuốc Thóc lép"", ""QuanHe"": ""Tham gia bài thuốc [Bài thuốc Vết thương thóc lép] để chữa"", ""DoiTuong"": ""Bệnh Vết loét"", ""LieuDung"": ""Chưa ghi nhận"", ""CachDung"": ""Chưa ghi nhận"", ""GhiChu"": ""Vết loét | Rễ thóc lép $30g$, nước $200ml$. | Đun sôi, giữ sôi $15$ phút. Dùng rửa vết loét, vết thương | [Nguồn]: CT_VT_VN_T160""}, {""ChuThe"": ""Vị thuốc Thóc lép"", ""QuanHe"": ""Tham gia bài thuốc [Bài thuốc Vết thương thóc lép] để chữa"", ""DoiTuong"": ""Bệnh Vết thương"", ""LieuDung"": ""Chưa ghi nhận"", ""CachDung"": ""Chưa ghi nhận"", ""GhiChu"": ""Vết loét | Rễ thóc lép $30g$, nước $200ml$. | Đun sôi, giữ sôi $15$ phút. Dùng rửa vết loét, vết thương | [Nguồn]: CT_VT_VN_T160""}]']","Vị thuốc **Thóc** tham gia vào bài thuốc để chữa các bệnh sau:

*   Bệnh Giun sán quản tử (Bệnh Giun)
*   Bệnh Giày gỗ trâu bò ngựa chân bau (Bệnh Giày gỗ): Uống nước sắc hoặc thóc ngâm cây dây ký ninh (Liều dùng không rõ).","Giun, Giày gỗ",1.0,0.5466046145997266,0.9999999999,1.0,0.6367110379263974
Bệnh điều hòa dạ dày và ruột có thể dùng vị thuốc hoặc bài thuốc nào để chữa?,"['[{""ChuThe"": ""Bệnh Điều hòa dạ dày và ruột"", ""QuanHe"": ""Được chữa bằng (ViThuoc)"", ""DoiTuong"": ""Vị thuốc Niễng"", ""LieuDung"": ""Tham khảo liều dùng chung của vị thuốc"", ""CachDung"": ""Chỉ định lâm sàng"", ""GhiChu"": ""[Nguồn]: CT_VT_VN_T683"", ""sort_weight"": 3.0}]']","**Bệnh điều hòa dạ dày và ruột** có thể được chữa bằng vị thuốc **Niễng**. Về liều dùng và cách dùng, bạn nên tham khảo chỉ định lâm sàng và liều dùng chung của vị thuốc.",Niễng,1.0,0.5062771177903069,0.9999999999,1.0,0.5646005223506434
Bệnh nhiễm trùng đường ruột có thể dùng vị thuốc hoặc bài thuốc nào để chữa?,"['[{""ChuThe"": ""Bệnh Nhiễm trùng đường ruột"", ""QuanHe"": ""Được chữa bằng (BaiThuoc)"", ""DoiTuong"": ""Bài thuốc Sỏi mật mật lợn"", ""LieuDung"": ""Chưa ghi nhận"", ""CachDung"": ""Chưa ghi nhận"", ""GhiChu"": """", ""sort_weight"": 3.0}]']","Dựa trên y văn, đối với bệnh nhiễm trùng đường ruột, bạn có thể tham khảo bài thuốc sau:

*   **Bài thuốc Sỏi mật mật lợn**

Liều dùng và cách dùng của bài thuốc này hiện chưa được ghi nhận.",Sỏi mật mật lợn,1.0,0.0,0.9999999999,1.0,0.6102745776392344
Bệnh ho cảm có thể dùng vị thuốc hoặc bài thuốc nào để chữa?,"['[{""ChuThe"": ""Triệu chứng Ho cảm"", ""QuanHe"": ""Được chữa bằng (ViThuoc)"", ""DoiTuong"": ""Vị thuốc Hoàng cầm"", ""LieuDung"": ""Tham khảo liều dùng chung của vị thuốc | Ngày dùng $20-30$ viên"", ""CachDung"": ""Sắc với nước chia 3 lần uống trong ngày. Có thể dùng bột. | Hoàng cầm sấy khô tấn nhỏ làm thành viên to bằng hạt ngô"", ""GhiChu"": ""Chỉ định lâm sàng theo kinh nghiệm""}]']","Dựa trên y văn, bệnh ho cảm có thể được chữa bằng vị thuốc sau:

**Vị thuốc Hoàng cầm:**
*   Liều dùng: Ngày dùng 20-30 viên.
*   Cách dùng:
    *   Sắc với nước chia 3 lần uống trong ngày.
    *   Có thể dùng bột.
    *   Hoàng cầm sấy khô tán nhỏ làm thành viên to bằng hạt ngô.",Hoàng cầm,1.0,0.5015358480137515,0.9999999999,1.0,0.5420189568901017
"Để chữa bệnh ho, vị thuốc cà tàu được dùng với liều lượng và cách thức như thế nào?","['[{""ChuThe"": ""Vị thuốc Cà tàu"", ""QuanHe"": ""CHU_TRI_BENH"", ""DoiTuong"": ""Bệnh Ho"", ""LieuDung"": ""Tham khảo liều dùng chung của vị thuốc"", ""CachDung"": ""Toàn cây cà tàu"", ""GhiChu"": ""long đờm"", ""sort_weight"": 3.0}]']","Để chữa bệnh ho, theo y văn, **Cà tàu** có thể được sử dụng như sau:

*   **Cách dùng:** Toàn cây cà tàu.
*   **Liều dùng:** Tham khảo liều dùng chung của vị thuốc.
*   **Ghi chú:** Có tác dụng long đờm.","Để chữa bệnh ho, vị thuốc cà tàu có liều dùng: Tham khảo liều dùng chung của vị thuốc và cách dùng: Toàn cây cà tàu",1.0,0.4566230255812339,0.9999999999,1.0,0.742982894651955
Thuốc nào vừa có tính hàn vừa trực tiếp chữa bệnh khát nước?,['Không có dữ liệu'],Hệ thống y văn hiện tại chưa ghi nhận dữ liệu về vấn đề này.,"Cỏ tranh, Qua lâu nhân, Sa sâm",1.0,0.0,0.0,0.0,0.21809700696689682
Thuốc nào vừa có tính bình vừa trực tiếp chữa bệnh mụn nhọt?,"['[{""ChuThe"": ""Vị thuốc Bảy lá một hoa"", ""QuanHe"": ""Thỏa mãn đồng thời"", ""DoiTuong"": ""Bình và Bệnh Mụn nhọt"", ""LieuDung"": ""Chưa ghi nhận"", ""CachDung"": ""Chưa ghi nhận"", ""GhiChu"": """", ""score"": 2.0}, {""ChuThe"": ""Vị thuốc Huyết kiệt"", ""QuanHe"": ""Thỏa mãn đồng thời"", ""DoiTuong"": ""Bình và Bệnh Mụn nhọt"", ""LieuDung"": ""Chưa ghi nhận"", ""CachDung"": ""Chưa ghi nhận"", ""GhiChu"": """", ""score"": 2.0}, {""ChuThe"": ""Vị thuốc Cối xay"", ""QuanHe"": ""Thỏa mãn đồng thời"", ""DoiTuong"": ""Bình và Bệnh Mụn nhọt"", ""LieuDung"": ""Chưa ghi nhận"", ""CachDung"": ""Chưa ghi nhận"", ""GhiChu"": """", ""score"": 2.0}, {""ChuThe"": ""Vị thuốc Kê nội kim"", ""QuanHe"": ""Thỏa mãn đồng thời"", ""DoiTuong"": ""Bình và Bệnh Mụn nhọt"", ""LieuDung"": ""Chưa ghi nhận"", ""CachDung"": ""Chưa ghi nhận"", ""GhiChu"": """", ""score"": 2.0}, {""ChuThe"": ""Vị thuốc Tỳ giải"", ""QuanHe"": ""Thỏa mãn đồng thời"", ""DoiTuong"": ""Bình và Bệnh Mụn nhọt"", ""LieuDung"": ""Chưa ghi nhận"", ""CachDung"": ""Chưa ghi nhận"", ""GhiChu"": """", ""score"": 2.0}, {""ChuThe"": ""Vị thuốc Rau đắng"", ""QuanHe"": ""Thỏa mãn đồng thời"", ""DoiTuong"": ""Bình và Bệnh Mụn nhọt"", ""LieuDung"": ""Chưa ghi nhận"", ""CachDung"": ""Chưa ghi nhận"", ""GhiChu"": """", ""score"": 2.0}, {""ChuThe"": ""Vị thuốc Hành"", ""QuanHe"": ""Thỏa mãn đồng thời"", ""DoiTuong"": ""Bình và Bệnh Mụn nhọt"", ""LieuDung"": ""Chưa ghi nhận"", ""CachDung"": ""Chưa ghi nhận"", ""GhiChu"": """", ""score"": 2.0}, {""ChuThe"": ""Vị thuốc Dâu"", ""QuanHe"": ""Thỏa mãn đồng thời"", ""DoiTuong"": ""Bình và Bệnh Mụn nhọt lâu ngày không liền miệng"", ""LieuDung"": ""Chưa ghi nhận"", ""CachDung"": ""Chưa ghi nhận"", ""GhiChu"": """", ""score"": 2.0}, {""ChuThe"": ""Vị thuốc Dâu"", ""QuanHe"": ""Thỏa mãn đồng thời"", ""DoiTuong"": ""Công năng Bình suyễn và Bệnh Mụn nhọt lâu ngày không liền miệng"", ""LieuDung"": ""Chưa ghi nhận"", ""CachDung"": ""Chưa ghi nhận"", ""GhiChu"": """", ""score"": 2.0}, {""ChuThe"": ""Vị thuốc Bạch cập"", ""QuanHe"": ""Thỏa mãn đồng thời"", ""DoiTuong"": ""Bình và Bệnh Mụn nhọt sưng tấy"", ""LieuDung"": ""Chưa ghi nhận"", ""CachDung"": ""Chưa ghi nhận"", ""GhiChu"": """", ""score"": 2.0}, {""ChuThe"": ""Vị thuốc Cam thảo bắc"", ""QuanHe"": ""Thỏa mãn đồng thời"", ""DoiTuong"": ""Bình và Bệnh Mụn nhọt"", ""LieuDung"": ""Chưa ghi nhận"", ""CachDung"": ""Chưa ghi nhận"", ""GhiChu"": """", ""score"": 2.0}, {""ChuThe"": ""Vị thuốc Kim anh"", ""QuanHe"": ""Thỏa mãn đồng thời"", ""DoiTuong"": ""Bình và Bệnh Mụn nhọt"", ""LieuDung"": ""Chưa ghi nhận"", ""CachDung"": ""Chưa ghi nhận"", ""GhiChu"": """", ""score"": 2.0}, {""ChuThe"": ""Vị thuốc Hổ phách"", ""QuanHe"": ""Thỏa mãn đồng thời"", ""DoiTuong"": ""Bình và Bệnh Mụn nhọt lâu lành"", ""LieuDung"": ""Chưa ghi nhận"", ""CachDung"": ""Chưa ghi nhận"", ""GhiChu"": """", ""score"": 2.0}, {""ChuThe"": ""Vị thuốc Ngũ bội tử"", ""QuanHe"": ""Thỏa mãn đồng thời"", ""DoiTuong"": ""Bình và Bệnh Mụn nhọt"", ""LieuDung"": ""Chưa ghi nhận"", ""CachDung"": ""Chưa ghi nhận"", ""GhiChu"": """", ""score"": 2.0}, {""ChuThe"": ""Vị thuốc Hoài sơn"", ""QuanHe"": ""Thỏa mãn đồng thời"", ""DoiTuong"": ""Bình và Bệnh Mụn nhọt"", ""LieuDung"": ""Chưa ghi nhận"", ""CachDung"": ""Chưa ghi nhận"", ""GhiChu"": """", ""score"": 2.0}, {""ChuThe"": ""Vị thuốc Hoài sơn"", ""QuanHe"": ""Thỏa mãn đồng thời"", ""DoiTuong"": ""Công năng Bình suyễn và Bệnh Mụn nhọt"", ""LieuDung"": ""Chưa ghi nhận"", ""CachDung"": ""Chưa ghi nhận"", ""GhiChu"": """", ""score"": 2.0}, {""ChuThe"": ""Vị thuốc Rau má"", ""QuanHe"": ""Thỏa mãn đồng thời"", ""DoiTuong"": ""Bình và Bệnh Mụn nhọt"", ""LieuDung"": ""Chưa ghi nhận"", ""CachDung"": ""Chưa ghi nhận"", ""GhiChu"": """", ""score"": 2.0}]']","Dựa trên dữ liệu y văn, các vị thuốc vừa có tính bình, vừa được dùng để điều trị mụn nhọt bao gồm:

*   **Bảy lá một hoa**
*   **Huyết kiệt**
*   **Cối xay**
*   **Kê nội kim**
*   **Tỳ giải**
*   **Rau đắng**
*   **Hành**
*   **Cam thảo bắc**
*   **Kim anh**
*   **Ngũ bội tử**
*   **Hoài sơn**
*   **Rau má**

Ngoài ra, có một số vị thuốc được dùng cho các trường hợp mụn nhọt cụ thể:

*   **Dâu**: Dùng cho mụn nhọt lâu ngày không liền miệng.
*   **Bạch cập**: Dùng cho mụn nhọt sưng tấy.
*   **Hổ phách**: Dùng cho mụn nhọt lâu lành.

Lưu ý: Liều dùng và cách dùng của các vị thuốc trên chưa được ghi nhận trong dữ liệu này.","Bảy lá một hoa, Cam thảo bắc, Cối xay, Hoài sơn, Huyết kiệt, Hành, Kim anh, Kê nội kim, Ngũ bội tử, Rau má, Rau đắng, Tỳ giải",1.0,0.41934296590811665,0.9999999999,1.0,0.8662661832932952
Vị thuốc rắn có chứa hoạt chất chrysophanol không?,['Không có dữ liệu'],"Không. Dựa trên dữ liệu y văn hiện tại, không có ghi nhận nào cho thấy rắn có liên quan hoặc tác dụng tới chrysophanol.","Không, vị thuốc rắn không chứa hoạt chất chrysophanol",0.0,0.8487754568444769,0.0,1.0,0.7434946851178506
Hãy cho biết công năng của thanh đại.,"['[{""ChuThe"": ""Bài thuốc Cam tẩu mã thanh đại"", ""QuanHe"": ""BAO_GOM_VI_THUOC"", ""DoiTuong"": ""Vị thuốc Hoàng bá"", ""LieuDung"": ""$12g$"", ""CachDung"": ""Chưa ghi nhận"", ""GhiChu"": ""[Nguồn]: CT_VT_VN_T131"", ""score"": 2.0}, {""ChuThe"": ""Bài thuốc Cam tẩu mã thanh đại"", ""QuanHe"": ""BAO_GOM_VI_THUOC"", ""DoiTuong"": ""Vị thuốc Hoàng liên"", ""LieuDung"": ""$16g$"", ""CachDung"": ""Chưa ghi nhận"", ""GhiChu"": ""[Nguồn]: CT_VT_VN_T131"", ""score"": 2.0}, {""ChuThe"": ""Bài thuốc Cam tẩu mã thanh đại"", ""QuanHe"": ""BAO_GOM_VI_THUOC"", ""DoiTuong"": ""Vị thuốc Bạch phàn"", ""LieuDung"": ""$12g$"", ""CachDung"": ""Chưa ghi nhận"", ""GhiChu"": ""[Nguồn]: CT_VT_VN_T131"", ""score"": 2.0}, {""ChuThe"": ""Bài thuốc Cam tẩu mã thanh đại"", ""QuanHe"": ""BAO_GOM_VI_THUOC"", ""DoiTuong"": ""Vị thuốc Đại hồi"", ""LieuDung"": ""$4g$"", ""CachDung"": ""Chưa ghi nhận"", ""GhiChu"": ""[Nguồn]: CT_VT_VN_T131"", ""score"": 2.0}, {""ChuThe"": ""Bài thuốc Cam tẩu mã thanh đại"", ""QuanHe"": ""BAO_GOM_VI_THUOC"", ""DoiTuong"": ""Vị thuốc Đinh hương"", ""LieuDung"": ""$12g$"", ""CachDung"": ""Chưa ghi nhận"", ""GhiChu"": ""[Nguồn]: CT_VT_VN_T131"", ""score"": 2.0}, {""ChuThe"": ""Bài thuốc Cam tẩu mã thanh đại"", ""QuanHe"": ""BAO_GOM_VI_THUOC"", ""DoiTuong"": ""Vị thuốc Thanh đại"", ""LieuDung"": ""$20g$"", ""CachDung"": ""Chưa ghi nhận"", ""GhiChu"": ""[Nguồn]: CT_VT_VN_T131"", ""score"": 2.0}, {""ChuThe"": ""Bài thuốc Cam tẩu mã thanh đại"", ""QuanHe"": ""BAO_GOM_VI_THUOC"", ""DoiTuong"": ""Vị thuốc nhân trung bạch"", ""LieuDung"": ""$20g$"", ""CachDung"": ""Chưa ghi nhận"", ""GhiChu"": ""[Nguồn]: CT_VT_VN_T131"", ""score"": 2.0}, {""ChuThe"": ""Bài thuốc Chảy máu thanh đại"", ""QuanHe"": ""CHU_TRI_BENH"", ""DoiTuong"": ""Bệnh Viêm lợi răng"", ""LieuDung"": ""Chưa ghi nhận"", ""CachDung"": ""Tất cả tán bột, đựng trong lọ kín. Trước khi dùng, rửa sạch răng miệng bằng nước"", ""GhiChu"": ""[Nguồn]: CT_VT_VN_T130"", ""score"": 2.0}, {""ChuThe"": ""Bài thuốc Chảy máu thanh đại"", ""QuanHe"": ""CHU_TRI_TRIEU_CHUNG"", ""DoiTuong"": ""Triệu chứng Chảy máu"", ""LieuDung"": ""Chưa ghi nhận"", ""CachDung"": ""Tất cả tán bột, đựng trong lọ kín. Trước khi dùng, rửa sạch răng miệng bằng nước"", ""GhiChu"": ""[Nguồn]: CT_VT_VN_T130"", ""score"": 2.0}, {""ChuThe"": ""Bài thuốc Chảy máu thanh đại"", ""QuanHe"": ""BAO_GOM_VI_THUOC"", ""DoiTuong"": ""Vị thuốc Bạch phàn"", ""LieuDung"": ""$40g$"", ""CachDung"": ""Chưa ghi nhận"", ""GhiChu"": ""[Nguồn]: CT_VT_VN_T130"", ""score"": 2.0}, {""ChuThe"": ""Bài thuốc Chảy máu thanh đại"", ""QuanHe"": ""BAO_GOM_VI_THUOC"", ""DoiTuong"": ""Vị thuốc Hồng hoang"", ""LieuDung"": ""$2g$"", ""CachDung"": ""Chưa ghi nhận"", ""GhiChu"": ""[Nguồn]: CT_VT_VN_T130"", ""score"": 2.0}, {""ChuThe"": ""Bài thuốc Chảy máu thanh đại"", ""QuanHe"": ""BAO_GOM_VI_THUOC"", ""DoiTuong"": ""Vị thuốc Mai hoa băng phiến"", ""LieuDung"": ""$2g$"", ""CachDung"": ""Chưa ghi nhận"", ""GhiChu"": ""[Nguồn]: CT_VT_VN_T130"", ""score"": 2.0}, {""ChuThe"": ""Bài thuốc Chảy máu thanh đại"", ""QuanHe"": ""BAO_GOM_VI_THUOC"", ""DoiTuong"": ""Vị thuốc Thanh đại"", ""LieuDung"": ""$80g$"", ""CachDung"": ""Chưa ghi nhận"", ""GhiChu"": ""[Nguồn]: CT_VT_VN_T130"", ""score"": 2.0}, {""ChuThe"": ""Bài thuốc Yết hầu thanh đại"", ""QuanHe"": ""CHU_TRI_BENH"", ""DoiTuong"": ""Bệnh Viêm hạch hạnh nhân"", ""LieuDung"": ""Chưa ghi nhận"", ""CachDung"": ""Tất cả tán nhỏ, khi dùng sức miệng sạch bởi thuốc vào chỗ đau."", ""GhiChu"": ""[Nguồn]: CT_VT_VN_T131"", ""score"": 2.0}, {""ChuThe"": ""Bài thuốc Yết hầu thanh đại"", ""QuanHe"": ""CHU_TRI_BENH"", ""DoiTuong"": ""Bệnh Yết hầu"", ""LieuDung"": ""Chưa ghi nhận"", ""CachDung"": ""Tất cả tán nhỏ, khi dùng sức miệng sạch bởi thuốc vào chỗ đau."", ""GhiChu"": ""[Nguồn]: CT_VT_VN_T131"", ""score"": 2.0}, {""ChuThe"": ""Bài thuốc Yết hầu thanh đại"", ""QuanHe"": ""BAO_GOM_VI_THUOC"", ""DoiTuong"": ""Vị thuốc Hàn the"", ""LieuDung"": ""$5g$"", ""CachDung"": ""Chưa ghi nhận"", ""GhiChu"": ""[Nguồn]: CT_VT_VN_T131"", ""score"": 2.0}, {""ChuThe"": ""Bài thuốc Yết hầu thanh đại"", ""QuanHe"": ""BAO_GOM_VI_THUOC"", ""DoiTuong"": ""Vị thuốc Tây ngưu hoàng"", ""LieuDung"": ""$1g$"", ""CachDung"": ""Chưa ghi nhận"", ""GhiChu"": ""[Nguồn]: CT_VT_VN_T131"", ""score"": 2.0}, {""ChuThe"": ""Bài thuốc Yết hầu thanh đại"", ""QuanHe"": ""BAO_GOM_VI_THUOC"", ""DoiTuong"": ""Vị thuốc Thanh đại"", ""LieuDung"": ""$5g$"", ""CachDung"": ""Chưa ghi nhận"", ""GhiChu"": ""[Nguồn]: CT_VT_VN_T131"", ""score"": 2.0}, {""ChuThe"": ""Bài thuốc Yết hầu thanh đại"", ""QuanHe"": ""BAO_GOM_VI_THUOC"", ""DoiTuong"": ""Vị thuốc Băng phiến"", ""LieuDung"": ""$0,5g$"", ""CachDung"": ""Chưa ghi nhận"", ""GhiChu"": ""[Nguồn]: CT_VT_VN_T131"", ""score"": 2.0}, {""ChuThe"": ""Vị thuốc Thanh đại"", ""QuanHe"": ""CO_CHUA_HOAT_CHAT"", ""DoiTuong"": ""Hoạt chất Indican"", ""LieuDung"": ""Chưa ghi nhận"", ""CachDung"": ""Chưa ghi nhận"", ""GhiChu"": """", ""score"": 2.0}, {""ChuThe"": ""Vị thuốc Thanh đại"", ""QuanHe"": ""CO_CHUA_HOAT_CHAT"", ""DoiTuong"": ""Hoạt chất Indigotin"", ""LieuDung"": ""Chưa ghi nhận"", ""CachDung"": ""Chưa ghi nhận"", ""GhiChu"": """", ""score"": 2.0}, {""ChuThe"": ""Vị thuốc Thanh đại"", ""QuanHe"": ""CO_CHUA_HOAT_CHAT"", ""DoiTuong"": ""Hoạt chất Indoxyl"", ""LieuDung"": ""Chưa ghi nhận"", ""CachDung"": ""Chưa ghi nhận"", ""GhiChu"": """", ""score"": 2.0}, {""ChuThe"": ""Vị thuốc Thanh đại"", ""QuanHe"": ""CO_CHUA_HOAT_CHAT"", ""DoiTuong"": ""Hoạt chất Leucoindigo"", ""LieuDung"": ""Chưa ghi nhận"", ""CachDung"": ""Chưa ghi nhận"", ""GhiChu"": """", ""score"": 2.0}, {""ChuThe"": ""Vị thuốc Thanh đại"", ""QuanHe"": ""CHU_TRI_BENH"", ""DoiTuong"": ""Bệnh Cam tẩu mã"", ""LieuDung"": ""Thanh đại hay chàm"", ""CachDung"": ""Chỉ định lâm sàng (không ghi rõ liều)"", ""GhiChu"": ""[Nguồn]: CT_VT_VN_T130"", ""score"": 2.0}, {""ChuThe"": ""Vị thuốc Thanh đại"", ""QuanHe"": ""CHU_TRI_BENH"", ""DoiTuong"": ""Bệnh Điên cuồng"", ""LieuDung"": ""Toàn cây nghể chàm"", ""CachDung"": ""Sắc uống"", ""GhiChu"": ""[Nguồn]: CT_VT_VN_T130"", ""score"": 2.0}, {""ChuThe"": ""Vị thuốc Thanh đại"", ""QuanHe"": ""CHU_TRI_BENH"", ""DoiTuong"": ""Bệnh Viêm hạch hạnh nhân"", ""LieuDung"": ""Thanh đại hay chàm"", ""CachDung"": ""Chỉ định lâm sàng (không ghi rõ liều)"", ""GhiChu"": ""[Nguồn]: CT_VT_VN_T130"", ""score"": 2.0}, {""ChuThe"": ""Vị thuốc Thanh đại"", ""QuanHe"": ""CHU_TRI_BENH"", ""DoiTuong"": ""Bệnh Viêm lợi chảy máu"", ""LieuDung"": ""Thanh đại hay chàm"", ""CachDung"": ""Chỉ định lâm sàng (không ghi rõ liều)"", ""GhiChu"": ""[Nguồn]: CT_VT_VN_T130"", ""score"": 2.0}, {""ChuThe"": ""Vị thuốc Thanh đại"", ""QuanHe"": ""CHU_TRI_BENH"", ""DoiTuong"": ""Bệnh Răng cắn"", ""LieuDung"": ""Rễ [nghể chàm] trộn với xạ hương và hùng hoàng"", ""CachDung"": ""Chỉ định lâm sàng theo kinh nghiệm"", ""GhiChu"": ""[Nguồn]: CT_VT_VN_T130"", ""score"": 2.0}, {""ChuThe"": ""Vị thuốc Thanh đại"", ""QuanHe"": ""CHU_TRI_TRIEU_CHUNG"", ""DoiTuong"": ""Triệu chứng Ra thai"", ""LieuDung"": ""Toàn cây nghể chàm"", ""CachDung"": ""Sắc uống"", ""GhiChu"": ""[Nguồn]: CT_VT_VN_T130"", ""score"": 2.0}, {""ChuThe"": ""Bài thuốc Cam tẩu mã thanh đại"", ""QuanHe"": ""CHU_TRI_BENH"", ""DoiTuong"": ""Bệnh Cam tẩu mã"", ""LieuDung"": ""Chưa ghi nhận"", ""CachDung"": ""Các vị hoàng liên, hoàng bả, đinh hương, đại hồi sấy khô, tán nhỏ, cuối cùng trộn nhân trung bạch và bạch phàn rồi thanh đại vào. Nếu bệnh nặng cần thêm ít xạ hương vào (chừng $1g$). Người lớn ngày đắp thuốc 3-4 lần, cách 3 giờ thay thuốc 1 lần. Trẻ con, trước khi đi ngủ đắp thuốc 1 lần, đêm dậy đắp lần nữa (kinh nghiệm nhân dân)."", ""GhiChu"": ""[Nguồn]: CT_VT_VN_T131"", ""score"": 2.0}]']",Hệ thống y văn hiện tại chưa ghi nhận dữ liệu về vấn đề này.,Giải độc,0.0,0.0,0.9999999999,0.0,0.2294417980042004
Vị thuốc quế thanh hóa có chứa hoạt chất morindon không?,['Không có dữ liệu'],"Không. Dựa trên dữ liệu y văn hiện tại, không có ghi nhận nào cho thấy quế thanh hóa có liên quan hoặc tác dụng tới morindon.","Không, vị thuốc quế thanh hóa không chứa hoạt chất morindon",0.0,0.7746192528009086,0.0,1.0,0.741226208691161
"Để chữa bệnh răng cắn, vị thuốc hùng hoàng và thư hoàng được dùng với liều lượng và cách thức như thế nào?",['Không có dữ liệu'],Hệ thống y văn hiện tại chưa ghi nhận dữ liệu về vấn đề này.,"Để chữa bệnh răng cắn, vị thuốc hùng hoàng và thư hoàng có liều dùng: Tham khảo liều dùng chung của vị thuốc và cách dùng: Giã nhỏ lên vết cắn",1.0,0.0,0.0,0.0,0.2318257006453882
Bệnh thấy phấn xoa mặt có thể dùng vị thuốc hoặc bài thuốc nào để chữa?,"['[{""ChuThe"": ""Triệu chứng Thấy phấn xoa mặt"", ""QuanHe"": ""Được chữa bằng (ViThuoc)"", ""DoiTuong"": ""Vị thuốc Hoa phấn"", ""LieuDung"": ""Tham khảo liều dùng chung của vị thuốc"", ""CachDung"": ""Phấn trong quả xoa mặt"", ""GhiChu"": ""Chỉ định lâm sàng theo kinh nghiệm"", ""score"": 2.0}]']","Dựa trên y văn, đối với triệu chứng thấy phấn xoa mặt, có thể tham khảo thông tin sau:

**Thông tin tham khảo thêm:**

*   **Vị thuốc Hoa phấn:** Phấn trong quả dùng để xoa mặt. Về liều dùng, bạn nên tham khảo liều dùng chung của vị thuốc. Đây là chỉ định lâm sàng theo kinh nghiệm.",Hoa phấn,1.0,0.444362497104426,0.9999999999,1.0,0.6369214851082773
Vị thuốc mù mắt tham gia vào bài thuốc để chữa những bệnh gì?,"['[{""ChuThe"": ""Vị thuốc Mù mắt"", ""QuanHe"": ""Tham gia bài thuốc [Bài thuốc Khó Thở Mù Mắt] để chữa"", ""DoiTuong"": ""Bệnh Hen"", ""LieuDung"": ""Cồn thuốc mù mắt (tỉ lệ 1:10 trong cồn 70°) $1-3g$"", ""CachDung"": ""Dùng trong 24 giờ. Thuốc mạnh, dùng phải hết sức cẩn thận"", ""GhiChu"": ""Dùng phải hết sức cẩn thận"", ""score"": 2.0, ""sort_weight"": 3.0}]']","**Vị thuốc Mù mắt** được dùng trong bài thuốc **Khó Thở Mù Mắt** để chữa bệnh Hen. Liều dùng là cồn thuốc mù mắt (tỉ lệ 1:10 trong cồn 70°) 1-3g, dùng trong 24 giờ. Lưu ý đây là thuốc mạnh, dùng phải hết sức cẩn thận.",Hen,1.0,0.5195899949374521,0.9999999999,1.0,0.4595613075719589
"Để chữa bệnh kinh nguyệt dài ngày không hết, vị thuốc mào gà đỏ được dùng với liều lượng và cách thức như thế nào?","['[{""ChuThe"": ""Vị thuốc Mào gà đỏ"", ""QuanHe"": ""CHU_TRI_BENH"", ""DoiTuong"": ""Bệnh Kinh nguyệt dài ngày không hết"", ""LieuDung"": ""Hoa mào gà đỏ khô $10$g (nếu dùng tươi dùng $25-30$g)"", ""CachDung"": ""Sấy khô, tán nhỏ. Chia làm nhiều lần uống trong ngày. Mỗi lần uống $1-2$g (kinh nghiệm nhân dân)."", ""GhiChu"": ""CT_VT_VN_T308"", ""score"": 2.0, ""sort_weight"": 3.0}]']","Để chữa bệnh kinh nguyệt dài ngày không hết, bạn có thể dùng **Mào gà đỏ** theo hướng dẫn sau:

*   **Liều dùng:** Hoa mào gà đỏ khô 10g (nếu dùng tươi dùng 25-30g).
*   **Cách dùng:** Sấy khô, tán nhỏ. Chia làm nhiều lần uống trong ngày. Mỗi lần uống 1-2g (kinh nghiệm nhân dân).","Để chữa bệnh kinh nguyệt dài ngày không hết, vị thuốc mào gà đỏ có liều dùng: Hoa mào gà đỏ khô 10g (nếu dùng tươi dùng 25-30g) và cách dùng: Sấy khô, tán nhỏ. Chia làm nhiều lần uống trong ngày. Mỗi lần uống 1-2g (kinh nghiệm nhân dân).",1.0,0.45996683352347567,0.9999999999,1.0,0.9982208278593522
Vị thuốc bạch thược có tính gì?,"['[{""ChuThe"": ""Vị thuốc Bạch thược"", ""QuanHe"": ""CO_TINH"", ""DoiTuong"": ""Hàn"", ""LieuDung"": ""Chưa ghi nhận"", ""CachDung"": ""Chưa ghi nhận"", ""GhiChu"": """", ""score"": 2.0, ""sort_weight"": 3.0}]']","Dựa trên y văn, vị thuốc **Bạch thược** có tính Hàn.",Hàn,1.0,0.6146111248850324,0.9999999999,1.0,0.957786356890643
Vị thuốc hắc đỗ trọng có chứa hoạt chất phytolaccatoxin không?,['Không có dữ liệu'],"Không. Dựa trên dữ liệu y văn hiện tại, không có ghi nhận nào cho thấy hắc đỗ trọng có liên quan hoặc tác dụng tới phytolaccatoxin.","Không, vị thuốc hắc đỗ trọng không chứa hoạt chất phytolaccatoxin",0.0,0.8514066058873676,0.0,0.0,0.8431618408652989
"Để chữa bệnh đau răng, vị thuốc cà dại hoa tím được dùng với liều lượng và cách thức như thế nào?","['[{""ChuThe"": ""Vị thuốc Cà dại hoa tím"", ""QuanHe"": ""CHU_TRI_BENH"", ""DoiTuong"": ""Bệnh Đau răng"", ""LieuDung"": ""Tham khảo liều dùng chung của vị thuốc"", ""CachDung"": ""Hứng khói này vào miệng | Xát lên lợi nơi đau răng"", ""GhiChu"": ""Hạt cà dại hoa tím rang cháy | Than hạt cà dại hoa tím còn lại giã nhỏ"", ""score"": 2.0, ""sort_weight"": 3.0}]']","Để chữa bệnh đau răng, **Cà dại hoa tím** được dùng như sau:

*   Hạt **Cà dại hoa tím** rang cháy, sau đó giã nhỏ phần than hạt còn lại.
*   Cách dùng:
    *   Hứng khói này vào miệng.
    *   Xát lên lợi nơi đau răng.
*   Liều dùng: Tham khảo liều dùng chung của vị thuốc.","Để chữa bệnh đau răng, vị thuốc cà dại hoa tím có liều dùng: Tham khảo liều dùng chung của vị thuốc và cách dùng: Hứng khói này vào miệng | Xát lên lợi nơi đau răng",1.0,0.560699998640191,0.9999999999,1.0,0.9075672925782537
Tính chất của thanh cao hoa vàng là gì?,"['[{""ChuThe"": ""Vị thuốc Thanh cao hoa vàng"", ""QuanHe"": ""CO_TINH"", ""DoiTuong"": ""Hàn"", ""LieuDung"": ""Chưa ghi nhận"", ""CachDung"": ""Chưa ghi nhận"", ""GhiChu"": """", ""score"": 2.0, ""sort_weight"": 3.0}]']","Dựa trên y văn, **Thanh cao hoa vàng** có tính Hàn.",Hàn,1.0,0.656517807095213,0.9999999999,1.0,0.9590214280183424
Thuốc nào vừa có tính lương vừa trực tiếp chữa bệnh ho?,"['[{""ChuThe"": ""Vị thuốc Cỏ nhọ nồi"", ""QuanHe"": ""Thỏa mãn đồng thời"", ""DoiTuong"": ""Lương và Bệnh Ho"", ""LieuDung"": ""Chưa ghi nhận"", ""CachDung"": ""Chưa ghi nhận"", ""GhiChu"": """", ""score"": 2.0}, {""ChuThe"": ""Vị thuốc Mã đề"", ""QuanHe"": ""Thỏa mãn đồng thời"", ""DoiTuong"": ""Lương và Bệnh Ho"", ""LieuDung"": ""Chưa ghi nhận"", ""CachDung"": ""Chưa ghi nhận"", ""GhiChu"": """", ""score"": 2.0}, {""ChuThe"": ""Vị thuốc Đại bi"", ""QuanHe"": ""Thỏa mãn đồng thời"", ""DoiTuong"": ""Lương và Công năng Trị ho lâu ngày"", ""LieuDung"": ""Chưa ghi nhận"", ""CachDung"": ""Chưa ghi nhận"", ""GhiChu"": """", ""score"": 2.0}, {""ChuThe"": ""Vị thuốc Đại bi"", ""QuanHe"": ""Thỏa mãn đồng thời"", ""DoiTuong"": ""Lương và Bệnh Ho"", ""LieuDung"": ""Chưa ghi nhận"", ""CachDung"": ""Chưa ghi nhận"", ""GhiChu"": """", ""score"": 2.0}]']","Hệ thống y văn hiện tại ghi nhận các vị thuốc có tính lương và có công năng trị ho như sau:

*   **Cỏ nhọ nồi**: Lương và Bệnh Ho.
*   **Mã đề**: Lương và Bệnh Ho.
*   **Đại bi**: Lương và Bệnh Ho; Lương và Công năng Trị ho lâu ngày.

Lưu ý: Liều dùng và cách dùng của các vị thuốc trên chưa được ghi nhận trong dữ liệu.","Bạch đàn và tinh dầu bạch đàn, Me rừng, Mã đề, Nắp ấm, Trúc như",1.0,0.4276357846900054,0.9999999999,0.2,0.4081118563894746
"Để chữa bệnh vết thương, vị thuốc ba chạc được dùng với liều lượng và cách thức như thế nào?","['[{""ChuThe"": ""Vị thuốc Ba chạc"", ""QuanHe"": ""CHU_TRI_BENH"", ""DoiTuong"": ""Bệnh Vết thương"", ""LieuDung"": ""Tham khảo liều dùng chung của vị thuốc"", ""CachDung"": ""Nấu với nước để rửa"", ""GhiChu"": ""Lá và cành tươi"", ""score"": 2.0, ""sort_weight"": 3.0}]']","Để chữa bệnh vết thương, **Ba chạc** được dùng như sau:

*   **Liều dùng:** Tham khảo liều dùng chung của vị thuốc.
*   **Cách dùng:** Nấu lá và cành tươi với nước để rửa vết thương.","Để chữa bệnh vết thương, vị thuốc ba chạc có liều dùng: Tham khảo liều dùng chung của vị thuốc và cách dùng: Nấu với nước để rửa",1.0,0.4686651729721613,0.9999999999,1.0,0.7451225197056619
Thuốc nào vừa có tính hàn vừa trực tiếp chữa bệnh chảy máu cam?,"['[{""ChuThe"": ""Vị thuốc Trắc bách diệp"", ""QuanHe"": ""Thỏa mãn đồng thời"", ""DoiTuong"": ""Hàn và Triệu chứng Chảy máu cam"", ""LieuDung"": ""Chưa ghi nhận"", ""CachDung"": ""Chưa ghi nhận"", ""GhiChu"": """", ""score"": 2.0}]']","Hệ thống y văn hiện tại chưa ghi nhận phương án trực tiếp như bạn hỏi, tuy nhiên đối với các thể bệnh liên quan, bạn có thể tham khảo phương án sau đây:

**Vị thuốc Trắc bách diệp** có tính hàn và được dùng cho triệu chứng chảy máu cam. Liều dùng và cách dùng chưa được ghi nhận.","Dưa hấu, Dướng, Hoàng cầm, Thanh cao, Trắc bách diệp",0.8,0.0,0.9999999999,1.0,0.458363515811592
Vị thuốc tang diệp có chứa hoạt chất phylirin không?,['Không có dữ liệu'],"Không. Dựa trên dữ liệu y văn hiện tại, không có ghi nhận nào cho thấy tang diệp có liên quan hoặc tác dụng tới phylirin.","Không, vị thuốc tang diệp không chứa hoạt chất phylirin",0.0,0.8279171970109229,0.0,1.0,0.7425547843947584
Vị thuốc thằn lằn có chứa hoạt chất glycocola không?,['Không có dữ liệu'],"Không. Dựa trên dữ liệu y văn hiện tại, không có ghi nhận nào cho thấy thằn lằn có liên quan hoặc tác dụng tới glycocola.","Không, vị thuốc thằn lằn không chứa hoạt chất glycocola",1.0,0.8004301277268879,0.0,1.0,0.24269802229252804
Bệnh loét lưỡi có thể dùng vị thuốc hoặc bài thuốc nào để chữa?,"['[{""ChuThe"": ""Bệnh loét lưỡi"", ""QuanHe"": ""Được chữa bằng (ViThuoc)"", ""DoiTuong"": ""Vị thuốc Hoàng bá"", ""LieuDung"": ""Tham khảo liều dùng chung của vị thuốc"", ""CachDung"": ""Chẻ nhỏ, ngậm. Nước có thể nuốt hay nhổ đi"", ""GhiChu"": """", ""score"": 2.0, ""sort_weight"": 3.0}, {""ChuThe"": ""Triệu chứng Loét lưỡi"", ""QuanHe"": ""Được chữa bằng (ViThuoc)"", ""DoiTuong"": ""Vị thuốc Dạ cẩm"", ""LieuDung"": ""Tham khảo liều dùng chung của vị thuốc"", ""CachDung"": ""Toàn cây dạ cẩm, lá và ngọn non | Lá dạ cẩm. Trẻ con dùng nước vắt của lá uống hoặc ngậm"", ""GhiChu"": ""Chỉ định lâm sàng theo kinh nghiệm dân gian Lạng Sơn, Cao Bằng"", ""score"": 2.0}]']","Để chữa bệnh loét lưỡi, bạn có thể tham khảo các vị thuốc sau:

*   **Vị thuốc Hoàng bá:** Chẻ nhỏ, ngậm. Nước có thể nuốt hay nhổ đi. Về liều dùng, bạn có thể tham khảo liều dùng chung của vị thuốc.

**Thông tin tham khảo thêm:**

Đối với triệu chứng loét lưỡi, bạn có thể tham khảo:

*   **Vị thuốc Dạ cẩm:** Toàn cây dạ cẩm, lá và ngọn non hoặc lá dạ cẩm. Trẻ con dùng nước vắt của lá uống hoặc ngậm. Về liều dùng, bạn có thể tham khảo liều dùng chung của vị thuốc. Đây là chỉ định lâm sàng theo kinh nghiệm dân gian Lạng Sơn, Cao Bằng.",Hoàng bá,1.0,0.4104455250761044,0.9999999999,1.0,0.5314930600230949
Bệnh thũng nước có thể dùng vị thuốc hoặc bài thuốc nào để chữa?,"['[{""ChuThe"": ""Bệnh Thũng nước"", ""QuanHe"": ""Được chữa bằng (ViThuoc)"", ""DoiTuong"": ""Vị thuốc Đại"", ""LieuDung"": ""Sắc $5-10g$ vỏ trong $200ml$ | Dùng với liều $0,50-0,80g$ dưới dạng nhũ dịch"", ""CachDung"": ""Sắc $5-10g$ vỏ trong $200ml$ | Dùng với liều $0,50-0,80g$ dưới dạng nhũ dịch"", ""GhiChu"": ""[Nguồn]: CT_VT_VN_T463"", ""score"": 2.0, ""sort_weight"": 3.0}]']","**Vị thuốc Đại** có thể được dùng để chữa bệnh thũng nước.

*   **Liều dùng và cách dùng:** Sắc 5-10g vỏ trong với 200ml nước hoặc dùng với liều 0,50-0,80g dưới dạng nhũ dịch.",Đại,1.0,0.5460981127981944,0.9999999999,1.0,0.5397193021437579
Thuốc nào vừa có tính ôn vừa trực tiếp chữa bệnh gầy còm?,"['[{""ChuThe"": ""Vị thuốc Nhau sản phụ"", ""QuanHe"": ""Thỏa mãn đồng thời"", ""DoiTuong"": ""Ôn và Bệnh Gầy còm"", ""LieuDung"": ""Chưa ghi nhận"", ""CachDung"": ""Chưa ghi nhận"", ""GhiChu"": """", ""score"": 2.0}]']",Hệ thống y văn hiện tại chưa ghi nhận dữ liệu về vấn đề này.,"Dê, Nhựa cóc",1.0,0.0,0.0,0.0,0.22754587314821828
"Để chữa bệnh chảy máu cam, vị thuốc thanh cao được dùng với liều lượng và cách thức như thế nào?","['[{""ChuThe"": ""Vị thuốc Thanh cao"", ""QuanHe"": ""CHU_TRI_TRIEU_CHUNG"", ""DoiTuong"": ""Triệu chứng Chảy máu cam"", ""LieuDung"": ""$6-12g$"", ""CachDung"": ""Sắc uống"", ""GhiChu"": ""CT_VT_VN_T660"", ""score"": 2.0, ""sort_weight"": 3.0}]']","Để chữa chảy máu cam, theo y văn, bạn có thể sử dụng **Thanh cao** với liều lượng 6-12g, sắc uống.","Để chữa bệnh chảy máu cam, vị thuốc thanh cao có liều dùng: 6-12g và cách dùng: Sắc uống",1.0,0.42732235079017133,0.9999999999,1.0,0.8349736028214019
Vị thuốc bồ kết có tính ôn không?,"['[{""ChuThe"": ""Vị thuốc Bồ kết"", ""QuanHe"": ""Xác nhận: CO_CONG_NANG"", ""DoiTuong"": ""Công năng Ôn"", ""LieuDung"": ""Chưa ghi nhận"", ""CachDung"": ""Chưa ghi nhận"", ""GhiChu"": """", ""score"": 2.0, ""sort_weight"": 3.0}, {""ChuThe"": ""Vị thuốc Bồ kết"", ""QuanHe"": ""Xác nhận: CO_TINH"", ""DoiTuong"": ""Ôn"", ""LieuDung"": ""Chưa ghi nhận"", ""CachDung"": ""Chưa ghi nhận"", ""GhiChu"": """", ""score"": 2.0, ""sort_weight"": 3.0}]']","Dựa trên y văn, vị thuốc **Bồ kết** có tính ôn.","Có, vị thuốc bồ kết có tính ôn",1.0,0.6242984061476252,0.9999999999,1.0,0.9849391612632208
Tác dụng dược lý của rau đay ra sao?,"['[{""ChuThe"": ""Công năng Rau đay"", ""QuanHe"": ""Thông tin chung"", ""DoiTuong"": ""Không có"", ""LieuDung"": ""Chưa ghi nhận"", ""CachDung"": ""Chưa ghi nhận"", ""GhiChu"": """", ""score"": 2.0}, {""ChuThe"": ""Vị thuốc Rau đay"", ""QuanHe"": ""CHU_TRI_BENH"", ""DoiTuong"": ""Bệnh Táo bón"", ""LieuDung"": ""Tham khảo liều dùng chung của vị thuốc | $40-80g$"", ""CachDung"": ""Nấu canh ăn hoặc làm thuốc mát | Nấu canh ăn hằng ngày"", ""GhiChu"": ""Có thể dùng riêng hoặc phối hợp với các loại rau khác"", ""score"": 2.0}, {""ChuThe"": ""Vị thuốc Rau đay"", ""QuanHe"": ""CHU_TRI_BENH"", ""DoiTuong"": ""Bệnh Tim"", ""LieuDung"": ""Tham khảo liều dùng chung của vị thuốc"", ""CachDung"": ""Chế đay cozit"", ""GhiChu"": """", ""score"": 2.0}, {""ChuThe"": ""Vị thuốc Rau đay"", ""QuanHe"": ""CHU_TRI_BENH"", ""DoiTuong"": ""Bệnh Mụn nhọt"", ""LieuDung"": ""Tham khảo liều dùng chung của vị thuốc"", ""CachDung"": ""Giã nát với cơm nguội và muối đắp lên mụn nhọt"", ""GhiChu"": ""Ngày 1-2 lần"", ""score"": 2.0}, {""ChuThe"": ""Vị thuốc Rau đay"", ""QuanHe"": ""CHU_TRI_BENH"", ""DoiTuong"": ""Bệnh Lỵ"", ""LieuDung"": ""$6-12g$"", ""CachDung"": ""Sắc uống"", ""GhiChu"": """", ""score"": 2.0}, {""ChuThe"": ""Vị thuốc Rau đay"", ""QuanHe"": ""CHU_TRI_TRIEU_CHUNG"", ""DoiTuong"": ""Triệu chứng Ho"", ""LieuDung"": ""Tham khảo liều dùng chung của vị thuốc"", ""CachDung"": ""Nấu canh ăn hoặc làm thuốc mát"", ""GhiChu"": """", ""score"": 2.0}, {""ChuThe"": ""Vị thuốc Rau đay"", ""QuanHe"": ""CHU_TRI_TRIEU_CHUNG"", ""DoiTuong"": ""Triệu chứng Đau bụng"", ""LieuDung"": ""$6-12g$"", ""CachDung"": ""Sắc uống"", ""GhiChu"": """", ""score"": 2.0}, {""ChuThe"": ""Vị thuốc Rau đay"", ""QuanHe"": ""CHU_TRI_TRIEU_CHUNG"", ""DoiTuong"": ""Triệu chứng Nhức đầu"", ""LieuDung"": ""$5-10g$"", ""CachDung"": ""Sắc uống"", ""GhiChu"": """", ""score"": 2.0}, {""ChuThe"": ""Vị thuốc Rau đay"", ""QuanHe"": ""CHU_TRI_TRIEU_CHUNG"", ""DoiTuong"": ""Triệu chứng Sốt"", ""LieuDung"": ""$5-10g$"", ""CachDung"": ""Sắc uống"", ""GhiChu"": """", ""score"": 2.0}, {""ChuThe"": ""Vị thuốc Rau đay"", ""QuanHe"": ""CO_CONG_NANG"", ""DoiTuong"": ""Triệu chứng Tiểu tiện khó khăn"", ""LieuDung"": ""$40-80g$"", ""CachDung"": ""Nấu canh ăn hằng ngày"", ""GhiChu"": ""Có thể dùng riêng hoặc phối hợp với các loại rau khác"", ""score"": 2.0}, {""ChuThe"": ""Vị thuốc Rau đay"", ""QuanHe"": ""CO_CONG_NANG"", ""DoiTuong"": ""Công năng Thông sữa"", ""LieuDung"": ""$6-12g$"", ""CachDung"": ""Sắc uống"", ""GhiChu"": """", ""score"": 2.0}, {""ChuThe"": ""Vị thuốc Rau đay"", ""QuanHe"": ""CO_CONG_NANG"", ""DoiTuong"": ""Công năng Lợi sữa"", ""LieuDung"": ""$150-200g$"", ""CachDung"": ""Tuần đầu tiên sau khi đẻ, ăn hàng ngày vào mỗi bữa ăn chính. Các tuần lễ sau, mỗi tuần ăn 2 lần với liều $200-250g$ thì lượng sữa tăng. Trong sữa tỷ lệ chất béo tăng hơn mức trung bình"", ""GhiChu"": ""Ăn hàng ngày vào mỗi bữa ăn chính trong tuần đầu tiên sau khi đẻ. Các tuần lễ sau, mỗi tuần ăn 2 lần với liều $200-250g$ thì lượng sữa tăng. Trong sữa tỷ lệ chất béo tăng hơn mức trung bình"", ""score"": 2.0}, {""ChuThe"": ""Vị thuốc Rau đay"", ""QuanHe"": ""CO_CONG_NANG"", ""DoiTuong"": ""Công năng Rau đay"", ""LieuDung"": ""Chưa ghi nhận"", ""CachDung"": ""Chưa ghi nhận"", ""GhiChu"": """", ""score"": 2.0}, {""ChuThe"": ""Vị thuốc Rau đay"", ""QuanHe"": ""CO_CONG_NANG"", ""DoiTuong"": ""Công năng Lợi tiểu"", ""LieuDung"": ""$6-12g$"", ""CachDung"": ""Sắc uống"", ""GhiChu"": """", ""score"": 2.0}, {""ChuThe"": ""Vị thuốc Rau đay"", ""QuanHe"": ""CO_TAC_DUNG_DUOC_LY"", ""DoiTuong"": ""Dược lý Độc tính tim"", ""LieuDung"": ""Chưa ghi nhận"", ""CachDung"": ""Chưa ghi nhận"", ""GhiChu"": ""Độc tính được đo bằng đơn vị ếch và đơn vị mèo, cho thấy tác động mạnh lên tim."", ""score"": 2.0, ""sort_weight"": 3.0}, {""ChuThe"": ""Vị thuốc Rau đay"", ""QuanHe"": ""CO_TAC_DUNG_DUOC_LY"", ""DoiTuong"": ""Dược lý Tim"", ""LieuDung"": ""Chưa ghi nhận"", ""CachDung"": ""Chưa ghi nhận"", ""GhiChu"": """", ""score"": 2.0, ""sort_weight"": 3.0}, {""ChuThe"": ""Vị thuốc Rau đay"", ""QuanHe"": ""CO_CHUA_HOAT_CHAT"", ""DoiTuong"": ""Hoạt chất Axit Stearic"", ""LieuDung"": ""Chưa ghi nhận"", ""CachDung"": ""Chưa ghi nhận"", ""GhiChu"": """", ""score"": 2.0}, {""ChuThe"": ""Vị thuốc Rau đay"", ""QuanHe"": ""CO_CHUA_HOAT_CHAT"", ""DoiTuong"": ""Hoạt chất Axit Behenic"", ""LieuDung"": ""Chưa ghi nhận"", ""CachDung"": ""Chưa ghi nhận"", ""GhiChu"": """", ""score"": 2.0}, {""ChuThe"": ""Vị thuốc Rau đay"", ""QuanHe"": ""CO_CHUA_HOAT_CHAT"", ""DoiTuong"": ""Hoạt chất Axit Lignoxeric"", ""LieuDung"": ""Chưa ghi nhận"", ""CachDung"": ""Chưa ghi nhận"", ""GhiChu"": """", ""score"": 2.0}, {""ChuThe"": ""Vị thuốc Rau đay"", ""QuanHe"": ""CO_CHUA_HOAT_CHAT"", ""DoiTuong"": ""Hoạt chất Axit Linolenic"", ""LieuDung"": ""Chưa ghi nhận"", ""CachDung"": ""Chưa ghi nhận"", ""GhiChu"": """", ""score"": 2.0}, {""ChuThe"": ""Vị thuốc Rau đay"", ""QuanHe"": ""CO_CHUA_HOAT_CHAT"", ""DoiTuong"": ""Hoạt chất Capsulin"", ""LieuDung"": ""Chưa ghi nhận"", ""CachDung"": ""Chưa ghi nhận"", ""GhiChu"": """", ""score"": 2.0}, {""ChuThe"": ""Vị thuốc Rau đay"", ""QuanHe"": ""CO_CHUA_HOAT_CHAT"", ""DoiTuong"": ""Hoạt chất Corchorin"", ""LieuDung"": ""Chưa ghi nhận"", ""CachDung"": ""Chưa ghi nhận"", ""GhiChu"": ""Lặp lại ở [CT_VT_VN_T414]"", ""score"": 2.0}, {""ChuThe"": ""Vị thuốc Rau đay"", ""QuanHe"": ""CO_CHUA_HOAT_CHAT"", ""DoiTuong"": ""Hoạt chất Corchoritin"", ""LieuDung"": ""Chưa ghi nhận"", ""CachDung"": ""Chưa ghi nhận"", ""GhiChu"": ""Lặp lại ở [CT_VT_VN_T414]"", ""score"": 2.0}, {""ChuThe"": ""Vị thuốc Rau đay"", ""QuanHe"": ""CO_CHUA_HOAT_CHAT"", ""DoiTuong"": ""Hoạt chất Corchorozit"", ""LieuDung"": ""Chưa ghi nhận"", ""CachDung"": ""Chưa ghi nhận"", ""GhiChu"": """", ""score"": 2.0}, {""ChuThe"": ""Vị thuốc Rau đay"", ""QuanHe"": ""CO_CHUA_HOAT_CHAT"", ""DoiTuong"": ""Hoạt chất Corchosularoza"", ""LieuDung"": ""Chưa ghi nhận"", ""CachDung"": ""Chưa ghi nhận"", ""GhiChu"": """", ""score"": 2.0}, {""ChuThe"": ""Vị thuốc Rau đay"", ""QuanHe"": ""CO_CHUA_HOAT_CHAT"", ""DoiTuong"": ""Hoạt chất Corchotoxin"", ""LieuDung"": ""Chưa ghi nhận"", ""CachDung"": ""Chưa ghi nhận"", ""GhiChu"": """", ""score"": 2.0}, {""ChuThe"": ""Vị thuốc Rau đay"", ""QuanHe"": ""CO_CHUA_HOAT_CHAT"", ""DoiTuong"": ""Hoạt chất Corchsularin"", ""LieuDung"": ""Chưa ghi nhận"", ""CachDung"": ""Chưa ghi nhận"", ""GhiChu"": """", ""score"": 2.0}, {""ChuThe"": ""Vị thuốc Rau đay"", ""QuanHe"": ""CO_CHUA_HOAT_CHAT"", ""DoiTuong"": ""Hoạt chất Daycozit"", ""LieuDung"": ""Chưa ghi nhận"", ""CachDung"": ""Chưa ghi nhận"", ""GhiChu"": """", ""score"": 2.0}, {""ChuThe"": ""Vị thuốc Rau đay"", ""QuanHe"": ""CO_CHUA_HOAT_CHAT"", ""DoiTuong"": ""Hoạt chất Olitorizit"", ""LieuDung"": ""Chưa ghi nhận"", ""CachDung"": ""Chưa ghi nhận"", ""GhiChu"": """", ""score"": 2.0}, {""ChuThe"": ""Vị thuốc Rau đay"", ""QuanHe"": ""CO_CHUA_HOAT_CHAT"", ""DoiTuong"": ""Hoạt chất Axit Panmitic"", ""LieuDung"": ""Chưa ghi nhận"", ""CachDung"": ""Chưa ghi nhận"", ""GhiChu"": """", ""score"": 2.0}]']","Dựa trên y văn, **Rau đay** có các tác dụng dược lý sau:

*   **Dược lý Độc tính tim**: Độc tính được đo bằng đơn vị ếch và đơn vị mèo, cho thấy tác động mạnh lên tim.
*   **Dược lý Tim**: Chưa ghi nhận thông tin chi tiết.","Dược lý Tim, Dược lý Độc tim",1.0,0.4017321442243028,0.9999999999,1.0,0.6402583185801654
Thuốc nào vừa có tính lương vừa trực tiếp chữa bệnh ia ra mau?,"['[{""ChuThe"": ""Vị thuốc Cỏ nhọ nồi"", ""QuanHe"": ""Thỏa mãn đồng thời"", ""DoiTuong"": ""Lương và Bệnh Ia Ra Mau"", ""LieuDung"": ""Chưa ghi nhận"", ""CachDung"": ""Chưa ghi nhận"", ""GhiChu"": """", ""score"": 2.0}, {""ChuThe"": ""Vị thuốc Mào gà đỏ"", ""QuanHe"": ""Thỏa mãn đồng thời"", ""DoiTuong"": ""Lương và Bệnh Ia Ra Mau"", ""LieuDung"": ""Chưa ghi nhận"", ""CachDung"": ""Chưa ghi nhận"", ""GhiChu"": """", ""score"": 2.0}]']",Hệ thống y văn hiện tại chưa ghi nhận dữ liệu về vấn đề này.,"Cỏ nhọ nồi, Mào gà đỏ",1.0,0.0,0.9999999999,1.0,0.23719971257818234
"Để chữa bệnh cảm mạo, vị thuốc dâu được dùng với liều lượng và cách thức như thế nào?","['[{""ChuThe"": ""Vị thuốc Dâu"", ""QuanHe"": ""CHU_TRI_BENH"", ""DoiTuong"": ""Bệnh Cảm mạo"", ""LieuDung"": ""Tang diệp $6-18g$"", ""CachDung"": ""Dưới dạng thuốc sắc"", ""GhiChu"": ""CT_VT_VN_T739"", ""score"": 2.0, ""sort_weight"": 3.0}]']","Để chữa bệnh cảm mạo, **Dâu** (Tang diệp) được dùng như sau:

*   **Liều dùng:** 6-18g
*   **Cách dùng:** Dưới dạng thuốc sắc.","Để chữa bệnh cảm mạo, vị thuốc dâu có liều dùng: Tang diệp 6-18g và cách dùng: Dưới dạng thuốc sắc",1.0,0.5179285388515563,0.9999999999,1.0,0.7372310117279405
Thuốc nào vừa có tính bình vừa trực tiếp chữa bệnh hen?,"['[{""ChuThe"": ""Vị thuốc Bảy lá một hoa"", ""QuanHe"": ""Thỏa mãn đồng thời"", ""DoiTuong"": ""Bình và Bệnh Hen suyễn"", ""LieuDung"": ""Chưa ghi nhận"", ""CachDung"": ""Chưa ghi nhận"", ""GhiChu"": """", ""score"": 2.0}, {""ChuThe"": ""Vị thuốc Dâu"", ""QuanHe"": ""Thỏa mãn đồng thời"", ""DoiTuong"": ""Bình và Bệnh Hen"", ""LieuDung"": ""Chưa ghi nhận"", ""CachDung"": ""Chưa ghi nhận"", ""GhiChu"": """", ""score"": 2.0}, {""ChuThe"": ""Vị thuốc Dâu"", ""QuanHe"": ""Thỏa mãn đồng thời"", ""DoiTuong"": ""Công năng Bình suyễn và Bệnh Hen"", ""LieuDung"": ""Chưa ghi nhận"", ""CachDung"": ""Chưa ghi nhận"", ""GhiChu"": """", ""score"": 2.0}, {""ChuThe"": ""Vị thuốc Nấm linh chi"", ""QuanHe"": ""Thỏa mãn đồng thời"", ""DoiTuong"": ""Bình và Bệnh Hen"", ""LieuDung"": ""Chưa ghi nhận"", ""CachDung"": ""Chưa ghi nhận"", ""GhiChu"": """", ""score"": 2.0}, {""ChuThe"": ""Vị thuốc Nấm linh chi"", ""QuanHe"": ""Thỏa mãn đồng thời"", ""DoiTuong"": ""Công năng Bình và Bệnh Hen"", ""LieuDung"": ""Chưa ghi nhận"", ""CachDung"": ""Chưa ghi nhận"", ""GhiChu"": """", ""score"": 2.0}, {""ChuThe"": ""Vị thuốc Yến"", ""QuanHe"": ""Thỏa mãn đồng thời"", ""DoiTuong"": ""Bình và Bệnh Ho hen"", ""LieuDung"": ""Chưa ghi nhận"", ""CachDung"": ""Chưa ghi nhận"", ""GhiChu"": """", ""score"": 2.0}, {""ChuThe"": ""Vị thuốc Yến"", ""QuanHe"": ""Thỏa mãn đồng thời"", ""DoiTuong"": ""Bình và Bệnh Hen suyễn"", ""LieuDung"": ""Chưa ghi nhận"", ""CachDung"": ""Chưa ghi nhận"", ""GhiChu"": """", ""score"": 2.0}, {""ChuThe"": ""Vị thuốc Long duyên hương"", ""QuanHe"": ""Thỏa mãn đồng thời"", ""DoiTuong"": ""Bình và Bệnh Hen suyễn"", ""LieuDung"": ""Chưa ghi nhận"", ""CachDung"": ""Chưa ghi nhận"", ""GhiChu"": """", ""score"": 2.0}]']","Hệ thống y văn ghi nhận các vị thuốc vừa có tính bình, vừa có tác dụng với bệnh hen như sau:

**Thông tin tham khảo thêm:**

*   **Bảy lá một hoa**, **Dâu**, **Nấm linh chi**, **Yến**, **Long duyên hương** có tác dụng với bệnh hen suyễn. Liều dùng và cách dùng chưa được ghi nhận.
*   **Dâu**, **Nấm linh chi**, **Yến** có tác dụng với bệnh ho hen. Liều dùng và cách dùng chưa được ghi nhận.","Dâu, Nấm linh chi",1.0,0.44852810779484903,0.9999999999,1.0,0.43849844639540114
Bệnh đau nhức thấp khớp có thể dùng vị thuốc hoặc bài thuốc nào để chữa?,"['[{""ChuThe"": ""Bệnh Đau nhức thấp khớp"", ""QuanHe"": ""Được chữa bằng (ViThuoc)"", ""DoiTuong"": ""Vị thuốc Cát sâm"", ""LieuDung"": ""$40-80g$"", ""CachDung"": ""Dưới dạng thuốc sắc"", ""GhiChu"": ""Tham khảo liều dùng chung của vị thuốc"", ""score"": 2.0, ""sort_weight"": 3.0}, {""ChuThe"": ""Triệu chứng Đau nhức thấp khớp"", ""QuanHe"": ""Được chữa bằng (ViThuoc)"", ""DoiTuong"": ""Vị thuốc Rắn"", ""LieuDung"": ""$0,1mg$ nọc rắn hổ mang khô"", ""CachDung"": ""Khi dùng lấy $3-5g$ thuốc này bôi lên nơi đau, xoa bóp cho đều. Ngày xoa 1 đến 2 hoặc 3 lần"", ""GhiChu"": """", ""score"": 2.0}]']","Bệnh đau nhức thấp khớp có thể được chữa bằng các vị thuốc sau:

*   **Vị thuốc Cát sâm**: Dùng 40-80g dưới dạng thuốc sắc. Tham khảo liều dùng chung của vị thuốc.

**Thông tin tham khảo thêm:**

Đối với triệu chứng đau nhức thấp khớp, bạn có thể tham khảo:

*   **Vị thuốc Rắn**: Dùng 0,1mg nọc rắn hổ mang khô. Khi dùng lấy 3-5g thuốc này bôi lên nơi đau, xoa bóp cho đều. Ngày xoa 1 đến 2 hoặc 3 lần.",Rắn,1.0,0.43462331984293784,0.9999999999,1.0,0.404458253596951
Bệnh âm ngứa có thể dùng vị thuốc hoặc bài thuốc nào để chữa?,"['[{""ChuThe"": ""Triệu chứng Âm ngứa"", ""QuanHe"": ""Được chữa bằng (BaiThuoc)"", ""DoiTuong"": ""Bài thuốc Am Ngựa Cam Thạch"", ""LieuDung"": ""Chưa ghi nhận"", ""CachDung"": ""Chưa ghi nhận"", ""GhiChu"": """", ""score"": 2.0}]']","Dựa trên y văn hiện có, đối với triệu chứng âm ngứa, bạn có thể tham khảo bài thuốc sau:

**Bài thuốc Am Ngựa Cam Thạch** được dùng để chữa trị triệu chứng âm ngứa. Liều dùng và cách dùng của bài thuốc này hiện chưa được ghi nhận.",Am Ngựa Cam Thạch,1.0,0.0,0.9999999999,1.0,0.5235787576534834
"Để chữa bệnh sâu răng, vị thuốc trẩu được dùng với liều lượng và cách thức như thế nào?","['[{""ChuThe"": ""Vị thuốc Trẩu"", ""QuanHe"": ""CHU_TRI_BENH"", ""DoiTuong"": ""Bệnh Sâu răng"", ""LieuDung"": ""Tham khảo liều dùng chung của vị thuốc"", ""CachDung"": ""Vỏ cây trẩu sắc với nước dùng ngậm nhiều lần, nhổ nước đi không được nuốt"", ""GhiChu"": ""CT_VT_VN_T356"", ""score"": 2.0, ""sort_weight"": 3.0}]']","Để chữa bệnh sâu răng, bạn có thể tham khảo cách dùng vị thuốc **Trẩu** như sau:

*   **Cách dùng:** Vỏ cây trẩu sắc với nước dùng ngậm nhiều lần, nhổ nước đi không được nuốt.
*   **Liều dùng:** Tham khảo liều dùng chung của vị thuốc.","Để chữa bệnh sâu răng, vị thuốc trẩu có liều dùng: Tham khảo liều dùng chung của vị thuốc và cách dùng: Vỏ cây trẩu sắc với nước dùng ngậm nhiều lần, nhổ nước đi không được nuốt",1.0,0.4820806727944907,0.9999999999,1.0,0.88730423294567
Bệnh sốt về chiều có thể dùng vị thuốc hoặc bài thuốc nào để chữa?,"['[{""ChuThe"": ""Bệnh Sốt về chiều"", ""QuanHe"": ""Được chữa bằng (ViThuoc)"", ""DoiTuong"": ""Vị thuốc Kỷ tử"", ""LieuDung"": ""$20-40g$"", ""CachDung"": ""Sắc uống"", ""GhiChu"": ""Địa tiên (lá kỷ tử)"", ""score"": 2.0, ""sort_weight"": 3.0}, {""ChuThe"": ""Triệu chứng Sốt về chiều"", ""QuanHe"": ""Được chữa bằng (BaiThuoc)"", ""DoiTuong"": ""Bài thuốc Sốt về chiều, bồn chồn"", ""LieuDung"": ""Chưa ghi nhận"", ""CachDung"": ""Long nhãn cho vào nước sắc kỹ, vắt lọc lấy nước, cắt nhỏ cao ban long vào khuấy và đun cho tan. Uống khi còn nóng"", ""GhiChu"": """", ""score"": 2.0}]']","Bệnh sốt về chiều có thể được chữa bằng các vị thuốc và bài thuốc sau:

*   **Vị thuốc Kỷ tử:** Liều dùng 20-40g, sắc uống. Có thể dùng lá kỷ tử (Địa tiên).

**Thông tin tham khảo thêm:**

*   **Bài thuốc Sốt về chiều, bồn chồn:** Long nhãn cho vào nước sắc kỹ, vắt lọc lấy nước, cắt nhỏ cao ban long vào khuấy và đun cho tan. Uống khi còn nóng.","Sốt về chiều, bồn chồn",1.0,0.40396555768705045,0.9999999999,1.0,0.45253805377386547
Bệnh kinh phong cấp có thể dùng vị thuốc hoặc bài thuốc nào để chữa?,"['[{""ChuThe"": ""Bệnh Kinh phong cấp"", ""QuanHe"": ""Được chữa bằng (ViThuoc)"", ""DoiTuong"": ""Vị thuốc Giun đất"", ""LieuDung"": ""Tham khảo liều dùng chung của vị thuốc"", ""CachDung"": ""Chỉ định lâm sàng theo kinh nghiệm"", ""GhiChu"": ""CT_VT_VN_T995"", ""score"": 2.0, ""sort_weight"": 3.0}]']","**Bệnh kinh phong cấp** có thể được chữa bằng vị thuốc **Giun đất**. Về liều dùng và cách dùng, bạn nên tham khảo liều dùng chung của vị thuốc và chỉ định lâm sàng theo kinh nghiệm.",Giun đất,1.0,0.5804708332994968,0.9999999999,1.0,0.5621520674192234
Thuốc nào vừa có tính bình vừa trực tiếp chữa bệnh hôi miệng?,['Không có dữ liệu'],Hệ thống y văn hiện tại chưa ghi nhận dữ liệu về vấn đề này.,"Bán, Mật đà tăng",1.0,0.0,0.0,0.0,0.22605540734334348
Vị thuốc lộc nhung (mã nhung) chứa hoạt chất gì?,"['[{""ChuThe"": ""Vị thuốc Lộc nhung (mã nhung)"", ""QuanHe"": ""CO_CHUA_HOAT_CHAT"", ""DoiTuong"": ""Hoạt chất Keo"", ""LieuDung"": ""Chưa ghi nhận"", ""CachDung"": ""Chưa ghi nhận"", ""GhiChu"": ""Tìm thấy trong nhung hươu nai nói chung, không chỉ rõ loài nào nên để null ở ap_dung_cho_loai. Cần xem xét thêm thông tin để xác định chính xác hơn nếu có."", ""score"": 2.0, ""sort_weight"": 3.0}, {""ChuThe"": ""Vị thuốc Lộc nhung (mã nhung)"", ""QuanHe"": ""CO_CHUA_HOAT_CHAT"", ""DoiTuong"": ""Hoạt chất Lộc nhung tinh"", ""LieuDung"": ""Chưa ghi nhận"", ""CachDung"": ""Chưa ghi nhận"", ""GhiChu"": ""Tìm thấy trong nhung hươu nai nói chung, không chỉ rõ loài nào nên để null ở ap_dung_cho_loai. Cần xem xét thêm thông tin để xác định chính xác hơn nếu có."", ""score"": 2.0, ""sort_weight"": 3.0}, {""ChuThe"": ""Vị thuốc Lộc nhung (mã nhung)"", ""QuanHe"": ""CO_CHUA_HOAT_CHAT"", ""DoiTuong"": ""Hoạt chất Protit"", ""LieuDung"": ""Chưa ghi nhận"", ""CachDung"": ""Chưa ghi nhận"", ""GhiChu"": ""Tìm thấy trong nhung hươu nai nói chung, không chỉ rõ loài nào nên để null ở ap_dung_cho_loai. Cần xem xét thêm thông tin để xác định chính xác hơn nếu có."", ""score"": 2.0, ""sort_weight"": 3.0}, {""ChuThe"": ""Vị thuốc Lộc nhung (mã nhung)"", ""QuanHe"": ""CO_CHUA_HOAT_CHAT"", ""DoiTuong"": ""Hoạt chất Canxi Cacbonat"", ""LieuDung"": ""Chưa ghi nhận"", ""CachDung"": ""Chưa ghi nhận"", ""GhiChu"": ""Tìm thấy trong nhung hươu nai nói chung, không chỉ rõ loài nào nên để null ở ap_dung_cho_loai. Cần xem xét thêm thông tin để xác định chính xác hơn nếu có."", ""score"": 2.0, ""sort_weight"": 3.0}, {""ChuThe"": ""Vị thuốc Lộc nhung (mã nhung)"", ""QuanHe"": ""CO_CHUA_HOAT_CHAT"", ""DoiTuong"": ""Hoạt chất Canxi Photphat"", ""LieuDung"": ""Chưa ghi nhận"", ""CachDung"": ""Chưa ghi nhận"", ""GhiChu"": ""Tìm thấy trong nhung hươu nai nói chung, không chỉ rõ loài nào nên để null ở ap_dung_cho_loai. Cần xem xét thêm thông tin để xác định chính xác hơn nếu có."", ""score"": 2.0, ""sort_weight"": 3.0}]']","Vị thuốc **Lộc nhung (mã nhung)** chứa các hoạt chất sau:

*   Hoạt chất Keo
*   Hoạt chất Lộc nhung tinh
*   Hoạt chất Protit
*   Hoạt chất Canxi Cacbonat
*   Hoạt chất Canxi Photphat","Canxi Cacbonat, Canxi Photphat, Keo, Lộc nhung tinh, Protit",1.0,0.6119173511199297,0.9999999999,1.0,0.9555652897286782
Vị thuốc khương hoạt có công năng gì?,"['[{""ChuThe"": ""Bài thuốc Phù thũng Khương hoạt"", ""QuanHe"": ""CHU_TRI_BENH"", ""DoiTuong"": ""Bệnh Phù thũng"", ""LieuDung"": ""Mỗi lần uống $6$ đến $8g$. Ngày thứ $1$ uống $1$ lần, ngày thứ $2$ uống $2$ lần, ngày thứ $3$ uống $3$ lần là đủ."", ""CachDung"": ""Dùng rượu hâm nóng lên mà chiêu thuốc."", ""GhiChu"": ""CT_VT_VN_T682"", ""score"": 2.0}, {""ChuThe"": ""Bài thuốc Phù thũng Khương hoạt"", ""QuanHe"": ""BAO_GOM_VI_THUOC"", ""DoiTuong"": ""Vị thuốc Lá bách tử"", ""LieuDung"": ""La bặc tử"", ""CachDung"": ""Sao thơm, tán nhỏ"", ""GhiChu"": ""CT_VT_VN_T682"", ""score"": 2.0}, {""ChuThe"": ""Bài thuốc Phù thũng Khương hoạt"", ""QuanHe"": ""BAO_GOM_VI_THUOC"", ""DoiTuong"": ""Vị thuốc Khương hoạt"", ""LieuDung"": ""Khương hoạt"", ""CachDung"": ""Sao thơm, tán nhỏ"", ""GhiChu"": ""CT_VT_VN_T682"", ""score"": 2.0}, {""ChuThe"": ""Bài thuốc Tê dại mất tiếng Khương hoạt"", ""QuanHe"": ""CHU_TRI_TRIEU_CHUNG"", ""DoiTuong"": ""Triệu chứng Chân tay co quắp"", ""LieuDung"": ""Mỗi lần cho uống $8$ đến $12g"", ""CachDung"": ""Dùng rượu chiêu thuốc."", ""GhiChu"": ""CT_VT_VN_T682"", ""score"": 2.0}, {""ChuThe"": ""Bài thuốc Tê dại mất tiếng Khương hoạt"", ""QuanHe"": ""CHU_TRI_TRIEU_CHUNG"", ""DoiTuong"": ""Triệu chứng Nôn"", ""LieuDung"": ""Mỗi lần cho uống $8$ đến $12g"", ""CachDung"": ""Dùng rượu chiêu thuốc."", ""GhiChu"": ""CT_VT_VN_T682"", ""score"": 2.0}, {""ChuThe"": ""Bài thuốc Tê dại mất tiếng Khương hoạt"", ""QuanHe"": ""CHU_TRI_TRIEU_CHUNG"", ""DoiTuong"": ""Triệu chứng Nói ngọng"", ""LieuDung"": ""Mỗi lần cho uống $8$ đến $12g"", ""CachDung"": ""Dùng rượu chiêu thuốc."", ""GhiChu"": ""CT_VT_VN_T682"", ""score"": 2.0}, {""ChuThe"": ""Bài thuốc Tê dại mất tiếng Khương hoạt"", ""QuanHe"": ""CHU_TRI_TRIEU_CHUNG"", ""DoiTuong"": ""Triệu chứng Tê dại mất tiếng"", ""LieuDung"": ""Mỗi lần cho uống $8$ đến $12g"", ""CachDung"": ""Dùng rượu chiêu thuốc."", ""GhiChu"": ""CT_VT_VN_T682"", ""score"": 2.0}, {""ChuThe"": ""Bài thuốc Tê dại mất tiếng Khương hoạt"", ""QuanHe"": ""BAO_GOM_VI_THUOC"", ""DoiTuong"": ""Vị thuốc Khương hoạt"", ""LieuDung"": ""Khương hoạt"", ""CachDung"": ""Tán nhỏ"", ""GhiChu"": ""CT_VT_VN_T682"", ""score"": 2.0}, {""ChuThe"": ""Vị thuốc Khương hoạt"", ""QuanHe"": ""CO_VI"", ""DoiTuong"": ""Vị ngọt"", ""LieuDung"": ""Chưa ghi nhận"", ""CachDung"": ""Chưa ghi nhận"", ""GhiChu"": """", ""score"": 2.0}, {""ChuThe"": ""Vị thuốc Khương hoạt"", ""QuanHe"": ""CO_VI"", ""DoiTuong"": ""Vị đắng"", ""LieuDung"": ""Chưa ghi nhận"", ""CachDung"": ""Chưa ghi nhận"", ""GhiChu"": """", ""score"": 2.0}, {""ChuThe"": ""Vị thuốc Khương hoạt"", ""QuanHe"": ""CO_TINH"", ""DoiTuong"": ""Bình"", ""LieuDung"": ""Chưa ghi nhận"", ""CachDung"": ""Chưa ghi nhận"", ""GhiChu"": """", ""score"": 2.0}, {""ChuThe"": ""Vị thuốc Khương hoạt"", ""QuanHe"": ""CO_CHUA_HOAT_CHAT"", ""DoiTuong"": ""Hoạt chất Tinh dầu"", ""LieuDung"": ""Chưa ghi nhận"", ""CachDung"": ""Chưa ghi nhận"", ""GhiChu"": ""trong Khương Hoạt có tinh dầu, các hoạt chất khác chưa thấy có tài liệu nghiên cứu."", ""score"": 2.0}, {""ChuThe"": ""Vị thuốc Khương hoạt"", ""QuanHe"": ""CHU_TRI_TRIEU_CHUNG"", ""DoiTuong"": ""Triệu chứng Cảm mạo phong hàn"", ""LieuDung"": ""$4-$8g$"", ""CachDung"": ""Dạng thuốc sắc hay thuốc rượu."", ""GhiChu"": ""CT_VT_VN_T682"", ""score"": 2.0}, {""ChuThe"": ""Vị thuốc Khương hoạt"", ""QuanHe"": ""CHU_TRI_TRIEU_CHUNG"", ""DoiTuong"": ""Triệu chứng Thân lạnh"", ""LieuDung"": ""$4-$8g$"", ""CachDung"": ""Dạng thuốc sắc hay thuốc rượu."", ""GhiChu"": ""CT_VT_VN_T682"", ""score"": 2.0}, {""ChuThe"": ""Vị thuốc Khương hoạt"", ""QuanHe"": ""CHU_TRI_TRIEU_CHUNG"", ""DoiTuong"": ""Triệu chứng Đau nhức"", ""LieuDung"": ""$4-$8g$"", ""CachDung"": ""Dạng thuốc sắc hay thuốc rượu."", ""GhiChu"": ""CT_VT_VN_T682"", ""score"": 2.0}, {""ChuThe"": ""Vị thuốc Khương hoạt"", ""QuanHe"": ""CHU_TRI_TRIEU_CHUNG"", ""DoiTuong"": ""Triệu chứng Nhức đầu"", ""LieuDung"": ""$4-$8g$"", ""CachDung"": ""Dạng thuốc sắc hay thuốc rượu."", ""GhiChu"": ""CT_VT_VN_T682"", ""score"": 2.0}, {""ChuThe"": ""Vị thuốc Khương hoạt"", ""QuanHe"": ""CHU_TRI_TRIEU_CHUNG"", ""DoiTuong"": ""Triệu chứng Sốt"", ""LieuDung"": ""$4-$8g$"", ""CachDung"": ""Dạng thuốc sắc hay thuốc rượu."", ""GhiChu"": ""CT_VT_VN_T682"", ""score"": 2.0}, {""ChuThe"": ""Vị thuốc Khương hoạt"", ""QuanHe"": ""CO_CONG_NANG"", ""DoiTuong"": ""Công năng Trừ thấp"", ""LieuDung"": ""Chưa ghi nhận"", ""CachDung"": ""Chưa ghi nhận"", ""GhiChu"": """", ""score"": 2.0, ""sort_weight"": 3.0}, {""ChuThe"": ""Vị thuốc Khương hoạt"", ""QuanHe"": ""CO_CONG_NANG"", ""DoiTuong"": ""Công năng Tán hàn"", ""LieuDung"": ""Chưa ghi nhận"", ""CachDung"": ""Chưa ghi nhận"", ""GhiChu"": """", ""score"": 2.0, ""sort_weight"": 3.0}, {""ChuThe"": ""Vị thuốc Khương hoạt"", ""QuanHe"": ""CO_CONG_NANG"", ""DoiTuong"": ""Công năng Khu phong"", ""LieuDung"": ""Chưa ghi nhận"", ""CachDung"": ""Chưa ghi nhận"", ""GhiChu"": """", ""score"": 2.0, ""sort_weight"": 3.0}]']","Vị thuốc **Khương hoạt** có các công năng sau:

*   Trừ thấp
*   Tán hàn
*   Khu phong","Khu phong, Trừ thấp, Tán hàn",1.0,0.5641951338654927,0.9999999999,1.0,0.9800780337644397
Hãy cho biết công năng của tử uyển.,"['[{""ChuThe"": ""Bài thuốc Ho gà (Tự Uyển)"", ""QuanHe"": ""BAO_GOM_VI_THUOC"", ""DoiTuong"": ""Vị thuốc Bách bộ"", ""LieuDung"": ""$0,05g$"", ""CachDung"": ""Chưa ghi nhận"", ""GhiChu"": """", ""score"": 2.0}, {""ChuThe"": ""Bài thuốc Ho gà (Tự Uyển)"", ""QuanHe"": ""BAO_GOM_VI_THUOC"", ""DoiTuong"": ""Vị thuốc Tía tô"", ""LieuDung"": ""$0,025g$"", ""CachDung"": ""Chưa ghi nhận"", ""GhiChu"": """", ""score"": 2.0}, {""ChuThe"": ""Bài thuốc Ho gà (Tự Uyển)"", ""QuanHe"": ""BAO_GOM_VI_THUOC"", ""DoiTuong"": ""Vị thuốc Cát căn"", ""LieuDung"": ""$0,025g$"", ""CachDung"": ""Chưa ghi nhận"", ""GhiChu"": """", ""score"": 2.0}, {""ChuThe"": ""Bài thuốc Ho gà (Tự Uyển)"", ""QuanHe"": ""BAO_GOM_VI_THUOC"", ""DoiTuong"": ""Vị thuốc Cà độc dược"", ""LieuDung"": ""$0,015g$"", ""CachDung"": ""Chưa ghi nhận"", ""GhiChu"": """", ""score"": 2.0}, {""ChuThe"": ""Bài thuốc Ho gà (Tự Uyển)"", ""QuanHe"": ""BAO_GOM_VI_THUOC"", ""DoiTuong"": ""Vị thuốc Tử uyển"", ""LieuDung"": ""$0,025g$"", ""CachDung"": ""Chưa ghi nhận"", ""GhiChu"": """", ""score"": 2.0}, {""ChuThe"": ""Bài thuốc Ho gà (Tự Uyển)"", ""QuanHe"": ""BAO_GOM_VI_THUOC"", ""DoiTuong"": ""Vị thuốc Trần bì"", ""LieuDung"": ""$0,05g$"", ""CachDung"": ""Chưa ghi nhận"", ""GhiChu"": """", ""score"": 2.0}, {""ChuThe"": ""Bài thuốc Ho không ra tiếng (Tự Uyển)"", ""QuanHe"": ""CHU_TRI_TRIEU_CHUNG"", ""DoiTuong"": ""Triệu chứng Ho không ra tiếng"", ""LieuDung"": ""3-4 viên/ngày"", ""CachDung"": ""chia làm nhiều lần uống"", ""GhiChu"": ""Trẻ con ho không ra tiếng"", ""score"": 2.0}, {""ChuThe"": ""Bài thuốc Ho không ra tiếng (Tự Uyển)"", ""QuanHe"": ""BAO_GOM_VI_THUOC"", ""DoiTuong"": ""Vị thuốc Hạnh nhân"", ""LieuDung"": ""bằng nhau"", ""CachDung"": ""Tán nhỏ, viên với mật bằng hạt ngô. Ngày uống 3-4 viên, chia làm nhiều lần uống"", ""GhiChu"": ""Trẻ con ho không ra tiếng"", ""score"": 2.0}, {""ChuThe"": ""Bài thuốc Ho không ra tiếng (Tự Uyển)"", ""QuanHe"": ""BAO_GOM_VI_THUOC"", ""DoiTuong"": ""Vị thuốc Tử uyển"", ""LieuDung"": ""bằng nhau"", ""CachDung"": ""Tán nhỏ, viên với mật bằng hạt ngô. Ngày uống 3-4 viên, chia làm nhiều lần uống"", ""GhiChu"": ""Trẻ con ho không ra tiếng"", ""score"": 2.0}, {""ChuThe"": ""Bài thuốc Viêm khí quản mạn tính (Tự Uyển)"", ""QuanHe"": ""CHU_TRI_BENH"", ""DoiTuong"": ""Bệnh Viêm khí quản mạn tính"", ""LieuDung"": ""Nước $600ml$ sắc còn $200ml$"", ""CachDung"": ""Chia làm 3 lần uống trong ngày"", ""GhiChu"": """", ""score"": 2.0}, {""ChuThe"": ""Bài thuốc Viêm khí quản mạn tính (Tự Uyển)"", ""QuanHe"": ""BAO_GOM_VI_THUOC"", ""DoiTuong"": ""Vị thuốc Bối mẫu"", ""LieuDung"": ""$10g$"", ""CachDung"": ""Chưa ghi nhận"", ""GhiChu"": """", ""score"": 2.0}, {""ChuThe"": ""Bài thuốc Viêm khí quản mạn tính (Tự Uyển)"", ""QuanHe"": ""BAO_GOM_VI_THUOC"", ""DoiTuong"": ""Vị thuốc Hạnh nhân"", ""LieuDung"": ""$10g$"", ""CachDung"": ""Chưa ghi nhận"", ""GhiChu"": """", ""score"": 2.0}, {""ChuThe"": ""Bài thuốc Viêm khí quản mạn tính (Tự Uyển)"", ""QuanHe"": ""BAO_GOM_VI_THUOC"", ""DoiTuong"": ""Vị thuốc Khoản đông hoa"", ""LieuDung"": ""$10g$"", ""CachDung"": ""Chưa ghi nhận"", ""GhiChu"": """", ""score"": 2.0}, {""ChuThe"": ""Bài thuốc Viêm khí quản mạn tính (Tự Uyển)"", ""QuanHe"": ""BAO_GOM_VI_THUOC"", ""DoiTuong"": ""Vị thuốc Tử uyển"", ""LieuDung"": ""$10g$"", ""CachDung"": ""Chưa ghi nhận"", ""GhiChu"": """", ""score"": 2.0}, {""ChuThe"": ""Bài thuốc Viêm khí quản mạn tính (Tự Uyển)"", ""QuanHe"": ""BAO_GOM_VI_THUOC"", ""DoiTuong"": ""Vị thuốc Cam thảo"", ""LieuDung"": ""$3g$"", ""CachDung"": ""Chưa ghi nhận"", ""GhiChu"": """", ""score"": 2.0}, {""ChuThe"": ""Bài thuốc Viêm khí quản mạn tính (Tự Uyển)"", ""QuanHe"": ""BAO_GOM_VI_THUOC"", ""DoiTuong"": ""Vị thuốc Cát cánh"", ""LieuDung"": ""$7g$"", ""CachDung"": ""Chưa ghi nhận"", ""GhiChu"": """", ""score"": 2.0}, {""ChuThe"": ""Vị thuốc Tử uyển"", ""QuanHe"": ""CO_VI"", ""DoiTuong"": ""Vị ngọt"", ""LieuDung"": ""Chưa ghi nhận"", ""CachDung"": ""Chưa ghi nhận"", ""GhiChu"": """", ""score"": 2.0}, {""ChuThe"": ""Vị thuốc Tử uyển"", ""QuanHe"": ""CO_VI"", ""DoiTuong"": ""Vị đắng"", ""LieuDung"": ""Chưa ghi nhận"", ""CachDung"": ""Chưa ghi nhận"", ""GhiChu"": """", ""score"": 2.0}, {""ChuThe"": ""Vị thuốc Tử uyển"", ""QuanHe"": ""CO_TINH"", ""DoiTuong"": ""Ôn"", ""LieuDung"": ""Chưa ghi nhận"", ""CachDung"": ""Chưa ghi nhận"", ""GhiChu"": """", ""score"": 2.0}, {""ChuThe"": ""Vị thuốc Tử uyển"", ""QuanHe"": ""QUY_KINH"", ""DoiTuong"": ""Phe"", ""LieuDung"": ""Chưa ghi nhận"", ""CachDung"": ""Chưa ghi nhận"", ""GhiChu"": """", ""score"": 2.0}, {""ChuThe"": ""Vị thuốc Tử uyển"", ""QuanHe"": ""CO_CHUA_HOAT_CHAT"", ""DoiTuong"": ""Hoạt chất Arabinoza"", ""LieuDung"": ""Chưa ghi nhận"", ""CachDung"": ""Chưa ghi nhận"", ""GhiChu"": ""Không tìm thấy"", ""score"": 2.0}, {""ChuThe"": ""Vị thuốc Tử uyển"", ""QuanHe"": ""CO_CHUA_HOAT_CHAT"", ""DoiTuong"": ""Hoạt chất Quexetin"", ""LieuDung"": ""Chưa ghi nhận"", ""CachDung"": ""Chưa ghi nhận"", ""GhiChu"": ""Không tìm thấy"", ""score"": 2.0}, {""ChuThe"": ""Vị thuốc Tử uyển"", ""QuanHe"": ""CO_CHUA_HOAT_CHAT"", ""DoiTuong"": ""Asterasponin"", ""LieuDung"": ""Chưa ghi nhận"", ""CachDung"": ""Chưa ghi nhận"", ""GhiChu"": ""Không tìm thấy"", ""score"": 2.0}, {""ChuThe"": ""Vị thuốc Tử uyển"", ""QuanHe"": ""CO_CHUA_HOAT_CHAT"", ""DoiTuong"": ""Aster Sapogenin"", ""LieuDung"": ""Chưa ghi nhận"", ""CachDung"": ""Chưa ghi nhận"", ""GhiChu"": ""Không tìm thấy"", ""score"": 2.0}, {""ChuThe"": ""Vị thuốc Tử uyển"", ""QuanHe"": ""CO_CHUA_HOAT_CHAT"", ""DoiTuong"": ""Shionon"", ""LieuDung"": ""Chưa ghi nhận"", ""CachDung"": ""Chưa ghi nhận"", ""GhiChu"": ""Không tìm thấy"", ""score"": 2.0}, {""ChuThe"": ""Vị thuốc Tử uyển"", ""QuanHe"": ""CHU_TRI_BENH"", ""DoiTuong"": ""Bệnh Viêm khí quản mạn tính"", ""LieuDung"": ""$6-12g$"", ""CachDung"": ""dưới dạng thuốc sắc hoặc thuốc viên"", ""GhiChu"": ""Phối hợp với nhiều vị thuốc khác"", ""score"": 2.0}, {""ChuThe"": ""Vị thuốc Tử uyển"", ""QuanHe"": ""CHU_TRI_BENH"", ""DoiTuong"": ""Bệnh Viêm khí quản cấp tính"", ""LieuDung"": ""$6-12g$"", ""CachDung"": ""dưới dạng thuốc sắc hoặc thuốc viên"", ""GhiChu"": ""Phối hợp với nhiều vị thuốc khác"", ""score"": 2.0}, {""ChuThe"": ""Vị thuốc Tử uyển"", ""QuanHe"": ""CHU_TRI_TRIEU_CHUNG"", ""DoiTuong"": ""Triệu chứng Ho nhiều đờm"", ""LieuDung"": ""$6-12g$"", ""CachDung"": ""dưới dạng thuốc sắc hoặc thuốc viên"", ""GhiChu"": ""Phối hợp với nhiều vị thuốc khác"", ""score"": 2.0}, {""ChuThe"": ""Vị thuốc Tử uyển"", ""QuanHe"": ""CO_TAC_DUNG_DUOC_LY"", ""DoiTuong"": ""Công năng Lợi tiểu"", ""LieuDung"": ""Chưa ghi nhận"", ""CachDung"": ""Chưa ghi nhận"", ""GhiChu"": ""Dữ liệu từ Tăng Quảng Phương 1936, Trung Hoa y học tạp chí."", ""score"": 2.0}, {""ChuThe"": ""Bài thuốc Ho gà (Tự Uyển)"", ""QuanHe"": ""CHU_TRI_BENH"", ""DoiTuong"": ""Bệnh Ho gà"", ""LieuDung"": ""Dưới 1 tuổi ngày uống 1 viên, chia làm 2 lần uống. Từ 1-13 tuổi mỗi tuổi ngày 1 viên, chia làm 2-3 lần uống trong ngày. 13 tuổi trở lên và người lớn: Ngày uống 13-20 viên chia làm 2-3 lần uống"", ""CachDung"": ""Trộn đều làm thành viên"", ""GhiChu"": ""cồn cà độc dược"", ""score"": 2.0}]']",Hệ thống y văn hiện tại chưa ghi nhận dữ liệu về vấn đề này.,"Chỉ ho, Hóa đờm, Thông điều thủy đạo, Tiểu tiện ra huyết, Ôn phế, Hạ khí",0.0,0.0,0.9999999999,0.6666666666666666,0.22790011785467443
Cơ chế tác dụng của trạch tả là gì?,"['[{""ChuThe"": ""Bài thuốc Đại tháo đường Trạch tả"", ""QuanHe"": ""BAO_GOM_VI_THUOC"", ""DoiTuong"": ""Vị thuốc Đơn bì"", ""LieuDung"": ""$8g$"", ""CachDung"": ""Chưa ghi nhận"", ""GhiChu"": """", ""score"": 2.0}, {""ChuThe"": ""Bài thuốc Đại tháo đường Trạch tả"", ""QuanHe"": ""BAO_GOM_VI_THUOC"", ""DoiTuong"": ""Vị thuốc Mạch môn"", ""LieuDung"": ""$12g$"", ""CachDung"": ""Chưa ghi nhận"", ""GhiChu"": """", ""score"": 2.0}, {""ChuThe"": ""Bài thuốc Đại tháo đường Trạch tả"", ""QuanHe"": ""BAO_GOM_VI_THUOC"", ""DoiTuong"": ""Vị thuốc Sơn thù du"", ""LieuDung"": ""$8g$"", ""CachDung"": ""Chưa ghi nhận"", ""GhiChu"": """", ""score"": 2.0}, {""ChuThe"": ""Bài thuốc Đại tháo đường Trạch tả"", ""QuanHe"": ""BAO_GOM_VI_THUOC"", ""DoiTuong"": ""Vị thuốc Thiên môn"", ""LieuDung"": ""$12g$"", ""CachDung"": ""Chưa ghi nhận"", ""GhiChu"": """", ""score"": 2.0}, {""ChuThe"": ""Bài thuốc Đại tháo đường Trạch tả"", ""QuanHe"": ""BAO_GOM_VI_THUOC"", ""DoiTuong"": ""Vị thuốc Thục địa"", ""LieuDung"": ""$20g$"", ""CachDung"": ""Chưa ghi nhận"", ""GhiChu"": """", ""score"": 2.0}, {""ChuThe"": ""Bài thuốc Đại tháo đường Trạch tả"", ""QuanHe"": ""BAO_GOM_VI_THUOC"", ""DoiTuong"": ""Vị thuốc Trạch tả"", ""LieuDung"": ""$12g$"", ""CachDung"": ""Chưa ghi nhận"", ""GhiChu"": """", ""score"": 2.0}, {""ChuThe"": ""Bài thuốc Đại tháo đường Trạch tả"", ""QuanHe"": ""BAO_GOM_VI_THUOC"", ""DoiTuong"": ""Vị thuốc Phục linh"", ""LieuDung"": ""$12g$"", ""CachDung"": ""Chưa ghi nhận"", ""GhiChu"": """", ""score"": 2.0}, {""ChuThe"": ""Bài thuốc Đại tháo đường Trạch tả"", ""QuanHe"": ""BAO_GOM_VI_THUOC"", ""DoiTuong"": ""Vị thuốc Kỷ tử"", ""LieuDung"": ""$12g$"", ""CachDung"": ""Chưa ghi nhận"", ""GhiChu"": """", ""score"": 2.0}, {""ChuThe"": ""Bài thuốc Đại tháo đường Trạch tả"", ""QuanHe"": ""BAO_GOM_VI_THUOC"", ""DoiTuong"": ""Vị thuốc Ngũ vị tử"", ""LieuDung"": ""$6g$"", ""CachDung"": ""Chưa ghi nhận"", ""GhiChu"": """", ""score"": 2.0}, {""ChuThe"": ""Bài thuốc Đại tháo đường Trạch tả"", ""QuanHe"": ""BAO_GOM_VI_THUOC"", ""DoiTuong"": ""Vị thuốc Hoài sơn"", ""LieuDung"": ""$16g$"", ""CachDung"": ""Chưa ghi nhận"", ""GhiChu"": """", ""score"": 2.0}, {""ChuThe"": ""Bài thuốc Phù thũng Tiểu tiện khó khăn Trạch tả"", ""QuanHe"": ""CHU_TRI_BENH"", ""DoiTuong"": ""Bệnh Phù thũng"", ""LieuDung"": ""Chưa ghi nhận"", ""CachDung"": ""Chưa ghi nhận"", ""GhiChu"": """", ""score"": 2.0}, {""ChuThe"": ""Bài thuốc Phù thũng Tiểu tiện khó khăn Trạch tả"", ""QuanHe"": ""BAO_GOM_VI_THUOC"", ""DoiTuong"": ""Vị thuốc Bạch truật"", ""LieuDung"": ""$4g$"", ""CachDung"": ""Chưa ghi nhận"", ""GhiChu"": """", ""score"": 2.0}, {""ChuThe"": ""Bài thuốc Phù thũng Tiểu tiện khó khăn Trạch tả"", ""QuanHe"": ""BAO_GOM_VI_THUOC"", ""DoiTuong"": ""Vị thuốc Trạch tả"", ""LieuDung"": ""$12g$"", ""CachDung"": ""Chưa ghi nhận"", ""GhiChu"": """", ""score"": 2.0}, {""ChuThe"": ""Bài thuốc Phù thũng Tiểu tiện khó khăn Trạch tả"", ""QuanHe"": ""BAO_GOM_VI_THUOC"", ""DoiTuong"": ""Vị thuốc Trư linh"", ""LieuDung"": ""$8g$"", ""CachDung"": ""Chưa ghi nhận"", ""GhiChu"": """", ""score"": 2.0}, {""ChuThe"": ""Bài thuốc Phù thũng Tiểu tiện khó khăn Trạch tả"", ""QuanHe"": ""BAO_GOM_VI_THUOC"", ""DoiTuong"": ""Vị thuốc Quế chi"", ""LieuDung"": ""$4g$"", ""CachDung"": ""Chưa ghi nhận"", ""GhiChu"": """", ""score"": 2.0}, {""ChuThe"": ""Bài thuốc Phù thũng Tiểu tiện khó khăn Trạch tả"", ""QuanHe"": ""BAO_GOM_VI_THUOC"", ""DoiTuong"": ""Vị thuốc Phục linh"", ""LieuDung"": ""$12g$"", ""CachDung"": ""Chưa ghi nhận"", ""GhiChu"": """", ""score"": 2.0}, {""ChuThe"": ""Bài thuốc Phù thũng Tiểu tiện khó khăn Trạch tả"", ""QuanHe"": ""CO_CONG_NANG"", ""DoiTuong"": ""Triệu chứng Tiểu tiện khó khăn"", ""LieuDung"": ""Chưa ghi nhận"", ""CachDung"": ""Chưa ghi nhận"", ""GhiChu"": """", ""score"": 2.0}, {""ChuThe"": ""Bài thuốc Thủy thũng Trạch tả"", ""QuanHe"": ""CHU_TRI_BENH"", ""DoiTuong"": ""Bệnh Thủy thũng"", ""LieuDung"": ""Chưa ghi nhận"", ""CachDung"": ""Chưa ghi nhận"", ""GhiChu"": """", ""score"": 2.0}, {""ChuThe"": ""Bài thuốc Thủy thũng Trạch tả"", ""QuanHe"": ""BAO_GOM_VI_THUOC"", ""DoiTuong"": ""Vị thuốc Bạch truật"", ""LieuDung"": ""$40g$ | $4g$"", ""CachDung"": ""Chưa ghi nhận"", ""GhiChu"": """", ""score"": 2.0}, {""ChuThe"": ""Bài thuốc Thủy thũng Trạch tả"", ""QuanHe"": ""BAO_GOM_VI_THUOC"", ""DoiTuong"": ""Vị thuốc Trạch tả"", ""LieuDung"": ""$40g$ | $6g$"", ""CachDung"": ""Chưa ghi nhận"", ""GhiChu"": """", ""score"": 2.0}, {""ChuThe"": ""Bài thuốc Thủy thũng Trạch tả"", ""QuanHe"": ""BAO_GOM_VI_THUOC"", ""DoiTuong"": ""Vị thuốc Quế chi"", ""LieuDung"": ""$2g$"", ""CachDung"": ""Chưa ghi nhận"", ""GhiChu"": """", ""score"": 2.0}, {""ChuThe"": ""Bài thuốc Thủy thũng Trạch tả"", ""QuanHe"": ""BAO_GOM_VI_THUOC"", ""DoiTuong"": ""Vị thuốc Cam thảo"", ""LieuDung"": ""$2g$"", ""CachDung"": ""Chưa ghi nhận"", ""GhiChu"": """", ""score"": 2.0}, {""ChuThe"": ""Bài thuốc Thủy thũng Trạch tả"", ""QuanHe"": ""BAO_GOM_VI_THUOC"", ""DoiTuong"": ""Vị thuốc Phục linh"", ""LieuDung"": ""$6g$"", ""CachDung"": ""Chưa ghi nhận"", ""GhiChu"": """", ""score"": 2.0}, {""ChuThe"": ""Bài thuốc Viêm thận mạn tính Trạch tả"", ""QuanHe"": ""CHU_TRI_BENH"", ""DoiTuong"": ""Bệnh Viêm thận mạn tính"", ""LieuDung"": ""Chưa ghi nhận"", ""CachDung"": ""Chưa ghi nhận"", ""GhiChu"": """", ""score"": 2.0}, {""ChuThe"": ""Bài thuốc Viêm thận mạn tính Trạch tả"", ""QuanHe"": ""BAO_GOM_VI_THUOC"", ""DoiTuong"": ""Vị thuốc Hoạt thạch"", ""LieuDung"": ""$12g$"", ""CachDung"": ""Chưa ghi nhận"", ""GhiChu"": """", ""score"": 2.0}, {""ChuThe"": ""Bài thuốc Viêm thận mạn tính Trạch tả"", ""QuanHe"": ""BAO_GOM_VI_THUOC"", ""DoiTuong"": ""Vị thuốc A giao"", ""LieuDung"": ""$8g$"", ""CachDung"": ""Chưa ghi nhận"", ""GhiChu"": """", ""score"": 2.0}, {""ChuThe"": ""Bài thuốc Viêm thận mạn tính Trạch tả"", ""QuanHe"": ""BAO_GOM_VI_THUOC"", ""DoiTuong"": ""Vị thuốc Trạch tả"", ""LieuDung"": ""$12g$"", ""CachDung"": ""Chưa ghi nhận"", ""GhiChu"": """", ""score"": 2.0}, {""ChuThe"": ""Bài thuốc Viêm thận mạn tính Trạch tả"", ""QuanHe"": ""BAO_GOM_VI_THUOC"", ""DoiTuong"": ""Vị thuốc Trư linh"", ""LieuDung"": ""$8g$"", ""CachDung"": ""Chưa ghi nhận"", ""GhiChu"": """", ""score"": 2.0}, {""ChuThe"": ""Bài thuốc Viêm thận mạn tính Trạch tả"", ""QuanHe"": ""BAO_GOM_VI_THUOC"", ""DoiTuong"": ""Vị thuốc Xa tiền tử"", ""LieuDung"": ""$12g$"", ""CachDung"": ""Chưa ghi nhận"", ""GhiChu"": """", ""score"": 2.0}, {""ChuThe"": ""Bài thuốc Đại tháo đường Trạch tả"", ""QuanHe"": ""CHU_TRI_BENH"", ""DoiTuong"": ""Bệnh Tiểu đường"", ""LieuDung"": ""Chưa ghi nhận"", ""CachDung"": ""Chưa ghi nhận"", ""GhiChu"": """", ""score"": 2.0}]']",Hệ thống y văn hiện tại chưa ghi nhận dữ liệu về vấn đề này.,"Dược lý Giảm cholesterol, Dược lý Lợi tiểu",0.0,0.0,0.0,0.5,0.20539666465274367
Thuốc nào vừa có tính ôn vừa trực tiếp chữa bệnh rụng tóc?,['Không có dữ liệu'],Hệ thống y văn hiện tại chưa ghi nhận dữ liệu về vấn đề này.,"Bồ kết, Dâu",1.0,0.0,0.0,0.0,0.2101150135964681
Hãy cho biết công năng của rùm nao.,"['[{""ChuThe"": ""Công năng Rùm nao"", ""QuanHe"": ""Thông tin chung"", ""DoiTuong"": ""Không có"", ""LieuDung"": ""Chưa ghi nhận"", ""CachDung"": ""Chưa ghi nhận"", ""GhiChu"": """", ""score"": 2.0}, {""ChuThe"": ""Vị thuốc Rùm nao"", ""QuanHe"": ""CO_CHUA_HOAT_CHAT"", ""DoiTuong"": ""Hoạt chất Kamalin"", ""LieuDung"": ""Chưa ghi nhận"", ""CachDung"": ""Chưa ghi nhận"", ""GhiChu"": ""Hoạt chất chính trong hạch và lỗng rùm nao là một chất màu kết tinh hình phiến mỏng."", ""score"": 2.0}, {""ChuThe"": ""Vị thuốc Rùm nao"", ""QuanHe"": ""CO_CHUA_HOAT_CHAT"", ""DoiTuong"": ""Hoạt chất Malotoxin"", ""LieuDung"": ""Chưa ghi nhận"", ""CachDung"": ""Chưa ghi nhận"", ""GhiChu"": ""Hoạt chất chính trong hạch và lỗng rùm nao là một chất màu kết tinh hình phiến mỏng."", ""score"": 2.0}, {""ChuThe"": ""Vị thuốc Rùm nao"", ""QuanHe"": ""CO_CHUA_HOAT_CHAT"", ""DoiTuong"": ""Hoạt chất Rotlerin"", ""LieuDung"": ""Chưa ghi nhận"", ""CachDung"": ""Chưa ghi nhận"", ""GhiChu"": ""Hoạt chất chính trong hạch và lỗng rùm nao là một chất màu kết tinh hình phiến mỏng."", ""score"": 2.0}, {""ChuThe"": ""Vị thuốc Rùm nao"", ""QuanHe"": ""CO_CHUA_HOAT_CHAT"", ""DoiTuong"": ""Hoạt chất Rotletin"", ""LieuDung"": ""Chưa ghi nhận"", ""CachDung"": ""Chưa ghi nhận"", ""GhiChu"": """", ""score"": 2.0}, {""ChuThe"": ""Vị thuốc Rùm nao"", ""QuanHe"": ""CHU_TRI_BENH"", ""DoiTuong"": ""Bệnh Phù"", ""LieuDung"": ""Tham khảo liều dùng chung của vị thuốc"", ""CachDung"": ""Sắc uống"", ""GhiChu"": ""Bệnh dày da bụng, phù | Vỏ cây [rùm nao] | [Nguồn]: CT_VT_VN_T190"", ""score"": 2.0}, {""ChuThe"": ""Vị thuốc Rùm nao"", ""QuanHe"": ""CHU_TRI_BENH"", ""DoiTuong"": ""Bệnh Sán"", ""LieuDung"": ""Trẻ em ngày uống $2$g bột chia làm $2$ lần uống, mỗi lần cách nhau nửa giờ. Người lớn: Ngày uống $6-12$g cũng chia làm hai lần uống, mỗi lần cách nhau nửa giờ."", ""CachDung"": ""Uống"", ""GhiChu"": ""Sán | Hạch và lông [cây rùm nao] | [Nguồn]: CT_VT_VN_T190"", ""score"": 2.0}, {""ChuThe"": ""Vị thuốc Rùm nao"", ""QuanHe"": ""CO_CONG_NANG"", ""DoiTuong"": ""Công năng Rùm nao"", ""LieuDung"": ""Chưa ghi nhận"", ""CachDung"": ""Chưa ghi nhận"", ""GhiChu"": """", ""score"": 2.0, ""sort_weight"": 3.0}]']","Dựa trên y văn, **Rùm nao** có công năng như sau:

*   Công năng của **Rùm nao**.

Liều dùng và cách dùng của **Rùm nao** hiện chưa được ghi nhận.",Rùm nao,1.0,0.0,0.9999999999,1.0,0.19625900004799318
Bệnh da vàng có thể dùng vị thuốc hoặc bài thuốc nào để chữa?,"['[{""ChuThe"": ""Bệnh Da vàng"", ""QuanHe"": ""Được chữa bằng (ViThuoc)"", ""DoiTuong"": ""Vị thuốc Hoạt thạch"", ""LieuDung"": ""Tham khảo liều dùng chung của vị thuốc"", ""CachDung"": ""Sốt, tả, lỵ, lợi tiểu tiện, sốt khát nước, viêm ruột, lỵ, da vàng (hoàng đản) tiểu tiện ra máu, viêm niệu đạo hay do có sỏi ở bàng quang mà tiểu tiện đau buốt"", ""GhiChu"": ""Chỉ định lâm sàng theo kinh nghiệm"", ""score"": 2.0, ""sort_weight"": 3.0}, {""ChuThe"": ""Bệnh Da vàng"", ""QuanHe"": ""Được chữa bằng (ViThuoc)"", ""DoiTuong"": ""Vị thuốc Nàng nàng"", ""LieuDung"": ""Chưa ghi nhận"", ""CachDung"": ""Chưa ghi nhận"", ""GhiChu"": """", ""score"": 2.0, ""sort_weight"": 3.0}, {""ChuThe"": ""Bệnh da vàng"", ""QuanHe"": ""Được chữa bằng (ViThuoc)"", ""DoiTuong"": ""Vị thuốc lá móng tay"", ""LieuDung"": ""Tham khảo liều dùng chung của vị thuốc"", ""CachDung"": ""Chỉ định lâm sàng theo kinh nghiệm"", ""GhiChu"": ""[Nguồn]: CT_VT_VN_T121"", ""score"": 2.0, ""sort_weight"": 3.0}, {""ChuThe"": ""Triệu chứng Thấp nhiệt da vàng"", ""QuanHe"": ""Được chữa bằng (ViThuoc)"", ""DoiTuong"": ""Vị thuốc Hoàng cầm"", ""LieuDung"": ""$6-15g$"", ""CachDung"": ""Sắc với nước chia 3 lần uống trong ngày."", ""GhiChu"": """", ""score"": 2.0}, {""ChuThe"": ""Triệu chứng Da vàng"", ""QuanHe"": ""Được chữa bằng (ViThuoc)"", ""DoiTuong"": ""Vị thuốc Lộc mại"", ""LieuDung"": ""Lá khô $10-20g$ hoặc lá tươi $20-40g$"", ""CachDung"": ""Sắc uống"", ""GhiChu"": ""[Nguồn]: CT_VT_VN_T490"", ""score"": 2.0}, {""ChuThe"": ""Triệu chứng Da vàng"", ""QuanHe"": ""Được chữa bằng (ViThuoc)"", ""DoiTuong"": ""Vị thuốc Lê ki ma"", ""LieuDung"": ""Tham khảo liều dùng chung của vị thuốc"", ""CachDung"": ""Sắc uống. Lá còn dùng dưới dạng nấu nước tắm"", ""GhiChu"": ""Rễ và lá cây sầu riêng dùng cho bệnh về gan, da vàng do bệnh gan. (Theo CT_VT_VN_T945). Cần xem xét lại vì tên vị thuốc là Lê ki ma, còn cây sầu riêng là Durio zibethinus. Có thể có sự nhầm lẫn ở đây. Cần xác minh lại thông tin này."", ""score"": 2.0}, {""ChuThe"": ""Triệu chứng Da vàng"", ""QuanHe"": ""Được chữa bằng (ViThuoc)"", ""DoiTuong"": ""Vị thuốc Sầu riêng"", ""LieuDung"": ""Tham khảo liều dùng chung của vị thuốc"", ""CachDung"": ""Sắc uống. Lá còn dùng dưới dạng nấu nước tắm"", ""GhiChu"": ""cho những người vàng da do bệnh gan. | [Nguồn]: CT_VT_VN_T945"", ""score"": 2.0}, {""ChuThe"": ""Bệnh Thấp nhiệt da vàng"", ""QuanHe"": ""Được chữa bằng (ViThuoc)"", ""DoiTuong"": ""Vị thuốc Mật gấu"", ""LieuDung"": ""Tham khảo liều dùng chung của vị thuốc"", ""CachDung"": ""Chưa ghi nhận"", ""GhiChu"": ""Thấp nhiệt da vàng, lỵ lâu ngày, hồi hộp sợ hãi, co quắp"", ""score"": 2.0}, {""ChuThe"": ""Bệnh Da vàng"", ""QuanHe"": ""Được chữa bằng (BaiThuoc)"", ""DoiTuong"": ""Bài thuốc Mật Vàng Cỏ May"", ""LieuDung"": ""Chưa ghi nhận"", ""CachDung"": ""Chưa ghi nhận"", ""GhiChu"": """", ""score"": 2.0, ""sort_weight"": 3.0}, {""ChuThe"": ""Triệu chứng Da vàng"", ""QuanHe"": ""Được chữa bằng (BaiThuoc)"", ""DoiTuong"": ""Bài thuốc Ăn uống không tiêu đùm đùm"", ""LieuDung"": ""$15-30g$"", ""CachDung"": ""Sắc uống trước bữa cơm chính, chia 2-3 lần"", ""GhiChu"": ""[Nguồn]: CT_VT_VN_T410"", ""score"": 2.0}, {""ChuThe"": ""Triệu chứng Da vàng"", ""QuanHe"": ""Được chữa bằng (BaiThuoc)"", ""DoiTuong"": ""Bài thuốc Kem An Da Vang Buoi Bung"", ""LieuDung"": ""Chưa ghi nhận"", ""CachDung"": ""Thêm $400ml$ nước vào, sắc còn $200ml$, chia 2 lần uống trong ngày"", ""GhiChu"": """", ""score"": 2.0}, {""ChuThe"": ""Triệu chứng Da vàng xạm"", ""QuanHe"": ""Được chữa bằng (BaiThuoc)"", ""DoiTuong"": ""Bài thuốc Uế oải kỳ nam"", ""LieuDung"": ""Chưa ghi nhận"", ""CachDung"": ""Chưa ghi nhận"", ""GhiChu"": """", ""score"": 2.0}]']","Bệnh da vàng có thể được chữa bằng các vị thuốc và bài thuốc sau đây:

**Các phương án điều trị trực tiếp:**

*   **Vị thuốc Hoạt thạch:** Tham khảo liều dùng chung của vị thuốc. Dùng trong trường hợp sốt, tả, lỵ, lợi tiểu tiện, sốt khát nước, viêm ruột, lỵ, da vàng (hoàng đản) tiểu tiện ra máu, viêm niệu đạo hay do có sỏi ở bàng quang mà tiểu tiện đau buốt.
*   **Vị thuốc Nàng nàng:** Chưa ghi nhận liều dùng và cách dùng.
*   **Vị thuốc lá móng tay:** Tham khảo liều dùng chung của vị thuốc. Chỉ định lâm sàng theo kinh nghiệm.
*   **Bài thuốc Mật Vàng Cỏ May:** Chưa ghi nhận liều dùng và cách dùng.

**Thông tin tham khảo thêm:**

*   **Triệu chứng Thấp nhiệt da vàng:**
    *   **Vị thuốc Hoàng cầm:** 6-15g, sắc với nước chia 3 lần uống trong ngày.
    *   **Vị thuốc Mật gấu:** Tham khảo liều dùng chung của vị thuốc. Dùng trong trường hợp thấp nhiệt da vàng, lỵ lâu ngày, hồi hộp sợ hãi, co quắp.
*   **Triệu chứng Da vàng:**
    *   **Vị thuốc Lộc mại:** Lá khô 10-20g hoặc lá tươi 20-40g, sắc uống.
    *   **Vị thuốc Lê ki ma:** Tham khảo liều dùng chung của vị thuốc. Sắc uống. Lá còn dùng dưới dạng nấu nước tắm.
    *   **Vị thuốc Sầu riêng:** Tham khảo liều dùng chung của vị thuốc. Sắc uống. Lá còn dùng dưới dạng nấu nước tắm cho những người vàng da do bệnh gan.
    *   **Bài thuốc Ăn uống không tiêu đùm đùm:** 15-30g, sắc uống trước bữa cơm chính, chia 2-3 lần.
    *   **Bài thuốc Kem An Da Vang Buoi Bung:** Thêm 400ml nước vào, sắc còn 200ml, chia 2 lần uống trong ngày.
*   **Triệu chứng Da vàng xạm:**
    *   **Bài thuốc Uế oải kỳ nam:** Chưa ghi nhận liều dùng và cách dùng.",Lá móng tay,1.0,0.5426304631527183,0.9999999999,1.0,0.21341181007140472
Vị thuốc thạch vĩ có hoạt chất flavonozit không?,['Không có dữ liệu'],"Không. Dựa trên dữ liệu y văn hiện tại, không có ghi nhận nào cho thấy thạch vĩ có liên quan hoặc tác dụng tới flavonozit.","Có, vị thuốc thạch vĩ có hoạt chất flavonozit",0.0,0.8518973645231703,0.0,0.0,0.24268348393117362
Tác dụng dược lý của nhãn hương ra sao?,"['[{""ChuThe"": ""Vị thuốc Nhãn hương"", ""QuanHe"": ""CO_CHUA_HOAT_CHAT"", ""DoiTuong"": ""Hoạt chất Cumarin"", ""LieuDung"": ""Chưa ghi nhận"", ""CachDung"": ""Chưa ghi nhận"", ""GhiChu"": """", ""score"": 2.0}, {""ChuThe"": ""Vị thuốc Nhãn hương"", ""QuanHe"": ""CO_CHUA_HOAT_CHAT"", ""DoiTuong"": ""Hoạt chất Axit Melilotic"", ""LieuDung"": ""Chưa ghi nhận"", ""CachDung"": ""Chưa ghi nhận"", ""GhiChu"": """", ""score"": 2.0}, {""ChuThe"": ""Vị thuốc Nhãn hương"", ""QuanHe"": ""CO_CHUA_HOAT_CHAT"", ""DoiTuong"": ""Hoạt chất Dicumarola"", ""LieuDung"": ""Chưa ghi nhận"", ""CachDung"": ""Chưa ghi nhận"", ""GhiChu"": """", ""score"": 2.0}, {""ChuThe"": ""Vị thuốc Nhãn hương"", ""QuanHe"": ""CO_CHUA_HOAT_CHAT"", ""DoiTuong"": ""Hoạt chất Dihydrocumarin"", ""LieuDung"": ""Chưa ghi nhận"", ""CachDung"": ""Chưa ghi nhận"", ""GhiChu"": """", ""score"": 2.0}, {""ChuThe"": ""Vị thuốc Nhãn hương"", ""QuanHe"": ""CO_CHUA_HOAT_CHAT"", ""DoiTuong"": ""Hoạt chất Melilotozit"", ""LieuDung"": ""Chưa ghi nhận"", ""CachDung"": ""Chưa ghi nhận"", ""GhiChu"": """", ""score"": 2.0}, {""ChuThe"": ""Vị thuốc Nhãn hương"", ""QuanHe"": ""CHU_TRI_BENH"", ""DoiTuong"": ""Bệnh Đau mắt"", ""LieuDung"": ""$5-10g$"", ""CachDung"": ""Pha trong một lít nước sôi, dùng nước này để rửa mắt"", ""GhiChu"": ""[Nguồn]: CT_VT_VN_T589"", ""score"": 2.0}, {""ChuThe"": ""Vị thuốc Nhãn hương"", ""QuanHe"": ""CO_TAC_DUNG_DUOC_LY"", ""DoiTuong"": ""Dược lý Chống đông máu"", ""LieuDung"": ""Chưa ghi nhận"", ""CachDung"": ""Chưa ghi nhận"", ""GhiChu"": """", ""score"": 2.0, ""sort_weight"": 3.0}, {""ChuThe"": ""Vị thuốc Nhãn hương"", ""QuanHe"": ""CO_TAC_DUNG_DUOC_LY"", ""DoiTuong"": ""Dược lý Chống xuất huyết"", ""LieuDung"": ""Chưa ghi nhận"", ""CachDung"": ""Chưa ghi nhận"", ""GhiChu"": """", ""score"": 2.0, ""sort_weight"": 3.0}]']","Tác dụng dược lý của **Nhãn hương** bao gồm:

*   Dược lý Chống đông máu
*   Dược lý Chống xuất huyết","Dược lý Chống xuất huyết, Dược lý Chống đông máu",1.0,0.5549043235198262,0.9999999999,1.0,0.9858720347670016
Vị thuốc lười ươi có hoạt chất tanin không?,['Không có dữ liệu'],"Không. Dựa trên dữ liệu y văn hiện tại, không có ghi nhận nào cho thấy lười ươi có liên quan hoặc tác dụng tới tanin.","Có, vị thuốc lười ươi có hoạt chất tanin",0.0,0.6969117191789528,0.0,0.0,0.24174960755034797
Thuốc nào vừa có tính hàn vừa trực tiếp chữa bệnh nhọt độc?,"['[{""ChuThe"": ""Vị thuốc Hy thiêm"", ""QuanHe"": ""Thỏa mãn đồng thời"", ""DoiTuong"": ""Hàn và Bệnh Nhọt độc"", ""LieuDung"": ""Chưa ghi nhận"", ""CachDung"": ""Chưa ghi nhận"", ""GhiChu"": """", ""score"": 2.0}, {""ChuThe"": ""Vị thuốc Xuyên sơn giáp"", ""QuanHe"": ""Thỏa mãn đồng thời"", ""DoiTuong"": ""Hàn và Bệnh Nhọt độc"", ""LieuDung"": ""Chưa ghi nhận"", ""CachDung"": ""Chưa ghi nhận"", ""GhiChu"": """", ""score"": 2.0}]']",Hệ thống y văn hiện tại chưa ghi nhận dữ liệu về vấn đề này.,"Hy thiêm, Xuyên sơn giáp",1.0,0.0,0.9999999999,1.0,0.2383355857520503
"Để chữa bệnh mụn nhọt lâu lành, vị thuốc hổ phách được dùng với liều lượng và cách thức như thế nào?","['[{""ChuThe"": ""Vị thuốc Hổ phách"", ""QuanHe"": ""CHU_TRI_BENH"", ""DoiTuong"": ""Bệnh Mụn nhọt lâu lành"", ""LieuDung"": ""Tham khảo liều dùng chung của vị thuốc"", ""CachDung"": ""Chỉ định lâm sàng theo kinh nghiệm"", ""GhiChu"": ""CT_VT_VN_T1002"", ""score"": 2.0, ""sort_weight"": 3.0}]']","Để chữa bệnh mụn nhọt lâu lành, bạn có thể tham khảo thông tin sau về vị thuốc **Hổ phách**:

*   **Liều dùng:** Tham khảo liều dùng chung của vị thuốc.
*   **Cách dùng:** Chỉ định lâm sàng theo kinh nghiệm.","Để chữa bệnh mụn nhọt lâu lành, vị thuốc hổ phách có liều dùng: Tham khảo liều dùng chung của vị thuốc và cách dùng: Chỉ định lâm sàng theo kinh nghiệm",1.0,0.5182536988190094,0.9999999999,1.0,0.6731329241926436
Bệnh nào có thể chữa bằng bài thuốc chứa trân châu?,"['[{""ChuThe"": ""Vị thuốc Trân châu"", ""QuanHe"": ""Tham gia bài thuốc [Bài thuốc Cổ quắp ngưu hoàng] để chữa"", ""DoiTuong"": ""Triệu chứng Sốt quá nói mê"", ""LieuDung"": ""Mỗi lần uống 1 viên. Bệnh nặng thể thực có thể uống thêm. Trong ngày có thể uống tới 3 viên. Trẻ con giảm liều xuống một nửa"", ""CachDung"": ""Tất cả tán nhỏ, dùng mật viên thành viên, mỗi viên nặng $4g$. Bảo quản trong viên sáp."", ""GhiChu"": """", ""score"": 2.0, ""sort_weight"": 3.0}, {""ChuThe"": ""Vị thuốc Trân châu"", ""QuanHe"": ""Tham gia bài thuốc [Bài thuốc Cổ quắp ngưu hoàng] để chữa"", ""DoiTuong"": ""Triệu chứng Sốt nóng"", ""LieuDung"": ""Mỗi lần uống 1 viên. Bệnh nặng thể thực có thể uống thêm. Trong ngày có thể uống tới 3 viên. Trẻ con giảm liều xuống một nửa"", ""CachDung"": ""Tất cả tán nhỏ, dùng mật viên thành viên, mỗi viên nặng $4g$. Bảo quản trong viên sáp."", ""GhiChu"": """", ""score"": 2.0, ""sort_weight"": 3.0}, {""ChuThe"": ""Vị thuốc Trân châu"", ""QuanHe"": ""Tham gia bài thuốc [Bài thuốc Viêm não ngưu hoàng] để chữa"", ""DoiTuong"": ""Bệnh Viêm não"", ""LieuDung"": ""Mỗi lần uống 1 viên. Bệnh nặng thể thực có thể uống thêm. Trong ngày có thể uống tới 3 viên. Trẻ con giảm liều xuống một nửa"", ""CachDung"": ""Tất cả tán nhỏ, dùng mật viên thành viên, mỗi viên nặng $4g$. Bảo quản trong viên sáp."", ""GhiChu"": """", ""score"": 2.0, ""sort_weight"": 3.0}, {""ChuThe"": ""Vị thuốc Trân châu"", ""QuanHe"": ""Tham gia bài thuốc [Bài thuốc Sốt Nặng Trúng Độc Mê Man Tim Suy Nhược Nhựa Cóc] để chữa"", ""DoiTuong"": ""Bệnh Sốt"", ""LieuDung"": ""Mỗi lần uống $5-10$ viên, ngày uống $1-2$ lần"", ""CachDung"": ""thiềm tô để riêng, các vị khác đem tán nhỏ, thêm thiềm tô tẩm rượu vào, làm thành viên to bằng hạt cải (bằng đầu đinh ghim); dùng muội bếp (bách thảo sương) làm áo thuốc viên"", ""GhiChu"": """", ""score"": 2.0, ""sort_weight"": 3.0}, {""ChuThe"": ""Vị thuốc Trân châu"", ""QuanHe"": ""Tham gia bài thuốc [Bài thuốc Sốt Nặng Trúng Độc Mê Man Tim Suy Nhược Nhựa Cóc] để chữa"", ""DoiTuong"": ""Bệnh Trúng độc"", ""LieuDung"": ""Mỗi lần uống $5-10$ viên, ngày uống $1-2$ lần"", ""CachDung"": ""thiềm tô để riêng, các vị khác đem tán nhỏ, thêm thiềm tô tẩm rượu vào, làm thành viên to bằng hạt cải (bằng đầu đinh ghim); dùng muội bếp (bách thảo sương) làm áo thuốc viên"", ""GhiChu"": """", ""score"": 2.0, ""sort_weight"": 3.0}, {""ChuThe"": ""Vị thuốc Trân châu"", ""QuanHe"": ""Tham gia bài thuốc [Bài thuốc Sốt Nặng Trúng Độc Mê Man Tim Suy Nhược Nhựa Cóc] để chữa"", ""DoiTuong"": ""Bệnh Suy nhược"", ""LieuDung"": ""Mỗi lần uống $5-10$ viên, ngày uống $1-2$ lần"", ""CachDung"": ""thiềm tô để riêng, các vị khác đem tán nhỏ, thêm thiềm tô tẩm rượu vào, làm thành viên to bằng hạt cải (bằng đầu đinh ghim); dùng muội bếp (bách thảo sương) làm áo thuốc viên"", ""GhiChu"": """", ""score"": 2.0, ""sort_weight"": 3.0}, {""ChuThe"": ""Vị thuốc Trân châu"", ""QuanHe"": ""Tham gia bài thuốc [Bài thuốc Sốt Nặng Trúng Độc Mê Man Tim Suy Nhược Nhựa Cóc] để chữa"", ""DoiTuong"": ""Triệu chứng Mê man"", ""LieuDung"": ""Mỗi lần uống $5-10$ viên, ngày uống $1-2$ lần"", ""CachDung"": ""thiềm tô để riêng, các vị khác đem tán nhỏ, thêm thiềm tô tẩm rượu vào, làm thành viên to bằng hạt cải (bằng đầu đinh ghim); dùng muội bếp (bách thảo sương) làm áo thuốc viên"", ""GhiChu"": """", ""score"": 2.0, ""sort_weight"": 3.0}]']","Dựa trên dữ liệu y văn, vị thuốc **Trân châu** tham gia vào các bài thuốc để chữa các bệnh và triệu chứng sau:

*   Sốt quá nói mê: Sử dụng trong **Bài thuốc Cổ quắp ngưu hoàng**. Liều dùng: Mỗi lần uống 1 viên. Bệnh nặng thể thực có thể uống thêm. Trong ngày có thể uống tới 3 viên. Trẻ con giảm liều xuống một nửa. Cách dùng: Tất cả tán nhỏ, dùng mật viên thành viên, mỗi viên nặng 4g. Bảo quản trong viên sáp.
*   Sốt nóng: Sử dụng trong **Bài thuốc Cổ quắp ngưu hoàng**. Liều dùng: Mỗi lần uống 1 viên. Bệnh nặng thể thực có thể uống thêm. Trong ngày có thể uống tới 3 viên. Trẻ con giảm liều xuống một nửa. Cách dùng: Tất cả tán nhỏ, dùng mật viên thành viên, mỗi viên nặng 4g. Bảo quản trong viên sáp.
*   Viêm não: Sử dụng trong **Bài thuốc Viêm não ngưu hoàng**. Liều dùng: Mỗi lần uống 1 viên. Bệnh nặng thể thực có thể uống thêm. Trong ngày có thể uống tới 3 viên. Trẻ con giảm liều xuống một nửa. Cách dùng: Tất cả tán nhỏ, dùng mật viên thành viên, mỗi viên nặng 4g. Bảo quản trong viên sáp.
*   Sốt, Trúng độc, Suy nhược, Mê man: Sử dụng trong **Bài thuốc Sốt Nặng Trúng Độc Mê Man Tim Suy Nhược Nhựa Cóc**. Liều dùng: Mỗi lần uống 5-10 viên, ngày uống 1-2 lần. Cách dùng: thiềm tô để riêng, các vị khác đem tán nhỏ, thêm thiềm tô tẩm rượu vào, làm thành viên to bằng hạt cải (bằng đầu đinh ghim); dùng muội bếp (bách thảo sương) làm áo thuốc viên.","Suy nhược, Sốt, Trúng độc, Viêm não, Mê man, Sốt nóng, Sốt quá nói mê",1.0,0.6331496843702841,0.9999999999,1.0,0.4020974738292304
Thuốc nào vừa có tính hàn vừa trực tiếp chữa bệnh xích bạch đới?,"['[{""ChuThe"": ""Vị thuốc Hoàng bá"", ""QuanHe"": ""Thỏa mãn đồng thời"", ""DoiTuong"": ""Hàn và Bệnh Xích Bạch đới"", ""LieuDung"": ""Chưa ghi nhận"", ""CachDung"": ""Chưa ghi nhận"", ""GhiChu"": """", ""score"": 2.0}, {""ChuThe"": ""Vị thuốc Rau sam"", ""QuanHe"": ""Thỏa mãn đồng thời"", ""DoiTuong"": ""Hàn và Bệnh Xích Bạch đới"", ""LieuDung"": ""Chưa ghi nhận"", ""CachDung"": ""Chưa ghi nhận"", ""GhiChu"": """", ""score"": 2.0}, {""ChuThe"": ""Vị thuốc Trắc bách diệp"", ""QuanHe"": ""Thỏa mãn đồng thời"", ""DoiTuong"": ""Hàn và Bệnh Xích Bạch đới"", ""LieuDung"": ""Chưa ghi nhận"", ""CachDung"": ""Chưa ghi nhận"", ""GhiChu"": """", ""score"": 2.0}, {""ChuThe"": ""Vị thuốc Hạ khô thảo"", ""QuanHe"": ""Thỏa mãn đồng thời"", ""DoiTuong"": ""Hàn và Bệnh Xích Bạch đới"", ""LieuDung"": ""Chưa ghi nhận"", ""CachDung"": ""Chưa ghi nhận"", ""GhiChu"": """", ""score"": 2.0}, {""ChuThe"": ""Vị thuốc Câu Đằng"", ""QuanHe"": ""Thỏa mãn đồng thời"", ""DoiTuong"": ""Hàn và Bệnh Xích Bạch đới"", ""LieuDung"": ""Chưa ghi nhận"", ""CachDung"": ""Chưa ghi nhận"", ""GhiChu"": """", ""score"": 2.0}, {""ChuThe"": ""Vị thuốc Củ nâu"", ""QuanHe"": ""Thỏa mãn đồng thời"", ""DoiTuong"": ""Hàn và Bệnh Xích Bạch đới"", ""LieuDung"": ""Chưa ghi nhận"", ""CachDung"": ""Chưa ghi nhận"", ""GhiChu"": """", ""score"": 2.0}]']",Hệ thống y văn hiện tại chưa ghi nhận dữ liệu về vấn đề này.,"Câu Đằng, Củ nâu, Hoàng bá, Hạ khô thảo, Rau sam, Trắc bách diệp",0.0,0.0,0.9999999999,1.0,0.2157011347707607
Vị thuốc phục linh có hoạt chất fructoza không?,['Không có dữ liệu'],"Không. Dựa trên dữ liệu y văn hiện tại, không có ghi nhận nào cho thấy phục linh có liên quan hoặc tác dụng tới fructoza.","Có, vị thuốc phục linh có hoạt chất fructoza",0.0,0.8529844587993414,0.0,0.0,0.24305378838587682
Thuốc nào vừa có tính hàn vừa trực tiếp chữa bệnh thổ huyết?,"['[{""ChuThe"": ""Vị thuốc Cỏ tranh"", ""QuanHe"": ""Thỏa mãn đồng thời"", ""DoiTuong"": ""Hàn và Bệnh thổ huyết"", ""LieuDung"": ""Chưa ghi nhận"", ""CachDung"": ""Chưa ghi nhận"", ""GhiChu"": """", ""score"": 2.0}, {""ChuThe"": ""Vị thuốc Thiên môn đông"", ""QuanHe"": ""Thỏa mãn đồng thời"", ""DoiTuong"": ""Hàn và Bệnh Thổ huyết ho ra máu"", ""LieuDung"": ""Chưa ghi nhận"", ""CachDung"": ""Chưa ghi nhận"", ""GhiChu"": """", ""score"": 2.0}, {""ChuThe"": ""Vị thuốc Trắc bách diệp"", ""QuanHe"": ""Thỏa mãn đồng thời"", ""DoiTuong"": ""Hàn và Bệnh thổ huyết"", ""LieuDung"": ""Chưa ghi nhận"", ""CachDung"": ""Chưa ghi nhận"", ""GhiChu"": """", ""score"": 2.0}, {""ChuThe"": ""Vị thuốc Mào gà trắng"", ""QuanHe"": ""Thỏa mãn đồng thời"", ""DoiTuong"": ""Hàn và Bệnh thổ huyết"", ""LieuDung"": ""Chưa ghi nhận"", ""CachDung"": ""Chưa ghi nhận"", ""GhiChu"": """", ""score"": 2.0}, {""ChuThe"": ""Vị thuốc Bách hợp"", ""QuanHe"": ""Thỏa mãn đồng thời"", ""DoiTuong"": ""Hàn và Bệnh thổ huyết"", ""LieuDung"": ""Chưa ghi nhận"", ""CachDung"": ""Chưa ghi nhận"", ""GhiChu"": """", ""score"": 2.0}, {""ChuThe"": ""Vị thuốc Ngải cứu"", ""QuanHe"": ""Thỏa mãn đồng thời"", ""DoiTuong"": ""Công năng Trục hàn thấp và Bệnh thổ huyết"", ""LieuDung"": ""Chưa ghi nhận"", ""CachDung"": ""Chưa ghi nhận"", ""GhiChu"": """", ""score"": 2.0}, {""ChuThe"": ""Vị thuốc Ngải cứu"", ""QuanHe"": ""Thỏa mãn đồng thời"", ""DoiTuong"": ""Bệnh Đau bụng do hàn và Bệnh thổ huyết"", ""LieuDung"": ""Chưa ghi nhận"", ""CachDung"": ""Chưa ghi nhận"", ""GhiChu"": """", ""score"": 2.0}]']",Hệ thống y văn hiện tại chưa ghi nhận dữ liệu về vấn đề này.,"Bách hợp, Cỏ tranh, Mào gà trắng, Trắc bách diệp",0.0,0.0,0.9999999999,1.0,0.23033422938382708
"Để chữa bệnh thấp nhiệt da vàng, vị thuốc hoàng cầm được dùng với liều lượng và cách thức như thế nào?","['[{""ChuThe"": ""Vị thuốc Hoàng cầm"", ""QuanHe"": ""CHU_TRI_TRIEU_CHUNG"", ""DoiTuong"": ""Triệu chứng Thấp nhiệt da vàng"", ""LieuDung"": ""$6-15g$"", ""CachDung"": ""Sắc với nước chia 3 lần uống trong ngày."", ""GhiChu"": """", ""score"": 2.0, ""sort_weight"": 3.0}]']","Để chữa trị triệu chứng thấp nhiệt da vàng, bạn có thể sử dụng **Hoàng cầm** với liều dùng và cách dùng như sau:

*   Liều dùng: 6-15g
*   Cách dùng: Sắc với nước chia 3 lần uống trong ngày.","Để chữa bệnh thấp nhiệt da vàng, vị thuốc hoàng cầm có liều dùng: 6-15g và cách dùng: Sắc với nước chia 3 lần uống trong ngày.",1.0,0.44371965211269854,0.9999999999,1.0,0.9931442981658112
Cho tôi biết vị của đỗ trọng.,"['[{""ChuThe"": ""Vị thuốc Đỗ trọng"", ""QuanHe"": ""CO_VI"", ""DoiTuong"": ""Vị ngọt"", ""LieuDung"": ""Chưa ghi nhận"", ""CachDung"": ""Chưa ghi nhận"", ""GhiChu"": """", ""score"": 2.0, ""sort_weight"": 3.0}, {""ChuThe"": ""Vị thuốc Đỗ trọng"", ""QuanHe"": ""CO_VI"", ""DoiTuong"": ""Vị cay"", ""LieuDung"": ""Chưa ghi nhận"", ""CachDung"": ""Chưa ghi nhận"", ""GhiChu"": """", ""score"": 2.0, ""sort_weight"": 3.0}]']","Dựa trên y văn, **Đỗ trọng** có vị ngọt và vị cay.","Vị cay, Vị ngọt",1.0,0.6228544253074834,0.9999999999,1.0,0.9697840089671479
Vị thuốc trạch tả quy vào kinh nào?,"['[{""ChuThe"": ""Vị thuốc Trạch tả"", ""QuanHe"": ""QUY_KINH"", ""DoiTuong"": ""Bang Quang"", ""LieuDung"": ""Chưa ghi nhận"", ""CachDung"": ""Chưa ghi nhận"", ""GhiChu"": """", ""score"": 2.0, ""sort_weight"": 3.0}, {""ChuThe"": ""Vị thuốc Trạch tả"", ""QuanHe"": ""QUY_KINH"", ""DoiTuong"": ""Than"", ""LieuDung"": ""Chưa ghi nhận"", ""CachDung"": ""Chưa ghi nhận"", ""GhiChu"": """", ""score"": 2.0, ""sort_weight"": 3.0}]']",Vị thuốc **Trạch tả** quy vào kinh Bàng Quang và kinh Thận.,"Bang Quang, Than",1.0,0.6200216314337237,0.9999999999,1.0,0.9583437604659808
Thuốc nào vừa có tính lương vừa trực tiếp chữa bệnh lỵ?,"['[{""ChuThe"": ""Vị thuốc Ké hoa đào"", ""QuanHe"": ""Thỏa mãn đồng thời"", ""DoiTuong"": ""Lương và Bệnh Lỵ"", ""LieuDung"": ""Chưa ghi nhận"", ""CachDung"": ""Chưa ghi nhận"", ""GhiChu"": """", ""score"": 2.0}, {""ChuThe"": ""Vị thuốc Cỏ nhọ nồi"", ""QuanHe"": ""Thỏa mãn đồng thời"", ""DoiTuong"": ""Lương và Bệnh Lỵ"", ""LieuDung"": ""Chưa ghi nhận"", ""CachDung"": ""Chưa ghi nhận"", ""GhiChu"": """", ""score"": 2.0}, {""ChuThe"": ""Vị thuốc San sư cô"", ""QuanHe"": ""Thỏa mãn đồng thời"", ""DoiTuong"": ""Lương và Bệnh Lỵ"", ""LieuDung"": ""Chưa ghi nhận"", ""CachDung"": ""Chưa ghi nhận"", ""GhiChu"": """", ""score"": 2.0}, {""ChuThe"": ""Vị thuốc Mã đề"", ""QuanHe"": ""Thỏa mãn đồng thời"", ""DoiTuong"": ""Lương và Bệnh Lỵ"", ""LieuDung"": ""Chưa ghi nhận"", ""CachDung"": ""Chưa ghi nhận"", ""GhiChu"": """", ""score"": 2.0}, {""ChuThe"": ""Vị thuốc Hoa hiên"", ""QuanHe"": ""Thỏa mãn đồng thời"", ""DoiTuong"": ""Lương và Bệnh Lỵ"", ""LieuDung"": ""Chưa ghi nhận"", ""CachDung"": ""Chưa ghi nhận"", ""GhiChu"": """", ""score"": 2.0}, {""ChuThe"": ""Vị thuốc Mào gà đỏ"", ""QuanHe"": ""Thỏa mãn đồng thời"", ""DoiTuong"": ""Lương và Bệnh Lỵ ra máu"", ""LieuDung"": ""Chưa ghi nhận"", ""CachDung"": ""Chưa ghi nhận"", ""GhiChu"": """", ""score"": 2.0}, {""ChuThe"": ""Vị thuốc Ô rô"", ""QuanHe"": ""Thỏa mãn đồng thời"", ""DoiTuong"": ""Lương và Bệnh Lỵ"", ""LieuDung"": ""Chưa ghi nhận"", ""CachDung"": ""Chưa ghi nhận"", ""GhiChu"": """", ""score"": 2.0}]']",Hệ thống y văn hiện tại chưa ghi nhận dữ liệu về vấn đề này.,"Cỏ nhọ nồi, Hoa hiên, Ké hoa đào, Mã đề, San sư cô, Ô rô",0.0,0.0,0.9999999999,1.0,0.219299392513235
Bệnh nào có thể chữa bằng bài thuốc chứa khiên ngưu?,"['[{""ChuThe"": ""Vị thuốc Khiên ngưu"", ""QuanHe"": ""Tham gia bài thuốc [Bài thuốc Tinh Thần Phân Liệt Khiên Ngưu] để chữa"", ""DoiTuong"": ""Bệnh Tâm thần phân liệt"", ""LieuDung"": ""Chưa ghi nhận"", ""CachDung"": ""Các vị tán bột, viên thành viên $2g$. Ngày uống 4 viên. Dùng một đợt 15 ngày liền, nghỉ 7 ngày rồi lại dùng tiếp"", ""GhiChu"": ""CT_VT_VN_T461"", ""score"": 2.0, ""sort_weight"": 3.0}]']","**Vị thuốc Khiên ngưu** tham gia bài thuốc **Bài thuốc Tinh Thần Phân Liệt Khiên Ngưu** để chữa bệnh Tâm thần phân liệt. Cách dùng bài thuốc này như sau: Các vị tán bột, viên thành viên 2g. Ngày uống 4 viên. Dùng một đợt 15 ngày liền, nghỉ 7 ngày rồi lại dùng tiếp.",Tâm thần phân liệt,1.0,0.5819086469086878,0.9999999999,1.0,0.4872426962457336
Thuốc nào vừa có tính lương vừa trực tiếp chữa bệnh đau mắt?,"['[{""ChuThe"": ""Vị thuốc Mã đề"", ""QuanHe"": ""Thỏa mãn đồng thời"", ""DoiTuong"": ""Lương và Bệnh Đau mắt"", ""LieuDung"": ""Chưa ghi nhận"", ""CachDung"": ""Chưa ghi nhận"", ""GhiChu"": """", ""score"": 2.0}, {""ChuThe"": ""Vị thuốc Đại bi"", ""QuanHe"": ""Thỏa mãn đồng thời"", ""DoiTuong"": ""Lương và Công năng Trị đau mắt cảm gió"", ""LieuDung"": ""Chưa ghi nhận"", ""CachDung"": ""Chưa ghi nhận"", ""GhiChu"": """", ""score"": 2.0}, {""ChuThe"": ""Vị thuốc Đại bi"", ""QuanHe"": ""Thỏa mãn đồng thời"", ""DoiTuong"": ""Lương và Bệnh Đau mắt"", ""LieuDung"": ""Chưa ghi nhận"", ""CachDung"": ""Chưa ghi nhận"", ""GhiChu"": """", ""score"": 2.0}]']","Dựa trên dữ liệu y văn, các vị thuốc có tính lương và được dùng để chữa bệnh đau mắt bao gồm:

*   **Vị thuốc Đại bi**: Lương và Bệnh Đau mắt.
*   **Vị thuốc Mã đề**: Lương và Bệnh Đau mắt.
*   **Vị thuốc Đại bi**: Lương và Công năng Trị đau mắt cảm gió.

Lưu ý: Liều dùng và cách dùng của các vị thuốc này chưa được ghi nhận trong dữ liệu.","Mã đề, Đại bi",1.0,0.4553397786537934,0.9999999999,1.0,0.6314775364963809
Bệnh nào có thể chữa bằng bài thuốc chứa tế tân?,"['[{""ChuThe"": ""Vị thuốc Tế Tân"", ""QuanHe"": ""Tham gia bài thuốc [Bài thuốc Thiên đầu thống cao bản] để chữa"", ""DoiTuong"": ""Bệnh Nhức đầu"", ""LieuDung"": ""Chưa ghi nhận"", ""CachDung"": ""Nước $600ml$, sắc còn $200ml$ chia 3 lần uống trong ngày, sau khi ăn cơm xong, uống lúc còn nóng"", ""GhiChu"": ""Nhức đầu, thiên đầu thống | Cảo bản $6g$, xuyên khung $3g$, phòng phong $5g$, bạch chỉ $3g$, tế tân $2g$, cam thảo $3g$ | Nước $600ml$, sắc còn $200ml$ chia 3 lần uống trong ngày, sau khi ăn cơm xong, uống lúc còn nóng | [Nguồn]: CT_VT_VN_T111"", ""score"": 2.0, ""sort_weight"": 3.0}, {""ChuThe"": ""Vị thuốc Tế Tân"", ""QuanHe"": ""Tham gia bài thuốc [Bài thuốc Thiên đầu thống cao bản] để chữa"", ""DoiTuong"": ""Bệnh Thiên đầu thống"", ""LieuDung"": ""Chưa ghi nhận"", ""CachDung"": ""Nước $600ml$, sắc còn $200ml$ chia 3 lần uống trong ngày, sau khi ăn cơm xong, uống lúc còn nóng"", ""GhiChu"": ""Nhức đầu, thiên đầu thống | Cảo bản $6g$, xuyên khung $3g$, phòng phong $5g$, bạch chỉ $3g$, tế tân $2g$, cam thảo $3g$ | Nước $600ml$, sắc còn $200ml$ chia 3 lần uống trong ngày, sau khi ăn cơm xong, uống lúc còn nóng | [Nguồn]: CT_VT_VN_T111"", ""score"": 2.0, ""sort_weight"": 3.0}, {""ChuThe"": ""Vị thuốc Tế Tân"", ""QuanHe"": ""Tham gia bài thuốc [Bài thuốc Cảm lạnh tê tán] để chữa"", ""DoiTuong"": ""Bệnh Cam lanh"", ""LieuDung"": ""Chưa ghi nhận"", ""CachDung"": ""Nước $200ml$ sắc còn $100ml$ chia 3 lần uống trong ngày."", ""GhiChu"": """", ""score"": 2.0, ""sort_weight"": 3.0}, {""ChuThe"": ""Vị thuốc Tế Tân"", ""QuanHe"": ""Tham gia bài thuốc [Bài thuốc Đau răng tê tán] để chữa"", ""DoiTuong"": ""Bệnh Đau răng"", ""LieuDung"": ""Chưa ghi nhận"", ""CachDung"": ""Ngâm vào $100ml$ rượu trong nửa ngày. Dùng rượu này ngậm: Khi mỏi miệng thì nhổ đi."", ""GhiChu"": """", ""score"": 2.0, ""sort_weight"": 3.0}, {""ChuThe"": ""Vị thuốc Tế Tân"", ""QuanHe"": ""Tham gia bài thuốc [Bài thuốc Lo mồm lo lưỡi tê tán] để chữa"", ""DoiTuong"": ""Bệnh Lo lưỡi"", ""LieuDung"": ""Chưa ghi nhận"", ""CachDung"": ""Bôi vào miệng, lưỡi, ngậm cho chảy dãi ra là khỏi."", ""GhiChu"": """", ""score"": 2.0, ""sort_weight"": 3.0}, {""ChuThe"": ""Vị thuốc Tế Tân"", ""QuanHe"": ""Tham gia bài thuốc [Bài thuốc Lo mồm lo lưỡi tê tán] để chữa"", ""DoiTuong"": ""Bệnh Lo mồm"", ""LieuDung"": ""Chưa ghi nhận"", ""CachDung"": ""Bôi vào miệng, lưỡi, ngậm cho chảy dãi ra là khỏi."", ""GhiChu"": """", ""score"": 2.0, ""sort_weight"": 3.0}, {""ChuThe"": ""Vị thuốc Tế Tân"", ""QuanHe"": ""Tham gia bài thuốc [Bài thuốc Tễ thấp tễ tán] để chữa"", ""DoiTuong"": ""Bệnh Tê thấp"", ""LieuDung"": ""Chưa ghi nhận"", ""CachDung"": ""Sắc uống"", ""GhiChu"": """", ""score"": 2.0, ""sort_weight"": 3.0}, {""ChuThe"": ""Vị thuốc Tế Tân"", ""QuanHe"": ""Tham gia bài thuốc [Bài thuốc Viêm mũi dị ứng tê tán] để chữa"", ""DoiTuong"": ""Bệnh Viêm mũi dị ứng"", ""LieuDung"": ""Chưa ghi nhận"", ""CachDung"": ""Sắc uống"", ""GhiChu"": """", ""score"": 2.0, ""sort_weight"": 3.0}, {""ChuThe"": ""Vị thuốc Tế Tân"", ""QuanHe"": ""Tham gia bài thuốc [Bài thuốc Mũi tắc điều tân] để chữa"", ""DoiTuong"": ""Triệu chứng Mũi tắc"", ""LieuDung"": ""Chưa ghi nhận"", ""CachDung"": ""Chưa ghi nhận"", ""GhiChu"": """", ""score"": 2.0, ""sort_weight"": 3.0}, {""ChuThe"": ""Vị thuốc Tế Tân"", ""QuanHe"": ""Tham gia bài thuốc [Bài thuốc Mũi tắc điều tân] để chữa"", ""DoiTuong"": ""Triệu chứng Mất ngủ"", ""LieuDung"": ""Chưa ghi nhận"", ""CachDung"": ""Chưa ghi nhận"", ""GhiChu"": """", ""score"": 2.0, ""sort_weight"": 3.0}, {""ChuThe"": ""Vị thuốc Tế Tân"", ""QuanHe"": ""Tham gia bài thuốc [Bài thuốc Mũi tắc điều tân] để chữa"", ""DoiTuong"": ""Triệu chứng Chóng mặt"", ""LieuDung"": ""Chưa ghi nhận"", ""CachDung"": ""Chưa ghi nhận"", ""GhiChu"": """", ""score"": 2.0, ""sort_weight"": 3.0}, {""ChuThe"": ""Vị thuốc Tế Tân"", ""QuanHe"": ""Tham gia bài thuốc [Bài thuốc Lao Ma hoàng] để chữa"", ""DoiTuong"": ""Bệnh Viêm phế quản mạn tính"", ""LieuDung"": ""Chưa ghi nhận"", ""CachDung"": ""Nước $600ml$, sắc còn $200ml$, chia $3$ lần uống trong ngày"", ""GhiChu"": ""CT_VT_VN_T635. Hen suyễn, viêm phế quản mãn tính, lao"", ""score"": 2.0, ""sort_weight"": 3.0}, {""ChuThe"": ""Vị thuốc Tế Tân"", ""QuanHe"": ""Tham gia bài thuốc [Bài thuốc Lao Ma hoàng] để chữa"", ""DoiTuong"": ""Bệnh Hen suyễn"", ""LieuDung"": ""Chưa ghi nhận"", ""CachDung"": ""Nước $600ml$, sắc còn $200ml$, chia $3$ lần uống trong ngày"", ""GhiChu"": ""CT_VT_VN_T635. Hen suyễn, viêm phế quản mãn tính, lao"", ""score"": 2.0, ""sort_weight"": 3.0}, {""ChuThe"": ""Vị thuốc Tế Tân"", ""QuanHe"": ""Tham gia bài thuốc [Bài thuốc Lao Ma hoàng] để chữa"", ""DoiTuong"": ""Bệnh Lao"", ""LieuDung"": ""Chưa ghi nhận"", ""CachDung"": ""Nước $600ml$, sắc còn $200ml$, chia $3$ lần uống trong ngày"", ""GhiChu"": ""CT_VT_VN_T635. Hen suyễn, viêm phế quản mãn tính, lao"", ""score"": 2.0, ""sort_weight"": 3.0}, {""ChuThe"": ""Vị thuốc Tế Tân"", ""QuanHe"": ""Tham gia bài thuốc [Bài thuốc Thiên đầu thống mạn kinh tử] để chữa"", ""DoiTuong"": ""Bệnh Thiên đầu thống"", ""LieuDung"": ""Chưa ghi nhận"", ""CachDung"": ""Chưa ghi nhận"", ""GhiChu"": """", ""score"": 2.0, ""sort_weight"": 3.0}, {""ChuThe"": ""Vị thuốc Tế Tân"", ""QuanHe"": ""Tham gia bài thuốc [Bài thuốc Chóng mặt Xuyên khung] để chữa"", ""DoiTuong"": ""Triệu chứng Nhức đầu"", ""LieuDung"": ""Chưa ghi nhận"", ""CachDung"": ""nước $300$ml, sắc còn $100$ml. Chia $3$ lần uống trong ngày"", ""GhiChu"": ""CT_VT_VN_T673"", ""score"": 2.0, ""sort_weight"": 3.0}, {""ChuThe"": ""Vị thuốc Tế Tân"", ""QuanHe"": ""Tham gia bài thuốc [Bài thuốc Chóng mặt Xuyên khung] để chữa"", ""DoiTuong"": ""Triệu chứng Chóng mặt"", ""LieuDung"": ""Chưa ghi nhận"", ""CachDung"": ""nước $300$ml, sắc còn $100$ml. Chia $3$ lần uống trong ngày"", ""GhiChu"": ""CT_VT_VN_T673"", ""score"": 2.0, ""sort_weight"": 3.0}, {""ChuThe"": ""Vị thuốc Tế Tân"", ""QuanHe"": ""Tham gia bài thuốc [Bài thuốc Mắt mờ Xuyên khung] để chữa"", ""DoiTuong"": ""Bệnh Thiên đầu thống"", ""LieuDung"": ""Chưa ghi nhận"", ""CachDung"": ""Các vị trên tán nhỏ, ngày uống hai lần, mỗi lần uống $6$g bột, dùng nước chè mà chiêu thuốc"", ""GhiChu"": ""CT_VT_VN_T673"", ""score"": 2.0, ""sort_weight"": 3.0}, {""ChuThe"": ""Vị thuốc Tế Tân"", ""QuanHe"": ""Tham gia bài thuốc [Bài thuốc Mắt mờ Xuyên khung] để chữa"", ""DoiTuong"": ""Triệu chứng Ngạt mũi"", ""LieuDung"": ""Chưa ghi nhận"", ""CachDung"": ""Các vị trên tán nhỏ, ngày uống hai lần, mỗi lần uống $6$g bột, dùng nước chè mà chiêu thuốc"", ""GhiChu"": ""CT_VT_VN_T673"", ""score"": 2.0, ""sort_weight"": 3.0}, {""ChuThe"": ""Vị thuốc Tế Tân"", ""QuanHe"": ""Tham gia bài thuốc [Bài thuốc Mắt mờ Xuyên khung] để chữa"", ""DoiTuong"": ""Triệu chứng Mắt mờ"", ""LieuDung"": ""Chưa ghi nhận"", ""CachDung"": ""Các vị trên tán nhỏ, ngày uống hai lần, mỗi lần uống $6$g bột, dùng nước chè mà chiêu thuốc"", ""GhiChu"": ""CT_VT_VN_T673"", ""score"": 2.0, ""sort_weight"": 3.0}, {""ChuThe"": ""Vị thuốc Tế Tân"", ""QuanHe"": ""Tham gia bài thuốc [Bài thuốc Mụn nhọt tóc rối] để chữa"", ""DoiTuong"": ""Bệnh Mụn nhọt"", ""LieuDung"": ""Chưa ghi nhận"", ""CachDung"": ""Dùng để dán lên mụn nhọt chưa vỡ mủ."", ""GhiChu"": ""CT_VT_VN_T1024"", ""score"": 2.0, ""sort_weight"": 3.0}]']","Dựa trên y văn, vị thuốc **Tế Tân** có thể tham gia vào các bài thuốc để chữa các bệnh và triệu chứng sau:

*   Nhức đầu, thiên đầu thống: Tham gia bài thuốc **Thiên đầu thống cao bản**. Cách dùng: Nước 600ml, sắc còn 200ml chia 3 lần uống trong ngày, sau khi ăn cơm xong, uống lúc còn nóng.
*   Cam lạnh: Tham gia bài thuốc **Cảm lạnh tê tán**. Cách dùng: Nước 200ml sắc còn 100ml chia 3 lần uống trong ngày.
*   Đau răng: Tham gia bài thuốc **Đau răng tê tán**. Cách dùng: Ngâm vào 100ml rượu trong nửa ngày. Dùng rượu này ngậm: Khi mỏi miệng thì nhổ đi.
*   Lo lưỡi, lo mồm: Tham gia bài thuốc **Lo mồm lo lưỡi tê tán**. Cách dùng: Bôi vào miệng, lưỡi, ngậm cho chảy dãi ra là khỏi.
*   Tê thấp: Tham gia bài thuốc **Tễ thấp tễ tán**. Cách dùng: Sắc uống.
*   Viêm mũi dị ứng: Tham gia bài thuốc **Viêm mũi dị ứng tê tán**. Cách dùng: Sắc uống.
*   Mũi tắc: Tham gia bài thuốc **Mũi tắc điều tân**.
*   Mất ngủ: Tham gia bài thuốc **Mũi tắc điều tân**.
*   Chóng mặt: Tham gia bài thuốc **Mũi tắc điều tân**.
*   Viêm phế quản mạn tính, hen suyễn, lao: Tham gia bài thuốc **Lao Ma hoàng**. Cách dùng: Nước 600ml, sắc còn 200ml, chia 3 lần uống trong ngày.
*   Thiên đầu thống: Tham gia bài thuốc **Thiên đầu thống mạn kinh tử**.
*   Nhức đầu, chóng mặt: Tham gia bài thuốc **Chóng mặt Xuyên khung**. Cách dùng: nước 300ml, sắc còn 100ml. Chia 3 lần uống trong ngày.
*   Thiên đầu thống, ngạt mũi, mắt mờ: Tham gia bài thuốc **Mắt mờ Xuyên khung**. Cách dùng: Các vị trên tán nhỏ, ngày uống hai lần, mỗi lần uống 6g bột, dùng nước chè mà chiêu thuốc.
*   Mụn nhọt: Tham gia bài thuốc **Mụn nhọt tóc rối**. Cách dùng: Dùng để dán lên mụn nhọt chưa vỡ mủ.","Cam lanh, Hen suyễn, Lao, Lo lưỡi, Lo mồm, Mụn nhọt, Nhức đầu, Thiên đầu thống, Tê thấp, Viêm mũi dị ứng, Viêm phế quản mạn, Đau răng, Chóng mặt, Mũi tắc, Mất ngủ, Mắt mờ, Ngạt mũi, Nhức đầu",1.0,0.576410947182075,0.9999999999,1.0,0.5952394366709913
Thuốc nào vừa có tính bình vừa trực tiếp chữa bệnh răng cắn?,"['[{""ChuThe"": ""Vị thuốc Rau đắng"", ""QuanHe"": ""Thỏa mãn đồng thời"", ""DoiTuong"": ""Bình và Bệnh Răng cắn"", ""LieuDung"": ""Chưa ghi nhận"", ""CachDung"": ""Chưa ghi nhận"", ""GhiChu"": """", ""score"": 2.0}, {""ChuThe"": ""Vị thuốc Bán"", ""QuanHe"": ""Thỏa mãn đồng thời"", ""DoiTuong"": ""Bình và Bệnh Răng cắn"", ""LieuDung"": ""Chưa ghi nhận"", ""CachDung"": ""Chưa ghi nhận"", ""GhiChu"": """", ""score"": 2.0}, {""ChuThe"": ""Vị thuốc Sắn dây"", ""QuanHe"": ""Thỏa mãn đồng thời"", ""DoiTuong"": ""Bình và Bệnh Răng cắn"", ""LieuDung"": ""Chưa ghi nhận"", ""CachDung"": ""Chưa ghi nhận"", ""GhiChu"": """", ""score"": 2.0}, {""ChuThe"": ""Vị thuốc Rắn"", ""QuanHe"": ""Thỏa mãn đồng thời"", ""DoiTuong"": ""Bình và Bệnh Răng cắn"", ""LieuDung"": ""Chưa ghi nhận"", ""CachDung"": ""Chưa ghi nhận"", ""GhiChu"": """", ""score"": 2.0}]']",Hệ thống y văn hiện tại chưa ghi nhận dữ liệu về vấn đề này.,"Bán, Rau đắng, Rắn, Sắn dây",1.0,0.0,0.9999999999,1.0,0.20502816545788857
Vị thuốc mỏ তাম থể có chứa hoạt chất axitmuravic không?,['Không có dữ liệu'],"Không. Dựa trên dữ liệu y văn hiện tại, không có ghi nhận nào cho thấy mỏ তাম থể có liên quan hoặc tác dụng tới axitmuravic.","Không, vị thuốc mỏ তাম থể không chứa hoạt chất axitmuravic",0.0,0.7920357490077893,0.0,1.0,0.7435951724499907
Vị thuốc bạc thau có chứa hoạt chất flavonoit glycozit c không?,['Không có dữ liệu'],"Không. Dựa trên dữ liệu y văn hiện tại, không có ghi nhận nào cho thấy bạc thau có liên quan hoặc tác dụng tới flavonoit glycozit c.","Không, vị thuốc bạc thau không chứa hoạt chất flavonoit glycozit c",0.0,0.8399838386972303,0.0,1.0,0.99334204637337
Vị thuốc dầu giun có tính ôn không?,"['[{""ChuThe"": ""Vị thuốc Dầu giun"", ""QuanHe"": ""Xác nhận: CO_TINH"", ""DoiTuong"": ""Ôn"", ""LieuDung"": ""Chưa ghi nhận"", ""CachDung"": ""Chưa ghi nhận"", ""GhiChu"": """", ""score"": 2.0, ""sort_weight"": 3.0}]']","Dựa trên y văn, **Dầu giun** có tính ôn.","Có, vị thuốc dầu giun có tính ôn",1.0,0.6098643961687145,0.9999999999,1.0,0.9749637651658014
Bệnh đau bụng đi ngoài có thể dùng vị thuốc hoặc bài thuốc nào để chữa?,"['[{""ChuThe"": ""Triệu chứng Đau bụng đi ngoài"", ""QuanHe"": ""Được chữa bằng (ViThuoc)"", ""DoiTuong"": ""Vị thuốc Me rừng"", ""LieuDung"": ""$15-20g$"", ""CachDung"": ""Sắc uống hàng ngày"", ""GhiChu"": ""Rễ me rừng"", ""score"": 2.0}]']","Hiện tại y văn chưa ghi nhận phương án trực tiếp như bạn hỏi, tuy nhiên đối với các thể bệnh liên quan, bạn có thể tham khảo phương án sau đây:

**Thông tin tham khảo thêm:**

Đối với triệu chứng đau bụng đi ngoài, bạn có thể tham khảo dùng rễ **Me rừng** với liều lượng 15-20g, sắc uống hàng ngày.",Me rừng,0.3333333333333333,0.0,0.9999999999,1.0,0.5023005334188716
Vị thuốc vi kim anh tu tham gia vào bài thuốc để chữa những bệnh gì?,"['[{""ChuThe"": ""Vi Kim Anh Tu"", ""QuanHe"": ""Tham gia bài thuốc [Bài thuốc Viêm ruột mạn tính Khiếm thực] để chữa"", ""DoiTuong"": ""Bệnh Lỵ mạn tính"", ""LieuDung"": ""Ngày uống 3 lần, mỗi lần $3-5g$."", ""CachDung"": ""Tán nhỏ, thêm mật làm thành viên. Uống với nước nóng."", ""GhiChu"": ""CT_VT_VN_T864"", ""score"": 2.0, ""sort_weight"": 3.0}, {""ChuThe"": ""Vi Kim Anh Tu"", ""QuanHe"": ""Tham gia bài thuốc [Bài thuốc Viêm ruột mạn tính Khiếm thực] để chữa"", ""DoiTuong"": ""Bệnh Viêm ruột mãn tính"", ""LieuDung"": ""Ngày uống 3 lần, mỗi lần $3-5g$."", ""CachDung"": ""Tán nhỏ, thêm mật làm thành viên. Uống với nước nóng."", ""GhiChu"": ""CT_VT_VN_T864"", ""score"": 2.0, ""sort_weight"": 3.0}, {""ChuThe"": ""Vi Kim Anh Tu"", ""QuanHe"": ""Tham gia bài thuốc [Bài thuốc Viêm ruột mạn tính Khiếm thực] để chữa"", ""DoiTuong"": ""Bệnh di mộng tinh"", ""LieuDung"": ""Ngày uống 3 lần, mỗi lần $3-5g$."", ""CachDung"": ""Tán nhỏ, thêm mật làm thành viên. Uống với nước nóng."", ""GhiChu"": ""CT_VT_VN_T864"", ""score"": 2.0, ""sort_weight"": 3.0}, {""ChuThe"": ""Vi Kim Anh Tu"", ""QuanHe"": ""Tham gia bài thuốc [Bài thuốc Viêm ruột mạn tính Khiếm thực] để chữa"", ""DoiTuong"": ""Bệnh Suy nhược thần kinh"", ""LieuDung"": ""Ngày uống 3 lần, mỗi lần $3-5g$."", ""CachDung"": ""Tán nhỏ, thêm mật làm thành viên. Uống với nước nóng."", ""GhiChu"": ""CT_VT_VN_T864"", ""score"": 2.0, ""sort_weight"": 3.0}]']","Vị thuốc Vi Kim Anh Tu tham gia vào bài thuốc **Bài thuốc Viêm ruột mạn tính Khiếm thực** để chữa các bệnh sau:

*   Bệnh Lỵ mạn tính.
    *   Liều dùng: Ngày uống 3 lần, mỗi lần 3-5g.
    *   Cách dùng: Tán nhỏ, thêm mật làm thành viên. Uống với nước nóng.
*   Bệnh Viêm ruột mãn tính.
    *   Liều dùng: Ngày uống 3 lần, mỗi lần 3-5g.
    *   Cách dùng: Tán nhỏ, thêm mật làm thành viên. Uống với nước nóng.
*   Bệnh di mộng tinh.
    *   Liều dùng: Ngày uống 3 lần, mỗi lần 3-5g.
    *   Cách dùng: Tán nhỏ, thêm mật làm thành viên. Uống với nước nóng.
*   Bệnh Suy nhược thần kinh.
    *   Liều dùng: Ngày uống 3 lần, mỗi lần 3-5g.
    *   Cách dùng: Tán nhỏ, thêm mật làm thành viên. Uống với nước nóng.","Lỵ mạn, Suy nhược thần kinh, Viêm ruột mãn, Di mộng tinh",1.0,0.5294620292255722,0.9999999999,1.0,0.5429825816785132
Vị thuốc xạ hương tham gia vào bài thuốc để chữa những bệnh gì?,"['[{""ChuThe"": ""Vị thuốc Xạ hương"", ""QuanHe"": ""Tham gia bài thuốc [Bài thuốc Đại Đảm Phục Long Can] để chữa"", ""DoiTuong"": ""Bệnh Đái dầm"", ""LieuDung"": ""Phục long can tán nhỏ $8g$, chu sa $4g$, xạ hương $0,03g$"", ""CachDung"": ""Tất cả tán nhỏ viên bằng hạt đậu xanh. Mỗi tối cho uống 2 đến 4 viên."", ""GhiChu"": ""CT_VT_VN_T1064"", ""score"": 2.0, ""sort_weight"": 3.0}, {""ChuThe"": ""Vị thuốc Xạ hương"", ""QuanHe"": ""Tham gia bài thuốc [Bài thuốc Tai có mủ Mai mực] để chữa"", ""DoiTuong"": ""Triệu chứng tai có mủ"", ""LieuDung"": ""Chưa ghi nhận"", ""CachDung"": ""Tán thật nhỏ, lấy bông bọc vào đầu tăm chấm thuốc ngoáy vào tai"", ""GhiChu"": ""Tai có mủ. CT_VT_VN_T503"", ""score"": 2.0, ""sort_weight"": 3.0}, {""ChuThe"": ""Vị thuốc Xạ hương"", ""QuanHe"": ""Tham gia bài thuốc [Bài thuốc Ngũ độc thực ăn sơn tứ cố] để chữa"", ""DoiTuong"": ""Bệnh Ngộ độc thức ăn"", ""LieuDung"": ""Mỗi đỉnh hay viên $2$ hoặc $4g$. Mỗi lần dùng $1$ đến $2g$, ngày uống $1$ đến $2$ lần"", ""CachDung"": ""Dùng nước nóng chiều thuốc"", ""GhiChu"": ""Nếu chế thành đỉnh mang tên tử kim đĩnh hay thái ất tử kim đĩnh dùng chữa ngộ độc thức ăn, nôn hay ỉa được là khỏi"", ""score"": 2.0, ""sort_weight"": 3.0}, {""ChuThe"": ""Vị thuốc Xạ hương"", ""QuanHe"": ""Tham gia bài thuốc [Bài thuốc Cổ quắp ngưu hoàng] để chữa"", ""DoiTuong"": ""Triệu chứng Sốt quá nói mê"", ""LieuDung"": ""Mỗi lần uống 1 viên. Bệnh nặng thể thực có thể uống thêm. Trong ngày có thể uống tới 3 viên. Trẻ con giảm liều xuống một nửa"", ""CachDung"": ""Tất cả tán nhỏ, dùng mật viên thành viên, mỗi viên nặng $4g$. Bảo quản trong viên sáp."", ""GhiChu"": """", ""score"": 2.0, ""sort_weight"": 3.0}, {""ChuThe"": ""Vị thuốc Xạ hương"", ""QuanHe"": ""Tham gia bài thuốc [Bài thuốc Cổ quắp ngưu hoàng] để chữa"", ""DoiTuong"": ""Triệu chứng Sốt nóng"", ""LieuDung"": ""Mỗi lần uống 1 viên. Bệnh nặng thể thực có thể uống thêm. Trong ngày có thể uống tới 3 viên. Trẻ con giảm liều xuống một nửa"", ""CachDung"": ""Tất cả tán nhỏ, dùng mật viên thành viên, mỗi viên nặng $4g$. Bảo quản trong viên sáp."", ""GhiChu"": """", ""score"": 2.0, ""sort_weight"": 3.0}, {""ChuThe"": ""Vị thuốc Xạ hương"", ""QuanHe"": ""Tham gia bài thuốc [Bài thuốc Viêm não ngưu hoàng] để chữa"", ""DoiTuong"": ""Bệnh Viêm não"", ""LieuDung"": ""Mỗi lần uống 1 viên. Bệnh nặng thể thực có thể uống thêm. Trong ngày có thể uống tới 3 viên. Trẻ con giảm liều xuống một nửa"", ""CachDung"": ""Tất cả tán nhỏ, dùng mật viên thành viên, mỗi viên nặng $4g$. Bảo quản trong viên sáp."", ""GhiChu"": """", ""score"": 2.0, ""sort_weight"": 3.0}, {""ChuThe"": ""Vị thuốc Xạ hương"", ""QuanHe"": ""Tham gia bài thuốc [Bài thuốc Cam Tẩu Mã Nhựa Cóc] để chữa"", ""DoiTuong"": ""Bệnh Cam tẩu mã"", ""LieuDung"": ""Tất cả tán nhỏ"", ""CachDung"": ""xỉa vào chỗ răng và lợi bị cam đã rửa sạch bằng nước muối"", ""GhiChu"": """", ""score"": 2.0, ""sort_weight"": 3.0}, {""ChuThe"": ""Vị thuốc Xạ hương"", ""QuanHe"": ""Tham gia bài thuốc [Bài thuốc Sốt Nặng Trúng Độc Mê Man Tim Suy Nhược Nhựa Cóc] để chữa"", ""DoiTuong"": ""Bệnh Sốt"", ""LieuDung"": ""Mỗi lần uống $5-10$ viên, ngày uống $1-2$ lần"", ""CachDung"": ""thiềm tô để riêng, các vị khác đem tán nhỏ, thêm thiềm tô tẩm rượu vào, làm thành viên to bằng hạt cải (bằng đầu đinh ghim); dùng muội bếp (bách thảo sương) làm áo thuốc viên"", ""GhiChu"": """", ""score"": 2.0, ""sort_weight"": 3.0}, {""ChuThe"": ""Vị thuốc Xạ hương"", ""QuanHe"": ""Tham gia bài thuốc [Bài thuốc Sốt Nặng Trúng Độc Mê Man Tim Suy Nhược Nhựa Cóc] để chữa"", ""DoiTuong"": ""Bệnh Trúng độc"", ""LieuDung"": ""Mỗi lần uống $5-10$ viên, ngày uống $1-2$ lần"", ""CachDung"": ""thiềm tô để riêng, các vị khác đem tán nhỏ, thêm thiềm tô tẩm rượu vào, làm thành viên to bằng hạt cải (bằng đầu đinh ghim); dùng muội bếp (bách thảo sương) làm áo thuốc viên"", ""GhiChu"": """", ""score"": 2.0, ""sort_weight"": 3.0}, {""ChuThe"": ""Vị thuốc Xạ hương"", ""QuanHe"": ""Tham gia bài thuốc [Bài thuốc Sốt Nặng Trúng Độc Mê Man Tim Suy Nhược Nhựa Cóc] để chữa"", ""DoiTuong"": ""Bệnh Suy nhược"", ""LieuDung"": ""Mỗi lần uống $5-10$ viên, ngày uống $1-2$ lần"", ""CachDung"": ""thiềm tô để riêng, các vị khác đem tán nhỏ, thêm thiềm tô tẩm rượu vào, làm thành viên to bằng hạt cải (bằng đầu đinh ghim); dùng muội bếp (bách thảo sương) làm áo thuốc viên"", ""GhiChu"": """", ""score"": 2.0, ""sort_weight"": 3.0}, {""ChuThe"": ""Vị thuốc Xạ hương"", ""QuanHe"": ""Tham gia bài thuốc [Bài thuốc Sốt Nặng Trúng Độc Mê Man Tim Suy Nhược Nhựa Cóc] để chữa"", ""DoiTuong"": ""Triệu chứng Mê man"", ""LieuDung"": ""Mỗi lần uống $5-10$ viên, ngày uống $1-2$ lần"", ""CachDung"": ""thiềm tô để riêng, các vị khác đem tán nhỏ, thêm thiềm tô tẩm rượu vào, làm thành viên to bằng hạt cải (bằng đầu đinh ghim); dùng muội bếp (bách thảo sương) làm áo thuốc viên"", ""GhiChu"": """", ""score"": 2.0, ""sort_weight"": 3.0}, {""ChuThe"": ""Vị thuốc Xạ hương"", ""QuanHe"": ""Tham gia bài thuốc [Bài thuốc chữa nha cam từ Nhân trung bạch] để chữa"", ""DoiTuong"": ""Bệnh nha cam tẩu mã"", ""LieuDung"": ""Chưa ghi nhận"", ""CachDung"": ""Cả ba vị tán nhỏ, trộn đều bởi vào nơi cam tẩu mã đã rửa sạch bằng nước muối"", ""GhiChu"": """", ""score"": 2.0, ""sort_weight"": 3.0}, {""ChuThe"": ""Vị thuốc Xạ hương"", ""QuanHe"": ""Tham gia bài thuốc [Triệu chứng Tâm trạng suy nhược] để chữa"", ""DoiTuong"": ""Bệnh Trúng độc"", ""LieuDung"": ""5-10 viên"", ""CachDung"": ""Năm vị trên tán nhỏ, thêm thiềm tô tẩm rượu, viên bằng hạt cải, lấy muội bếp (bách thảo sương) làm áo cho nên viên có màu đen. Mỗi lần dùng 5-10 viên tùy theo bệnh và sức khỏe."", ""GhiChu"": ""Tùy theo bệnh và sức khỏe"", ""score"": 2.0, ""sort_weight"": 3.0}, {""ChuThe"": ""Vị thuốc Xạ hương"", ""QuanHe"": ""Tham gia bài thuốc [Triệu chứng Tâm trạng suy nhược] để chữa"", ""DoiTuong"": ""Triệu chứng Mê loạn"", ""LieuDung"": ""5-10 viên"", ""CachDung"": ""Năm vị trên tán nhỏ, thêm thiềm tô tẩm rượu, viên bằng hạt cải, lấy muội bếp (bách thảo sương) làm áo cho nên viên có màu đen. Mỗi lần dùng 5-10 viên tùy theo bệnh và sức khỏe."", ""GhiChu"": ""Tùy theo bệnh và sức khỏe"", ""score"": 2.0, ""sort_weight"": 3.0}, {""ChuThe"": ""Vị thuốc Xạ hương"", ""QuanHe"": ""Tham gia bài thuốc [Triệu chứng Tâm trạng suy nhược] để chữa"", ""DoiTuong"": ""Triệu chứng Sốt cấp tính"", ""LieuDung"": ""5-10 viên"", ""CachDung"": ""Năm vị trên tán nhỏ, thêm thiềm tô tẩm rượu, viên bằng hạt cải, lấy muội bếp (bách thảo sương) làm áo cho nên viên có màu đen. Mỗi lần dùng 5-10 viên tùy theo bệnh và sức khỏe."", ""GhiChu"": ""Tùy theo bệnh và sức khỏe"", ""score"": 2.0, ""sort_weight"": 3.0}, {""ChuThe"": ""Vị thuốc Xạ hương"", ""QuanHe"": ""Tham gia bài thuốc [Triệu chứng Tâm trạng suy nhược] để chữa"", ""DoiTuong"": ""Triệu chứng Tâm trạng suy nhược"", ""LieuDung"": ""5-10 viên"", ""CachDung"": ""Năm vị trên tán nhỏ, thêm thiềm tô tẩm rượu, viên bằng hạt cải, lấy muội bếp (bách thảo sương) làm áo cho nên viên có màu đen. Mỗi lần dùng 5-10 viên tùy theo bệnh và sức khỏe."", ""GhiChu"": ""Tùy theo bệnh và sức khỏe"", ""score"": 2.0, ""sort_weight"": 3.0}, {""ChuThe"": ""Vị thuốc Xạ hương"", ""QuanHe"": ""Tham gia bài thuốc [Bài thuốc Thai chết xạ hương] để chữa"", ""DoiTuong"": ""Bệnh Thai chết"", ""LieuDung"": ""$1g$"", ""CachDung"": ""Hòa với rượu nóng dùng riêng hay phối hợp với nhiều vị thuốc khác, cho uống; nếu cần có thể tăng liều xạ hương"", ""GhiChu"": """", ""score"": 2.0, ""sort_weight"": 3.0}, {""ChuThe"": ""Vị thuốc Xạ hương"", ""QuanHe"": ""Tham gia bài thuốc [Bài thuốc Tử tử thất cô xạ hương] để chữa"", ""DoiTuong"": ""Bệnh Chết đuối"", ""LieuDung"": ""nửa đĩnh (thỏi) cho đến 1 hay 2 thỏi"", ""CachDung"": ""Các vị tán nhỏ viên thành thỏi hình trụ, mỗi thỏi nặng $4g$. Liều dùng trung bình cho người lớn là nửa đĩnh (thỏi) cho đến 1 hay 2 thỏi."", ""GhiChu"": """", ""score"": 2.0, ""sort_weight"": 3.0}, {""ChuThe"": ""Vị thuốc Xạ hương"", ""QuanHe"": ""Tham gia bài thuốc [Bài thuốc Tử tử thất cô xạ hương] để chữa"", ""DoiTuong"": ""Bệnh Trúng độc do thức ăn"", ""LieuDung"": ""nửa đĩnh (thỏi) cho đến 1 hay 2 thỏi"", ""CachDung"": ""Các vị tán nhỏ viên thành thỏi hình trụ, mỗi thỏi nặng $4g$. Liều dùng trung bình cho người lớn là nửa đĩnh (thỏi) cho đến 1 hay 2 thỏi."", ""GhiChu"": """", ""score"": 2.0, ""sort_weight"": 3.0}, {""ChuThe"": ""Vị thuốc Xạ hương"", ""QuanHe"": ""Tham gia bài thuốc [Bài thuốc Tử tử thất cô xạ hương] để chữa"", ""DoiTuong"": ""Bệnh Tử tử thất cô"", ""LieuDung"": ""nửa đĩnh (thỏi) cho đến 1 hay 2 thỏi"", ""CachDung"": ""Các vị tán nhỏ viên thành thỏi hình trụ, mỗi thỏi nặng $4g$. Liều dùng trung bình cho người lớn là nửa đĩnh (thỏi) cho đến 1 hay 2 thỏi."", ""GhiChu"": """", ""score"": 2.0, ""sort_weight"": 3.0}, {""ChuThe"": ""Vị thuốc Xạ hương"", ""QuanHe"": ""Tham gia bài thuốc [Bài thuốc Tử tử thất cô xạ hương] để chữa"", ""DoiTuong"": ""Triệu chứng Hôn mê"", ""LieuDung"": ""nửa đĩnh (thỏi) cho đến 1 hay 2 thỏi"", ""CachDung"": ""Các vị tán nhỏ viên thành thỏi hình trụ, mỗi thỏi nặng $4g$. Liều dùng trung bình cho người lớn là nửa đĩnh (thỏi) cho đến 1 hay 2 thỏi."", ""GhiChu"": """", ""score"": 2.0, ""sort_weight"": 3.0}, {""ChuThe"": ""Vị thuốc Xạ hương"", ""QuanHe"": ""Tham gia bài thuốc [Bài thuốc Mụn nhọt tóc rối] để chữa"", ""DoiTuong"": ""Bệnh Mụn nhọt"", ""LieuDung"": ""Chưa ghi nhận"", ""CachDung"": ""Dùng để dán lên mụn nhọt chưa vỡ mủ."", ""GhiChu"": ""CT_VT_VN_T1024"", ""score"": 2.0, ""sort_weight"": 3.0}]']","Vị thuốc **Xạ hương** tham gia vào các bài thuốc để chữa các bệnh và triệu chứng sau:

*   Bệnh Đái dầm: Tham gia bài thuốc **Đại Đảm Phục Long Can**. Liều dùng: Phục long can tán nhỏ 8g, chu sa 4g, xạ hương 0,03g. Cách dùng: Tất cả tán nhỏ viên bằng hạt đậu xanh. Mỗi tối cho uống 2 đến 4 viên.
*   Triệu chứng tai có mủ: Tham gia bài thuốc **Tai có mủ Mai mực**. Cách dùng: Tán thật nhỏ, lấy bông bọc vào đầu tăm chấm thuốc ngoáy vào tai.
*   Bệnh Ngộ độc thức ăn: Tham gia bài thuốc **Ngũ độc thực ăn sơn tứ cố**. Liều dùng: Mỗi đỉnh hay viên 2 hoặc 4g. Mỗi lần dùng 1 đến 2g, ngày uống 1 đến 2 lần. Cách dùng: Dùng nước nóng chiều thuốc.
*   Triệu chứng Sốt quá nói mê: Tham gia bài thuốc **Cổ quắp ngưu hoàng**. Liều dùng: Mỗi lần uống 1 viên. Bệnh nặng thể thực có thể uống thêm. Trong ngày có thể uống tới 3 viên. Trẻ con giảm liều xuống một nửa. Cách dùng: Tất cả tán nhỏ, dùng mật viên thành viên, mỗi viên nặng 4g. Bảo quản trong viên sáp.
*   Triệu chứng Sốt nóng: Tham gia bài thuốc **Cổ quắp ngưu hoàng**. Liều dùng: Mỗi lần uống 1 viên. Bệnh nặng thể thực có thể uống thêm. Trong ngày có thể uống tới 3 viên. Trẻ con giảm liều xuống một nửa. Cách dùng: Tất cả tán nhỏ, dùng mật viên thành viên, mỗi viên nặng 4g. Bảo quản trong viên sáp.
*   Bệnh Viêm não: Tham gia bài thuốc **Viêm não ngưu hoàng**. Liều dùng: Mỗi lần uống 1 viên. Bệnh nặng thể thực có thể uống thêm. Trong ngày có thể uống tới 3 viên. Trẻ con giảm liều xuống một nửa. Cách dùng: Tất cả tán nhỏ, dùng mật viên thành viên, mỗi viên nặng 4g. Bảo quản trong viên sáp.
*   Bệnh Cam tẩu mã: Tham gia bài thuốc **Cam Tẩu Mã Nhựa Cóc**. Liều dùng: Tất cả tán nhỏ. Cách dùng: xỉa vào chỗ răng và lợi bị cam đã rửa sạch bằng nước muối.
*   Bệnh Sốt, Trúng độc, Suy nhược, Triệu chứng Mê man: Tham gia bài thuốc **Sốt Nặng Trúng Độc Mê Man Tim Suy Nhược Nhựa Cóc**. Liều dùng: Mỗi lần uống 5-10 viên, ngày uống 1-2 lần. Cách dùng: thiềm tô để riêng, các vị khác đem tán nhỏ, thêm thiềm tô tẩm rượu vào, làm thành viên to bằng hạt cải (bằng đầu đinh ghim); dùng muội bếp (bách thảo sương) làm áo thuốc viên.
*   Bệnh nha cam tẩu mã: Tham gia bài thuốc **chữa nha cam từ Nhân trung bạch**. Cách dùng: Cả ba vị tán nhỏ, trộn đều bởi vào nơi cam tẩu mã đã rửa sạch bằng nước muối.
*   Bệnh Trúng độc, Triệu chứng Mê loạn, Sốt cấp tính, Tâm trạng suy nhược: Tham gia bài thuốc **Triệu chứng Tâm trạng suy nhược**. Liều dùng: 5-10 viên. Cách dùng: Năm vị trên tán nhỏ, thêm thiềm tô tẩm rượu, viên bằng hạt cải, lấy muội bếp (bách thảo sương) làm áo cho nên viên có màu đen. Mỗi lần dùng 5-10 viên tùy theo bệnh và sức khỏe.
*   Bệnh Thai chết: Tham gia bài thuốc **Thai chết xạ hương**. Liều dùng: 1g. Cách dùng: Hòa với rượu nóng dùng riêng hay phối hợp với nhiều vị thuốc khác, cho uống; nếu cần có thể tăng liều xạ hương.
*   Bệnh Chết đuối, Trúng độc do thức ăn, Tử tử thất cô, Triệu chứng Hôn mê: Tham gia bài thuốc **Tử tử thất cô xạ hương**. Liều dùng: nửa đĩnh (thỏi) cho đến 1 hay 2 thỏi. Cách dùng: Các vị tán nhỏ viên thành thỏi hình trụ, mỗi thỏi nặng 4g. Liều dùng trung bình cho người lớn là nửa đĩnh (thỏi) cho đến 1 hay 2 thỏi.
*   Bệnh Mụn nhọt: Tham gia bài thuốc **Mụn nhọt tóc rối**. Cách dùng: Dùng để dán lên mụn nhọt chưa vỡ mủ.","Cam tẩu mã, Chết đuối, Mụn nhọt, Ngộ độc thức ăn, Suy nhược, Sốt, Thai chết, Trúng độc, Trúng độc do thức ăn, Tử tử thất cô, Viêm não, Nha cam tẩu mã, Đái dầm, Hôn mê, Mê loạn, Mê man, Sốt cấp, Sốt nóng, Sốt quá nói mê, Tâm trạng suy nhược, Tai có mủ",1.0,0.5214802360936358,0.9999999999,1.0,0.5602641345610501
Thuốc nào vừa có tính lương vừa trực tiếp chữa bệnh vàng da?,"['[{""ChuThe"": ""Vị thuốc Hoa hiên"", ""QuanHe"": ""Thỏa mãn đồng thời"", ""DoiTuong"": ""Lương và Bệnh Vàng da"", ""LieuDung"": ""Chưa ghi nhận"", ""CachDung"": ""Chưa ghi nhận"", ""GhiChu"": """", ""score"": 2.0}, {""ChuThe"": ""Vị thuốc Nắp ấm"", ""QuanHe"": ""Thỏa mãn đồng thời"", ""DoiTuong"": ""Lương và Bệnh Vàng da"", ""LieuDung"": ""Chưa ghi nhận"", ""CachDung"": ""Chưa ghi nhận"", ""GhiChu"": """", ""score"": 2.0}, {""ChuThe"": ""Vị thuốc Lục phàn"", ""QuanHe"": ""Thỏa mãn đồng thời"", ""DoiTuong"": ""Lương và Bệnh Vàng da"", ""LieuDung"": ""Chưa ghi nhận"", ""CachDung"": ""Chưa ghi nhận"", ""GhiChu"": """", ""score"": 2.0}]']",Hệ thống y văn hiện tại chưa ghi nhận dữ liệu về vấn đề này.,"Hoa hiên, Lục phàn, Nắp ấm",1.0,0.0,0.9999999999,1.0,0.23562560009278236
"Để chữa bệnh cao huyết áp, vị thuốc cúc hoa được dùng với liều lượng và cách thức như thế nào?","['[{""ChuThe"": ""Vị thuốc Cúc hoa"", ""QuanHe"": ""CHU_TRI_BENH"", ""DoiTuong"": ""Bệnh Cao huyết áp"", ""LieuDung"": ""Tham khảo liều dùng chung của vị thuốc"", ""CachDung"": ""Chỉ định lâm sàng theo kinh nghiệm"", ""GhiChu"": ""CT_VT_VN_T622"", ""score"": 2.0, ""sort_weight"": 3.0}]']","Để chữa bệnh cao huyết áp, **Cúc hoa** được dùng với liều lượng và cách thức như sau:

*   **Liều dùng:** Tham khảo liều dùng chung của vị thuốc.
*   **Cách dùng:** Chỉ định lâm sàng theo kinh nghiệm.","Để chữa bệnh cao huyết áp, vị thuốc cúc hoa có liều dùng: Tham khảo liều dùng chung của vị thuốc và cách dùng: Chỉ định lâm sàng theo kinh nghiệm",1.0,0.4298167836454546,0.9999999999,1.0,0.9965309840576699
"Để chữa bệnh đi lại khó khăn, vị thuốc xương hổ được dùng với liều lượng và cách thức như thế nào?","['[{""ChuThe"": ""Vị thuốc Xương hổ"", ""QuanHe"": ""CHU_TRI_TRIEU_CHUNG"", ""DoiTuong"": ""Triệu chứng Đi lại khó khăn"", ""LieuDung"": ""Nếu dùng cao mỗi ngày dùng $4-6$g hay hơn."", ""CachDung"": ""Dùng phối hợp với nhiều vị thuốc khác. Dùng dưới dạng thuốc sắc, thuốc bột hay ngâm rượu. | Chỉ định lâm sàng theo kinh nghiệm"", ""GhiChu"": """", ""score"": 2.0, ""sort_weight"": 3.0}]']","Để chữa triệu chứng đi lại khó khăn, vị thuốc **Xương hổ** được dùng như sau:

*   **Liều dùng:** Nếu dùng cao, mỗi ngày dùng 4-6g hoặc hơn.
*   **Cách dùng:**
    *   Dùng phối hợp với nhiều vị thuốc khác.
    *   Dùng dưới dạng thuốc sắc, thuốc bột hay ngâm rượu.
    *   Chỉ định lâm sàng theo kinh nghiệm.","Để chữa bệnh đi lại khó khăn, vị thuốc xương hổ có liều dùng: Nếu dùng cao mỗi ngày dùng 4-6g hay hơn. và cách dùng: Dùng phối hợp với nhiều vị thuốc khác. Dùng dưới dạng thuốc sắc, thuốc bột hay ngâm rượu. | Chỉ định lâm sàng theo kinh nghiệm",1.0,0.5271593512607428,0.9999999999,1.0,0.9943866878566254
Bệnh nào có thể chữa bằng bài thuốc chứa dầu dừa?,"['[{""ChuThe"": ""Vị thuốc Dầu dừa"", ""QuanHe"": ""Tham gia bài thuốc [Bài thuốc Sung Vu Đại hải] để chữa"", ""DoiTuong"": ""Bệnh Sưng vú"", ""LieuDung"": ""Chưa ghi nhận"", ""CachDung"": ""Chưa ghi nhận"", ""GhiChu"": """", ""score"": 2.0, ""sort_weight"": 3.0}]']",Dầu dừa tham gia vào bài thuốc **Bài thuốc Sung Vu Đại hải** để chữa bệnh Sưng vú. Liều dùng và cách dùng của dầu dừa trong bài thuốc này chưa được ghi nhận.,Sưng vú,1.0,0.5767111510956922,0.9999999999,1.0,0.5843815989064339
Bệnh nào có thể chữa bằng bài thuốc chứa địa hoàng?,"['[{""ChuThe"": ""Vị thuốc Địa hoàng"", ""QuanHe"": ""Tham gia bài thuốc [Bài thuốc Kinh nguyệt không ra Đan sâm] để chữa"", ""DoiTuong"": ""Bệnh Kinh nguyệt không ra"", ""LieuDung"": ""Chưa ghi nhận"", ""CachDung"": ""Chưa ghi nhận"", ""GhiChu"": """", ""score"": 2.0, ""sort_weight"": 3.0}, {""ChuThe"": ""Vị thuốc Thục địa hoàng"", ""QuanHe"": ""Tham gia bài thuốc [Bài thuốc Đầu xương óc sơn thù du] để chữa"", ""DoiTuong"": ""Triệu chứng Đầu xương óc"", ""LieuDung"": ""Chưa ghi nhận"", ""CachDung"": ""Sắc uống hằng ngày. Uống luôn trong 20 ngày."", ""GhiChu"": ""[Nguồn]: CT_VT_VN_T929"", ""score"": 2.0}, {""ChuThe"": ""Vị thuốc Địa hoàng"", ""QuanHe"": ""Tham gia bài thuốc [Bài thuốc Thận hư tại u sơn thù du] để chữa"", ""DoiTuong"": ""Triệu chứng Ù tai"", ""LieuDung"": ""Chưa ghi nhận"", ""CachDung"": ""Sắc uống hằng ngày hay ngâm rượu uống. Uống trong thời gian 15 hôm lại nghỉ 10 ngày rồi uống tiếp 3 đến 5 lần."", ""GhiChu"": ""[Nguồn]: CT_VT_VN_T929"", ""score"": 2.0, ""sort_weight"": 3.0}, {""ChuThe"": ""Vị thuốc Sinh địa hoàng"", ""QuanHe"": ""Tham gia bài thuốc [Bài thuốc Mụn nhọt tóc rối] để chữa"", ""DoiTuong"": ""Bệnh Mụn nhọt"", ""LieuDung"": ""Chưa ghi nhận"", ""CachDung"": ""Dùng để dán lên mụn nhọt chưa vỡ mủ."", ""GhiChu"": ""CT_VT_VN_T1024"", ""score"": 2.0}]']","Dựa trên y văn, **Địa hoàng** có thể tham gia vào bài thuốc để chữa các bệnh sau:

*   **Kinh nguyệt không ra**: Tham gia bài thuốc **Kinh nguyệt không ra Đan sâm**.
*   **Ù tai**: Tham gia bài thuốc **Thận hư tại u sơn thù du**, sắc uống hằng ngày hay ngâm rượu uống. Uống trong thời gian 15 hôm lại nghỉ 10 ngày rồi uống tiếp 3 đến 5 lần.

**Thông tin tham khảo thêm:**

*   **Đầu xương óc**: Có thể tham khảo bài thuốc chứa **Thục địa hoàng** là bài thuốc **Đầu xương óc sơn thù du**, sắc uống hằng ngày. Uống luôn trong 20 ngày.
*   **Mụn nhọt**: Có thể tham khảo bài thuốc chứa **Sinh địa hoàng** là bài thuốc **Mụn nhọt tóc rối**, dùng để dán lên mụn nhọt chưa vỡ mủ.","Kinh nguyệt không ra, Ù tai",1.0,0.4213568814575049,0.9999999999,1.0,0.45427413880300826
Bệnh sởi đậu có thể dùng vị thuốc hoặc bài thuốc nào để chữa?,"['[{""ChuThe"": ""Bệnh Sởi đậu"", ""QuanHe"": ""Được chữa bằng (ViThuoc)"", ""DoiTuong"": ""Vị thuốc Ngưu bàng"", ""LieuDung"": ""Tham khảo liều dùng chung của vị thuốc"", ""CachDung"": ""Có tác dụng làm cho chóng khỏi"", ""GhiChu"": ""Quả ngưu bàng"", ""score"": 2.0, ""sort_weight"": 3.0}, {""ChuThe"": ""Bệnh Sởi đậu"", ""QuanHe"": ""Được chữa bằng (ViThuoc)"", ""DoiTuong"": ""Vị thuốc Phân người"", ""LieuDung"": ""Tham khảo liều dùng chung của vị thuốc"", ""CachDung"": ""Chưa ghi nhận"", ""GhiChu"": ""CT_VT_VN_T992"", ""score"": 2.0, ""sort_weight"": 3.0}]']","Dựa trên y văn, bệnh sởi đậu có thể được chữa bằng các vị thuốc sau:

*   **Vị thuốc Ngưu bàng**: Tham khảo liều dùng chung của vị thuốc. Có tác dụng làm cho chóng khỏi. (Ghi chú: Quả ngưu bàng)
*   **Vị thuốc Phân người**: Tham khảo liều dùng chung của vị thuốc.","Ngưu bàng, Phân người",1.0,0.4370430559352019,0.9999999999,1.0,0.5563511141549784
Vị thuốc sâm bố chính có chứa hoạt chất proscillaridin a không?,['Không có dữ liệu'],"Không. Dựa trên dữ liệu y văn hiện tại, không có ghi nhận nào cho thấy sâm bố chính có liên quan hoặc tác dụng tới proscillaridin a.","Không, vị thuốc sâm bố chính không chứa hoạt chất proscillaridin a",0.0,0.8489062525448725,0.9999999999,1.0,0.8438504399606508
"Để chữa bệnh mụn nhọt, vị thuốc hạt gấc được dùng với liều lượng và cách thức như thế nào?","['[{""ChuThe"": ""Vị thuốc Hạt gấc"", ""QuanHe"": ""CO_CONG_NANG"", ""DoiTuong"": ""Công năng Trị mụn nhọt"", ""LieuDung"": ""Chưa ghi nhận"", ""CachDung"": ""Chưa ghi nhận"", ""GhiChu"": """", ""score"": 2.0, ""sort_weight"": 3.0}, {""ChuThe"": ""Vị thuốc Hạt gấc"", ""QuanHe"": ""CHU_TRI_BENH"", ""DoiTuong"": ""Bệnh Mụn nhọt"", ""LieuDung"": ""Tham khảo liều dùng chung của vị thuốc"", ""CachDung"": ""Uống trong và dùng ngoài. Chủ yếu dùng bội ngoài."", ""GhiChu"": ""tiêu thũng, ngã, bị thương, sang độc, phụ nữ sưng vú, hậu môn sung thũng"", ""score"": 2.0, ""sort_weight"": 3.0}]']","Để chữa bệnh mụn nhọt bằng **Hạt gấc**, bạn có thể tham khảo thông tin sau:

*   **Liều dùng và cách dùng:** Tham khảo liều dùng chung của vị thuốc, có thể dùng uống trong và dùng ngoài, chủ yếu dùng bôi ngoài.
*   **Ghi chú:** Hạt gấc có tác dụng tiêu thũng, trị ngã, bị thương, sang độc, phụ nữ sưng vú, hậu môn sung thũng.","Để chữa bệnh mụn nhọt, vị thuốc hạt gấc có liều dùng: Tham khảo liều dùng chung của vị thuốc và cách dùng: Uống trong và dùng ngoài. Chủ yếu dùng bội ngoài.",1.0,0.42363395626297407,0.9999999999,1.0,0.7253039292456431
Thành phần hóa học của dương xuân sa gồm những gì?,"['[{""ChuThe"": ""Vị thuốc Dương xuân sa"", ""QuanHe"": ""CO_CHUA_HOAT_CHAT"", ""DoiTuong"": ""Hoạt chất Saponin"", ""LieuDung"": ""Chưa ghi nhận"", ""CachDung"": ""Chưa ghi nhận"", ""GhiChu"": ""[CT_VT_VN_T416]"", ""score"": 2.0, ""sort_weight"": 3.0}]']",Thành phần hóa học của **Dương xuân sa** có chứa hoạt chất Saponin.,Saponin,1.0,0.579130222727198,0.9999999999,1.0,0.9362141134147413
Thuốc nào vừa có tính bình vừa trực tiếp chữa bệnh đau lưng?,"['[{""ChuThe"": ""Vị thuốc Tật lê"", ""QuanHe"": ""Thỏa mãn đồng thời"", ""DoiTuong"": ""Công năng Bình Can và Bệnh Đau lưng"", ""LieuDung"": ""Chưa ghi nhận"", ""CachDung"": ""Chưa ghi nhận"", ""GhiChu"": """", ""score"": 2.0}, {""ChuThe"": ""Vị thuốc Hồng đằng"", ""QuanHe"": ""Thỏa mãn đồng thời"", ""DoiTuong"": ""Bình và Bệnh Đau lưng"", ""LieuDung"": ""Chưa ghi nhận"", ""CachDung"": ""Chưa ghi nhận"", ""GhiChu"": """", ""score"": 2.0}, {""ChuThe"": ""Vị thuốc Rau má"", ""QuanHe"": ""Thỏa mãn đồng thời"", ""DoiTuong"": ""Bình và Bệnh Đau lưng"", ""LieuDung"": ""Chưa ghi nhận"", ""CachDung"": ""Chưa ghi nhận"", ""GhiChu"": """", ""score"": 2.0}]']","Dựa trên y văn, các vị thuốc vừa có tính bình, vừa có tác dụng với bệnh đau lưng bao gồm:

*   **Tật lê**: Công năng Bình Can và Bệnh Đau lưng.
*   **Hồng đằng**: Bình và Bệnh Đau lưng.
*   **Rau má**: Bình và Bệnh Đau lưng.

Lưu ý: Liều dùng và cách dùng của các vị thuốc này chưa được ghi nhận trong dữ liệu.","Dâu, Rắn",1.0,0.43989264277623014,0.0,0.0,0.19704414244816765
Vị thuốc sâm bố chính tham gia vào bài thuốc để chữa những bệnh gì?,"['[{""ChuThe"": ""Vị thuốc Sâm bố chính"", ""QuanHe"": ""Tham gia bài thuốc [Bài thuốc Ăn uống không được, bồn chồn] để chữa"", ""DoiTuong"": ""Bệnh Mắt vàng"", ""LieuDung"": ""Chưa ghi nhận"", ""CachDung"": ""Các vị trên sắc với nước nhiều lần, cô đặc thành cao, mỗi lần uống chừng 2 cốc con, dùng nước hạt sen làm thang. Nếu hay sôi bụng thêm $4g$ đinh hương. Nếu đại tiện lỏng quá thêm $12g$ nhục đậu khấu và $4g$ ngũ vị tử"", ""GhiChu"": """", ""score"": 2.0, ""sort_weight"": 3.0}, {""ChuThe"": ""Vị thuốc Sâm bố chính"", ""QuanHe"": ""Tham gia bài thuốc [Bài thuốc Ăn uống không được, bồn chồn] để chữa"", ""DoiTuong"": ""Bệnh Miệng lở"", ""LieuDung"": ""Chưa ghi nhận"", ""CachDung"": ""Các vị trên sắc với nước nhiều lần, cô đặc thành cao, mỗi lần uống chừng 2 cốc con, dùng nước hạt sen làm thang. Nếu hay sôi bụng thêm $4g$ đinh hương. Nếu đại tiện lỏng quá thêm $12g$ nhục đậu khấu và $4g$ ngũ vị tử"", ""GhiChu"": """", ""score"": 2.0, ""sort_weight"": 3.0}]']","Dựa trên y văn, **Sâm bố chính** tham gia vào bài thuốc [Bài thuốc Ăn uống không được, bồn chồn] để chữa bệnh Mắt vàng và bệnh Miệng lở.

Cách dùng bài thuốc: Các vị trên sắc với nước nhiều lần, cô đặc thành cao, mỗi lần uống chừng 2 cốc con, dùng nước hạt sen làm thang. Nếu hay sôi bụng thêm 4g đinh hương. Nếu đại tiện lỏng quá thêm 12g nhục đậu khấu và 4g ngũ vị tử.","Miệng lở, Mắt vàng",1.0,0.5582979651650463,0.9999999999,1.0,0.4353187793832928
Vị thuốc tần giao có chứa hoạt chất hesperidin không?,['Không có dữ liệu'],"Không. Dựa trên dữ liệu y văn hiện tại, không có ghi nhận nào cho thấy tần giao có liên quan hoặc tác dụng tới hesperidin.","Không, vị thuốc tần giao không chứa hoạt chất hesperidin",0.0,0.8697379946152946,0.0,1.0,0.8438375488113905
Vị thuốc bạch thược có vị vị đắng không?,"['[{""ChuThe"": ""Vị thuốc Bạch thược"", ""QuanHe"": ""Xác nhận: CO_VI"", ""DoiTuong"": ""Vị đắng"", ""LieuDung"": ""Chưa ghi nhận"", ""CachDung"": ""Chưa ghi nhận"", ""GhiChu"": """", ""score"": 2.0, ""sort_weight"": 3.0}]']","Dựa trên y văn, vị thuốc **Bạch thược** có vị đắng.","Có, vị thuốc bạch thược có vị vị đắng",1.0,0.5987646795526635,0.9999999999,1.0,0.9854507114942634
Vị thuốc phèn đen có chứa hoạt chất lộc nhung tinh không?,['Không có dữ liệu'],"Không. Dựa trên dữ liệu y văn hiện tại, không có ghi nhận nào cho thấy phèn đen có liên quan hoặc tác dụng tới lộc nhung tinh.","Không, vị thuốc phèn đen không chứa hoạt chất lộc nhung tinh",0.0,0.6546335615184784,0.0,1.0,0.9933623119888277
Vị thuốc tật lê tham gia vào bài thuốc để chữa những bệnh gì?,"['[{""ChuThe"": ""Vị thuốc Tật lê"", ""QuanHe"": ""Tham gia bài thuốc [Bài thuốc Đau bụng tắt lệ] để chữa"", ""DoiTuong"": ""Bệnh Kinh nguyệt không đều"", ""LieuDung"": ""Chưa ghi nhận"", ""CachDung"": ""Chưa ghi nhận"", ""GhiChu"": """", ""score"": 2.0, ""sort_weight"": 3.0}, {""ChuThe"": ""Vị thuốc Tật lê"", ""QuanHe"": ""Tham gia bài thuốc [Bài thuốc Đau bụng tắt lệ] để chữa"", ""DoiTuong"": ""Triệu chứng Đau bụng"", ""LieuDung"": ""Chưa ghi nhận"", ""CachDung"": ""Chưa ghi nhận"", ""GhiChu"": """", ""score"": 2.0, ""sort_weight"": 3.0}, {""ChuThe"": ""Vị thuốc Tật lê"", ""QuanHe"": ""Tham gia bài thuốc [Bài thuốc Đầu xương óc sơn thù du] để chữa"", ""DoiTuong"": ""Triệu chứng Đầu xương óc"", ""LieuDung"": ""Chưa ghi nhận"", ""CachDung"": ""Sắc uống hằng ngày. Uống luôn trong 20 ngày."", ""GhiChu"": ""[Nguồn]: CT_VT_VN_T929"", ""score"": 2.0, ""sort_weight"": 3.0}]']","Vị thuốc **Tật lê** tham gia vào các bài thuốc để chữa các bệnh sau:

*   Tham gia bài thuốc **Đau bụng tắt lệ** để chữa:
    *   Bệnh Kinh nguyệt không đều
    *   Triệu chứng Đau bụng
*   Tham gia bài thuốc **Đầu xương óc sơn thù du** để chữa:
    *   Triệu chứng Đầu xương óc. Cách dùng: Sắc uống hằng ngày. Uống luôn trong 20 ngày. \[Nguồn]: CT\_VT\_VN\_T929","Kinh nguyệt không đều, Đau bụng, Đầu xương óc",1.0,0.5040274622408036,0.9999999999,1.0,0.8241953108724929
Thuốc nào vừa có tính lương vừa trực tiếp chữa bệnh đau nhức?,['Không có dữ liệu'],Hệ thống y văn hiện tại chưa ghi nhận dữ liệu về vấn đề này.,"Cửu lý hương, Ô rô",1.0,0.0,0.0,0.0,0.22918534980937474
Bệnh nào có thể chữa bằng bài thuốc chứa đảng sâm?,"['[{""ChuThe"": ""Vị thuốc Đảng sâm"", ""QuanHe"": ""Tham gia bài thuốc [Bài thuốc Rối loạn tiêu hóa trần bì] để chữa"", ""DoiTuong"": ""Bệnh Rối loạn tiêu hóa"", ""LieuDung"": ""Chưa ghi nhận"", ""CachDung"": ""Tất cả tán bột, trộn đều. Chia ba lần uống trong ngày"", ""GhiChu"": """", ""score"": 2.0, ""sort_weight"": 3.0}, {""ChuThe"": ""Vị thuốc Đảng sâm"", ""QuanHe"": ""Tham gia bài thuốc [Bài thuốc Ho Kha tử] để chữa"", ""DoiTuong"": ""Bệnh Ho"", ""LieuDung"": ""Chưa ghi nhận"", ""CachDung"": ""Chưa ghi nhận"", ""GhiChu"": """", ""score"": 2.0, ""sort_weight"": 3.0}, {""ChuThe"": ""Vị thuốc Đảng sâm"", ""QuanHe"": ""Tham gia bài thuốc [Bệnh Ung thư tử cung hoàng cung] để chữa"", ""DoiTuong"": ""Bệnh Ung thư tử cung"", ""LieuDung"": ""Tuần đầu uống $4$ thang bổ thận cùng với $7$ ngày uống nước sắc Trinh nữ hoàng cung. $2$ tuần tiếp theo, khi uống Trinh nữ hoàng cung thì mỗi tuần kết hợp uống $3$ thang bổ thận."", ""CachDung"": ""Chưa ghi nhận"", ""GhiChu"": ""Phối hợp Trinh nữ hoàng cung với đơn thuốc Bổ thận (chữa u xơ, ung thư)"", ""score"": 2.0, ""sort_weight"": 3.0}, {""ChuThe"": ""Vị thuốc Đảng sâm"", ""QuanHe"": ""Tham gia bài thuốc [Bệnh Ung thư tử cung hoàng cung] để chữa"", ""DoiTuong"": ""Bệnh U xơ tử cung"", ""LieuDung"": ""Tuần đầu uống $4$ thang bổ thận cùng với $7$ ngày uống nước sắc Trinh nữ hoàng cung. $2$ tuần tiếp theo, khi uống Trinh nữ hoàng cung thì mỗi tuần kết hợp uống $3$ thang bổ thận."", ""CachDung"": ""Chưa ghi nhận"", ""GhiChu"": ""Phối hợp Trinh nữ hoàng cung với đơn thuốc Bổ thận (chữa u xơ, ung thư)"", ""score"": 2.0, ""sort_weight"": 3.0}, {""ChuThe"": ""Vị thuốc Đảng sâm"", ""QuanHe"": ""Tham gia bài thuốc [Triệu chứng Đi lại khó khăn mọc quạ] để chữa"", ""DoiTuong"": ""Bệnh Chân tay cứng đờ"", ""LieuDung"": ""Chưa ghi nhận"", ""CachDung"": ""Chưa ghi nhận"", ""GhiChu"": """", ""score"": 2.0, ""sort_weight"": 3.0}, {""ChuThe"": ""Vị thuốc Đảng sâm"", ""QuanHe"": ""Tham gia bài thuốc [Triệu chứng Đi lại khó khăn mọc quạ] để chữa"", ""DoiTuong"": ""Bệnh Đi lại khó khăn"", ""LieuDung"": ""Chưa ghi nhận"", ""CachDung"": ""Chưa ghi nhận"", ""GhiChu"": """", ""score"": 2.0, ""sort_weight"": 3.0}, {""ChuThe"": ""Vị thuốc Đảng sâm"", ""QuanHe"": ""Tham gia bài thuốc [Triệu chứng Đi lại khó khăn mọc quạ] để chữa"", ""DoiTuong"": ""Bệnh Gan cốt yếu"", ""LieuDung"": ""Chưa ghi nhận"", ""CachDung"": ""Chưa ghi nhận"", ""GhiChu"": """", ""score"": 2.0, ""sort_weight"": 3.0}, {""ChuThe"": ""Vị thuốc Đảng sâm"", ""QuanHe"": ""Tham gia bài thuốc [Triệu chứng Đi lại khó khăn mọc quạ] để chữa"", ""DoiTuong"": ""Bệnh Lưng gối đau nhức"", ""LieuDung"": ""Chưa ghi nhận"", ""CachDung"": ""Chưa ghi nhận"", ""GhiChu"": """", ""score"": 2.0, ""sort_weight"": 3.0}, {""ChuThe"": ""Vị thuốc Đảng sâm"", ""QuanHe"": ""Tham gia bài thuốc [Bài thuốc Hư lao Thạch hộc] để chữa"", ""DoiTuong"": ""Bệnh Hư lao"", ""LieuDung"": ""Chưa ghi nhận"", ""CachDung"": ""Chưa ghi nhận"", ""GhiChu"": """", ""score"": 2.0, ""sort_weight"": 3.0}, {""ChuThe"": ""Vị thuốc Đảng sâm"", ""QuanHe"": ""Tham gia bài thuốc [Bài thuốc Mồ hôi trộm Thanh cao] để chữa"", ""DoiTuong"": ""Bệnh Thương hàn"", ""LieuDung"": ""Chưa ghi nhận"", ""CachDung"": ""Chưa ghi nhận"", ""GhiChu"": """", ""score"": 2.0, ""sort_weight"": 3.0}, {""ChuThe"": ""Vị thuốc Đảng sâm"", ""QuanHe"": ""Tham gia bài thuốc [Bài thuốc Mồ hôi trộm Thanh cao] để chữa"", ""DoiTuong"": ""Bệnh Phổi"", ""LieuDung"": ""Chưa ghi nhận"", ""CachDung"": ""Chưa ghi nhận"", ""GhiChu"": """", ""score"": 2.0, ""sort_weight"": 3.0}, {""ChuThe"": ""Vị thuốc Đảng sâm"", ""QuanHe"": ""Tham gia bài thuốc [Bài thuốc Mồ hôi trộm Thanh cao] để chữa"", ""DoiTuong"": ""Triệu chứng Mồ hôi trộm"", ""LieuDung"": ""Chưa ghi nhận"", ""CachDung"": ""Chưa ghi nhận"", ""GhiChu"": """", ""score"": 2.0, ""sort_weight"": 3.0}, {""ChuThe"": ""Vị thuốc Đảng sâm"", ""QuanHe"": ""Tham gia bài thuốc [Bài thuốc Ho khan, thở hổn hển lâu ngày mạch môn đông] để chữa"", ""DoiTuong"": ""Triệu chứng Ho"", ""LieuDung"": ""Chưa ghi nhận"", ""CachDung"": ""Nước $600$ml. Sắc còn $200$ml. Chia làm 3 lần uống trong ngày"", ""GhiChu"": ""đơn thuốc của Trương Trọng Cảnh"", ""score"": 2.0, ""sort_weight"": 3.0}, {""ChuThe"": ""Vị thuốc Đảng sâm"", ""QuanHe"": ""Tham gia bài thuốc [Bài thuốc Ho khan, thở hổn hển lâu ngày mạch môn đông] để chữa"", ""DoiTuong"": ""Triệu chứng Ho lâu ngày"", ""LieuDung"": ""Chưa ghi nhận"", ""CachDung"": ""Nước $600$ml. Sắc còn $200$ml. Chia làm 3 lần uống trong ngày"", ""GhiChu"": ""đơn thuốc của Trương Trọng Cảnh"", ""score"": 2.0, ""sort_weight"": 3.0}, {""ChuThe"": ""Vị thuốc Đảng sâm"", ""QuanHe"": ""Tham gia bài thuốc [Bài thuốc Ho đảng sâm] để chữa"", ""DoiTuong"": ""Bệnh Lao"", ""LieuDung"": ""Chưa ghi nhận"", ""CachDung"": ""Nước $600ml$ sắc còn $200ml$. Chia 3 lần uống trong ngày"", ""GhiChu"": ""đơn của Diệp Quyết Tuyên"", ""score"": 2.0, ""sort_weight"": 3.0}, {""ChuThe"": ""Vị thuốc Đảng sâm"", ""QuanHe"": ""Tham gia bài thuốc [Bài thuốc Ho đảng sâm] để chữa"", ""DoiTuong"": ""Triệu chứng Ho"", ""LieuDung"": ""Chưa ghi nhận"", ""CachDung"": ""Nước $600ml$ sắc còn $200ml$. Chia 3 lần uống trong ngày"", ""GhiChu"": ""đơn của Diệp Quyết Tuyên"", ""score"": 2.0, ""sort_weight"": 3.0}, {""ChuThe"": ""Vị thuốc Đảng sâm"", ""QuanHe"": ""Tham gia bài thuốc [Bài thuốc Tim Yếu Tắc Kè] để chữa"", ""DoiTuong"": ""Bệnh Tim yếu"", ""LieuDung"": ""Ngày uống 3 lần, mỗi lần 1 đến 2 viên"", ""CachDung"": ""Tắc kè một đôi bỏ đầu, chân, sấy khô tán nhỏ, đảng sâm $20g$, quy bản nướng tán bột $20g$, bắc sa nhân $20g$ tán bột. Tất cả trộn đều. Thêm vị táo đỏ và giã nát làm thành viên, mỗi viên nặng $1g$. Ngày uống 3 lần, mỗi lần 1 đến 2 viên, nhai và dùng nước mà chiêu thuốc"", ""GhiChu"": ""Ho lao, già mà ho nhiều đờm, tim yếu. CT_VT_VN_T971"", ""score"": 2.0, ""sort_weight"": 3.0}, {""ChuThe"": ""Vị thuốc Đảng sâm"", ""QuanHe"": ""Tham gia bài thuốc [Bài thuốc Tim Yếu Tắc Kè] để chữa"", ""DoiTuong"": ""Bệnh Hư lao"", ""LieuDung"": ""Ngày uống 3 lần, mỗi lần 1 đến 2 viên"", ""CachDung"": ""Tắc kè một đôi bỏ đầu, chân, sấy khô tán nhỏ, đảng sâm $20g$, quy bản nướng tán bột $20g$, bắc sa nhân $20g$ tán bột. Tất cả trộn đều. Thêm vị táo đỏ và giã nát làm thành viên, mỗi viên nặng $1g$. Ngày uống 3 lần, mỗi lần 1 đến 2 viên, nhai và dùng nước mà chiêu thuốc"", ""GhiChu"": ""Ho lao, già mà ho nhiều đờm, tim yếu. CT_VT_VN_T971"", ""score"": 2.0, ""sort_weight"": 3.0}, {""ChuThe"": ""Vị thuốc Đảng sâm"", ""QuanHe"": ""Tham gia bài thuốc [Bài thuốc Tim Yếu Tắc Kè] để chữa"", ""DoiTuong"": ""Triệu chứng Ho nhiều đờm"", ""LieuDung"": ""Ngày uống 3 lần, mỗi lần 1 đến 2 viên"", ""CachDung"": ""Tắc kè một đôi bỏ đầu, chân, sấy khô tán nhỏ, đảng sâm $20g$, quy bản nướng tán bột $20g$, bắc sa nhân $20g$ tán bột. Tất cả trộn đều. Thêm vị táo đỏ và giã nát làm thành viên, mỗi viên nặng $1g$. Ngày uống 3 lần, mỗi lần 1 đến 2 viên, nhai và dùng nước mà chiêu thuốc"", ""GhiChu"": ""Ho lao, già mà ho nhiều đờm, tim yếu. CT_VT_VN_T971"", ""score"": 2.0, ""sort_weight"": 3.0}, {""ChuThe"": ""Vị thuốc Đảng sâm"", ""QuanHe"": ""Tham gia bài thuốc [Bài thuốc Ho lâu ngày quy bản] để chữa"", ""DoiTuong"": ""Triệu chứng Ho lâu ngày"", ""LieuDung"": ""Chưa ghi nhận"", ""CachDung"": ""Hai vị trộn đều, ngày uống 3 lần mỗi lần $1-2g$"", ""GhiChu"": ""[Nguồn]: CT_VT_VN_T1019"", ""score"": 2.0, ""sort_weight"": 3.0}]']","Dựa trên y văn, vị thuốc **Đảng sâm** tham gia vào các bài thuốc chữa các bệnh sau:

*   Bệnh Rối loạn tiêu hóa: Tham gia bài thuốc **Rối loạn tiêu hóa trần bì**. Cách dùng: Tất cả tán bột, trộn đều. Chia ba lần uống trong ngày.
*   Bệnh Ho: Tham gia bài thuốc **Ho Kha tử**.
*   Bệnh Ung thư tử cung và U xơ tử cung: Tham gia bài thuốc **Ung thư tử cung hoàng cung**. Liều dùng: Tuần đầu uống 4 thang bổ thận cùng với 7 ngày uống nước sắc Trinh nữ hoàng cung. 2 tuần tiếp theo, khi uống Trinh nữ hoàng cung thì mỗi tuần kết hợp uống 3 thang bổ thận. Ghi chú: Phối hợp Trinh nữ hoàng cung với đơn thuốc Bổ thận (chữa u xơ, ung thư).
*   Bệnh Chân tay cứng đờ, Đi lại khó khăn, Gan cốt yếu, Lưng gối đau nhức: Tham gia bài thuốc **Đi lại khó khăn mọc quạ**.
*   Bệnh Hư lao: Tham gia bài thuốc **Hư lao Thạch hộc** và bài thuốc **Tim Yếu Tắc Kè**. Bài thuốc **Tim Yếu Tắc Kè**: Ngày uống 3 lần, mỗi lần 1 đến 2 viên. Cách dùng: Tắc kè một đôi bỏ đầu, chân, sấy khô tán nhỏ, đảng sâm 20g, quy bản nướng tán bột 20g, bắc sa nhân 20g tán bột. Tất cả trộn đều. Thêm vị táo đỏ và giã nát làm thành viên, mỗi viên nặng 1g. Ngày uống 3 lần, mỗi lần 1 đến 2 viên, nhai và dùng nước mà chiêu thuốc.
*   Bệnh Thương hàn và Phổi: Tham gia bài thuốc **Mồ hôi trộm Thanh cao**.
*   Bệnh Lao: Tham gia bài thuốc **Ho đảng sâm**. Cách dùng: Nước 600ml sắc còn 200ml. Chia 3 lần uống trong ngày.
*   Bệnh Tim yếu: Tham gia bài thuốc **Tim Yếu Tắc Kè**. Ngày uống 3 lần, mỗi lần 1 đến 2 viên. Cách dùng: Tắc kè một đôi bỏ đầu, chân, sấy khô tán nhỏ, đảng sâm 20g, quy bản nướng tán bột 20g, bắc sa nhân 20g tán bột. Tất cả trộn đều. Thêm vị táo đỏ và giã nát làm thành viên, mỗi viên nặng 1g. Ngày uống 3 lần, mỗi lần 1 đến 2 viên, nhai và dùng nước mà chiêu thuốc.

Ngoài ra, **Đảng sâm** còn được dùng để chữa các triệu chứng sau:

*   Triệu chứng Mồ hôi trộm: Tham gia bài thuốc **Mồ hôi trộm Thanh cao**.
*   Triệu chứng Ho và Ho lâu ngày: Tham gia bài thuốc **Ho khan, thở hổn hển lâu ngày mạch môn đông**. Cách dùng: Nước 600ml. Sắc còn 200ml. Chia làm 3 lần uống trong ngày.
*   Triệu chứng Ho: Tham gia bài thuốc **Ho đảng sâm**. Cách dùng: Nước 600ml sắc còn 200ml. Chia 3 lần uống trong ngày.
*   Triệu chứng Ho nhiều đờm: Tham gia bài thuốc **Tim Yếu Tắc Kè**. Ngày uống 3 lần, mỗi lần 1 đến 2 viên. Cách dùng: Tắc kè một đôi bỏ đầu, chân, sấy khô tán nhỏ, đảng sâm 20g, quy bản nướng tán bột 20g, bắc sa nhân 20g tán bột. Tất cả trộn đều. Thêm vị táo đỏ và giã nát làm thành viên, mỗi viên nặng 1g. Ngày uống 3 lần, mỗi lần 1 đến 2 viên, nhai và dùng nước mà chiêu thuốc.
*   Triệu chứng Ho lâu ngày: Tham gia bài thuốc **Ho lâu ngày quy bản**. Cách dùng: Hai vị trộn đều, ngày uống 3 lần mỗi lần 1-2g.","Chân tay cứng đờ, Gan cốt yếu, Ho, Hư lao, Lao, Lưng gối đau nhức, Phổi, Rối loạn tiêu hóa, Thương hàn, Tim yếu, U xơ tử cung, Ung thư tử cung, Đi lại khó khăn, Ho, Ho lâu ngày, Ho nhiều đờm, Mồ hôi trộm",1.0,0.5779311268293339,0.9999999999,1.0,0.5935829255708351
Vị thuốc bồ kết có công năng gì?,"['[{""ChuThe"": ""Vị thuốc Bồ kết"", ""QuanHe"": ""CO_VI"", ""DoiTuong"": ""Vị mặn"", ""LieuDung"": ""Chưa ghi nhận"", ""CachDung"": ""Chưa ghi nhận"", ""GhiChu"": """", ""score"": 2.0}, {""ChuThe"": ""Vị thuốc Bồ kết"", ""QuanHe"": ""CO_VI"", ""DoiTuong"": ""Vị cay"", ""LieuDung"": ""Chưa ghi nhận"", ""CachDung"": ""Chưa ghi nhận"", ""GhiChu"": """", ""score"": 2.0}, {""ChuThe"": ""Vị thuốc Bồ kết"", ""QuanHe"": ""CO_TINH"", ""DoiTuong"": ""Ôn"", ""LieuDung"": ""Chưa ghi nhận"", ""CachDung"": ""Chưa ghi nhận"", ""GhiChu"": """", ""score"": 2.0}, {""ChuThe"": ""Vị thuốc Bồ kết"", ""QuanHe"": ""CHU_TRI_BENH"", ""DoiTuong"": ""Bệnh Lỵ"", ""LieuDung"": ""Ngày dùng 10 đến 20 viên"", ""CachDung"": ""Tán nhỏ, dùng hồ nếp viên bằng hạt ngô. Dùng nước chè đặc mà chiêu thuốc (nên uống buổi sáng sớm khỏi mất ngủ)"", ""GhiChu"": ""Hạt bồ kết sao vàng"", ""score"": 2.0}, {""ChuThe"": ""Vị thuốc Bồ kết"", ""QuanHe"": ""CHU_TRI_TRIEU_CHUNG"", ""DoiTuong"": ""Triệu chứng Nhức răng"", ""LieuDung"": ""Tham khảo liều dùng chung của vị thuốc"", ""CachDung"": ""Tán nhỏ, đắp vào chân răng, hễ chảy dãi ra thì nhổ đi"", ""GhiChu"": ""Quả bồ kết"", ""score"": 2.0}, {""ChuThe"": ""Vị thuốc Bồ kết"", ""QuanHe"": ""CHU_TRI_TRIEU_CHUNG"", ""DoiTuong"": ""Triệu chứng Rụng tóc"", ""LieuDung"": ""Tham khảo liều dùng chung của vị thuốc"", ""CachDung"": ""Đốt ra than, tán nhỏ rửa sạch vết chốc, rồi đắp than bồ kết lên"", ""GhiChu"": ""Trẻ con chốc đầu"", ""score"": 2.0}, {""ChuThe"": ""Vị thuốc Bồ kết"", ""QuanHe"": ""CHU_TRI_TRIEU_CHUNG"", ""DoiTuong"": ""Triệu chứng Bí đại tiện"", ""LieuDung"": ""Lấy $1/4$ quả"", ""CachDung"": ""Lấy $1/4$ quả bồ kết, nướng thật vàng, đừng nướng cháy quá hay còn sống, bỏ hột đi rồi tán thành bột nhỏ. Lấy canulơ, đầu có bôivadolin hay dầu, chấm vào bột bồ kết. Cho vào hậu môn sâu độ $3-4cm$, cứ thế làm $3-4$ lần cho bột vào trong hậu môn, sau 2 đến 5 phút bệnh nhân đi ngoài được"", ""GhiChu"": """", ""score"": 2.0}, {""ChuThe"": ""Vị thuốc Bồ kết"", ""QuanHe"": ""CO_CONG_NANG"", ""DoiTuong"": ""Công năng Tan"", ""LieuDung"": ""Chưa ghi nhận"", ""CachDung"": ""Chưa ghi nhận"", ""GhiChu"": """", ""score"": 2.0, ""sort_weight"": 3.0}, {""ChuThe"": ""Vị thuốc Bồ kết"", ""QuanHe"": ""CO_CONG_NANG"", ""DoiTuong"": ""Công năng Ôn"", ""LieuDung"": ""Chưa ghi nhận"", ""CachDung"": ""Chưa ghi nhận"", ""GhiChu"": """", ""score"": 2.0, ""sort_weight"": 3.0}, {""ChuThe"": ""Vị thuốc Bồ kết"", ""QuanHe"": ""CO_CONG_NANG"", ""DoiTuong"": ""Công năng Mạn"", ""LieuDung"": ""Chưa ghi nhận"", ""CachDung"": ""Chưa ghi nhận"", ""GhiChu"": """", ""score"": 2.0, ""sort_weight"": 3.0}, {""ChuThe"": ""Vị thuốc Bồ kết"", ""QuanHe"": ""CO_TAC_DUNG_DUOC_LY"", ""DoiTuong"": ""Dược lý Trừ đờm"", ""LieuDung"": ""Chưa ghi nhận"", ""CachDung"": ""Chưa ghi nhận"", ""GhiChu"": """", ""score"": 2.0}, {""ChuThe"": ""Vị thuốc Bồ kết"", ""QuanHe"": ""CO_TAC_DUNG_DUOC_LY"", ""DoiTuong"": ""Dược lý Chống siêu vi trùng"", ""LieuDung"": ""Chưa ghi nhận"", ""CachDung"": ""Chưa ghi nhận"", ""GhiChu"": """", ""score"": 2.0}, {""ChuThe"": ""Vị thuốc Bồ kết"", ""QuanHe"": ""CO_TAC_DUNG_DUOC_LY"", ""DoiTuong"": ""Dược lý Đối với trùng roi âm đạo"", ""LieuDung"": ""Chưa ghi nhận"", ""CachDung"": ""Chưa ghi nhận"", ""GhiChu"": """", ""score"": 2.0}, {""ChuThe"": ""Vị thuốc Bồ kết"", ""QuanHe"": ""CO_TAC_DUNG_DUOC_LY"", ""DoiTuong"": ""Dược lý Độc tính"", ""LieuDung"": ""Chưa ghi nhận"", ""CachDung"": ""Chưa ghi nhận"", ""GhiChu"": ""LD50 (thỏ, tiêm tĩnh mạch): $40-47mg$/kg"", ""score"": 2.0}, {""ChuThe"": ""Vị thuốc Bồ kết"", ""QuanHe"": ""CO_TAC_DUNG_DUOC_LY"", ""DoiTuong"": ""Công năng Giảm đau"", ""LieuDung"": ""Chưa ghi nhận"", ""CachDung"": ""Chưa ghi nhận"", ""GhiChu"": """", ""score"": 2.0}, {""ChuThe"": ""Vị thuốc Bồ kết"", ""QuanHe"": ""CO_CHUA_HOAT_CHAT"", ""DoiTuong"": ""Hoạt chất Saponin"", ""LieuDung"": ""Chưa ghi nhận"", ""CachDung"": ""Chưa ghi nhận"", ""GhiChu"": ""Không có thông tin"", ""score"": 2.0}, {""ChuThe"": ""Vị thuốc Bồ kết"", ""QuanHe"": ""CO_CHUA_HOAT_CHAT"", ""DoiTuong"": ""Hoạt chất Galactoza"", ""LieuDung"": ""Chưa ghi nhận"", ""CachDung"": ""Chưa ghi nhận"", ""GhiChu"": ""Không có thông tin"", ""score"": 2.0}, {""ChuThe"": ""Vị thuốc Bồ kết"", ""QuanHe"": ""CO_CHUA_HOAT_CHAT"", ""DoiTuong"": ""Hoạt chất Glucoza"", ""LieuDung"": ""Chưa ghi nhận"", ""CachDung"": ""Chưa ghi nhận"", ""GhiChu"": ""Không có thông tin"", ""score"": 2.0}, {""ChuThe"": ""Vị thuốc Bồ kết"", ""QuanHe"": ""CO_CHUA_HOAT_CHAT"", ""DoiTuong"": ""Hoạt chất Xyloza"", ""LieuDung"": ""Chưa ghi nhận"", ""CachDung"": ""Chưa ghi nhận"", ""GhiChu"": ""Không có thông tin"", ""score"": 2.0}, {""ChuThe"": ""Vị thuốc Bồ kết"", ""QuanHe"": ""CO_CHUA_HOAT_CHAT"", ""DoiTuong"": ""Hoạt chất Flavonoid"", ""LieuDung"": ""Chưa ghi nhận"", ""CachDung"": ""Chưa ghi nhận"", ""GhiChu"": ""Không có thông tin"", ""score"": 2.0}, {""ChuThe"": ""Vị thuốc Bồ kết"", ""QuanHe"": ""CO_CHUA_HOAT_CHAT"", ""DoiTuong"": ""Hoạt chất Arabinoza"", ""LieuDung"": ""Chưa ghi nhận"", ""CachDung"": ""Chưa ghi nhận"", ""GhiChu"": ""Không có thông tin"", ""score"": 2.0}, {""ChuThe"": ""Vị thuốc Bồ kết"", ""QuanHe"": ""CO_CHUA_HOAT_CHAT"", ""DoiTuong"": ""Hoạt chất Axit Oleanolic"", ""LieuDung"": ""Chưa ghi nhận"", ""CachDung"": ""Chưa ghi nhận"", ""GhiChu"": ""Không có thông tin"", ""score"": 2.0}, {""ChuThe"": ""Vị thuốc Bồ kết"", ""QuanHe"": ""CO_CHUA_HOAT_CHAT"", ""DoiTuong"": ""Luteolin"", ""LieuDung"": ""Chưa ghi nhận"", ""CachDung"": ""Chưa ghi nhận"", ""GhiChu"": ""Không có thông tin"", ""score"": 2.0}, {""ChuThe"": ""Vị thuốc Bồ kết"", ""QuanHe"": ""CO_CHUA_HOAT_CHAT"", ""DoiTuong"": ""Hoạt chất Vitexin"", ""LieuDung"": ""Chưa ghi nhận"", ""CachDung"": ""Chưa ghi nhận"", ""GhiChu"": ""Không có thông tin"", ""score"": 2.0}, {""ChuThe"": ""Vị thuốc Bồ kết"", ""QuanHe"": ""CO_CHUA_HOAT_CHAT"", ""DoiTuong"": ""Hoạt chất Australozit"", ""LieuDung"": ""Chưa ghi nhận"", ""CachDung"": ""Chưa ghi nhận"", ""GhiChu"": ""Không có thông tin"", ""score"": 2.0}, {""ChuThe"": ""Vị thuốc Bồ kết"", ""QuanHe"": ""CO_CHUA_HOAT_CHAT"", ""DoiTuong"": ""Hoạt chất Axit Echinoxystic"", ""LieuDung"": ""Chưa ghi nhận"", ""CachDung"": ""Chưa ghi nhận"", ""GhiChu"": ""Không có thông tin"", ""score"": 2.0}, {""ChuThe"": ""Vị thuốc Bồ kết"", ""QuanHe"": ""CO_CHUA_HOAT_CHAT"", ""DoiTuong"": ""Hoạt chất Gleditsapogenin"", ""LieuDung"": ""Chưa ghi nhận"", ""CachDung"": ""Chưa ghi nhận"", ""GhiChu"": ""Không có thông tin"", ""score"": 2.0}, {""ChuThe"": ""Vị thuốc Bồ kết"", ""QuanHe"": ""CO_CHUA_HOAT_CHAT"", ""DoiTuong"": ""Hoạt chất Gleditsaponin"", ""LieuDung"": ""Chưa ghi nhận"", ""CachDung"": ""Chưa ghi nhận"", ""GhiChu"": ""Không có thông tin"", ""score"": 2.0}, {""ChuThe"": ""Vị thuốc Bồ kết"", ""QuanHe"": ""CO_CHUA_HOAT_CHAT"", ""DoiTuong"": ""Hoạt chất Homoorientin"", ""LieuDung"": ""Chưa ghi nhận"", ""CachDung"": ""Chưa ghi nhận"", ""GhiChu"": ""Không có thông tin"", ""score"": 2.0}, {""ChuThe"": ""Vị thuốc Gai bồ kết"", ""QuanHe"": ""Thông tin chung"", ""DoiTuong"": ""Không có"", ""LieuDung"": ""Chưa ghi nhận"", ""CachDung"": ""Chưa ghi nhận"", ""GhiChu"": """", ""score"": 2.0}]']","Vị thuốc **Bồ kết** có các công năng sau:

*   Công năng Tan
*   Công năng Ôn
*   Công năng Mạn

Về liều dùng và cách dùng của vị thuốc này, hiện tại y văn chưa ghi nhận.","Mạn, Tan, Ôn",1.0,0.0,0.9999999999,1.0,0.7546639177213281
"Để chữa bệnh mụn nhọt đinh độc, vị thuốc đậu sị được dùng với liều lượng và cách thức như thế nào?","['[{""ChuThe"": ""Vị thuốc Đậu sị"", ""QuanHe"": ""CHU_TRI_BENH"", ""DoiTuong"": ""Bệnh Mụn nhọt đinh độc"", ""LieuDung"": ""Tham khảo liều dùng chung của vị thuốc"", ""CachDung"": ""Nấu nhừ nát, đắp vào nơi sưng đau. Chừng 3-4 lần thấy đỡ và khỏi"", ""GhiChu"": ""CT_VT_VN_T704"", ""score"": 2.0, ""sort_weight"": 3.0}]']","Để chữa bệnh mụn nhọt đinh độc, bạn có thể tham khảo cách dùng vị thuốc **Đậu sị** như sau:

*   **Liều dùng và cách dùng:** Nấu nhừ nát **Đậu sị**, đắp vào nơi sưng đau. Thực hiện chừng 3-4 lần sẽ thấy đỡ và khỏi.
*   **Liều dùng:** Tham khảo liều dùng chung của vị thuốc.","Để chữa bệnh mụn nhọt đinh độc, vị thuốc đậu sị có liều dùng: Tham khảo liều dùng chung của vị thuốc và cách dùng: Nấu nhừ nát, đắp vào nơi sưng đau. Chừng 3-4 lần thấy đỡ và khỏi",1.0,0.509443415033048,0.9999999999,1.0,0.9935966367374889
"Để chữa bệnh băng huyết tử cung, vị thuốc ô rô được dùng với liều lượng và cách thức như thế nào?","['[{""ChuThe"": ""Vị thuốc Ô rô"", ""QuanHe"": ""CHU_TRI_BENH"", ""DoiTuong"": ""Bệnh Băng huyết tử cung"", ""LieuDung"": ""$8-12g$"", ""CachDung"": ""Ngày dùng"", ""GhiChu"": ""Kinh nguyệt quá nhiều"", ""score"": 2.0, ""sort_weight"": 3.0}]']","Để chữa bệnh băng huyết tử cung, bạn có thể dùng vị thuốc **Ô rô** với liều lượng 8-12g mỗi ngày. Vị thuốc này được dùng khi kinh nguyệt ra quá nhiều.","Để chữa bệnh băng huyết tử cung, vị thuốc ô rô có liều dùng: 8-12g và cách dùng: Ngày dùng",1.0,0.4325281640401155,0.9999999999,1.0,0.5403767672821465
"Để chữa bệnh viêm thận, vị thuốc xương sáo được dùng với liều lượng và cách thức như thế nào?","['[{""ChuThe"": ""Vị thuốc Xương sáo"", ""QuanHe"": ""CHU_TRI_BENH"", ""DoiTuong"": ""Bệnh Viêm thận"", ""LieuDung"": ""Chưa ghi nhận"", ""CachDung"": ""Dạng thuốc sắc"", ""GhiChu"": """", ""score"": 2.0, ""sort_weight"": 3.0}]']","**Vị thuốc Xương sáo** được dùng để chữa bệnh Viêm thận dưới dạng thuốc sắc. Hiện tại, hệ thống y văn chưa ghi nhận liều dùng cụ thể của vị thuốc này.","Để chữa bệnh viêm thận, vị thuốc xương sáo có liều dùng: Theo chỉ định và cách dùng: Dạng thuốc sắc",1.0,0.0,0.9999999999,1.0,0.4842154453196017
Vị thuốc thân tóc rối có chứa hoạt chất demetyltetrandrin không?,['Không có dữ liệu'],"Không. Dựa trên dữ liệu y văn hiện tại, không có ghi nhận nào cho thấy thân tóc rối có liên quan hoặc tác dụng tới demetyltetrandrin.","Không, vị thuốc thân tóc rối không chứa hoạt chất demetyltetrandrin",0.0,0.8509001426312622,0.0,1.0,0.8441880930197376
Vị thuốc đại táo có hoạt chất caroten không?,['Không có dữ liệu'],"Không. Dựa trên dữ liệu y văn hiện tại, không có ghi nhận nào cho thấy đại táo có liên quan hoặc tác dụng tới caroten.","Có, vị thuốc đại táo có hoạt chất caroten",0.0,0.8191892836294684,0.0,0.0,0.2427761203943573
Bệnh nào có thể chữa bằng bài thuốc chứa vỏ quýt?,"['[{""ChuThe"": ""Vị thuốc Vỏ quýt"", ""QuanHe"": ""Tham gia bài thuốc [Bài thuốc Bụng đầy trướng thìa là] để chữa"", ""DoiTuong"": ""Triệu chứng Bụng đầy trướng"", ""LieuDung"": ""Chưa ghi nhận"", ""CachDung"": ""Chưa ghi nhận"", ""GhiChu"": """", ""score"": 2.0, ""sort_weight"": 3.0}, {""ChuThe"": ""Vị thuốc Vỏ quýt"", ""QuanHe"": ""Tham gia bài thuốc [Bài thuốc Ho Lâu Ngày Hồng Xiêm] để chữa"", ""DoiTuong"": ""Bệnh Ho lâu ngày"", ""LieuDung"": ""Chưa ghi nhận"", ""CachDung"": ""Sắc với $400ml$ nước còn $100ml$, uống làm hai lần trong ngày."", ""GhiChu"": """", ""score"": 2.0, ""sort_weight"": 3.0}]']","Dựa trên y văn, **Vỏ quýt** có thể tham gia vào các bài thuốc để chữa các bệnh sau:

*   Triệu chứng Bụng đầy trướng: Tham gia bài thuốc **Bụng đầy trướng thìa là**.
*   Bệnh Ho lâu ngày: Tham gia bài thuốc **Ho Lâu Ngày Hồng Xiêm**. Cách dùng: Sắc với 400ml nước còn 100ml, uống làm hai lần trong ngày.","Ho lâu ngày, Bụng đầy trướng",1.0,0.4221246694949896,0.9999999999,1.0,0.4895418607357141
"Để chữa bệnh cúm, vị thuốc tràm và tinh dầu tràm được dùng với liều lượng và cách thức như thế nào?","['[{""ChuThe"": ""Vị thuốc Tràm và tinh dầu tràm"", ""QuanHe"": ""CHU_TRI_BENH"", ""DoiTuong"": ""Bệnh Cúm"", ""LieuDung"": ""5-10 hay 20$\\\\%$"", ""CachDung"": ""Dùng với tên gomenol (buile goménolée) để nhỏ mũi"", ""GhiChu"": ""Dung dịch tinh dầu tràm trong dầu. CT_VT_VN_T759. Cúm, ngạt mũi"", ""score"": 2.0, ""sort_weight"": 3.0}]']","Để chữa bệnh cúm, **vị thuốc Tràm và tinh dầu tràm** được dùng như sau:

*   **Liều dùng:** 5-10 hay 20%.
*   **Cách dùng:** Dùng với tên gomenol (buile goménolée) để nhỏ mũi. Đây là dung dịch tinh dầu tràm trong dầu, dùng để trị cúm và ngạt mũi.","Để chữa bệnh cúm, vị thuốc tràm và tinh dầu tràm có liều dùng: 5-10 hay 20\% và cách dùng: Dùng với tên gomenol (buile goménolée) để nhỏ mũi",1.0,0.46980768744558543,0.9999999999,1.0,0.8065164421749337
Thuốc nào vừa có tính ôn vừa trực tiếp chữa bệnh lỵ ra máu?,"['[{""ChuThe"": ""Vị thuốc Tam thất"", ""QuanHe"": ""Thỏa mãn đồng thời"", ""DoiTuong"": ""Ôn và Bệnh Lỵ ra máu"", ""LieuDung"": ""Chưa ghi nhận"", ""CachDung"": ""Chưa ghi nhận"", ""GhiChu"": """", ""score"": 2.0}, {""ChuThe"": ""Vị thuốc Tóc rối"", ""QuanHe"": ""Thỏa mãn đồng thời"", ""DoiTuong"": ""Ôn và Bệnh Lỵ ra máu"", ""LieuDung"": ""Chưa ghi nhận"", ""CachDung"": ""Chưa ghi nhận"", ""GhiChu"": """", ""score"": 2.0}]']",Hệ thống y văn hiện tại chưa ghi nhận dữ liệu về vấn đề này.,"Tam thất, Tóc rối",1.0,0.0,0.9999999999,1.0,0.24090318285961948
Vị thuốc thị đế chứa hoạt chất gì?,"['[{""ChuThe"": ""Vị thuốc Thị đế"", ""QuanHe"": ""CO_CHUA_HOAT_CHAT"", ""DoiTuong"": ""Hoạt chất Axit Ursolic"", ""LieuDung"": ""Chưa ghi nhận"", ""CachDung"": ""Chưa ghi nhận"", ""GhiChu"": ""trong tai hồng (thị đế)"", ""score"": 2.0, ""sort_weight"": 3.0}, {""ChuThe"": ""Vị thuốc Thị đế"", ""QuanHe"": ""CO_CHUA_HOAT_CHAT"", ""DoiTuong"": ""Hoạt chất Manit"", ""LieuDung"": ""Chưa ghi nhận"", ""CachDung"": ""Chưa ghi nhận"", ""GhiChu"": """", ""score"": 2.0, ""sort_weight"": 3.0}, {""ChuThe"": ""Vị thuốc Thị đế"", ""QuanHe"": ""CO_CHUA_HOAT_CHAT"", ""DoiTuong"": ""Axit betulinic"", ""LieuDung"": ""Chưa ghi nhận"", ""CachDung"": ""Chưa ghi nhận"", ""GhiChu"": ""trong tai hồng (thị đế)"", ""score"": 2.0, ""sort_weight"": 3.0}, {""ChuThe"": ""Vị thuốc Thị đế"", ""QuanHe"": ""CO_CHUA_HOAT_CHAT"", ""DoiTuong"": ""Axit tritecpenic"", ""LieuDung"": ""Chưa ghi nhận"", ""CachDung"": ""Chưa ghi nhận"", ""GhiChu"": ""trong tai hồng (thị đế)"", ""score"": 2.0, ""sort_weight"": 3.0}, {""ChuThe"": ""Vị thuốc Thị đế"", ""QuanHe"": ""CO_CHUA_HOAT_CHAT"", ""DoiTuong"": ""Oleanolic"", ""LieuDung"": ""Chưa ghi nhận"", ""CachDung"": ""Chưa ghi nhận"", ""GhiChu"": ""trong tai hồng (thị đế)"", ""score"": 2.0, ""sort_weight"": 3.0}, {""ChuThe"": ""Vị thuốc Thị đế"", ""QuanHe"": ""CO_CHUA_HOAT_CHAT"", ""DoiTuong"": ""Shibuol"", ""LieuDung"": ""Chưa ghi nhận"", ""CachDung"": ""Chưa ghi nhận"", ""GhiChu"": """", ""score"": 2.0, ""sort_weight"": 3.0}]']","Vị thuốc **Thị đế** chứa các hoạt chất sau:

*   Axit Ursolic (trong tai hồng)
*   Manit
*   Axit betulinic (trong tai hồng)
*   Axit tritecpenic (trong tai hồng)
*   Oleanolic (trong tai hồng)
*   Shibuol","Axit betulinic, Axit tritecpenic, Axit Ursolic, Manit, Oleanolic, Shibuol",1.0,0.5451312394725364,0.9999999999,1.0,0.9101030864956023
Bệnh đẻ xong ra huyết nhiều có thể dùng vị thuốc hoặc bài thuốc nào để chữa?,"['[{""ChuThe"": ""Triệu chứng Đẻ xong ra huyết nhiều"", ""QuanHe"": ""Được chữa bằng (BaiThuoc)"", ""DoiTuong"": ""Bài thuốc Đẻ xong ra huyết nhiều Tô mộc"", ""LieuDung"": ""Chưa ghi nhận"", ""CachDung"": ""Sắc với $200ml$ nước còn $100ml$. Chia 2 lần uống trong ngày"", ""GhiChu"": ""Đẻ xong ra huyết nhiều | Tô mộc $12g$ | Sắc với $200ml$ nước còn $100ml$. Chia 2 lần uống trong ngày | [Nguồn]: CT_VT_VN_T67"", ""score"": 2.0}]']","Dựa trên y văn, đối với bệnh đẻ xong ra huyết nhiều, bạn có thể tham khảo bài thuốc sau:

**Bài thuốc Đẻ xong ra huyết nhiều Tô mộc**:
*   Thành phần: Tô mộc 12g.
*   Cách dùng: Sắc với 200ml nước còn 100ml. Chia 2 lần uống trong ngày.",Đẻ xong ra huyết nhiều Tô mộc,1.0,0.45218472199657417,0.9999999999,1.0,0.4160305580558598
Thành phần hóa học của sơn tra gồm những gì?,"['[{""ChuThe"": ""Vị thuốc Sơn tra"", ""QuanHe"": ""CO_CHUA_HOAT_CHAT"", ""DoiTuong"": ""Hoạt chất Tinh dầu"", ""LieuDung"": ""Chưa ghi nhận"", ""CachDung"": ""Chưa ghi nhận"", ""GhiChu"": ""NULL"", ""score"": 2.0, ""sort_weight"": 3.0}, {""ChuThe"": ""Vị thuốc Sơn tra"", ""QuanHe"": ""CO_CHUA_HOAT_CHAT"", ""DoiTuong"": ""Hoạt chất Tanin"", ""LieuDung"": ""Chưa ghi nhận"", ""CachDung"": ""Chưa ghi nhận"", ""GhiChu"": ""NULL"", ""score"": 2.0, ""sort_weight"": 3.0}, {""ChuThe"": ""Vị thuốc Sơn tra"", ""QuanHe"": ""CO_CHUA_HOAT_CHAT"", ""DoiTuong"": ""Hoạt chất Axit Xitric"", ""LieuDung"": ""Chưa ghi nhận"", ""CachDung"": ""Chưa ghi nhận"", ""GhiChu"": ""NULL"", ""score"": 2.0, ""sort_weight"": 3.0}, {""ChuThe"": ""Vị thuốc Sơn tra"", ""QuanHe"": ""CO_CHUA_HOAT_CHAT"", ""DoiTuong"": ""Hoạt chất Vitamin C"", ""LieuDung"": ""Chưa ghi nhận"", ""CachDung"": ""Chưa ghi nhận"", ""GhiChu"": ""NULL"", ""score"": 2.0, ""sort_weight"": 3.0}, {""ChuThe"": ""Vị thuốc Sơn tra"", ""QuanHe"": ""CO_CHUA_HOAT_CHAT"", ""DoiTuong"": ""Hoạt chất Axit Tactric"", ""LieuDung"": ""Chưa ghi nhận"", ""CachDung"": ""Chưa ghi nhận"", ""GhiChu"": ""NULL"", ""score"": 2.0, ""sort_weight"": 3.0}, {""ChuThe"": ""Vị thuốc Sơn tra"", ""QuanHe"": ""CO_CHUA_HOAT_CHAT"", ""DoiTuong"": ""Hoạt chất Oxyacanthin"", ""LieuDung"": ""Chưa ghi nhận"", ""CachDung"": ""Chưa ghi nhận"", ""GhiChu"": ""NULL"", ""score"": 2.0, ""sort_weight"": 3.0}, {""ChuThe"": ""Vị thuốc Sơn tra"", ""QuanHe"": ""CO_CHUA_HOAT_CHAT"", ""DoiTuong"": ""Hoạt chất Fructoza"", ""LieuDung"": ""Chưa ghi nhận"", ""CachDung"": ""Chưa ghi nhận"", ""GhiChu"": ""NULL"", ""score"": 2.0, ""sort_weight"": 3.0}, {""ChuThe"": ""Vị thuốc Sơn tra"", ""QuanHe"": ""CO_CHUA_HOAT_CHAT"", ""DoiTuong"": ""Hoạt chất Cholin"", ""LieuDung"": ""Chưa ghi nhận"", ""CachDung"": ""Chưa ghi nhận"", ""GhiChu"": ""NULL"", ""score"": 2.0, ""sort_weight"": 3.0}, {""ChuThe"": ""Vị thuốc Sơn tra"", ""QuanHe"": ""CO_CHUA_HOAT_CHAT"", ""DoiTuong"": ""Hoạt chất Quexetin"", ""LieuDung"": ""Chưa ghi nhận"", ""CachDung"": ""Chưa ghi nhận"", ""GhiChu"": ""NULL"", ""score"": 2.0, ""sort_weight"": 3.0}, {""ChuThe"": ""Vị thuốc Sơn tra"", ""QuanHe"": ""CO_CHUA_HOAT_CHAT"", ""DoiTuong"": ""Hydrat Cacbon"", ""LieuDung"": ""Chưa ghi nhận"", ""CachDung"": ""Chưa ghi nhận"", ""GhiChu"": ""NULL"", ""score"": 2.0, ""sort_weight"": 3.0}, {""ChuThe"": ""Vị thuốc Sơn tra"", ""QuanHe"": ""CO_CHUA_HOAT_CHAT"", ""DoiTuong"": ""Phytosterin"", ""LieuDung"": ""Chưa ghi nhận"", ""CachDung"": ""Chưa ghi nhận"", ""GhiChu"": ""NULL"", ""score"": 2.0, ""sort_weight"": 3.0}, {""ChuThe"": ""Vị thuốc Sơn tra"", ""QuanHe"": ""CO_CHUA_HOAT_CHAT"", ""DoiTuong"": ""Hoạt chất Axetylcholin"", ""LieuDung"": ""Chưa ghi nhận"", ""CachDung"": ""Chưa ghi nhận"", ""GhiChu"": ""NULL"", ""score"": 2.0, ""sort_weight"": 3.0}, {""ChuThe"": ""Vị thuốc Sơn tra"", ""QuanHe"": ""CO_CHUA_HOAT_CHAT"", ""DoiTuong"": ""Hoạt chất Axit Oleanic"", ""LieuDung"": ""Chưa ghi nhận"", ""CachDung"": ""Chưa ghi nhận"", ""GhiChu"": ""NULL"", ""score"": 2.0, ""sort_weight"": 3.0}, {""ChuThe"": ""Vị thuốc Sơn tra"", ""QuanHe"": ""CO_CHUA_HOAT_CHAT"", ""DoiTuong"": ""Hoạt chất Crataegic"", ""LieuDung"": ""Chưa ghi nhận"", ""CachDung"": ""Chưa ghi nhận"", ""GhiChu"": ""NULL"", ""score"": 2.0, ""sort_weight"": 3.0}, {""ChuThe"": ""Vị thuốc Sơn tra"", ""QuanHe"": ""CO_CHUA_HOAT_CHAT"", ""DoiTuong"": ""Hoạt chất Crataegin"", ""LieuDung"": ""Chưa ghi nhận"", ""CachDung"": ""Chưa ghi nhận"", ""GhiChu"": ""NULL"", ""score"": 2.0, ""sort_weight"": 3.0}, {""ChuThe"": ""Vị thuốc Sơn tra"", ""QuanHe"": ""CO_CHUA_HOAT_CHAT"", ""DoiTuong"": ""Hoạt chất Quexitrin"", ""LieuDung"": ""Chưa ghi nhận"", ""CachDung"": ""Chưa ghi nhận"", ""GhiChu"": ""NULL"", ""score"": 2.0, ""sort_weight"": 3.0}, {""ChuThe"": ""Vị thuốc Sơn tra"", ""QuanHe"": ""CO_CHUA_HOAT_CHAT"", ""DoiTuong"": ""Hoạt chất Ursolic"", ""LieuDung"": ""Chưa ghi nhận"", ""CachDung"": ""Chưa ghi nhận"", ""GhiChu"": ""NULL"", ""score"": 2.0, ""sort_weight"": 3.0}, {""ChuThe"": ""Vị thuốc Sơn tra"", ""QuanHe"": ""CO_CHUA_HOAT_CHAT"", ""DoiTuong"": ""Hoạt chất Protit"", ""LieuDung"": ""Chưa ghi nhận"", ""CachDung"": ""Chưa ghi nhận"", ""GhiChu"": ""NULL"", ""score"": 2.0, ""sort_weight"": 3.0}]']","Thành phần hóa học của **Sơn tra** bao gồm các hoạt chất sau:

*   Tinh dầu
*   Tanin
*   Axit Xitric
*   Vitamin C
*   Axit Tactric
*   Oxyacanthin
*   Fructoza
*   Cholin
*   Quexetin
*   Hydrat Cacbon
*   Phytosterin
*   Axetylcholin
*   Axit Oleanic
*   Crataegic
*   Crataegin
*   Quexitrin
*   Ursolic
*   Protit","Axetylcholin, Axit Oleanic, Axit Tactric, Axit Xitric, Cholin, Crataegic, Crataegin, Fructoza, Oxyacanthin, Protit, Quexetin, Quexitrin, Tanin, Tinh dầu, Ursolic, Vitamin C, Hydrat Cacbon, Phytosterin",1.0,0.5846766181496287,0.9999999999,1.0,0.9816335965747869
Bệnh nào có thể chữa bằng bài thuốc chứa tang diệp?,"['[{""ChuThe"": ""Vị thuốc Tang diệp"", ""QuanHe"": ""Tham gia bài thuốc [Bài thuốc Cảm mạo cúc âm] để chữa"", ""DoiTuong"": ""Bệnh Cảm mạo"", ""LieuDung"": ""Chưa ghi nhận"", ""CachDung"": ""Chưa ghi nhận"", ""GhiChu"": """", ""score"": 2.0, ""sort_weight"": 3.0}, {""ChuThe"": ""Vị thuốc Tang diệp"", ""QuanHe"": ""Tham gia bài thuốc [Bài thuốc Cảm mạo cúc âm] để chữa"", ""DoiTuong"": ""Triệu chứng Ho"", ""LieuDung"": ""Chưa ghi nhận"", ""CachDung"": ""Chưa ghi nhận"", ""GhiChu"": """", ""score"": 2.0, ""sort_weight"": 3.0}, {""ChuThe"": ""Vị thuốc Tang diệp"", ""QuanHe"": ""Tham gia bài thuốc [Bài thuốc Cảm mạo cúc âm] để chữa"", ""DoiTuong"": ""Triệu chứng Sốt"", ""LieuDung"": ""Chưa ghi nhận"", ""CachDung"": ""Chưa ghi nhận"", ""GhiChu"": """", ""score"": 2.0, ""sort_weight"": 3.0}]']","**Vị thuốc Tang diệp** tham gia vào bài thuốc **[Bài thuốc Cảm mạo cúc âm]** để chữa bệnh Cảm mạo và các triệu chứng Ho, Sốt. Liều dùng và cách dùng của bài thuốc chưa được ghi nhận.","Cảm mạo, Ho, Sốt",1.0,0.6307880944949389,0.9999999999,1.0,0.6332198074666153
Vị thuốc a giao (minh giao) tham gia vào bài thuốc để chữa những bệnh gì?,"['[{""ChuThe"": ""Vị thuốc A giao (Minh giao)"", ""QuanHe"": ""Tham gia bài thuốc [Bài thuốc Kinh nguyệt không ngừng A Giaominh Giao] để chữa"", ""DoiTuong"": ""Bệnh Kinh nguyệt không ngừng"", ""LieuDung"": ""A giao sao với bồ hoàng"", ""CachDung"": ""Tán nhỏ ngày uống $8-16g$. Nếu uống được rượu thì dùng rượu mà chiêu"", ""GhiChu"": ""CT_VT_VN_T963"", ""score"": 2.0, ""sort_weight"": 3.0}, {""ChuThe"": ""Vị thuốc A giao (Minh giao)"", ""QuanHe"": ""Tham gia bài thuốc [Bài thuốc Lỵ ra máu A Giaominh Giao] để chữa"", ""DoiTuong"": ""Bệnh Lỵ ra máu"", ""LieuDung"": ""A giao $10g$, hoàng liên $3g$, can khương $2g$, sinh lục địa $5g$"", ""CachDung"": ""Nước $600ml$. Sắc còn $200ml$. Lọc bỏ bã, nước thuốc còn đang nóng, thái nhỏ a giao cho vào. Chia làm 2 lần uống trong ngày (bài thuốc kinh nghiệm trong cuốn Thiên kim phương)"", ""GhiChu"": ""CT_VT_VN_T963"", ""score"": 2.0, ""sort_weight"": 3.0}]']","Vị thuốc **A giao (Minh giao)** tham gia vào bài thuốc để chữa các bệnh sau:

*   Bệnh Kinh nguyệt không ngừng: Tham gia bài thuốc **Kinh nguyệt không ngừng A Giaominh Giao**. Liều dùng: A giao sao với bồ hoàng. Cách dùng: Tán nhỏ ngày uống 8-16g. Nếu uống được rượu thì dùng rượu mà chiêu.
*   Bệnh Lỵ ra máu: Tham gia bài thuốc **Lỵ ra máu A Giaominh Giao**. Liều dùng: A giao 10g, hoàng liên 3g, can khương 2g, sinh lục địa 5g. Cách dùng: Nước 600ml. Sắc còn 200ml. Lọc bỏ bã, nước thuốc còn đang nóng, thái nhỏ a giao cho vào. Chia làm 2 lần uống trong ngày (bài thuốc kinh nghiệm trong cuốn Thiên kim phương).","Kinh nguyệt không ngừng, Lỵ ra máu",1.0,0.6606091437132281,0.9999999999,1.0,0.5887762272959849
Thuốc nào vừa có tính hàn vừa trực tiếp chữa bệnh xuất huyết tử cung?,"['[{""ChuThe"": ""Vị thuốc Trắc bách diệp"", ""QuanHe"": ""Thỏa mãn đồng thời"", ""DoiTuong"": ""Hàn và Bệnh Xuất huyết tử cung"", ""LieuDung"": ""Chưa ghi nhận"", ""CachDung"": ""Chưa ghi nhận"", ""GhiChu"": """", ""score"": 2.0}, {""ChuThe"": ""Vị thuốc Sen"", ""QuanHe"": ""Thỏa mãn đồng thời"", ""DoiTuong"": ""Hàn và Bệnh Xuất huyết tử cung"", ""LieuDung"": ""Chưa ghi nhận"", ""CachDung"": ""Chưa ghi nhận"", ""GhiChu"": """", ""score"": 2.0}]']",**Hệ thống y văn hiện tại chưa ghi nhận dữ liệu về vấn đề này.**,"Sen, Trắc bách diệp",1.0,0.0,0.9999999999,1.0,0.2279611595312538
Vị thuốc vỏ lựu có hoạt chất tanin không?,['Không có dữ liệu'],"Không. Dựa trên dữ liệu y văn hiện tại, không có ghi nhận nào cho thấy vỏ lựu có liên quan hoặc tác dụng tới tanin.","Có, vị thuốc vỏ lựu có hoạt chất tanin",0.0,0.68726378529716,0.0,0.0,0.24199072623776202
"Để chữa bệnh canh châu, vị thuốc cảnh châu được dùng với liều lượng và cách thức như thế nào?","['[{""ChuThe"": ""Vị thuốc Cảnh châu"", ""QuanHe"": ""CHU_TRI_BENH"", ""DoiTuong"": ""Bệnh Canh châu"", ""LieuDung"": ""Tham khảo liều dùng chung của vị thuốc | Canh châu $12-16g$"", ""CachDung"": ""Sắc với nước cho trẻ con mắc bệnh canh châu (lên canh châu) uống | Thêm nước $300$ đến $400ml$, sắc còn $200ml$, chia $2$-$3$ lần uống trong ngày. Uống luôn trong $1$-$2$ ngày"", ""GhiChu"": ""[Nguồn]: CT_VT_VN_T688"", ""score"": 2.0, ""sort_weight"": 3.0}, {""ChuThe"": ""Bệnh Canh châu"", ""QuanHe"": ""CHU_TRI_BENH"", ""DoiTuong"": ""Vị thuốc Cảnh châu"", ""LieuDung"": ""Tham khảo liều dùng chung của vị thuốc | Canh châu $12-16g$"", ""CachDung"": ""Sắc với nước cho trẻ con mắc bệnh canh châu (lên canh châu) uống | Thêm nước $300$ đến $400ml$, sắc còn $200ml$, chia $2$-$3$ lần uống trong ngày. Uống luôn trong $1$-$2$ ngày"", ""GhiChu"": ""[Nguồn]: CT_VT_VN_T688"", ""score"": 2.0, ""sort_weight"": 3.0}]']","Để chữa bệnh canh châu, **vị thuốc Cảnh châu** được dùng như sau:

*   **Liều dùng:** 12-16g
*   **Cách dùng:** Sắc **Cảnh châu** với 300-400ml nước, sắc còn 200ml, chia 2-3 lần uống trong ngày. Uống liên tục trong 1-2 ngày cho trẻ con mắc bệnh canh châu (lên canh châu).","Để chữa bệnh canh châu, vị thuốc cảnh châu có liều dùng: Tham khảo liều dùng chung của vị thuốc | Canh châu 12-16g và cách dùng: Sắc với nước cho trẻ con mắc bệnh canh châu (lên canh châu) uống | Thêm nước 300 đến 400ml, sắc còn 200ml, chia 2-3 lần uống trong ngày. Uống luôn trong 1-2 ngày",1.0,0.597627331480738,0.9999999999,1.0,0.9954306519005289
"Để chữa bệnh tê thấp, vị thuốc dây đau xương được dùng với liều lượng và cách thức như thế nào?","['[{""ChuThe"": ""Vị thuốc Dây đau xương"", ""QuanHe"": ""CHU_TRI_TRIEU_CHUNG"", ""DoiTuong"": ""Triệu chứng Tê thấp"", ""LieuDung"": ""Tham khảo liều dùng chung của vị thuốc"", ""CachDung"": ""Lá dây đau xương giã nhỏ trộn với rượu để đắp lên những chỗ sưng đau | Thân dây đau xương thái nhỏ, sao vàng ngâm rượu với tỷ lệ $1phần$ 5. Ngày uống 3 lần, mỗi lần 1 cốc con. Phụ nữ và những người không uống được rượu có thể sắc với nước mà uống. | Dùng dưới hình thức thuốc uống hay thuốc xoa bóp."", ""GhiChu"": ""CT_VT_VN_T510"", ""score"": 2.0, ""sort_weight"": 3.0}]']","Để chữa bệnh tê thấp, bạn có thể tham khảo cách sử dụng vị thuốc **Dây đau xương** như sau:

*   Lá **dây đau xương** giã nhỏ trộn với rượu để đắp lên những chỗ sưng đau.
*   Thân **dây đau xương** thái nhỏ, sao vàng ngâm rượu với tỷ lệ 1 phần dược liệu với 5 phần rượu. Ngày uống 3 lần, mỗi lần 1 cốc con. Phụ nữ và những người không uống được rượu có thể sắc với nước mà uống.
*   **Dây đau xương** có thể dùng dưới hình thức thuốc uống hay thuốc xoa bóp.","Để chữa bệnh tê thấp, vị thuốc dây đau xương có liều dùng: Tham khảo liều dùng chung của vị thuốc và cách dùng: Lá dây đau xương giã nhỏ trộn với rượu để đắp lên những chỗ sưng đau | Thân dây đau xương thái nhỏ, sao vàng ngâm rượu với tỷ lệ 1phần 5. Ngày uống 3 lần, mỗi lần 1 cốc con. Phụ nữ và những người không uống được rượu có thể sắc với nước mà uống. | Dùng dưới hình thức thuốc uống hay thuốc xoa bóp.",1.0,0.5706538860643678,0.9999999999,1.0,0.8448328770946137
Thuốc nào vừa có tính hàn vừa trực tiếp chữa bệnh đau mắt?,"['[{""ChuThe"": ""Vị thuốc Ban miêu"", ""QuanHe"": ""Thỏa mãn đồng thời"", ""DoiTuong"": ""Hàn và Bệnh Đau mắt"", ""LieuDung"": ""Chưa ghi nhận"", ""CachDung"": ""Chưa ghi nhận"", ""GhiChu"": """", ""score"": 2.0}, {""ChuThe"": ""Vị thuốc Hoàng liên"", ""QuanHe"": ""Thỏa mãn đồng thời"", ""DoiTuong"": ""Hàn và Công năng Trị đau mắt"", ""LieuDung"": ""Chưa ghi nhận"", ""CachDung"": ""Chưa ghi nhận"", ""GhiChu"": """", ""score"": 2.0}, {""ChuThe"": ""Vị thuốc Hoàng Đằng"", ""QuanHe"": ""Thỏa mãn đồng thời"", ""DoiTuong"": ""Hàn và Bệnh Đau mắt"", ""LieuDung"": ""Chưa ghi nhận"", ""CachDung"": ""Chưa ghi nhận"", ""GhiChu"": """", ""score"": 2.0}, {""ChuThe"": ""Vị thuốc Vàng đằng"", ""QuanHe"": ""Thỏa mãn đồng thời"", ""DoiTuong"": ""Hàn và Bệnh Đau mắt"", ""LieuDung"": ""Chưa ghi nhận"", ""CachDung"": ""Chưa ghi nhận"", ""GhiChu"": """", ""score"": 2.0}, {""ChuThe"": ""Vị thuốc Mã đề"", ""QuanHe"": ""Thỏa mãn đồng thời"", ""DoiTuong"": ""Hàn và Bệnh Đau mắt"", ""LieuDung"": ""Chưa ghi nhận"", ""CachDung"": ""Chưa ghi nhận"", ""GhiChu"": """", ""score"": 2.0}, {""ChuThe"": ""Vị thuốc Dâu"", ""QuanHe"": ""Thỏa mãn đồng thời"", ""DoiTuong"": ""Hàn và Bệnh Trẻ con đau mắt"", ""LieuDung"": ""Chưa ghi nhận"", ""CachDung"": ""Chưa ghi nhận"", ""GhiChu"": """", ""score"": 2.0}]']","Dựa trên y văn, các vị thuốc có tính hàn và được ghi nhận liên quan đến bệnh đau mắt bao gồm:

*   **Ban miêu**: Thỏa mãn đồng thời Hàn và Bệnh Đau mắt.
*   **Hoàng liên**: Thỏa mãn đồng thời Hàn và Công năng Trị đau mắt.
*   **Hoàng Đằng**: Thỏa mãn đồng thời Hàn và Bệnh Đau mắt.
*   **Vàng đằng**: Thỏa mãn đồng thời Hàn và Bệnh Đau mắt.
*   **Mã đề**: Thỏa mãn đồng thời Hàn và Bệnh Đau mắt.
*   **Dâu**: Thỏa mãn đồng thời Hàn và Bệnh Trẻ con đau mắt.

Lưu ý: Liều dùng và cách dùng của các vị thuốc này chưa được ghi nhận trong dữ liệu hiện tại.","Cúc hoa, Hoàng liên gai, Hạ khô thảo, Rau mồng tơi",1.0,0.4568180396835119,0.9999999999,0.0,0.21680862658230943
"Để chữa bệnh đau lưng, vị thuốc tắc kè được dùng với liều lượng và cách thức như thế nào?","['[{""ChuThe"": ""Vị thuốc Tắc kè"", ""QuanHe"": ""CHU_TRI_TRIEU_CHUNG"", ""DoiTuong"": ""Triệu chứng Đau lưng"", ""LieuDung"": ""Tham khảo liều dùng chung của vị thuốc"", ""CachDung"": ""Tắc kè mổ bỏ ruột, sấy khô, cắt bỏ đầu, chân ngâm với rượu; mỗi một lít rượu 35-40° ngâm 2 đến 5 con. Ngâm trong một tuần lễ trở lên. Lọc lấy rượu trong mà uống. Ngày uống ($15-30ml$) chừng nửa cốc con. Uống nguyên hoặc pha với mật ong cho ngọt. Có thể thêm ít trần bì hay vỏ cam vào cho thơm. Uống vào buổi tối hay sáng sớm"", ""GhiChu"": ""Suy nhược thần kinh, đau ngang thắt lưng. CT_VT_VN_T971"", ""score"": 2.0, ""sort_weight"": 3.0}]']","Để chữa đau lưng, bạn có thể tham khảo cách dùng vị thuốc **Tắc kè** như sau:

**Tắc kè** mổ bỏ ruột, sấy khô, cắt bỏ đầu, chân ngâm với rượu; mỗi một lít rượu 35-40° ngâm 2 đến 5 con. Ngâm trong một tuần lễ trở lên. Lọc lấy rượu trong mà uống. Ngày uống 15-30ml chừng nửa cốc con. Uống nguyên hoặc pha với mật ong cho ngọt. Có thể thêm ít trần bì hay vỏ cam vào cho thơm. Uống vào buổi tối hay sáng sớm.

Lưu ý: Bài thuốc này còn được dùng cho người bị suy nhược thần kinh, đau ngang thắt lưng.","Để chữa bệnh đau lưng, vị thuốc tắc kè có liều dùng: Tham khảo liều dùng chung của vị thuốc và cách dùng: Tắc kè mổ bỏ ruột, sấy khô, cắt bỏ đầu, chân ngâm với rượu; mỗi một lít rượu 35-40° ngâm 2 đến 5 con. Ngâm trong một tuần lễ trở lên. Lọc lấy rượu trong mà uống. Ngày uống (15-30ml) chừng nửa cốc con. Uống nguyên hoặc pha với mật ong cho ngọt. Có thể thêm ít trần bì hay vỏ cam vào cho thơm. Uống vào buổi tối hay sáng sớm",1.0,0.5276248345563109,0.9999999999,1.0,0.8866917152879061
Vị thuốc khương hoạt có tính bình không?,['Không có dữ liệu'],"Không. Dựa trên dữ liệu y văn hiện tại, không có ghi nhận nào cho thấy khương hoạt có liên quan hoặc tác dụng tới tính bình.","Có, vị thuốc khương hoạt có tính bình",0.0,0.6436780612693423,0.0,0.0,0.24049110967737802
Vị thuốc đậu khấu có hoạt chất dbocneola không?,['Không có dữ liệu'],"Không. Dựa trên dữ liệu y văn hiện tại, không có ghi nhận nào cho thấy đậu khấu có liên quan hoặc tác dụng tới dbocneola.","Có, vị thuốc đậu khấu có hoạt chất dbocneola",1.0,0.8128764804327065,0.0,0.0,0.24331245703608884
Vị thuốc đào tiên có chứa hoạt chất rubiadin không?,['Không có dữ liệu'],"Không. Dựa trên dữ liệu y văn hiện tại, không có ghi nhận nào cho thấy đào tiên có liên quan hoặc tác dụng tới rubiadin.","Không, vị thuốc đào tiên không chứa hoạt chất rubiadin",0.0,0.8320495026632232,0.0,1.0,0.8432051362743529
Thuốc nào vừa có tính bình vừa trực tiếp chữa bệnh ho?,"['[{""ChuThe"": ""Vị thuốc Bảy lá một hoa"", ""QuanHe"": ""Thỏa mãn đồng thời"", ""DoiTuong"": ""Bình và Bệnh Ho lâu ngày"", ""LieuDung"": ""Chưa ghi nhận"", ""CachDung"": ""Chưa ghi nhận"", ""GhiChu"": """", ""score"": 2.0}, {""ChuThe"": ""Vị thuốc Tân cửu (Thanh táo)"", ""QuanHe"": ""Thỏa mãn đồng thời"", ""DoiTuong"": ""Bình và Công năng Trị ho sốt"", ""LieuDung"": ""Chưa ghi nhận"", ""CachDung"": ""Chưa ghi nhận"", ""GhiChu"": """", ""score"": 2.0}, {""ChuThe"": ""Vị thuốc Mộc qua"", ""QuanHe"": ""Thỏa mãn đồng thời"", ""DoiTuong"": ""Công năng Bình can và Bệnh Ho lâu ngày"", ""LieuDung"": ""Chưa ghi nhận"", ""CachDung"": ""Chưa ghi nhận"", ""GhiChu"": """", ""score"": 2.0}, {""ChuThe"": ""Vị thuốc Mộc qua"", ""QuanHe"": ""Thỏa mãn đồng thời"", ""DoiTuong"": ""Công năng Bình can và Công năng Chỉ ho"", ""LieuDung"": ""Chưa ghi nhận"", ""CachDung"": ""Chưa ghi nhận"", ""GhiChu"": """", ""score"": 2.0}, {""ChuThe"": ""Vị thuốc Dâu"", ""QuanHe"": ""Thỏa mãn đồng thời"", ""DoiTuong"": ""Bình và Bệnh Lao nhiệt sinh ho"", ""LieuDung"": ""Chưa ghi nhận"", ""CachDung"": ""Chưa ghi nhận"", ""GhiChu"": """", ""score"": 2.0}, {""ChuThe"": ""Vị thuốc Dâu"", ""QuanHe"": ""Thỏa mãn đồng thời"", ""DoiTuong"": ""Công năng Bình suyễn và Bệnh Lao nhiệt sinh ho"", ""LieuDung"": ""Chưa ghi nhận"", ""CachDung"": ""Chưa ghi nhận"", ""GhiChu"": """", ""score"": 2.0}, {""ChuThe"": ""Vị thuốc Hoàng tinh"", ""QuanHe"": ""Thỏa mãn đồng thời"", ""DoiTuong"": ""Bình và Bệnh Phế hư sinh ho"", ""LieuDung"": ""Chưa ghi nhận"", ""CachDung"": ""Chưa ghi nhận"", ""GhiChu"": """", ""score"": 2.0}, {""ChuThe"": ""Vị thuốc Cam thảo bắc"", ""QuanHe"": ""Thỏa mãn đồng thời"", ""DoiTuong"": ""Bình và Bệnh Phế hư mã ho"", ""LieuDung"": ""Chưa ghi nhận"", ""CachDung"": ""Chưa ghi nhận"", ""GhiChu"": """", ""score"": 2.0}, {""ChuThe"": ""Vị thuốc A giao (Minh giao)"", ""QuanHe"": ""Thỏa mãn đồng thời"", ""DoiTuong"": ""Bình và Triệu chứng Ho ra máu"", ""LieuDung"": ""Chưa ghi nhận"", ""CachDung"": ""Chưa ghi nhận"", ""GhiChu"": """", ""score"": 2.0}, {""ChuThe"": ""Vị thuốc Yến"", ""QuanHe"": ""Thỏa mãn đồng thời"", ""DoiTuong"": ""Bình và Bệnh Ho hen"", ""LieuDung"": ""Chưa ghi nhận"", ""CachDung"": ""Chưa ghi nhận"", ""GhiChu"": """", ""score"": 2.0}, {""ChuThe"": ""Vị thuốc Long duyên hương"", ""QuanHe"": ""Thỏa mãn đồng thời"", ""DoiTuong"": ""Bình và Bệnh Ho"", ""LieuDung"": ""Chưa ghi nhận"", ""CachDung"": ""Chưa ghi nhận"", ""GhiChu"": """", ""score"": 2.0}, {""ChuThe"": ""Vị thuốc Rắn"", ""QuanHe"": ""Thỏa mãn đồng thời"", ""DoiTuong"": ""Bình và Bệnh Ho"", ""LieuDung"": ""Chưa ghi nhận"", ""CachDung"": ""Chưa ghi nhận"", ""GhiChu"": """", ""score"": 2.0}, {""ChuThe"": ""Vị thuốc Ngũ bội tử"", ""QuanHe"": ""Thỏa mãn đồng thời"", ""DoiTuong"": ""Bình và Bệnh Ho"", ""LieuDung"": ""Chưa ghi nhận"", ""CachDung"": ""Chưa ghi nhận"", ""GhiChu"": """", ""score"": 2.0}, {""ChuThe"": ""Vị thuốc Kỷ tử"", ""QuanHe"": ""Thỏa mãn đồng thời"", ""DoiTuong"": ""Bình và Bệnh Ho khan"", ""LieuDung"": ""Chưa ghi nhận"", ""CachDung"": ""Chưa ghi nhận"", ""GhiChu"": """", ""score"": 2.0}, {""ChuThe"": ""Vị thuốc Kỷ tử"", ""QuanHe"": ""Thỏa mãn đồng thời"", ""DoiTuong"": ""Bình và Bệnh Ho"", ""LieuDung"": ""Chưa ghi nhận"", ""CachDung"": ""Chưa ghi nhận"", ""GhiChu"": """", ""score"": 2.0}, {""ChuThe"": ""Vị thuốc Mật ong"", ""QuanHe"": ""Thỏa mãn đồng thời"", ""DoiTuong"": ""Bình và Bệnh Ho khan"", ""LieuDung"": ""Chưa ghi nhận"", ""CachDung"": ""Chưa ghi nhận"", ""GhiChu"": """", ""score"": 2.0}]']","Dựa trên y văn, các vị thuốc có tính bình và có công năng chữa bệnh ho bao gồm:

*   **Long duyên hương**: Dùng cho bệnh ho.
*   **Rắn**: Dùng cho bệnh ho.
*   **Ngũ bội tử**: Dùng cho bệnh ho.
*   **Kỷ tử**: Dùng cho bệnh ho, ho khan.
*   **Mật ong**: Dùng cho bệnh ho khan.

Ngoài ra, bạn có thể tham khảo thêm các vị thuốc sau cho từng trường hợp cụ thể:

*   **Bảy lá một hoa**: Dùng cho bệnh ho lâu ngày.
*   **Tân cửu (Thanh táo)**: Dùng cho trường hợp trị ho sốt.
*   **Mộc qua**: Dùng cho trường hợp ho lâu ngày, hoặc cần bình can chỉ ho.
*   **Dâu**: Dùng cho trường hợp lao nhiệt sinh ho, hoặc cần bình suyễn.
*   **Hoàng tinh**: Dùng cho trường hợp phế hư sinh ho.
*   **Cam thảo bắc**: Dùng cho trường hợp phế hư mã ho.
*   **A giao (Minh giao)**: Dùng cho trường hợp ho ra máu.
*   **Yến**: Dùng cho bệnh ho hen.

Lưu ý: Liều dùng và cách dùng của các vị thuốc trên chưa được ghi nhận trong dữ liệu. Bạn nên tham khảo ý kiến của thầy thuốc trước khi sử dụng.","A giao (Minh giao), Củ cải, Dâu rượu, Hoài sơn, Đào, Đảng sâm",1.0,0.46323721397269696,0.9999999999,0.0,0.26997546082666424
Bệnh non mua có thể dùng vị thuốc hoặc bài thuốc nào để chữa?,"['[{""ChuThe"": ""Triệu chứng Nôn mửa"", ""QuanHe"": ""Được chữa bằng (ViThuoc)"", ""DoiTuong"": ""Vị thuốc Dê"", ""LieuDung"": ""Ngày uống $20-30g$"", ""CachDung"": ""Chưa ghi nhận"", ""GhiChu"": ""ăn vào"", ""score"": 2.0}, {""ChuThe"": ""Triệu chứng Nôn mửa ở phụ nữ có thai"", ""QuanHe"": ""Được chữa bằng (ViThuoc)"", ""DoiTuong"": ""Vị thuốc Bán hạ"", ""LieuDung"": ""Tham khảo liều dùng chung của vị thuốc"", ""CachDung"": ""Chỉ định lâm sàng theo kinh nghiệm"", ""GhiChu"": ""[Nguồn]: CT_VT_VN_T61"", ""score"": 2.0}, {""ChuThe"": ""Triệu chứng Nôn mửa"", ""QuanHe"": ""Được chữa bằng (ViThuoc)"", ""DoiTuong"": ""Vị thuốc Trúc như"", ""LieuDung"": ""Tham khảo liều dùng chung của vị thuốc"", ""CachDung"": ""Không ghi rõ | Tẩm nước gừng sao"", ""GhiChu"": ""Vị nhiệt sinh nôn mửa | Sốt, buồn bực, nôn mửa, nôn ra máu, chảy máu cam, băng huyết"", ""score"": 2.0}, {""ChuThe"": ""Triệu chứng Nôn mửa"", ""QuanHe"": ""Được chữa bằng (ViThuoc)"", ""DoiTuong"": ""Vị thuốc Ô dược"", ""LieuDung"": ""Tham khảo liều dùng chung của vị thuốc"", ""CachDung"": ""Chỉ định lâm sàng theo kinh nghiệm"", ""GhiChu"": ""Đau bụng, ăn không tiêu, nôn mửa, trẻ con có giun, sung huyết, đầu nhức, hay đi đái đêm | Rễ ô dược | Chỉ định lâm sàng theo kinh nghiệm | [Nguồn]: CT_VT_VN_T448"", ""score"": 2.0}, {""ChuThe"": ""Triệu chứng Nôn mửa"", ""QuanHe"": ""Được chữa bằng (ViThuoc)"", ""DoiTuong"": ""Vị thuốc Đào lộn hột"", ""LieuDung"": ""Tham khảo liều dùng chung của vị thuốc"", ""CachDung"": ""Nhấm nháp"", ""GhiChu"": ""Quả tươi (dưới dạng dịch ép). CT_VT_VN_T571"", ""score"": 2.0}, {""ChuThe"": ""Triệu chứng Nôn mửa"", ""QuanHe"": ""Được chữa bằng (ViThuoc)"", ""DoiTuong"": ""Vị thuốc Hồi"", ""LieuDung"": ""Tham khảo liều dùng chung của vị thuốc"", ""CachDung"": ""Không rõ"", ""GhiChu"": ""CT_VT_VN_T542"", ""score"": 2.0}, {""ChuThe"": ""Bệnh Non Mua"", ""QuanHe"": ""Được chữa bằng (ViThuoc)"", ""DoiTuong"": ""Vị thuốc Cà độc dược"", ""LieuDung"": ""ngày $1-1,5$g"", ""CachDung"": ""Dùng dưới hình thức bột lá hay bột hoa, hoặc dùng lá hay dùng hoa phơi khô, thái nhỏ để hút như thuốc lá-liều hút: ngày $1-1,5$g. Còn dùng dưới hình thức rượu $1/10$ ( ngày dùng $0,5-3$g rượu cho người lớn, $0,10$g=V giọt cho trẻ em)"", ""GhiChu"": """", ""score"": 2.0, ""sort_weight"": 3.0}, {""ChuThe"": ""Triệu chứng Nôn mửa"", ""QuanHe"": ""Được chữa bằng (ViThuoc)"", ""DoiTuong"": ""Vị thuốc Tất bạt"", ""LieuDung"": ""Tham khảo liều dùng chung của vị thuốc"", ""CachDung"": ""Đau bụng, nôn mửa, ỉa chảy"", ""GhiChu"": ""Chỉ định lâm sàng | [Nguồn]: CT_VT_VN_T595"", ""score"": 2.0}, {""ChuThe"": ""Triệu chứng Nôn mửa"", ""QuanHe"": ""Được chữa bằng (ViThuoc)"", ""DoiTuong"": ""Vị thuốc Phật thủ"", ""LieuDung"": ""Tham khảo liều dùng chung của vị thuốc | Không ghi rõ liều"", ""CachDung"": ""Dùng trong những trường hợp trên | Chỉ định lâm sàng"", ""GhiChu"": ""CT_VT_VN_T766"", ""score"": 2.0}, {""ChuThe"": ""Triệu chứng Nôn mửa"", ""QuanHe"": ""Được chữa bằng (ViThuoc)"", ""DoiTuong"": ""Vị thuốc Hương phụ"", ""LieuDung"": ""Tham khảo liều dùng chung của vị thuốc"", ""CachDung"": ""Không ghi rõ"", ""GhiChu"": ""Chỉ định lâm sàng (không ghi rõ liều). CT_VT_VN_T50"", ""score"": 2.0}, {""ChuThe"": ""Triệu chứng Nôn mửa"", ""QuanHe"": ""Được chữa bằng (ViThuoc)"", ""DoiTuong"": ""Vị thuốc Bùng bục"", ""LieuDung"": ""Tham khảo liều dùng chung của vị thuốc"", ""CachDung"": ""Vỏ thân cây Mallotus japonicus Muell, et Arg."", ""GhiChu"": ""Tham khảo loài Mallotus japonicus tại Trung Quốc. Chỉ định lâm sàng theo kinh nghiệm Trung Quốc"", ""score"": 2.0}, {""ChuThe"": ""Triệu chứng Nôn mửa"", ""QuanHe"": ""Được chữa bằng (ViThuoc)"", ""DoiTuong"": ""Vị thuốc Ngải cứu"", ""LieuDung"": ""Tham khảo liều dùng chung của vị thuốc"", ""CachDung"": ""Chỉ định lâm sàng theo kinh nghiệm"", ""GhiChu"": ""[Nguồn]: CT_VT_VN_T52"", ""score"": 2.0}, {""ChuThe"": ""Triệu chứng Nôn mửa"", ""QuanHe"": ""Được chữa bằng (ViThuoc)"", ""DoiTuong"": ""Vị thuốc Thanh đại"", ""LieuDung"": ""Toàn cây nghể chàm"", ""CachDung"": ""Sắc uống"", ""GhiChu"": ""[Nguồn]: CT_VT_VN_T130"", ""score"": 2.0}, {""ChuThe"": ""Triệu chứng Nôn mửa"", ""QuanHe"": ""Được chữa bằng (ViThuoc)"", ""DoiTuong"": ""Vị thuốc Cam xũng"", ""LieuDung"": ""$10-20g$"", ""CachDung"": ""Sắc uống"", ""GhiChu"": ""Lá cây cam xũng"", ""score"": 2.0}, {""ChuThe"": ""Triệu chứng Nôn mửa"", ""QuanHe"": ""Được chữa bằng (ViThuoc)"", ""DoiTuong"": ""Vị thuốc Gừng"", ""LieuDung"": ""Tham khảo liều dùng chung của vị thuốc"", ""CachDung"": ""Nhấm từng ít một cho đến khi hết nôn"", ""GhiChu"": ""CT_VT_VN_T383"", ""score"": 2.0}, {""ChuThe"": ""Triệu chứng Nôn mửa"", ""QuanHe"": ""Được chữa bằng (ViThuoc)"", ""DoiTuong"": ""Vị thuốc Nhân sâm"", ""LieuDung"": ""Tham khảo liều dùng chung của vị thuốc"", ""CachDung"": ""Cho vào miệng ngậm và nhấm từng ít một, nuốt nước và cả bã | Cho vào ấm hay chén sứ. Thêm một tí nước đậy nắp. Đun cách thuỷ, uống nước. Sau đó lại thêm nước và đun cách thuỷ tiếp tục uống, làm như vậy cho đến khi hết mùi vị mới thôi | Chỉ định lâm sàng"", ""GhiChu"": ""Sâm thái mỏng"", ""score"": 2.0}, {""ChuThe"": ""Triệu chứng Nôn mửa"", ""QuanHe"": ""Được chữa bằng (ViThuoc)"", ""DoiTuong"": ""Vị thuốc Bán hạ"", ""LieuDung"": ""Tham khảo liều dùng chung của vị thuốc"", ""CachDung"": ""Dùng trong những trường hợp nôn mửa, đờm thấp, hen suyễn, đầu nhức, đầu váng, không ngủ; dùng ngoài có tác dụng tiêu thũng"", ""GhiChu"": ""[Nguồn]: CT_VT_VN_T62"", ""score"": 2.0}, {""ChuThe"": ""Bệnh Trị nôn mửa"", ""QuanHe"": ""Được chữa bằng (ViThuoc)"", ""DoiTuong"": ""Vị thuốc Hậu phác"", ""LieuDung"": ""Chưa ghi nhận"", ""CachDung"": ""Chưa ghi nhận"", ""GhiChu"": """", ""score"": 2.0}, {""ChuThe"": ""Triệu chứng Nôn mửa"", ""QuanHe"": ""Được chữa bằng (ViThuoc)"", ""DoiTuong"": ""Vị thuốc Riềng"", ""LieuDung"": ""Tham khảo liều dùng chung của vị thuốc | $3-6g$"", ""CachDung"": ""Chỉ định lâm sàng theo kinh nghiệm | Dùng dưới dạng thuốc sắc, thuốc bột hay rượu thuốc"", ""GhiChu"": ""Đau bụng, đi ỉa, nôn mửa, đi lỵ | Cao lương khương | Chỉ định lâm sàng theo kinh nghiệm | [Nguồn]: CT_VT_VN_T402"", ""score"": 2.0}, {""ChuThe"": ""Triệu chứng Nôn mửa"", ""QuanHe"": ""Được chữa bằng (ViThuoc)"", ""DoiTuong"": ""Vị thuốc Xương sông"", ""LieuDung"": ""Tham khảo liều dùng chung của vị thuốc"", ""CachDung"": ""Lá xương sông"", ""GhiChu"": ""Chỉ định lâm sàng theo kinh nghiệm"", ""score"": 2.0}, {""ChuThe"": ""Triệu chứng Nôn mửa"", ""QuanHe"": ""Được chữa bằng (ViThuoc)"", ""DoiTuong"": ""Vị thuốc Đảng sâm"", ""LieuDung"": ""Tham khảo liều dùng chung của vị thuốc"", ""CachDung"": ""Chỉ định lâm sàng theo kinh nghiệm"", ""GhiChu"": ""ho"", ""score"": 2.0}, {""ChuThe"": ""Triệu chứng Nôn mửa"", ""QuanHe"": ""Được chữa bằng (ViThuoc)"", ""DoiTuong"": ""Vị thuốc Đậu khấu"", ""LieuDung"": ""Tham khảo liều dùng chung của vị thuốc"", ""CachDung"": ""Chỉ định lâm sàng theo kinh nghiệm"", ""GhiChu"": ""Dạ dày lạnh đau, nôn ra nước chua, nôn mửa, tả lỵ"", ""score"": 2.0}, {""ChuThe"": ""Triệu chứng Nôn mửa"", ""QuanHe"": ""Được chữa bằng (ViThuoc)"", ""DoiTuong"": ""Vị thuốc Hồng đậu khấu"", ""LieuDung"": ""Chưa ghi nhận"", ""CachDung"": ""Chưa ghi nhận"", ""GhiChu"": """", ""score"": 2.0}, {""ChuThe"": ""Triệu chứng Nôn mửa"", ""QuanHe"": ""Được chữa bằng (ViThuoc)"", ""DoiTuong"": ""Vị thuốc Thìa là"", ""LieuDung"": ""$3-6g$"", ""CachDung"": ""Sắc với $200ml$ nước, còn $100ml$, uống làm một lần trong ngày"", ""GhiChu"": """", ""score"": 2.0}, {""ChuThe"": ""Triệu chứng Nôn mửa"", ""QuanHe"": ""Được chữa bằng (ViThuoc)"", ""DoiTuong"": ""Vị thuốc Đinh hương"", ""LieuDung"": ""Tham khảo liều dùng chung của vị thuốc"", ""CachDung"": ""Chỉ định lâm sàng theo kinh nghiệm"", ""GhiChu"": ""CT_VT_VN_T692"", ""score"": 2.0}, {""ChuThe"": ""Triệu chứng Nôn mửa"", ""QuanHe"": ""Được chữa bằng (BaiThuoc)"", ""DoiTuong"": ""Bài thuốc Đau bụng đại hoàng"", ""LieuDung"": ""Chưa ghi nhận"", ""CachDung"": ""Nước $300ml$, sắc còn $100ml$. Uống lúc đói"", ""GhiChu"": ""Đơn thuốc của Trương Trọng Cảnh"", ""score"": 2.0}, {""ChuThe"": ""Triệu chứng Nôn mửa ở phụ nữ có thai"", ""QuanHe"": ""Được chữa bằng (BaiThuoc)"", ""DoiTuong"": ""Bài thuốc Nôn mửa ở phụ nữ có thai Linh thang"", ""LieuDung"": ""Chưa ghi nhận"", ""CachDung"": ""Chưa ghi nhận"", ""GhiChu"": ""[Nguồn]: CT_VT_VN_T62"", ""score"": 2.0}, {""ChuThe"": ""Triệu chứng Nôn mửa"", ""QuanHe"": ""Được chữa bằng (BaiThuoc)"", ""DoiTuong"": ""Bài thuốc Đau dạ dày Trầm hương"", ""LieuDung"": ""Chưa ghi nhận"", ""CachDung"": ""Chưa ghi nhận"", ""GhiChu"": """", ""score"": 2.0}, {""ChuThe"": ""Triệu chứng Nôn mửa"", ""QuanHe"": ""Được chữa bằng (BaiThuoc)"", ""DoiTuong"": ""Bài thuốc Đái dầm hương tần"", ""LieuDung"": ""Chưa ghi nhận"", ""CachDung"": ""Chưa ghi nhận"", ""GhiChu"": """", ""score"": 2.0}, {""ChuThe"": ""Bệnh Non Mua"", ""QuanHe"": ""Được chữa bằng (BaiThuoc)"", ""DoiTuong"": ""Bệnh Đau bụng tiêu hóa"", ""LieuDung"": ""Quế tán thành bột $100$g, nhục đậu khấu tán thành bột $80$g, đinh hương tán bột $40$g, sa nhân $30$g tán bột, canxi cacbonat bột $250$g, đường $500$g tán nhỏ"", ""CachDung"": ""Tất cả trộn đều. Ngày dùng $0,50$ đến $4$g bột này"", ""GhiChu"": ""CT_VT_VN_T423"", ""score"": 2.0, ""sort_weight"": 3.0}]']","Để chữa bệnh Non Mua, bạn có thể tham khảo các vị thuốc và bài thuốc sau:

**DU_LIEU_CHINH_XAC:**

*   **Vị thuốc Cà độc dược:**
    *   Liều dùng: ngày 1-1,5g.
    *   Cách dùng: Dùng dưới hình thức bột lá hay bột hoa, hoặc dùng lá hay dùng hoa phơi khô, thái nhỏ để hút như thuốc lá - liều hút: ngày 1-1,5g. Còn dùng dưới hình thức rượu 1/10 (ngày dùng 0,5-3g rượu cho người lớn, 0,10g=V giọt cho trẻ em).
*   **Bài thuốc Đau bụng tiêu hóa:**
    *   Liều dùng: Quế tán thành bột 100g, nhục đậu khấu tán thành bột 80g, đinh hương tán bột 40g, sa nhân 30g tán bột, canxi cacbonat bột 250g, đường 500g tán nhỏ. Tất cả trộn đều. Ngày dùng 0,50 đến 4g bột này.

**DU_LIEU_MO_RONG_LIEN_QUAN:**

Do bệnh Non Mua có triệu chứng nôn mửa, bạn có thể tham khảo thêm các vị thuốc và bài thuốc sau để điều trị triệu chứng nôn mửa:

*   **Vị thuốc Dê:** Ngày uống 20-30g, ăn vào.
*   **Vị thuốc Bán hạ:** Tham khảo liều dùng chung của vị thuốc. Chỉ định lâm sàng theo kinh nghiệm.
*   **Vị thuốc Trúc như:** Tham khảo liều dùng chung của vị thuốc. Tẩm nước gừng sao.
*   **Vị thuốc Ô dược:** Tham khảo liều dùng chung của vị thuốc. Chỉ định lâm sàng theo kinh nghiệm.
*   **Vị thuốc Đào lộn hột:** Tham khảo liều dùng chung của vị thuốc. Nhấm nháp quả tươi (dưới dạng dịch ép).
*   **Vị thuốc Hồi:** Tham khảo liều dùng chung của vị thuốc.
*   **Vị thuốc Tất bạt:** Tham khảo liều dùng chung của vị thuốc. Đau bụng, nôn mửa, ỉa chảy.
*   **Vị thuốc Phật thủ:** Tham khảo liều dùng chung của vị thuốc. Dùng trong những trường hợp trên. Chỉ định lâm sàng.
*   **Vị thuốc Hương phụ:** Tham khảo liều dùng chung của vị thuốc. Chỉ định lâm sàng (không ghi rõ liều).
*   **Vị thuốc Bùng bục:** Tham khảo liều dùng chung của vị thuốc. Vỏ thân cây Mallotus japonicus Muell, et Arg.
*   **Vị thuốc Ngải cứu:** Tham khảo liều dùng chung của vị thuốc. Chỉ định lâm sàng theo kinh nghiệm.
*   **Vị thuốc Thanh đại:** Toàn cây nghể chàm, sắc uống.
*   **Vị thuốc Cam xũng:** 10-20g, sắc uống lá cây cam xũng.
*   **Vị thuốc Gừng:** Tham khảo liều dùng chung của vị thuốc. Nhấm từng ít một cho đến khi hết nôn.
*   **Vị thuốc Nhân sâm:** Tham khảo liều dùng chung của vị thuốc. Sâm thái mỏng cho vào miệng ngậm và nhấm từng ít một, nuốt nước và cả bã. Hoặc cho vào ấm hay chén sứ, thêm một tí nước đậy nắp, đun cách thuỷ, uống nước. Sau đó lại thêm nước và đun cách thuỷ tiếp tục uống, làm như vậy cho đến khi hết mùi vị mới thôi. Chỉ định lâm sàng.
*   **Vị thuốc Bán hạ:** Tham khảo liều dùng chung của vị thuốc. Dùng trong những trường hợp nôn mửa, đờm thấp, hen suyễn, đầu nhức, đầu váng, không ngủ; dùng ngoài có tác dụng tiêu thũng.
*   **Vị thuốc Riềng:** Tham khảo liều dùng chung của vị thuốc hoặc 3-6g. Chỉ định lâm sàng theo kinh nghiệm. Dùng dưới dạng thuốc sắc, thuốc bột hay rượu thuốc.
*   **Vị thuốc Xương sông:** Tham khảo liều dùng chung của vị thuốc. Lá xương sông. Chỉ định lâm sàng theo kinh nghiệm.
*   **Vị thuốc Đảng sâm:** Tham khảo liều dùng chung của vị thuốc. Chỉ định lâm sàng theo kinh nghiệm.
*   **Vị thuốc Đậu khấu:** Tham khảo liều dùng chung của vị thuốc. Chỉ định lâm sàng theo kinh nghiệm.
*   **Vị thuốc Thìa là:** 3-6g, sắc với 200ml nước, còn 100ml, uống làm một lần trong ngày.
*   **Vị thuốc Đinh hương:** Tham khảo liều dùng chung của vị thuốc. Chỉ định lâm sàng theo kinh nghiệm.
*   **Bài thuốc Đau bụng đại hoàng:** Nước 300ml, sắc còn 100ml. Uống lúc đói.","Non Mua Ngô thù du, Đau bụng tiêu hóa, Cà độc dược",1.0,0.5890823793216143,0.9999999999,0.6666666666666666,0.21757532984068365
Bệnh ung tích lâu năm có thể dùng vị thuốc hoặc bài thuốc nào để chữa?,"['[{""ChuThe"": ""Bệnh Ung tích lâu năm"", ""QuanHe"": ""Được chữa bằng (ViThuoc)"", ""DoiTuong"": ""Vị thuốc Mỏ quạ"", ""LieuDung"": ""Tham khảo liều dùng chung của vị thuốc"", ""CachDung"": ""Sắc uống."", ""GhiChu"": ""Rễ mỏ quạ"", ""score"": 2.0, ""sort_weight"": 3.0}]']","Để chữa bệnh ung tích lâu năm, bạn có thể tham khảo vị thuốc sau:

*   **Vị thuốc Mỏ quạ (Rễ mỏ quạ):** Tham khảo liều dùng chung của vị thuốc, sắc uống.",Mỏ quạ,1.0,0.47381358707575416,0.9999999999,1.0,0.5876713606405609
Bệnh nào có thể chữa bằng bài thuốc chứa thỏ ty tử?,"['[{""ChuThe"": ""Vị thuốc Thỏ ty tử"", ""QuanHe"": ""Tham gia bài thuốc [Bài thuốc Dị đại đêm tỳ tử] để chữa"", ""DoiTuong"": ""Bệnh Đái dầm"", ""LieuDung"": ""Chưa ghi nhận"", ""CachDung"": ""Sắc còn $100ml$. Lọc bỏ bã. Chia 2,3 lần uống trong ngày"", ""GhiChu"": """", ""score"": 2.0, ""sort_weight"": 3.0}, {""ChuThe"": ""Vị thuốc Thỏ ty tử"", ""QuanHe"": ""Tham gia bài thuốc [Bài thuốc Dị đại đêm tỳ tử] để chữa"", ""DoiTuong"": ""Bệnh Di tinh"", ""LieuDung"": ""Chưa ghi nhận"", ""CachDung"": ""Sắc còn $100ml$. Lọc bỏ bã. Chia 2,3 lần uống trong ngày"", ""GhiChu"": """", ""score"": 2.0, ""sort_weight"": 3.0}, {""ChuThe"": ""Vị thuốc Thỏ ty tử"", ""QuanHe"": ""Tham gia bài thuốc [Bài thuốc Di mộng tinh dậy tô hồng] để chữa"", ""DoiTuong"": ""Bệnh di mộng tinh"", ""LieuDung"": ""Chưa ghi nhận"", ""CachDung"": ""Hái về phơi khô sắc uống"", ""GhiChu"": """", ""score"": 2.0, ""sort_weight"": 3.0}, {""ChuThe"": ""Vị thuốc Thỏ ty tử"", ""QuanHe"": ""Tham gia bài thuốc [Bài thuốc Lâu dây và hạt tơ hồng] để chữa"", ""DoiTuong"": ""Bệnh lậu"", ""LieuDung"": ""Chưa ghi nhận"", ""CachDung"": ""Chưa ghi nhận"", ""GhiChu"": """", ""score"": 2.0, ""sort_weight"": 3.0}, {""ChuThe"": ""Vị thuốc Thỏ ty tử"", ""QuanHe"": ""Tham gia bài thuốc [Bài thuốc Lộ sài dậy tô hồng] để chữa"", ""DoiTuong"": ""Bệnh Lộ sài"", ""LieuDung"": ""Chưa ghi nhận"", ""CachDung"": ""Hái về phơi khô sắc uống"", ""GhiChu"": """", ""score"": 2.0, ""sort_weight"": 3.0}, {""ChuThe"": ""Vị thuốc Thỏ ty tử"", ""QuanHe"": ""Tham gia bài thuốc [Bài thuốc Sốt Dây và Hạt Tơ Hồng] để chữa"", ""DoiTuong"": ""Bệnh Sốt"", ""LieuDung"": ""Chưa ghi nhận"", ""CachDung"": ""Chưa ghi nhận"", ""GhiChu"": """", ""score"": 2.0, ""sort_weight"": 3.0}, {""ChuThe"": ""Vị thuốc Thỏ ty tử"", ""QuanHe"": ""Tham gia bài thuốc [Bài thuốc Vết lo loét Dây và Hạt Tơ Hồng] để chữa"", ""DoiTuong"": ""Bệnh Vết lo loét"", ""LieuDung"": ""Chưa ghi nhận"", ""CachDung"": ""Đắp ngoài"", ""GhiChu"": """", ""score"": 2.0, ""sort_weight"": 3.0}, {""ChuThe"": ""Vị thuốc Thỏ ty tử"", ""QuanHe"": ""Tham gia bài thuốc [Bệnh Suy nhược thần kinh nhục thung dung] để chữa"", ""DoiTuong"": ""Bệnh Suy nhược thần kinh"", ""LieuDung"": ""Chưa ghi nhận"", ""CachDung"": ""Chưa ghi nhận"", ""GhiChu"": """", ""score"": 2.0, ""sort_weight"": 3.0}, {""ChuThe"": ""Vị thuốc Thỏ ty tử"", ""QuanHe"": ""Tham gia bài thuốc [Bài thuốc Bạch đới chim sẻ] để chữa"", ""DoiTuong"": ""Bệnh Bạch đới"", ""LieuDung"": ""Chưa ghi nhận"", ""CachDung"": ""Chưa ghi nhận"", ""GhiChu"": """", ""score"": 2.0, ""sort_weight"": 3.0}, {""ChuThe"": ""Vị thuốc Thỏ ty tử"", ""QuanHe"": ""Tham gia bài thuốc [Bài thuốc Bạch đới chim sẻ] để chữa"", ""DoiTuong"": ""Bệnh Di tinh"", ""LieuDung"": ""Chưa ghi nhận"", ""CachDung"": ""Chưa ghi nhận"", ""GhiChu"": """", ""score"": 2.0, ""sort_weight"": 3.0}, {""ChuThe"": ""Vị thuốc Thỏ ty tử"", ""QuanHe"": ""Tham gia bài thuốc [Bài thuốc Bạch đới chim sẻ] để chữa"", ""DoiTuong"": ""Bệnh Đau lưng"", ""LieuDung"": ""Chưa ghi nhận"", ""CachDung"": ""Chưa ghi nhận"", ""GhiChu"": """", ""score"": 2.0, ""sort_weight"": 3.0}, {""ChuThe"": ""Vị thuốc Thỏ ty tử"", ""QuanHe"": ""Tham gia bài thuốc [Bài thuốc Bạch đới chim sẻ] để chữa"", ""DoiTuong"": ""Bệnh Gói mỏi"", ""LieuDung"": ""Chưa ghi nhận"", ""CachDung"": ""Chưa ghi nhận"", ""GhiChu"": """", ""score"": 2.0, ""sort_weight"": 3.0}, {""ChuThe"": ""Vị thuốc Thỏ ty tử"", ""QuanHe"": ""Tham gia bài thuốc [Bài thuốc Bạch đới chim sẻ] để chữa"", ""DoiTuong"": ""Bệnh Liệt dương"", ""LieuDung"": ""Chưa ghi nhận"", ""CachDung"": ""Chưa ghi nhận"", ""GhiChu"": """", ""score"": 2.0, ""sort_weight"": 3.0}, {""ChuThe"": ""Vị thuốc Thỏ ty tử"", ""QuanHe"": ""Tham gia bài thuốc [Bài thuốc Bạch đới chim sẻ] để chữa"", ""DoiTuong"": ""Bệnh Yếu sinh lý"", ""LieuDung"": ""Chưa ghi nhận"", ""CachDung"": ""Chưa ghi nhận"", ""GhiChu"": """", ""score"": 2.0, ""sort_weight"": 3.0}, {""ChuThe"": ""Vị thuốc Thỏ ty tử"", ""QuanHe"": ""Tham gia bài thuốc [Bài thuốc Bạch đới chim sẻ] để chữa"", ""DoiTuong"": ""Triệu chứng Chóng mặt"", ""LieuDung"": ""Chưa ghi nhận"", ""CachDung"": ""Chưa ghi nhận"", ""GhiChu"": """", ""score"": 2.0, ""sort_weight"": 3.0}]']","Vị thuốc **Thỏ ty tử** có thể tham gia vào các bài thuốc để chữa các bệnh sau:

*   Bệnh Đái dầm: Tham gia bài thuốc **Dị đại đêm tỳ tử**. Cách dùng: Sắc còn 100ml. Lọc bỏ bã. Chia 2,3 lần uống trong ngày.
*   Bệnh Di tinh: Tham gia bài thuốc **Dị đại đêm tỳ tử**. Cách dùng: Sắc còn 100ml. Lọc bỏ bã. Chia 2,3 lần uống trong ngày.
*   Bệnh di mộng tinh: Tham gia bài thuốc **Di mộng tinh dậy tô hồng**. Cách dùng: Hái về phơi khô sắc uống.
*   Bệnh lậu: Tham gia bài thuốc **Lâu dây và hạt tơ hồng**.
*   Bệnh Lộ sài: Tham gia bài thuốc **Lộ sài dậy tô hồng**. Cách dùng: Hái về phơi khô sắc uống.
*   Bệnh Sốt: Tham gia bài thuốc **Sốt Dây và Hạt Tơ Hồng**.
*   Bệnh Vết lo loét: Tham gia bài thuốc **Vết lo loét Dây và Hạt Tơ Hồng**. Cách dùng: Đắp ngoài.
*   Bệnh Suy nhược thần kinh: Tham gia bài thuốc **Bệnh Suy nhược thần kinh nhục thung dung**.
*   Bệnh Bạch đới: Tham gia bài thuốc **Bạch đới chim sẻ**.
*   Bệnh Đau lưng: Tham gia bài thuốc **Bạch đới chim sẻ**.
*   Bệnh Gói mỏi: Tham gia bài thuốc **Bạch đới chim sẻ**.
*   Bệnh Liệt dương: Tham gia bài thuốc **Bạch đới chim sẻ**.
*   Bệnh Yếu sinh lý: Tham gia bài thuốc **Bạch đới chim sẻ**.
*   Triệu chứng Chóng mặt: Tham gia bài thuốc **Bạch đới chim sẻ**.","Bạch đới, Di tinh, Gói mỏi, Liệt dương, Lộ sài, Suy nhược thần kinh, Sốt, Vết lo loét, Yếu sinh lý, Di mộng tinh, Lậu, Đau lưng, Đái dầm, Chóng mặt",1.0,0.5875449183248938,0.9999999999,1.0,0.8620418758641871
Thuốc nào vừa có tính hàn vừa trực tiếp chữa bệnh sưng vú?,"['[{""ChuThe"": ""Vị thuốc Ích mẫu"", ""QuanHe"": ""Thỏa mãn đồng thời"", ""DoiTuong"": ""Hàn và Bệnh Sưng vú"", ""LieuDung"": ""Chưa ghi nhận"", ""CachDung"": ""Chưa ghi nhận"", ""GhiChu"": """", ""score"": 2.0}, {""ChuThe"": ""Vị thuốc Tía tô"", ""QuanHe"": ""Thỏa mãn đồng thời"", ""DoiTuong"": ""Công năng Phát tán phong hàn và Bệnh Sưng vú"", ""LieuDung"": ""Chưa ghi nhận"", ""CachDung"": ""Chưa ghi nhận"", ""GhiChu"": """", ""score"": 2.0}, {""ChuThe"": ""Vị thuốc Mạn kinh tử"", ""QuanHe"": ""Thỏa mãn đồng thời"", ""DoiTuong"": ""Hàn và Bệnh Sưng vú"", ""LieuDung"": ""Chưa ghi nhận"", ""CachDung"": ""Chưa ghi nhận"", ""GhiChu"": """", ""score"": 2.0}, {""ChuThe"": ""Vị thuốc Ngưu bàng"", ""QuanHe"": ""Thỏa mãn đồng thời"", ""DoiTuong"": ""Hàn và Bệnh Sưng vú"", ""LieuDung"": ""Chưa ghi nhận"", ""CachDung"": ""Chưa ghi nhận"", ""GhiChu"": """", ""score"": 2.0}, {""ChuThe"": ""Vị thuốc Qua lâu nhân"", ""QuanHe"": ""Thỏa mãn đồng thời"", ""DoiTuong"": ""Hàn và Bệnh Sưng vú"", ""LieuDung"": ""Chưa ghi nhận"", ""CachDung"": ""Chưa ghi nhận"", ""GhiChu"": """", ""score"": 2.0}, {""ChuThe"": ""Vị thuốc Xạ can"", ""QuanHe"": ""Thỏa mãn đồng thời"", ""DoiTuong"": ""Hàn và Bệnh Sưng vú"", ""LieuDung"": ""Chưa ghi nhận"", ""CachDung"": ""Chưa ghi nhận"", ""GhiChu"": """", ""score"": 2.0}, {""ChuThe"": ""Vị thuốc Bồ Công Anh Trung Quốc"", ""QuanHe"": ""Thỏa mãn đồng thời"", ""DoiTuong"": ""Hàn và Bệnh Sưng vú"", ""LieuDung"": ""Chưa ghi nhận"", ""CachDung"": ""Chưa ghi nhận"", ""GhiChu"": """", ""score"": 2.0}]']",Hệ thống y văn hiện tại chưa ghi nhận dữ liệu về vấn đề này.,"Bồ Công Anh Trung Quốc, Mạn kinh tử, Ngưu bàng, Qua lâu nhân, Xạ can, Ích mẫu",0.0,0.0,0.9999999999,1.0,0.23322651893877783
Bệnh trị đầy bụng có thể dùng vị thuốc hoặc bài thuốc nào để chữa?,"['[{""ChuThe"": ""Triệu chứng Ngực bụng đầy trướng"", ""QuanHe"": ""Được chữa bằng (ViThuoc)"", ""DoiTuong"": ""Vị thuốc Thương lục"", ""LieuDung"": ""$3-4g$"", ""CachDung"": ""Dạng thuốc sắc, dùng một vị hay phối hợp với các vị thuốc khác"", ""GhiChu"": ""[Nguồn]: CT_VT_VN_T291"", ""score"": 2.0}, {""ChuThe"": ""Triệu chứng Ngực bụng đầy trướng"", ""QuanHe"": ""Được chữa bằng (ViThuoc)"", ""DoiTuong"": ""Vị thuốc Xuyên khung"", ""LieuDung"": ""Tham khảo liều dùng chung của vị thuốc"", ""CachDung"": ""Dùng xuyên khung"", ""GhiChu"": ""Chỉ định lâm sàng theo kinh nghiệm"", ""score"": 2.0}, {""ChuThe"": ""Bệnh Trị đầy bụng"", ""QuanHe"": ""Được chữa bằng (ViThuoc)"", ""DoiTuong"": ""Vị thuốc Hậu phác"", ""LieuDung"": ""Chưa ghi nhận"", ""CachDung"": ""Chưa ghi nhận"", ""GhiChu"": """", ""score"": 2.0}, {""ChuThe"": ""Triệu chứng Đầy bụng"", ""QuanHe"": ""Được chữa bằng (ViThuoc)"", ""DoiTuong"": ""Vị thuốc Sọ"", ""LieuDung"": ""$10-20g$"", ""CachDung"": ""Dạng thuốc sắc hay nấu thành cao"", ""GhiChu"": ""CT_VT_VN_T440"", ""score"": 2.0}, {""ChuThe"": ""Triệu chứng Đầy bụng"", ""QuanHe"": ""Được chữa bằng (ViThuoc)"", ""DoiTuong"": ""Vị thuốc Long đờm thảo"", ""LieuDung"": ""Tham khảo liều dùng chung của vị thuốc"", ""CachDung"": ""Chia 3 lần uống trong ngày"", ""GhiChu"": ""theo Hoà hán được dụng nghiệm phương"", ""score"": 2.0}, {""ChuThe"": ""Triệu chứng Đầy bụng"", ""QuanHe"": ""Được chữa bằng (ViThuoc)"", ""DoiTuong"": ""Vị thuốc Đậu khấu"", ""LieuDung"": ""$2-4g$"", ""CachDung"": ""Chỉ định lâm sàng"", ""GhiChu"": ""Đau dạ dày, đầy bụng, nôn ọe, ăn không tiêu, và chữa các bệnh về phổi"", ""score"": 2.0}, {""ChuThe"": ""Triệu chứng Đầy bụng"", ""QuanHe"": ""Được chữa bằng (ViThuoc)"", ""DoiTuong"": ""Vị thuốc Bán"", ""LieuDung"": ""Tham khảo liều dùng chung của vị thuốc"", ""CachDung"": ""Chỉ định lâm sàng theo kinh nghiệm"", ""GhiChu"": ""[Nguồn]: CT_VT_VN_T556"", ""score"": 2.0}, {""ChuThe"": ""Triệu chứng Đầy bụng"", ""QuanHe"": ""Được chữa bằng (ViThuoc)"", ""DoiTuong"": ""Vị thuốc Xương sông"", ""LieuDung"": ""Tham khảo liều dùng chung của vị thuốc"", ""CachDung"": ""Lá xương sông"", ""GhiChu"": ""Chỉ định lâm sàng theo kinh nghiệm"", ""score"": 2.0}, {""ChuThe"": ""Triệu chứng Đầy bụng"", ""QuanHe"": ""Được chữa bằng (ViThuoc)"", ""DoiTuong"": ""Vị thuốc Phật thủ"", ""LieuDung"": ""Tham khảo liều dùng chung của vị thuốc"", ""CachDung"": ""Dùng trong những trường hợp trên"", ""GhiChu"": ""CT_VT_VN_T766"", ""score"": 2.0}, {""ChuThe"": ""Triệu chứng Trướng mãn"", ""QuanHe"": ""Được chữa bằng (ViThuoc)"", ""DoiTuong"": ""Vị thuốc Bạch truật"", ""LieuDung"": ""Tham khảo liều dùng chung của vị thuốc"", ""CachDung"": ""Không rõ"", ""GhiChu"": ""Chỉ định lâm sàng theo kinh nghiệm"", ""score"": 2.0}, {""ChuThe"": ""Bệnh Đầy bụng"", ""QuanHe"": ""Được chữa bằng (ViThuoc)"", ""DoiTuong"": ""Vị thuốc Đại bi"", ""LieuDung"": ""Chưa ghi nhận"", ""CachDung"": ""Sắc uống hàng ngày"", ""GhiChu"": """", ""score"": 2.0, ""sort_weight"": 3.0}, {""ChuThe"": ""Triệu chứng Chậm tiêu"", ""QuanHe"": ""Được chữa bằng (BaiThuoc)"", ""DoiTuong"": ""Bài thuốc Táo bón mật lợn"", ""LieuDung"": ""Chưa ghi nhận"", ""CachDung"": ""Chưa ghi nhận"", ""GhiChu"": """", ""score"": 2.0}, {""ChuThe"": ""Triệu chứng Bụng đầy"", ""QuanHe"": ""Được chữa bằng (BaiThuoc)"", ""DoiTuong"": ""Bài thuốc Lý thần khúc"", ""LieuDung"": ""Mỗi vị $14g$"", ""CachDung"": ""Các vị tán nhỏ. Ngày $3-6g$ chia làm 2 hoặc 3 lần uống"", ""GhiChu"": ""CT_VT_VN_T375"", ""score"": 2.0}, {""ChuThe"": ""Triệu chứng Bụng đầy"", ""QuanHe"": ""Được chữa bằng (BaiThuoc)"", ""DoiTuong"": ""Bài thuốc Đau bụng sa nhân"", ""LieuDung"": ""Ngày uống 2 hay 3 viên, mỗi viên nặng $0,25g$"", ""CachDung"": ""Các vị tán nhỏ, dùng nước sắc bạc hà nấu với gạo làm hồ viên thành viên"", ""GhiChu"": ""CT_VT_VN_T417"", ""score"": 2.0}, {""ChuThe"": ""Triệu chứng Bụng đầy"", ""QuanHe"": ""Được chữa bằng (BaiThuoc)"", ""DoiTuong"": ""Bài thuốc Bụng Đầy Vàng Da"", ""LieuDung"": ""Chưa ghi nhận"", ""CachDung"": ""Chưa ghi nhận"", ""GhiChu"": """", ""score"": 2.0}, {""ChuThe"": ""Triệu chứng Đầy bụng"", ""QuanHe"": ""Được chữa bằng (BaiThuoc)"", ""DoiTuong"": ""Bài thuốc Đau bụng thượng truật"", ""LieuDung"": ""Chưa ghi nhận"", ""CachDung"": ""Chưa ghi nhận"", ""GhiChu"": """", ""score"": 2.0}, {""ChuThe"": ""Triệu chứng Đầy bụng"", ""QuanHe"": ""Được chữa bằng (BaiThuoc)"", ""DoiTuong"": ""Bài thuốc Tiểu tiện khó khăn bách nhật"", ""LieuDung"": ""Chưa ghi nhận"", ""CachDung"": ""Sắc uống, khi uống có thêm ít rượu trắng cho chóng dẫn"", ""GhiChu"": """", ""score"": 2.0}, {""ChuThe"": ""Triệu chứng Đầy bụng"", ""QuanHe"": ""Được chữa bằng (BaiThuoc)"", ""DoiTuong"": ""Bài thuốc Nấc Thị Đế"", ""LieuDung"": ""Chưa ghi nhận"", ""CachDung"": ""Sắc còn $200ml$, chia nhiều lần uống trong ngày"", ""GhiChu"": """", ""score"": 2.0}]']","Để điều trị bệnh đầy bụng, bạn có thể tham khảo các thông tin sau:

**Thông tin chính xác:**

*   **Vị thuốc Đại bi**: Sắc uống hàng ngày.

**Thông tin tham khảo thêm:**

*   **Vị thuốc Hậu phác**: Chưa ghi nhận liều dùng và cách dùng.
*   Đối với triệu chứng ngực bụng đầy trướng:
    *   **Vị thuốc Thương lục**: Liều dùng 3-4g dạng thuốc sắc, dùng một vị hay phối hợp với các vị thuốc khác.
    *   **Vị thuốc Xuyên khung**: Tham khảo liều dùng chung của vị thuốc.
*   Đối với triệu chứng đầy bụng:
    *   **Vị thuốc Sọ**: Liều dùng 10-20g dạng thuốc sắc hay nấu thành cao.
    *   **Vị thuốc Long đờm thảo**: Tham khảo liều dùng chung của vị thuốc, chia 3 lần uống trong ngày.
    *   **Vị thuốc Đậu khấu**: Liều dùng 2-4g.
    *   **Vị thuốc Bán**: Tham khảo liều dùng chung của vị thuốc.
    *   **Vị thuốc Xương sông**: Tham khảo liều dùng chung của vị thuốc, dùng lá xương sông.
    *   **Vị thuốc Phật thủ**: Tham khảo liều dùng chung của vị thuốc.
*   Đối với triệu chứng trướng mãn:
    *   **Vị thuốc Bạch truật**: Tham khảo liều dùng chung của vị thuốc.
*   Đối với triệu chứng bụng đầy:
    *   **Bài thuốc Lý thần khúc**: Mỗi vị 14g, các vị tán nhỏ. Ngày 3-6g chia làm 2 hoặc 3 lần uống.
    *   **Bài thuốc Đau bụng sa nhân**: Ngày uống 2 hay 3 viên, mỗi viên nặng 0,25g. Các vị tán nhỏ, dùng nước sắc bạc hà nấu với gạo làm hồ viên thành viên.
    *   **Bài thuốc Bụng Đầy Vàng Da**: Chưa ghi nhận liều dùng và cách dùng.
*   Đối với triệu chứng đầy bụng:
    *   **Bài thuốc Đau bụng thượng truật**: Chưa ghi nhận liều dùng và cách dùng.
    *   **Bài thuốc Tiểu tiện khó khăn bách nhật**: Sắc uống, khi uống có thêm ít rượu trắng cho chóng dẫn.
    *   **Bài thuốc Nấc Thị Đế**: Sắc còn 200ml, chia nhiều lần uống trong ngày.
*   Đối với triệu chứng chậm tiêu:
    *   **Bài thuốc Táo bón mật lợn**: Chưa ghi nhận liều dùng và cách dùng.",Hậu phác,1.0,0.41900174320925626,0.9999999999,1.0,0.18752452004337583
Bệnh nào có thể chữa bằng bài thuốc chứa bình vôi?,"['[{""ChuThe"": ""Vị thuốc Bình vôi"", ""QuanHe"": ""Tham gia bài thuốc [Bài thuốc Ho lao bính voi] để chữa"", ""DoiTuong"": ""Bệnh Lỵ"", ""LieuDung"": ""Chưa ghi nhận"", ""CachDung"": ""Chưa ghi nhận"", ""GhiChu"": """", ""score"": 2.0, ""sort_weight"": 3.0}, {""ChuThe"": ""Vị thuốc Bình vôi"", ""QuanHe"": ""Tham gia bài thuốc [Bài thuốc Ho lao bính voi] để chữa"", ""DoiTuong"": ""Bệnh Hư lao"", ""LieuDung"": ""Chưa ghi nhận"", ""CachDung"": ""Chưa ghi nhận"", ""GhiChu"": """", ""score"": 2.0, ""sort_weight"": 3.0}, {""ChuThe"": ""Vị thuốc Bình vôi"", ""QuanHe"": ""Tham gia bài thuốc [Bài thuốc Ho lao bính voi] để chữa"", ""DoiTuong"": ""Triệu chứng Đau bụng"", ""LieuDung"": ""Chưa ghi nhận"", ""CachDung"": ""Chưa ghi nhận"", ""GhiChu"": """", ""score"": 2.0, ""sort_weight"": 3.0}]']","Bài thuốc chứa **Bình vôi** có thể được dùng để chữa các bệnh sau:

*   Bệnh Lỵ
*   Bệnh Hư lao
*   Triệu chứng Đau bụng

Lưu ý: Hiện tại y văn chưa ghi nhận liều dùng và cách dùng của **Bình vôi** trong bài thuốc này.","Hư lao, Lỵ, Đau bụng",1.0,0.42221203826667364,0.9999999999,1.0,0.5889067806441812
Vị thuốc củ khi chứa hoạt chất gì?,"['[{""ChuThe"": ""Vị thuốc Củ khi"", ""QuanHe"": ""CO_CHUA_HOAT_CHAT"", ""DoiTuong"": ""Hoạt chất Menton"", ""LieuDung"": ""Chưa ghi nhận"", ""CachDung"": ""Chưa ghi nhận"", ""GhiChu"": """", ""score"": 2.0, ""sort_weight"": 3.0}, {""ChuThe"": ""Vị thuốc Củ khi"", ""QuanHe"": ""CO_CHUA_HOAT_CHAT"", ""DoiTuong"": ""Hoạt chất Imperatorin"", ""LieuDung"": ""Chưa ghi nhận"", ""CachDung"": ""Chưa ghi nhận"", ""GhiChu"": """", ""score"": 2.0, ""sort_weight"": 3.0}, {""ChuThe"": ""Vị thuốc Củ khi"", ""QuanHe"": ""CO_CHUA_HOAT_CHAT"", ""DoiTuong"": ""Hoạt chất Dentatin"", ""LieuDung"": ""Chưa ghi nhận"", ""CachDung"": ""Chưa ghi nhận"", ""GhiChu"": """", ""score"": 2.0, ""sort_weight"": 3.0}, {""ChuThe"": ""Vị thuốc Củ khi"", ""QuanHe"": ""CO_CHUA_HOAT_CHAT"", ""DoiTuong"": ""Hoạt chất Izomenton"", ""LieuDung"": ""Chưa ghi nhận"", ""CachDung"": ""Chưa ghi nhận"", ""GhiChu"": """", ""score"": 2.0, ""sort_weight"": 3.0}, {""ChuThe"": ""Vị thuốc Củ khi"", ""QuanHe"": ""CO_CHUA_HOAT_CHAT"", ""DoiTuong"": ""Hoạt chất Nordentatin"", ""LieuDung"": ""Chưa ghi nhận"", ""CachDung"": ""Chưa ghi nhận"", ""GhiChu"": """", ""score"": 2.0, ""sort_weight"": 3.0}]']","Vị thuốc **Củ khi** chứa các hoạt chất sau:

*   Hoạt chất Menton
*   Hoạt chất Imperatorin
*   Hoạt chất Dentatin
*   Hoạt chất Izomenton
*   Hoạt chất Nordentatin","Dentatin, Imperatorin, Izomenton, Menton, Nordentatin",1.0,0.5734072846878265,0.9999999999,1.0,0.9613610785878122
Tính chất của a giao (minh giao) là gì?,"['[{""ChuThe"": ""Vị thuốc A giao (Minh giao)"", ""QuanHe"": ""CO_TINH"", ""DoiTuong"": ""Bình"", ""LieuDung"": ""Chưa ghi nhận"", ""CachDung"": ""Chưa ghi nhận"", ""GhiChu"": """", ""score"": 2.0}]']",Hệ thống y văn hiện tại chưa ghi nhận dữ liệu về vấn đề này.,Bình,0.0,0.0,0.9999999999,1.0,0.2182969290523198
"Để chữa bệnh hai di tinh, vị thuốc sơn thù du được dùng với liều lượng và cách thức như thế nào?","['[{""ChuThe"": ""Vị thuốc Sơn thù du"", ""QuanHe"": ""CHU_TRI_TRIEU_CHUNG"", ""DoiTuong"": ""Triệu chứng Di tinh"", ""LieuDung"": ""Tham khảo liều dùng chung của vị thuốc"", ""CachDung"": ""Dùng theo những kinh nghiệm cổ trong những đơn thuốc gồm nhiều vị như bài thuốc lục vị hay lục vị địa hoàng hoàn"", ""GhiChu"": ""[Nguồn]: CT_VT_VN_T929"", ""score"": 2.0, ""sort_weight"": 3.0}, {""ChuThe"": ""Vị thuốc Sơn thù du"", ""QuanHe"": ""CHU_TRI_TRIEU_CHUNG"", ""DoiTuong"": ""Triệu chứng Hai di tinh"", ""LieuDung"": ""Tham khảo liều dùng chung của vị thuốc"", ""CachDung"": ""Dùng theo những kinh nghiệm cổ trong những đơn thuốc gồm nhiều vị như bài thuốc lục vị hay lục vị địa hoàng hoàn"", ""GhiChu"": ""[Nguồn]: CT_VT_VN_T929"", ""score"": 2.0, ""sort_weight"": 3.0}]']","Để chữa trị chứng hai di tinh, theo y văn, **Sơn thù du** được dùng như sau:

*   **Liều dùng:** Tham khảo liều dùng chung của vị thuốc.
*   **Cách dùng:** Dùng theo những kinh nghiệm cổ trong những đơn thuốc gồm nhiều vị như bài thuốc lục vị hay lục vị địa hoàng hoàn.","Để chữa bệnh hai di tinh, vị thuốc sơn thù du có liều dùng: Tham khảo liều dùng chung của vị thuốc và cách dùng: Dùng theo những kinh nghiệm cổ trong những đơn thuốc gồm nhiều vị như bài thuốc lục vị hay lục vị địa hoàng hoàn",1.0,0.35312976124749484,0.9999999999,1.0,0.995118859590247
Thuốc nào vừa có tính ôn vừa trực tiếp chữa bệnh răng cắn?,"['[{""ChuThe"": ""Vị thuốc Hùng hoàng và Thư hoàng"", ""QuanHe"": ""Thỏa mãn đồng thời"", ""DoiTuong"": ""Ôn và Bệnh Răng cắn"", ""LieuDung"": ""Chưa ghi nhận"", ""CachDung"": ""Chưa ghi nhận"", ""GhiChu"": """", ""score"": 2.0}, {""ChuThe"": ""Vị thuốc Bạch biển đậu"", ""QuanHe"": ""Thỏa mãn đồng thời"", ""DoiTuong"": ""Ôn và Bệnh Răng cắn"", ""LieuDung"": ""Chưa ghi nhận"", ""CachDung"": ""Chưa ghi nhận"", ""GhiChu"": """", ""score"": 2.0}, {""ChuThe"": ""Vị thuốc Tía tô"", ""QuanHe"": ""Thỏa mãn đồng thời"", ""DoiTuong"": ""Ôn và Bệnh Răng cắn"", ""LieuDung"": ""Chưa ghi nhận"", ""CachDung"": ""Chưa ghi nhận"", ""GhiChu"": """", ""score"": 2.0}, {""ChuThe"": ""Vị thuốc Rau răm"", ""QuanHe"": ""Thỏa mãn đồng thời"", ""DoiTuong"": ""Ôn và Bệnh Răng cắn"", ""LieuDung"": ""Chưa ghi nhận"", ""CachDung"": ""Chưa ghi nhận"", ""GhiChu"": """", ""score"": 2.0}, {""ChuThe"": ""Vị thuốc Bòng nước"", ""QuanHe"": ""Thỏa mãn đồng thời"", ""DoiTuong"": ""Ôn và Bệnh Răng cắn"", ""LieuDung"": ""Chưa ghi nhận"", ""CachDung"": ""Chưa ghi nhận"", ""GhiChu"": """", ""score"": 2.0}, {""ChuThe"": ""Vị thuốc Nhện"", ""QuanHe"": ""Thỏa mãn đồng thời"", ""DoiTuong"": ""Ôn và Bệnh Răng cắn"", ""LieuDung"": ""Chưa ghi nhận"", ""CachDung"": ""Chưa ghi nhận"", ""GhiChu"": """", ""score"": 2.0}]']",Hệ thống y văn hiện tại chưa ghi nhận dữ liệu về vấn đề này.,"Bòng nước, Bạch biển đậu, Hùng hoàng và Thư hoàng, Nhện, Rau răm, Tía tô",0.0,0.0,0.9999999999,1.0,0.22216039716524097
"Để chữa bệnh nhức đầu, vị thuốc thảo quyết minh được dùng với liều lượng và cách thức như thế nào?","['[{""ChuThe"": ""Vị thuốc Thảo quyết minh"", ""QuanHe"": ""CHU_TRI_TRIEU_CHUNG"", ""DoiTuong"": ""Triệu chứng Nhức đầu"", ""LieuDung"": ""Tham khảo liều dùng chung của vị thuốc"", ""CachDung"": ""Uống thảo quyết minh, đại tiện dễ dàng mà không đau bụng, phân mềm không lỏng."", ""GhiChu"": ""Lá có thể dùng thay vị phan tả diệp"", ""score"": 2.0, ""sort_weight"": 3.0}]']","Để chữa triệu chứng nhức đầu, bạn có thể tham khảo thông tin về vị thuốc **Thảo quyết minh** như sau:

*   **Liều dùng và cách dùng:** Tham khảo liều dùng chung của vị thuốc. Uống **Thảo quyết minh**, đại tiện dễ dàng mà không đau bụng, phân mềm không lỏng. Lá có thể dùng thay vị phan tả diệp.","Để chữa bệnh nhức đầu, vị thuốc thảo quyết minh có liều dùng: Tham khảo liều dùng chung của vị thuốc và cách dùng: Uống thảo quyết minh, đại tiện dễ dàng mà không đau bụng, phân mềm không lỏng.",1.0,0.4683929097268858,0.9999999999,1.0,0.8848646227910186
"Để chữa bệnh xích bạch đới, vị thuốc rau sam được dùng với liều lượng và cách thức như thế nào?","['[{""ChuThe"": ""Vị thuốc Rau sam"", ""QuanHe"": ""CHU_TRI_BENH"", ""DoiTuong"": ""Bệnh Xích Bạch đới"", ""LieuDung"": ""Mỗi ngày dùng $100g$ rau sam tươi."", ""CachDung"": ""Giã nát rau sam vắt lấy nước, hòa với lòng trắng trứng gà, hấp chín, ăn trong vài ngày."", ""GhiChu"": """", ""score"": 2.0, ""sort_weight"": 3.0}]']","Để chữa bệnh xích bạch đới, bạn có thể tham khảo cách dùng vị thuốc **Rau sam** như sau:

*   **Liều dùng:** Mỗi ngày dùng 100g rau sam tươi.
*   **Cách dùng:** Giã nát rau sam vắt lấy nước, hòa với lòng trắng trứng gà, hấp chín, ăn trong vài ngày.","Để chữa bệnh xích bạch đới, vị thuốc rau sam có liều dùng: Mỗi ngày dùng 100g rau sam tươi. và cách dùng: Giã nát rau sam vắt lấy nước, hòa với lòng trắng trứng gà, hấp chín, ăn trong vài ngày.",1.0,0.4496848659312202,0.9999999999,1.0,0.9976542412046361
Thuốc nào vừa có tính ôn vừa trực tiếp chữa bệnh mụn nhọt?,"['[{""ChuThe"": ""Vị thuốc Ké hoa vàng"", ""QuanHe"": ""Thỏa mãn đồng thời"", ""DoiTuong"": ""Ôn và Bệnh Mụn nhọt"", ""LieuDung"": ""Chưa ghi nhận"", ""CachDung"": ""Chưa ghi nhận"", ""GhiChu"": """", ""score"": 2.0}, {""ChuThe"": ""Vị thuốc Tùng hương"", ""QuanHe"": ""Thỏa mãn đồng thời"", ""DoiTuong"": ""Ôn và Bệnh Mụn nhọt"", ""LieuDung"": ""Chưa ghi nhận"", ""CachDung"": ""Chưa ghi nhận"", ""GhiChu"": """", ""score"": 2.0}, {""ChuThe"": ""Vị thuốc Tía tô"", ""QuanHe"": ""Thỏa mãn đồng thời"", ""DoiTuong"": ""Ôn và Bệnh Mụn nhọt"", ""LieuDung"": ""Chưa ghi nhận"", ""CachDung"": ""Chưa ghi nhận"", ""GhiChu"": """", ""score"": 2.0}, {""ChuThe"": ""Vị thuốc Ké đầu ngựa"", ""QuanHe"": ""Thỏa mãn đồng thời"", ""DoiTuong"": ""Ôn và Bệnh Mụn nhọt"", ""LieuDung"": ""Chưa ghi nhận"", ""CachDung"": ""Chưa ghi nhận"", ""GhiChu"": """", ""score"": 2.0}, {""ChuThe"": ""Vị thuốc Rau răm"", ""QuanHe"": ""Thỏa mãn đồng thời"", ""DoiTuong"": ""Ôn và Bệnh Mụn nhọt"", ""LieuDung"": ""Chưa ghi nhận"", ""CachDung"": ""Chưa ghi nhận"", ""GhiChu"": """", ""score"": 2.0}, {""ChuThe"": ""Vị thuốc Cúc áo"", ""QuanHe"": ""Thỏa mãn đồng thời"", ""DoiTuong"": ""Ôn và Bệnh Mụn nhọt"", ""LieuDung"": ""Chưa ghi nhận"", ""CachDung"": ""Chưa ghi nhận"", ""GhiChu"": """", ""score"": 2.0}, {""ChuThe"": ""Vị thuốc Cà độc dược"", ""QuanHe"": ""Thỏa mãn đồng thời"", ""DoiTuong"": ""Ôn và Bệnh Mụn nhọt"", ""LieuDung"": ""Chưa ghi nhận"", ""CachDung"": ""Chưa ghi nhận"", ""GhiChu"": """", ""score"": 2.0}, {""ChuThe"": ""Vị thuốc Dâu"", ""QuanHe"": ""Thỏa mãn đồng thời"", ""DoiTuong"": ""Ôn và Bệnh Mụn nhọt lâu ngày không liền miệng"", ""LieuDung"": ""Chưa ghi nhận"", ""CachDung"": ""Chưa ghi nhận"", ""GhiChu"": """", ""score"": 2.0}, {""ChuThe"": ""Vị thuốc Dâu"", ""QuanHe"": ""Thỏa mãn đồng thời"", ""DoiTuong"": ""Bệnh Phong ôn biểu chứng và Bệnh Mụn nhọt lâu ngày không liền miệng"", ""LieuDung"": ""Chưa ghi nhận"", ""CachDung"": ""Chưa ghi nhận"", ""GhiChu"": """", ""score"": 2.0}, {""ChuThe"": ""Vị thuốc Hạt gấc"", ""QuanHe"": ""Thỏa mãn đồng thời"", ""DoiTuong"": ""Ôn và Bệnh Mụn nhọt"", ""LieuDung"": ""Chưa ghi nhận"", ""CachDung"": ""Chưa ghi nhận"", ""GhiChu"": """", ""score"": 2.0}, {""ChuThe"": ""Vị thuốc Hạt gấc"", ""QuanHe"": ""Thỏa mãn đồng thời"", ""DoiTuong"": ""Ôn và Công năng Trị mụn nhọt"", ""LieuDung"": ""Chưa ghi nhận"", ""CachDung"": ""Chưa ghi nhận"", ""GhiChu"": """", ""score"": 2.0}, {""ChuThe"": ""Vị thuốc Nhện"", ""QuanHe"": ""Thỏa mãn đồng thời"", ""DoiTuong"": ""Ôn và Bệnh Mụn nhọt"", ""LieuDung"": ""Chưa ghi nhận"", ""CachDung"": ""Chưa ghi nhận"", ""GhiChu"": """", ""score"": 2.0}, {""ChuThe"": ""Vị thuốc Nhện"", ""QuanHe"": ""Thỏa mãn đồng thời"", ""DoiTuong"": ""Ôn và Công năng Trị mụn nhọt"", ""LieuDung"": ""Chưa ghi nhận"", ""CachDung"": ""Chưa ghi nhận"", ""GhiChu"": """", ""score"": 2.0}, {""ChuThe"": ""Vị thuốc Cỏn rết"", ""QuanHe"": ""Thỏa mãn đồng thời"", ""DoiTuong"": ""Ôn và Bệnh Mụn nhọt"", ""LieuDung"": ""Chưa ghi nhận"", ""CachDung"": ""Chưa ghi nhận"", ""GhiChu"": """", ""score"": 2.0}, {""ChuThe"": ""Vị thuốc Long Não"", ""QuanHe"": ""Thỏa mãn đồng thời"", ""DoiTuong"": ""Ôn và Bệnh Mụn nhọt"", ""LieuDung"": ""Chưa ghi nhận"", ""CachDung"": ""Chưa ghi nhận"", ""GhiChu"": """", ""score"": 2.0}, {""ChuThe"": ""Vị thuốc Tóc rối"", ""QuanHe"": ""Thỏa mãn đồng thời"", ""DoiTuong"": ""Ôn và Bệnh Mụn nhọt"", ""LieuDung"": ""Chưa ghi nhận"", ""CachDung"": ""Chưa ghi nhận"", ""GhiChu"": """", ""score"": 2.0}, {""ChuThe"": ""Vị thuốc Dã Vôi"", ""QuanHe"": ""Thỏa mãn đồng thời"", ""DoiTuong"": ""Ôn và Bệnh Mụn nhọt"", ""LieuDung"": ""Chưa ghi nhận"", ""CachDung"": ""Chưa ghi nhận"", ""GhiChu"": """", ""score"": 2.0}, {""ChuThe"": ""Vị thuốc Chim sẻ"", ""QuanHe"": ""Thỏa mãn đồng thời"", ""DoiTuong"": ""Ôn và Bệnh Mụn nhọt"", ""LieuDung"": ""Chưa ghi nhận"", ""CachDung"": ""Chưa ghi nhận"", ""GhiChu"": """", ""score"": 2.0}]']","Dựa trên y văn, các vị thuốc vừa có tính ôn vừa được dùng cho bệnh mụn nhọt bao gồm:

*   **Ké hoa vàng**
*   **Tùng hương**
*   **Tía tô**
*   **Ké đầu ngựa**
*   **Rau răm**
*   **Cúc áo**
*   **Cà độc dược**
*   **Hạt gấc**
*   **Nhện**
*   **Cỏn rết**
*   **Long Não**
*   **Tóc rối**
*   **Dã Vôi**
*   **Chim sẻ**

Ngoài ra, **Dâu** cũng được dùng cho bệnh phong ôn biểu chứng và mụn nhọt lâu ngày không liền miệng.

Lưu ý: Liều dùng và cách dùng của các vị thuốc trên chưa được ghi nhận trong dữ liệu y văn hiện tại.","Chim sẻ, Cà độc dược, Cúc áo, Cỏn rết, Dã Vôi, Hạt gấc, Ké hoa vàng, Ké đầu ngựa, Long Não, Nhện, Rau răm, Tía tô, Tóc rối, Tùng hương",1.0,0.4338150810422934,0.9999999999,1.0,0.8952862505526938
"Để chữa bệnh răng cắn, vị thuốc rắn cắn được dùng với liều lượng và cách thức như thế nào?","['[{""ChuThe"": ""Bài thuốc Rắn cắn thóc lép"", ""QuanHe"": ""CHU_TRI_BENH"", ""DoiTuong"": ""Bệnh Răng cắn"", ""LieuDung"": ""Chưa ghi nhận"", ""CachDung"": ""Chưa ghi nhận"", ""GhiChu"": ""Rắn cắn | Rễ thóc lép tươi $20g$, gãi nát vắt lấy nước uống. Bã đắp lên nơi rắn cắn. Ngày dùng $2$ lần | Chỉ định lâm sàng | [Nguồn]: CT_VT_VN_T160"", ""score"": 2.0, ""sort_weight"": 3.0}, {""ChuThe"": ""Bài thuốc Rắn cắn Nghệ"", ""QuanHe"": ""CHU_TRI_BENH"", ""DoiTuong"": ""Bệnh Răng cắn"", ""LieuDung"": ""Chưa ghi nhận"", ""CachDung"": ""Cả $4$ vị giã nhỏ. Thêm một bát nước đun sôi để nguội, lọc lấy nước, cho vài hạt muối vào rồi uống. Chia làm $3$ lần trong ngày. Bã đắp vào nơi rắn cắn. Thời gian điều trị chừng $3$ ngày"", ""GhiChu"": """", ""score"": 2.0, ""sort_weight"": 3.0}, {""ChuThe"": ""Bài thuốc Rắn cắn Ruột gà"", ""QuanHe"": ""CHU_TRI_BENH"", ""DoiTuong"": ""Bệnh Răng cắn"", ""LieuDung"": ""Chưa ghi nhận"", ""CachDung"": ""Tất cả giã nát vắt lấy nước uống, bã đắp lên nơi rắn cắn"", ""GhiChu"": ""[Nguồn]: CT_VT_VN_T779"", ""score"": 2.0, ""sort_weight"": 3.0}, {""ChuThe"": ""Bài thuốc Rắn cắn"", ""QuanHe"": ""CHU_TRI_BENH"", ""DoiTuong"": ""Bệnh Răng cắn"", ""LieuDung"": ""Ngày $50ml$ rượu hội này, sau đó cứ cách 5 đến 10 phút lại uống 1 lần. Một ngày tối đa uống $150ml$ đến $200ml$."", ""CachDung"": ""Tất cả các vị thuốc tán nhỏ, ngâm với $1,5$ lít rượu $35-40$° trong 10 ngày, lấy ra cho uống. Nếu cần ngay có thể đun cách thủy trong 4 giờ, hoặc nếu cấp cứu thì nấu sôi trong bình có ống lạnh thẳng đứng trong 1 giờ là đem ra dùng được. Ngoài việc uống rượu hội còn dùng bông thấm rượu hội xoa và băng nhẹ vào vết cắn để lấy nọc ra. Tiếp tục ngày nào cũng uống cho đến khi hết đau nhức"", ""GhiChu"": """", ""score"": 2.0, ""sort_weight"": 3.0}]']","Để chữa bệnh răng cắn, bạn có thể tham khảo các bài thuốc và cách dùng sau:

*   **Bài thuốc Rắn cắn thóc lép**: Rễ thóc lép tươi 20g, gãi nát vắt lấy nước uống. Bã đắp lên nơi rắn cắn. Ngày dùng 2 lần.
*   **Bài thuốc Rắn cắn Nghệ**: Cả 4 vị giã nhỏ. Thêm một bát nước đun sôi để nguội, lọc lấy nước, cho vài hạt muối vào rồi uống. Chia làm 3 lần trong ngày. Bã đắp vào nơi rắn cắn. Thời gian điều trị chừng 3 ngày.
*   **Bài thuốc Rắn cắn Ruột gà**: Tất cả giã nát vắt lấy nước uống, bã đắp lên nơi rắn cắn.
*   **Bài thuốc Rắn cắn**: Tất cả các vị thuốc tán nhỏ, ngâm với 1,5 lít rượu 35-40° trong 10 ngày, lấy ra cho uống. Nếu cần ngay có thể đun cách thủy trong 4 giờ, hoặc nếu cấp cứu thì nấu sôi trong bình có ống lạnh thẳng đứng trong 1 giờ là đem ra dùng được. Ngày uống 50ml rượu hội này, sau đó cứ cách 5 đến 10 phút lại uống 1 lần. Một ngày tối đa uống 150ml đến 200ml. Ngoài việc uống rượu hội còn dùng bông thấm rượu hội xoa và băng nhẹ vào vết cắn để lấy nọc ra. Tiếp tục ngày nào cũng uống cho đến khi hết đau nhức.","Để chữa bệnh răng cắn, vị thuốc rắn cắn có liều dùng: Ngày 50ml rượu hội này, sau đó cứ cách 5 đến 10 phút lại uống 1 lần. Một ngày tối đa uống 150ml đến 200ml. và cách dùng: Tất cả các vị thuốc tán nhỏ, ngâm với 1,5 lít rượu 35-40° trong 10 ngày, lấy ra cho uống. Nếu cần ngay có thể đun cách thủy trong 4 giờ, hoặc nếu cấp cứu thì nấu sôi trong bình có ống lạnh thẳng đứng trong 1 giờ là đem ra dùng được. Ngoài việc uống rượu hội còn dùng bông thấm rượu hội xoa và băng nhẹ vào vết cắn để lấy nọc ra. Tiếp tục ngày nào cũng uống cho đến khi hết đau nhức",1.0,0.5163457854487173,0.9999999999,1.0,0.6690311615329493
Bệnh ngộ độc sắn có thể dùng vị thuốc hoặc bài thuốc nào để chữa?,"['[{""ChuThe"": ""Triệu chứng Ngộ độc sắn"", ""QuanHe"": ""Được chữa bằng (ViThuoc)"", ""DoiTuong"": ""Vị thuốc Phân người"", ""LieuDung"": ""Tham khảo liều dùng chung của vị thuốc"", ""CachDung"": ""Uống một thang"", ""GhiChu"": ""CT_VT_VN_T992"", ""score"": 2.0}]']","Dựa trên y văn hiện có, đối với triệu chứng ngộ độc sắn, bạn có thể tham khảo vị thuốc sau:

**Vị thuốc Phân người:** Uống một thang. Về liều dùng, bạn có thể tham khảo liều dùng chung của vị thuốc này.",Phân người,1.0,0.4391637674263508,0.9999999999,1.0,0.5246814335500367
"Để chữa bệnh nôn nao, vị thuốc gừng gió được dùng với liều lượng và cách thức như thế nào?","['[{""ChuThe"": ""Vị thuốc Gừng gió"", ""QuanHe"": ""CHU_TRI_TRIEU_CHUNG"", ""DoiTuong"": ""Triệu chứng Nôn nao"", ""LieuDung"": ""Tham khảo liều dùng chung của vị thuốc"", ""CachDung"": ""Thân rễ thái mỏng, ngâm trong rượu 40-50°. Ngâm trong thời gian 15-20 ngày, gạn lấy rượu uống. Mỗi ngày dùng 2-3 ly nhỏ (mỗi ly $15-20ml$)."", ""GhiChu"": ""Chứng nôn nao, chóng mặt, muốn ngất xỉu"", ""score"": 2.0, ""sort_weight"": 3.0}]']","Để chữa triệu chứng nôn nao, bạn có thể tham khảo cách sử dụng **Gừng gió** như sau:

*   **Cách dùng:** Thân rễ thái mỏng, ngâm trong rượu 40-50°. Ngâm trong thời gian 15-20 ngày, gạn lấy rượu uống.
*   **Liều dùng:** Mỗi ngày dùng 2-3 ly nhỏ (mỗi ly 15-20ml).
*   **Lưu ý:** Dùng cho chứng nôn nao, chóng mặt, muốn ngất xỉu.","Để chữa bệnh nôn nao, vị thuốc gừng gió có liều dùng: Tham khảo liều dùng chung của vị thuốc và cách dùng: Thân rễ thái mỏng, ngâm trong rượu 40-50°. Ngâm trong thời gian 15-20 ngày, gạn lấy rượu uống. Mỗi ngày dùng 2-3 ly nhỏ (mỗi ly 15-20ml).",1.0,0.4419079238745672,0.9999999999,1.0,0.8410109225635056
Tác dụng dược lý của trầu không ra sao?,"['[{""ChuThe"": ""Vị thuốc Trầu không"", ""QuanHe"": ""CO_CHUA_HOAT_CHAT"", ""DoiTuong"": ""Hoạt chất Betel Phenol"", ""LieuDung"": ""Chưa ghi nhận"", ""CachDung"": ""Chưa ghi nhận"", ""GhiChu"": """", ""score"": 2.0}, {""ChuThe"": ""Vị thuốc Trầu không"", ""QuanHe"": ""CO_CHUA_HOAT_CHAT"", ""DoiTuong"": ""Hoạt chất Chavicol"", ""LieuDung"": ""Chưa ghi nhận"", ""CachDung"": ""Chưa ghi nhận"", ""GhiChu"": """", ""score"": 2.0}, {""ChuThe"": ""Vị thuốc Trầu không"", ""QuanHe"": ""CHU_TRI_BENH"", ""DoiTuong"": ""Bệnh Mẩn ngứa"", ""LieuDung"": ""Tham khảo liều dùng chung của vị thuốc"", ""CachDung"": ""Giã nhỏ, thêm nước sôi, rửa vết thương"", ""GhiChu"": ""[Nguồn]: CT_VT_VN_T134"", ""score"": 2.0}, {""ChuThe"": ""Vị thuốc Trầu không"", ""QuanHe"": ""CHU_TRI_BENH"", ""DoiTuong"": ""Bệnh Chàm mắt"", ""LieuDung"": ""Tham khảo liều dùng chung của vị thuốc"", ""CachDung"": ""Nước pha lá trầu không dùng làm thuốc nhỏ mắt"", ""GhiChu"": ""[Nguồn]: CT_VT_VN_T134"", ""score"": 2.0}, {""ChuThe"": ""Vị thuốc Trầu không"", ""QuanHe"": ""CHU_TRI_BENH"", ""DoiTuong"": ""Bệnh Tắc sữa"", ""LieuDung"": ""Tham khảo liều dùng chung của vị thuốc"", ""CachDung"": ""Giã đắp lên vú"", ""GhiChu"": ""[Nguồn]: CT_VT_VN_T134"", ""score"": 2.0}, {""ChuThe"": ""Vị thuốc Trầu không"", ""QuanHe"": ""CHU_TRI_BENH"", ""DoiTuong"": ""Bệnh Vết chàm"", ""LieuDung"": ""2-3 lá"", ""CachDung"": ""Cắt nhỏ, cho vào cốc con, dội nước sôi ngập lá, đợi 10-15 phút cho chất thuốc thôi ra nước, dùng nước này rửa vết thương. Ngày 2-3 lần, nếu vết loét thì có thể dùng giấy bản đốt lấy tro đắp vào"", ""GhiChu"": ""[Nguồn]: CT_VT_VN_T134"", ""score"": 2.0}, {""ChuThe"": ""Vị thuốc Trầu không"", ""QuanHe"": ""CHU_TRI_BENH"", ""DoiTuong"": ""Bệnh Viêm kết mạc"", ""LieuDung"": ""Tham khảo liều dùng chung của vị thuốc"", ""CachDung"": ""Nước pha lá trầu không dùng làm thuốc nhỏ mắt"", ""GhiChu"": ""[Nguồn]: CT_VT_VN_T134"", ""score"": 2.0}, {""ChuThe"": ""Vị thuốc Trầu không"", ""QuanHe"": ""CHU_TRI_BENH"", ""DoiTuong"": ""Bệnh Viêm mạch hạch huyết"", ""LieuDung"": ""Tham khảo liều dùng chung của vị thuốc"", ""CachDung"": ""Giã nhỏ, thêm nước sôi, rửa vết thương"", ""GhiChu"": ""[Nguồn]: CT_VT_VN_T134"", ""score"": 2.0}, {""ChuThe"": ""Vị thuốc Trầu không"", ""QuanHe"": ""CHU_TRI_BENH"", ""DoiTuong"": ""Bệnh Ho"", ""LieuDung"": ""Tham khảo liều dùng chung của vị thuốc"", ""CachDung"": ""Giã đắp lên ngực"", ""GhiChu"": ""[Nguồn]: CT_VT_VN_T134"", ""score"": 2.0}, {""ChuThe"": ""Vị thuốc Trầu không"", ""QuanHe"": ""CHU_TRI_BENH"", ""DoiTuong"": ""Bệnh Hen"", ""LieuDung"": ""Tham khảo liều dùng chung của vị thuốc"", ""CachDung"": ""Giã đắp lên ngực"", ""GhiChu"": ""[Nguồn]: CT_VT_VN_T134"", ""score"": 2.0}, {""ChuThe"": ""Vị thuốc Trầu không"", ""QuanHe"": ""CHU_TRI_BENH"", ""DoiTuong"": ""Bệnh Mụn nhọt"", ""LieuDung"": ""2-3 lá"", ""CachDung"": ""Cắt nhỏ, cho vào cốc con, dội nước sôi ngập lá, đợi 10-15 phút cho chất thuốc thôi ra nước, dùng nước này rửa vết thương. Ngày 2-3 lần, nếu vết loét thì có thể dùng giấy bản đốt lấy tro đắp vào"", ""GhiChu"": ""[Nguồn]: CT_VT_VN_T134"", ""score"": 2.0}, {""ChuThe"": ""Vị thuốc Trầu không"", ""QuanHe"": ""CHU_TRI_BENH"", ""DoiTuong"": ""Bệnh Lở loét"", ""LieuDung"": ""2-3 lá | Tham khảo liều dùng chung của vị thuốc"", ""CachDung"": ""Cắt nhỏ, cho vào cốc con, dội nước sôi ngập lá, đợi 10-15 phút cho chất thuốc thôi ra nước, dùng nước này rửa vết thương. Ngày 2-3 lần, nếu vết loét thì có thể dùng giấy bản đốt lấy tro đắp vào | Đun với nước cho sôi kỹ để ấm mà dùng"", ""GhiChu"": ""[Nguồn]: CT_VT_VN_T134"", ""score"": 2.0}, {""ChuThe"": ""Vị thuốc Trầu không"", ""QuanHe"": ""CO_TAC_DUNG_DUOC_LY"", ""DoiTuong"": ""Dược lý Kháng sinh"", ""LieuDung"": ""Chưa ghi nhận"", ""CachDung"": ""Chưa ghi nhận"", ""GhiChu"": """", ""score"": 2.0, ""sort_weight"": 3.0}, {""ChuThe"": ""Vị thuốc Trầu không"", ""QuanHe"": ""CO_TAC_DUNG_DUOC_LY"", ""DoiTuong"": ""Công năng Điều trị viêm"", ""LieuDung"": ""Chưa ghi nhận"", ""CachDung"": ""Chưa ghi nhận"", ""GhiChu"": """", ""score"": 2.0, ""sort_weight"": 3.0}]']","Tác dụng dược lý của **Trầu không**:

*   Kháng sinh.
*   Điều trị viêm.","Điều trị viêm, Dược lý Kháng sinh",1.0,0.42046895723622496,0.9999999999,1.0,0.9853519920334444
Vị thuốc hoàng tinh tham gia vào bài thuốc để chữa những bệnh gì?,"['[{""ChuThe"": ""Vị thuốc Hoàng tinh"", ""QuanHe"": ""Tham gia bài thuốc [Bài thuốc bổ cho người yếu ho lao lực hoàng tinh] để chữa"", ""DoiTuong"": ""Bệnh Lao lực"", ""LieuDung"": ""Chưa ghi nhận"", ""CachDung"": ""Nước $600ml$, sắc còn $200ml$. Chia làm 3 lần uống trong ngày"", ""GhiChu"": ""Bổ dùng cho người yếu, ho, lao lực"", ""score"": 2.0, ""sort_weight"": 3.0}, {""ChuThe"": ""Vị thuốc Hoàng tinh"", ""QuanHe"": ""Tham gia bài thuốc [Bài thuốc bổ cho người yếu ho lao lực hoàng tinh] để chữa"", ""DoiTuong"": ""Bệnh Yếu"", ""LieuDung"": ""Chưa ghi nhận"", ""CachDung"": ""Nước $600ml$, sắc còn $200ml$. Chia làm 3 lần uống trong ngày"", ""GhiChu"": ""Bổ dùng cho người yếu, ho, lao lực"", ""score"": 2.0, ""sort_weight"": 3.0}, {""ChuThe"": ""Vị thuốc Hoàng tinh"", ""QuanHe"": ""Tham gia bài thuốc [Bài thuốc bổ cho người yếu ho lao lực hoàng tinh] để chữa"", ""DoiTuong"": ""Triệu chứng Ho"", ""LieuDung"": ""Chưa ghi nhận"", ""CachDung"": ""Nước $600ml$, sắc còn $200ml$. Chia làm 3 lần uống trong ngày"", ""GhiChu"": ""Bổ dùng cho người yếu, ho, lao lực"", ""score"": 2.0, ""sort_weight"": 3.0}]']","Vị thuốc **Hoàng tinh** tham gia vào bài thuốc [Bài thuốc bổ cho người yếu ho lao lực hoàng tinh] để chữa các bệnh sau:

*   Bệnh Lao lực
*   Bệnh Yếu
*   Triệu chứng Ho

Cách dùng bài thuốc: Nước 600ml, sắc còn 200ml. Chia làm 3 lần uống trong ngày. Bài thuốc này bổ dùng cho người yếu, ho, lao lực.","Lao lực, Yếu, Ho",1.0,0.5301840230661384,0.9999999999,1.0,0.7564945716203533
Vị thuốc mật ong có hoạt chất sacaroza không?,['Không có dữ liệu'],"Không. Dựa trên dữ liệu y văn hiện tại, không có ghi nhận nào cho thấy mật ong có liên quan hoặc tác dụng tới sacaroza.","Có, vị thuốc mật ong có hoạt chất sacaroza",0.0,0.7656454796580937,0.0,0.0,0.2416961242208203
Vị thuốc rau má ngọ có chứa hoạt chất actiin không?,['Không có dữ liệu'],"Không. Dựa trên dữ liệu y văn hiện tại, không có ghi nhận nào cho thấy rau má ngọ có liên quan hoặc tác dụng tới hoạt chất actiin.","Không, vị thuốc rau má ngọ không chứa hoạt chất actiin",0.0,0.7211126749208064,0.9999999999,1.0,0.7434778209713748
Bệnh nào có thể chữa bằng bài thuốc chứa đọt cây cầy?,"['[{""ChuThe"": ""Vị thuốc Đọt cây cầy"", ""QuanHe"": ""Tham gia bài thuốc [Bài thuốc Rắn cắn Ruột gà] để chữa"", ""DoiTuong"": ""Bệnh Răng cắn"", ""LieuDung"": ""Chưa ghi nhận"", ""CachDung"": ""Tất cả giã nát vắt lấy nước uống, bã đắp lên nơi rắn cắn"", ""GhiChu"": ""[Nguồn]: CT_VT_VN_T779"", ""score"": 2.0, ""sort_weight"": 3.0}]']","Dựa trên y văn, **Đọt cây cầy** tham gia bài thuốc **Rắn cắn Ruột gà** để chữa bệnh Rắn cắn. Cách dùng như sau:

*   **Bài thuốc Rắn cắn Ruột gà**: Tất cả giã nát vắt lấy nước uống, bã đắp lên nơi rắn cắn. Liều dùng chưa được ghi nhận.",Răng cắn,1.0,0.5635046547904433,0.9999999999,1.0,0.509817157447848
"Để chữa bệnh viêm bàng quang, vị thuốc sài đất được dùng với liều lượng và cách thức như thế nào?","['[{""ChuThe"": ""Vị thuốc Sài đất"", ""QuanHe"": ""CHU_TRI_BENH"", ""DoiTuong"": ""Bệnh Viêm bàng quang"", ""LieuDung"": ""Tham khảo liều dùng chung của vị thuốc"", ""CachDung"": ""Chỉ định lâm sàng theo kinh nghiệm"", ""GhiChu"": ""CT_VT_VN_T102"", ""score"": 2.0, ""sort_weight"": 3.0}]']","Để chữa bệnh viêm bàng quang, theo y văn, bạn có thể tham khảo thông tin sau về vị thuốc **Sài đất**:

*   **Liều dùng và cách dùng:** Tham khảo liều dùng chung của vị thuốc, chỉ định lâm sàng theo kinh nghiệm.","Để chữa bệnh viêm bàng quang, vị thuốc sài đất có liều dùng: Tham khảo liều dùng chung của vị thuốc và cách dùng: Chỉ định lâm sàng theo kinh nghiệm",1.0,0.4836626228979774,0.9999999999,1.0,0.7445768814938591
Bệnh sốt cao mê sảng có thể dùng vị thuốc hoặc bài thuốc nào để chữa?,"['[{""ChuThe"": ""Triệu chứng Sốt cao mê sảng"", ""QuanHe"": ""Được chữa bằng (ViThuoc)"", ""DoiTuong"": ""Vị thuốc Thạch cao"", ""LieuDung"": ""Tham khảo liều dùng chung của vị thuốc"", ""CachDung"": ""Sốt, sốt rét, trúng phong, sốt cao mê sảng, đầu buốt và nhức"", ""GhiChu"": ""Chỉ định lâm sàng theo kinh nghiệm"", ""score"": 2.0}, {""ChuThe"": ""Triệu chứng Sốt cao mê sảng"", ""QuanHe"": ""Được chữa bằng (BaiThuoc)"", ""DoiTuong"": ""Bài thuốc Sốt cao mê sảng Thạch cao"", ""LieuDung"": ""Chưa ghi nhận"", ""CachDung"": ""Chưa ghi nhận"", ""GhiChu"": """", ""score"": 2.0}]']","Để chữa bệnh sốt cao mê sảng, bạn có thể tham khảo các phương án sau:

**Thông tin tham khảo thêm:**

*   **Vị thuốc Thạch cao:** Dùng cho các trường hợp sốt, sốt rét, trúng phong, sốt cao mê sảng, đầu buốt và nhức. Về liều dùng, bạn có thể tham khảo liều dùng chung của vị thuốc.
*   **Bài thuốc Sốt cao mê sảng Thạch cao:** Hiện tại y văn chưa ghi nhận liều dùng và cách dùng của bài thuốc này.","Sốt cao mê sảng Thạch cao, Thạch cao",1.0,0.4011175698350564,0.9999999999,1.0,0.5171573848634358
Vị thuốc huyết lình tham gia vào bài thuốc để chữa những bệnh gì?,"['[{""ChuThe"": ""Vị thuốc Huyết lình"", ""QuanHe"": ""Tham gia bài thuốc [Bài thuốc Đau Ngã Huyết Lình] để chữa"", ""DoiTuong"": ""Bệnh Đậu"", ""LieuDung"": ""Chưa ghi nhận"", ""CachDung"": ""Cho vào ngâm càng đặc càng tốt, thường một phần huyết lình $5$ phần rượu. Khi dùng ngâm nóng mà xoa bóp vào chỗ sưng đau. Có thể dùng để uống."", ""GhiChu"": """", ""score"": 2.0, ""sort_weight"": 3.0}, {""ChuThe"": ""Vị thuốc Huyết lình"", ""QuanHe"": ""Tham gia bài thuốc [Bài thuốc Đau Ngã Huyết Lình] để chữa"", ""DoiTuong"": ""Bệnh Ngã"", ""LieuDung"": ""Chưa ghi nhận"", ""CachDung"": ""Cho vào ngâm càng đặc càng tốt, thường một phần huyết lình $5$ phần rượu. Khi dùng ngâm nóng mà xoa bóp vào chỗ sưng đau. Có thể dùng để uống."", ""GhiChu"": """", ""score"": 2.0, ""sort_weight"": 3.0}, {""ChuThe"": ""Vị thuốc Huyết lình"", ""QuanHe"": ""Tham gia bài thuốc [Bài thuốc Gầy Yếu Huyết Lình] để chữa"", ""DoiTuong"": ""Triệu chứng Xanh xao"", ""LieuDung"": ""Chưa ghi nhận"", ""CachDung"": ""Cho vào cháo nóng cho trẻ con ăn vào buổi sáng. Mỗi lần cho uống $1-2g$. Dùng luôn trong 7-10 ngày."", ""GhiChu"": """", ""score"": 2.0, ""sort_weight"": 3.0}, {""ChuThe"": ""Vị thuốc Huyết lình"", ""QuanHe"": ""Tham gia bài thuốc [Bài thuốc Gầy Yếu Huyết Lình] để chữa"", ""DoiTuong"": ""Triệu chứng Gầy yếu"", ""LieuDung"": ""Chưa ghi nhận"", ""CachDung"": ""Cho vào cháo nóng cho trẻ con ăn vào buổi sáng. Mỗi lần cho uống $1-2g$. Dùng luôn trong 7-10 ngày."", ""GhiChu"": """", ""score"": 2.0, ""sort_weight"": 3.0}, {""ChuThe"": ""Vị thuốc Huyết lình"", ""QuanHe"": ""Tham gia bài thuốc [Bài thuốc Kem An Huyết Lình] để chữa"", ""DoiTuong"": ""Bệnh Chàm lớn"", ""LieuDung"": ""Chưa ghi nhận"", ""CachDung"": ""Cho vào cháo nóng cho trẻ con ăn vào buổi sáng. Mỗi lần cho uống $1-2g$. Dùng luôn trong 7-10 ngày."", ""GhiChu"": """", ""score"": 2.0, ""sort_weight"": 3.0}, {""ChuThe"": ""Vị thuốc Huyết lình"", ""QuanHe"": ""Tham gia bài thuốc [Bài thuốc Kem An Huyết Lình] để chữa"", ""DoiTuong"": ""Triệu chứng Kém ăn"", ""LieuDung"": ""Chưa ghi nhận"", ""CachDung"": ""Cho vào cháo nóng cho trẻ con ăn vào buổi sáng. Mỗi lần cho uống $1-2g$. Dùng luôn trong 7-10 ngày."", ""GhiChu"": """", ""score"": 2.0, ""sort_weight"": 3.0}]']","Vị thuốc **Huyết lình** tham gia vào các bài thuốc để chữa các bệnh sau:

*   Tham gia bài thuốc **Đau Ngã Huyết Lình** để chữa bệnh Đậu và bệnh Ngã. Cách dùng: Cho vào ngâm càng đặc càng tốt, thường một phần huyết lình 5 phần rượu. Khi dùng ngâm nóng mà xoa bóp vào chỗ sưng đau. Có thể dùng để uống.
*   Tham gia bài thuốc **Gầy Yếu Huyết Lình** để chữa triệu chứng Xanh xao và Gầy yếu. Cách dùng: Cho vào cháo nóng cho trẻ con ăn vào buổi sáng. Mỗi lần cho uống 1-2g. Dùng luôn trong 7-10 ngày.
*   Tham gia bài thuốc **Kem An Huyết Lình** để chữa bệnh Chàm lớn và triệu chứng Kém ăn. Cách dùng: Cho vào cháo nóng cho trẻ con ăn vào buổi sáng. Mỗi lần cho uống 1-2g. Dùng luôn trong 7-10 ngày.","Chàm lớn, Ngã, Đậu, Gầy yếu, Kém ăn, Xanh xao",1.0,0.5453019486820101,0.9999999999,1.0,0.6564648496953362
Bệnh nào có thể chữa bằng bài thuốc chứa rau om?,"['[{""ChuThe"": ""Vị thuốc Rau om"", ""QuanHe"": ""Tham gia bài thuốc [Bài thuốc Sỏi Thận Rau Om] để chữa"", ""DoiTuong"": ""Bệnh Sỏi thận"", ""LieuDung"": ""Chưa ghi nhận"", ""CachDung"": ""Chưa ghi nhận"", ""GhiChu"": """", ""score"": 2.0, ""sort_weight"": 3.0}]']",**Rau om** tham gia bài thuốc **Bài thuốc Sỏi Thận Rau Om** để chữa bệnh **Sỏi thận**. Liều dùng và cách dùng của vị thuốc này trong bài thuốc chưa được ghi nhận.,Sỏi thận,1.0,0.0,0.9999999999,1.0,0.5844062805055199
Bệnh đại tiện táo bón có thể dùng vị thuốc hoặc bài thuốc nào để chữa?,"['[{""ChuThe"": ""Bệnh Đại tiện táo bón"", ""QuanHe"": ""Được chữa bằng (ViThuoc)"", ""DoiTuong"": ""Vị thuốc Mã thầy"", ""LieuDung"": ""$10-20g$"", ""CachDung"": ""Dưới dạng thuốc sắc"", ""GhiChu"": ""[Nguồn]: CT_VT_VN_T289"", ""score"": 2.0, ""sort_weight"": 3.0}, {""ChuThe"": ""Bệnh Đại tiện táo bón"", ""QuanHe"": ""Được chữa bằng (ViThuoc)"", ""DoiTuong"": ""Vị thuốc Tích dương"", ""LieuDung"": ""$6-12g$"", ""CachDung"": ""Dạng thuốc sắc, thuốc bột, thuốc hoàn, thuốc rượu"", ""GhiChu"": ""[Nguồn]: CT_VT_VN_T952"", ""score"": 2.0, ""sort_weight"": 3.0}]']","Dựa trên y văn, bệnh đại tiện táo bón có thể được chữa bằng các vị thuốc sau:

*   **Mã thầy**: Liều dùng 10-20g dưới dạng thuốc sắc.
*   **Tích dương**: Liều dùng 6-12g dưới dạng thuốc sắc, thuốc bột, thuốc hoàn, thuốc rượu.","Mã thầy, Tích dương",1.0,0.4333548064801191,0.9999999999,1.0,0.6283688599944337
Bệnh nào có thể chữa bằng bài thuốc chứa rượu trắng?,"['[{""ChuThe"": ""Vi Ruou Trang"", ""QuanHe"": ""Tham gia bài thuốc [Bài thuốc Ghẻ Máu chó 2] để chữa"", ""DoiTuong"": ""Bệnh Ghẻ"", ""LieuDung"": ""Chưa ghi nhận"", ""CachDung"": ""Giã nhỏ hạt máu chó, sẩy bỏ vỏ, trộn với rượu trắng, đun sôi trên bếp than đến khi được hỗn hợp sền sệt. Rửa nốt ghẻ cho bong vẩy, bôi ngay dầu còn hơi nóng, bôi thật mỏng, hôm sau tắm sạch bằng xà phòng, bôi một lần nữa. Thường chỉ $3$ lần là khỏi."", ""GhiChu"": """", ""score"": 2.0}, {""ChuThe"": ""Vi Ruou Trang"", ""QuanHe"": ""Tham gia bài thuốc [Bài thuốc Ghẻ Ruồi Máu chó] để chữa"", ""DoiTuong"": ""Bệnh ghẻ ruồi"", ""LieuDung"": ""Chưa ghi nhận"", ""CachDung"": ""Giã nhỏ hạt máu chó, sẩy bỏ vỏ, trộn với rượu trắng, đun sôi trên bếp than đến khi được hỗn hợp sền sệt. Rửa nốt ghẻ cho bong vẩy, bôi ngay dầu còn hơi nóng, bôi thật mỏng, hôm sau tắm sạch bằng xà phòng, bôi một lần nữa. Thường chỉ $3$ lần là khỏi."", ""GhiChu"": """", ""score"": 2.0}, {""ChuThe"": ""Vị thuốc Rượu Trắng"", ""QuanHe"": ""Tham gia bài thuốc [Bài thuốc Đau Răng Hoàng Liên Gai] để chữa"", ""DoiTuong"": ""Triệu chứng Đau răng"", ""LieuDung"": ""Chưa ghi nhận"", ""CachDung"": ""Ngâm trong 7-10 ngày. Chấm vào nơi răng đau"", ""GhiChu"": """", ""score"": 2.0, ""sort_weight"": 3.0}, {""ChuThe"": ""Vị thuốc Rượu Trắng"", ""QuanHe"": ""Tham gia bài thuốc [Bệnh Liệt dương (Sâm cau)] để chữa"", ""DoiTuong"": ""Bệnh Phong thấp"", ""LieuDung"": ""Chưa ghi nhận"", ""CachDung"": ""Ngâm trong vòng 7 ngày hay hơn. Mỗi ngày uống hai lần, vào trước hai bữa ăn chính, mỗi lần một chén nhỏ chừng $25-30ml$"", ""GhiChu"": ""CT_VT_VN_T927"", ""score"": 2.0, ""sort_weight"": 3.0}, {""ChuThe"": ""Vị thuốc Rượu Trắng"", ""QuanHe"": ""Tham gia bài thuốc [Bệnh Liệt dương (Sâm cau)] để chữa"", ""DoiTuong"": ""Bệnh Thần kinh suy nhược"", ""LieuDung"": ""Chưa ghi nhận"", ""CachDung"": ""Ngâm trong vòng 7 ngày hay hơn. Mỗi ngày uống hai lần, vào trước hai bữa ăn chính, mỗi lần một chén nhỏ chừng $25-30ml$"", ""GhiChu"": ""CT_VT_VN_T927"", ""score"": 2.0, ""sort_weight"": 3.0}, {""ChuThe"": ""Vị thuốc Rượu Trắng"", ""QuanHe"": ""Tham gia bài thuốc [Bệnh Liệt dương (Sâm cau)] để chữa"", ""DoiTuong"": ""Bệnh Liệt dương"", ""LieuDung"": ""Chưa ghi nhận"", ""CachDung"": ""Ngâm trong vòng 7 ngày hay hơn. Mỗi ngày uống hai lần, vào trước hai bữa ăn chính, mỗi lần một chén nhỏ chừng $25-30ml$"", ""GhiChu"": ""CT_VT_VN_T927"", ""score"": 2.0, ""sort_weight"": 3.0}, {""ChuThe"": ""Vị thuốc Rượu Trắng"", ""QuanHe"": ""Tham gia bài thuốc [Bệnh Liệt dương (Sâm cau)] để chữa"", ""DoiTuong"": ""Triệu chứng Lưng lạnh đầu"", ""LieuDung"": ""Chưa ghi nhận"", ""CachDung"": ""Ngâm trong vòng 7 ngày hay hơn. Mỗi ngày uống hai lần, vào trước hai bữa ăn chính, mỗi lần một chén nhỏ chừng $25-30ml$"", ""GhiChu"": ""CT_VT_VN_T927"", ""score"": 2.0, ""sort_weight"": 3.0}]']","Dựa trên y văn, **Rượu Trắng** tham gia vào các bài thuốc chữa các bệnh sau:

*   **Bài thuốc Đau Răng Hoàng Liên Gai**: Chữa triệu chứng Đau răng. Cách dùng: Ngâm trong 7-10 ngày. Chấm vào nơi răng đau.
*   **Bài thuốc Bệnh Liệt dương (Sâm cau)**: Chữa các bệnh Phong thấp, Thần kinh suy nhược, Liệt dương, triệu chứng Lưng lạnh đầu. Cách dùng: Ngâm trong vòng 7 ngày hay hơn. Mỗi ngày uống hai lần, vào trước hai bữa ăn chính, mỗi lần một chén nhỏ chừng 25-30ml.

Thông tin tham khảo thêm:

*   **Bài thuốc Ghẻ Máu chó 2**: Chữa bệnh Ghẻ. Cách dùng: Giã nhỏ hạt máu chó, sẩy bỏ vỏ, trộn với rượu trắng, đun sôi trên bếp than đến khi được hỗn hợp sền sệt. Rửa nốt ghẻ cho bong vẩy, bôi ngay dầu còn hơi nóng, bôi thật mỏng, hôm sau tắm sạch bằng xà phòng, bôi một lần nữa. Thường chỉ 3 lần là khỏi.
*   **Bài thuốc Ghẻ Ruồi Máu chó**: Chữa bệnh ghẻ ruồi. Cách dùng: Giã nhỏ hạt máu chó, sẩy bỏ vỏ, trộn với rượu trắng, đun sôi trên bếp than đến khi được hỗn hợp sền sệt. Rửa nốt ghẻ cho bong vẩy, bôi ngay dầu còn hơi nóng, bôi thật mỏng, hôm sau tắm sạch bằng xà phòng, bôi một lần nữa. Thường chỉ 3 lần là khỏi.","Liệt dương, Phong thấp, Thần kinh suy nhược, Lưng lạnh đầu, Đau răng",1.0,0.45470161185016256,0.9999999999,1.0,0.5367990901294808
Vị thuốc đông trùng hạ thảo có hoạt chất axit cocdixepic 3 4 5 tetraoxyhexahydrobenzoic không?,['Không có dữ liệu'],"Không. Dựa trên dữ liệu y văn hiện tại, không có ghi nhận nào cho thấy đông trùng hạ thảo có liên quan hoặc tác dụng tới axit cocdixepic 3 4 5 tetraoxyhexahydrobenzoic.","Có, vị thuốc đông trùng hạ thảo có hoạt chất axit cocdixepic 3 4 5 tetraoxyhexahydrobenzoic",0.0,0.8935924495656532,0.0,0.0,0.2437638183948006
Vị thuốc khế rừng có chứa hoạt chất peletierin không?,['Không có dữ liệu'],"Không. Dựa trên dữ liệu y văn hiện tại, không có ghi nhận nào cho thấy khế rừng có liên quan hoặc tác dụng tới peletierin.","Không, vị thuốc khế rừng không chứa hoạt chất peletierin",0.0,0.7932229033205898,0.0,1.0,0.738880077075114
Bệnh nào có thể chữa bằng bài thuốc chứa hương phụ?,"['[{""ChuThe"": ""Vị thuốc Hương phụ"", ""QuanHe"": ""Tham gia bài thuốc [Bài thuốc Đau bụng kinh niên thìa là] để chữa"", ""DoiTuong"": ""Triệu chứng Đau bụng kinh niên"", ""LieuDung"": ""Chưa ghi nhận"", ""CachDung"": ""Chưa ghi nhận"", ""GhiChu"": """", ""score"": 2.0, ""sort_weight"": 3.0}, {""ChuThe"": ""Vị thuốc Hương phụ"", ""QuanHe"": ""Tham gia bài thuốc [Bài thuốc Đái dầm hương tần] để chữa"", ""DoiTuong"": ""Bệnh Giới giun"", ""LieuDung"": ""Chưa ghi nhận"", ""CachDung"": ""Chưa ghi nhận"", ""GhiChu"": """", ""score"": 2.0, ""sort_weight"": 3.0}, {""ChuThe"": ""Vị thuốc Hương phụ"", ""QuanHe"": ""Tham gia bài thuốc [Bài thuốc Đái dầm hương tần] để chữa"", ""DoiTuong"": ""Triệu chứng Đái dầm"", ""LieuDung"": ""Chưa ghi nhận"", ""CachDung"": ""Chưa ghi nhận"", ""GhiChu"": """", ""score"": 2.0, ""sort_weight"": 3.0}, {""ChuThe"": ""Vị thuốc Hương phụ"", ""QuanHe"": ""Tham gia bài thuốc [Bài thuốc Đái dầm hương tần] để chữa"", ""DoiTuong"": ""Triệu chứng Sung huyết"", ""LieuDung"": ""Chưa ghi nhận"", ""CachDung"": ""Chưa ghi nhận"", ""GhiChu"": """", ""score"": 2.0, ""sort_weight"": 3.0}, {""ChuThe"": ""Vị thuốc Hương phụ"", ""QuanHe"": ""Tham gia bài thuốc [Bài thuốc Đái dầm hương tần] để chữa"", ""DoiTuong"": ""Triệu chứng Đau bụng"", ""LieuDung"": ""Chưa ghi nhận"", ""CachDung"": ""Chưa ghi nhận"", ""GhiChu"": """", ""score"": 2.0, ""sort_weight"": 3.0}, {""ChuThe"": ""Vị thuốc Hương phụ"", ""QuanHe"": ""Tham gia bài thuốc [Bài thuốc Đái dầm hương tần] để chữa"", ""DoiTuong"": ""Triệu chứng Đau nhức"", ""LieuDung"": ""Chưa ghi nhận"", ""CachDung"": ""Chưa ghi nhận"", ""GhiChu"": """", ""score"": 2.0, ""sort_weight"": 3.0}, {""ChuThe"": ""Vị thuốc Hương phụ"", ""QuanHe"": ""Tham gia bài thuốc [Bài thuốc Đái dầm hương tần] để chữa"", ""DoiTuong"": ""Triệu chứng Nôn mửa"", ""LieuDung"": ""Chưa ghi nhận"", ""CachDung"": ""Chưa ghi nhận"", ""GhiChu"": """", ""score"": 2.0, ""sort_weight"": 3.0}, {""ChuThe"": ""Vị thuốc Hương phụ"", ""QuanHe"": ""Tham gia bài thuốc [Bài thuốc Cao huyết áp Hương phụ] để chữa"", ""DoiTuong"": ""Bệnh Cao huyết áp"", ""LieuDung"": ""Chưa ghi nhận"", ""CachDung"": ""Chưa ghi nhận"", ""GhiChu"": """", ""score"": 2.0, ""sort_weight"": 3.0}, {""ChuThe"": ""Vị thuốc Hương phụ"", ""QuanHe"": ""Tham gia bài thuốc [Bài thuốc Cao huyết áp Hương phụ] để chữa"", ""DoiTuong"": ""Bệnh Phụ khoa"", ""LieuDung"": ""Chưa ghi nhận"", ""CachDung"": ""Chưa ghi nhận"", ""GhiChu"": """", ""score"": 2.0, ""sort_weight"": 3.0}, {""ChuThe"": ""Vị thuốc Hương phụ"", ""QuanHe"": ""Tham gia bài thuốc [Bài thuốc Khí hư bạch đới Hương phụ] để chữa"", ""DoiTuong"": ""Bệnh Khí hư bạch đới"", ""LieuDung"": ""Chưa ghi nhận"", ""CachDung"": ""Chưa ghi nhận"", ""GhiChu"": """", ""score"": 2.0, ""sort_weight"": 3.0}, {""ChuThe"": ""Vị thuốc Hương phụ"", ""QuanHe"": ""Tham gia bài thuốc [Bài thuốc Khí hư bạch đới Hương phụ] để chữa"", ""DoiTuong"": ""Bệnh Kinh nguyệt không đều"", ""LieuDung"": ""Chưa ghi nhận"", ""CachDung"": ""Chưa ghi nhận"", ""GhiChu"": """", ""score"": 2.0, ""sort_weight"": 3.0}, {""ChuThe"": ""Vị thuốc Hương phụ"", ""QuanHe"": ""Tham gia bài thuốc [Bài thuốc Khí hư bạch đới Hương phụ] để chữa"", ""DoiTuong"": ""Triệu chứng Đau bụng"", ""LieuDung"": ""Chưa ghi nhận"", ""CachDung"": ""Chưa ghi nhận"", ""GhiChu"": """", ""score"": 2.0, ""sort_weight"": 3.0}, {""ChuThe"": ""Vị thuốc Hương phụ"", ""QuanHe"": ""Tham gia bài thuốc [Bài thuốc Kinh nguyệt không đều Hương phụ] để chữa"", ""DoiTuong"": ""Bệnh Rong huyết"", ""LieuDung"": ""Chưa ghi nhận"", ""CachDung"": ""Chưa ghi nhận"", ""GhiChu"": """", ""score"": 2.0, ""sort_weight"": 3.0}, {""ChuThe"": ""Vị thuốc Hương phụ"", ""QuanHe"": ""Tham gia bài thuốc [Bài thuốc Kinh nguyệt không đều Hương phụ] để chữa"", ""DoiTuong"": ""Bệnh Kinh nguyệt không đều"", ""LieuDung"": ""Chưa ghi nhận"", ""CachDung"": ""Chưa ghi nhận"", ""GhiChu"": """", ""score"": 2.0, ""sort_weight"": 3.0}, {""ChuThe"": ""Vị thuốc Hương phụ"", ""QuanHe"": ""Tham gia bài thuốc [Bài thuốc Khí hư bạch đới bạch đồng nữ] để chữa"", ""DoiTuong"": ""Bệnh Bạch đới"", ""LieuDung"": ""Chưa ghi nhận"", ""CachDung"": ""Sắc uống. Thêm nước vào đun sôi giữ sôi trong nửa giờ lấy ra uống"", ""GhiChu"": ""Khí hư, bạch đới. Nguồn: CT_VT_VN_T54."", ""score"": 2.0, ""sort_weight"": 3.0}, {""ChuThe"": ""Vị thuốc Hương phụ"", ""QuanHe"": ""Tham gia bài thuốc [Bài thuốc Khí hư bạch đới bạch đồng nữ] để chữa"", ""DoiTuong"": ""Bệnh Khí hư"", ""LieuDung"": ""Chưa ghi nhận"", ""CachDung"": ""Sắc uống. Thêm nước vào đun sôi giữ sôi trong nửa giờ lấy ra uống"", ""GhiChu"": ""Khí hư, bạch đới. Nguồn: CT_VT_VN_T54."", ""score"": 2.0, ""sort_weight"": 3.0}, {""ChuThe"": ""Vị thuốc Hương phụ"", ""QuanHe"": ""Tham gia bài thuốc [Bài thuốc Khí hư đới hạ ở nữ] để chữa"", ""DoiTuong"": ""Bệnh Bạch đới"", ""LieuDung"": ""Chưa ghi nhận"", ""CachDung"": ""Sắc uống."", ""GhiChu"": ""Chữa bạch đới, khí hư, kinh nguyệt không đều. Nguồn: CT_VT_VN_T55."", ""score"": 2.0, ""sort_weight"": 3.0}, {""ChuThe"": ""Vị thuốc Hương phụ"", ""QuanHe"": ""Tham gia bài thuốc [Bài thuốc Khí hư đới hạ ở nữ] để chữa"", ""DoiTuong"": ""Bệnh Kinh nguyệt không đều"", ""LieuDung"": ""Chưa ghi nhận"", ""CachDung"": ""Sắc uống."", ""GhiChu"": ""Chữa bạch đới, khí hư, kinh nguyệt không đều. Nguồn: CT_VT_VN_T55."", ""score"": 2.0, ""sort_weight"": 3.0}, {""ChuThe"": ""Vị thuốc Hương phụ"", ""QuanHe"": ""Tham gia bài thuốc [Bài thuốc Khí hư đới hạ ở nữ] để chữa"", ""DoiTuong"": ""Bệnh Khí hư"", ""LieuDung"": ""Chưa ghi nhận"", ""CachDung"": ""Sắc uống."", ""GhiChu"": ""Chữa bạch đới, khí hư, kinh nguyệt không đều. Nguồn: CT_VT_VN_T55."", ""score"": 2.0, ""sort_weight"": 3.0}, {""ChuThe"": ""Vị thuốc Hương phụ"", ""QuanHe"": ""Tham gia bài thuốc [Bài thuốc Sưng đau gối Hoàng nàn] để chữa"", ""DoiTuong"": ""Bệnh Tê thấp"", ""LieuDung"": ""$2-3g$"", ""CachDung"": ""Bốn vị tán nhỏ. Sau bữa ăn nửa giờ, uống $2-3g$ thuốc này, chiêu bằng nước hoặc bằng rượu. Uống xong đi nằm. Một số người uống thuốc này vào thấy đau hơn, nhưng sau thì đỡ"", ""GhiChu"": ""CT_VT_VN_T540 - Trang 540, từ \'Tê thấp, nhức xương, sưng đầu gối | Hoàng nàn chế sao vàng $600g$, hương phụ tứ chế $160g$, thảo quả không sao, bỏ vỏ lấy hạt $20g$, đại hồi bỏ hạt, lấy vỏ $20g$ | Bốn vị tán nhỏ. Sau bữa ăn nửa giờ, uống $2-3g$ thuốc này, chiêu bằng nước hoặc bằng rượu. Uống xong đi nằm. Một số người uống thuốc này vào thấy đau hơn, nhưng sau thì đỡ | [Nguồn]: CT_VT_VN_T540\' -> \'Tê thấp, nhức xương, sưng đầu gối | Hoàng nàn chế sao vàng $600g$, hương phụ tứ chế $160g$, thảo quả không sao, bỏ vỏ lấy hạt $20g$, đại hồi bỏ hạt, lấy vỏ $20g$\'. Điều này cho thấy bài thuốc này có thể dùng để chữa tê thấp. Liều lượng là $2-3g$. Cách dùng là tán nhỏ bốn vị, sau bữa ăn nửa giờ uống $2-3g$ thuốc này, chiêu bằng nước hoặc bằng rượu. Uống xong đi nằm. Một số người uống thuốc này vào thấy đau hơn, nhưng sau thì đỡ. Nguồn thông tin là CT_VT_VN_T540, trang 540 của cuốn sách Cây thuốc và vị thuốc Việt Nam. Cần lưu ý tham khảo ý kiến của thầy thuốc trước khi sử dụng."", ""score"": 2.0, ""sort_weight"": 3.0}, {""ChuThe"": ""Vị thuốc Hương phụ"", ""QuanHe"": ""Tham gia bài thuốc [Bài thuốc Sưng đau gối Hoàng nàn] để chữa"", ""DoiTuong"": ""Triệu chứng Sưng đầu gối"", ""LieuDung"": ""$2-3g$"", ""CachDung"": ""Bốn vị tán nhỏ. Sau bữa ăn nửa giờ, uống $2-3g$ thuốc này, chiêu bằng nước hoặc bằng rượu. Uống xong đi nằm. Một số người uống thuốc này vào thấy đau hơn, nhưng sau thì đỡ"", ""GhiChu"": ""CT_VT_VN_T540 - Trang 540, từ \'Tê thấp, nhức xương, sưng đầu gối | Hoàng nàn chế sao vàng $600g$, hương phụ tứ chế $160g$, thảo quả không sao, bỏ vỏ lấy hạt $20g$, đại hồi bỏ hạt, lấy vỏ $20g$ | Bốn vị tán nhỏ. Sau bữa ăn nửa giờ, uống $2-3g$ thuốc này, chiêu bằng nước hoặc bằng rượu. Uống xong đi nằm. Một số người uống thuốc này vào thấy đau hơn, nhưng sau thì đỡ | [Nguồn]: CT_VT_VN_T540\' -> \'Tê thấp, nhức xương, sưng đầu gối | Hoàng nàn chế sao vàng $600g$, hương phụ tứ chế $160g$, thảo quả không sao, bỏ vỏ lấy hạt $20g$, đại hồi bỏ hạt, lấy vỏ $20g$\'. Điều này cho thấy bài thuốc này có thể dùng để chữa sưng đầu gối. Liều lượng là $2-3g$. Cách dùng là tán nhỏ bốn vị, sau bữa ăn nửa giờ uống $2-3g$ thuốc này, chiêu bằng nước hoặc bằng rượu. Uống xong đi nằm. Một số người uống thuốc này vào thấy đau hơn, nhưng sau thì đỡ. Nguồn thông tin là CT_VT_VN_T540, trang 540 của cuốn sách Cây thuốc và vị thuốc Việt Nam. Cần lưu ý tham khảo ý kiến của thầy thuốc trước khi sử dụng."", ""score"": 2.0, ""sort_weight"": 3.0}, {""ChuThe"": ""Vị thuốc Hương phụ"", ""QuanHe"": ""Tham gia bài thuốc [Bài thuốc Sưng đau gối Hoàng nàn] để chữa"", ""DoiTuong"": ""Triệu chứng Nhức xương"", ""LieuDung"": ""$2-3g$"", ""CachDung"": ""Bốn vị tán nhỏ. Sau bữa ăn nửa giờ, uống $2-3g$ thuốc này, chiêu bằng nước hoặc bằng rượu. Uống xong đi nằm. Một số người uống thuốc này vào thấy đau hơn, nhưng sau thì đỡ"", ""GhiChu"": ""CT_VT_VN_T540 - Trang 540, từ \'Tê thấp, nhức xương, sưng đầu gối | Hoàng nàn chế sao vàng $600g$, hương phụ tứ chế $160g$, thảo quả không sao, bỏ vỏ lấy hạt $20g$, đại hồi bỏ hạt, lấy vỏ $20g$ | Bốn vị tán nhỏ. Sau bữa ăn nửa giờ, uống $2-3g$ thuốc này, chiêu bằng nước hoặc bằng rượu. Uống xong đi nằm. Một số người uống thuốc này vào thấy đau hơn, nhưng sau thì đỡ | [Nguồn]: CT_VT_VN_T540\' -> \'Tê thấp, nhức xương, sưng đầu gối | Hoàng nàn chế sao vàng $600g$, hương phụ tứ chế $160g$, thảo quả không sao, bỏ vỏ lấy hạt $20g$, đại hồi bỏ hạt, lấy vỏ $20g$\'. Điều này cho thấy bài thuốc này có thể dùng để chữa nhức xương. Liều lượng là $2-3g$. Cách dùng là tán nhỏ bốn vị, sau bữa ăn nửa giờ uống $2-3g$ thuốc này, chiêu bằng nước hoặc bằng rượu. Uống xong đi nằm. Một số người uống thuốc này vào thấy đau hơn, nhưng sau thì đỡ. Nguồn thông tin là CT_VT_VN_T540, trang 540 của cuốn sách Cây thuốc và vị thuốc Việt Nam. Cần lưu ý tham khảo ý kiến của thầy thuốc trước khi sử dụng."", ""score"": 2.0, ""sort_weight"": 3.0}, {""ChuThe"": ""Vị thuốc Hương phụ tử"", ""QuanHe"": ""Tham gia bài thuốc [Bài thuốc Tễ Thập Mã Tiền] để chữa"", ""DoiTuong"": ""Bệnh Tê thấp"", ""LieuDung"": ""Mỗi ngày uống $4$ viên, tối đa $6$ đến $8$ viên"", ""CachDung"": ""Hoàn $1000$ viên. Theo hướng dẫn uống khi nào thấy giật giật mới có kết quả. Một đợt uống $50$ viên thì lại nghỉ"", ""GhiChu"": ""đau nhức, sưng khớp"", ""score"": 2.0}, {""ChuThe"": ""Vị thuốc Hương phụ"", ""QuanHe"": ""Tham gia bài thuốc [Bài thuốc Mũi tắc điều tân] để chữa"", ""DoiTuong"": ""Triệu chứng Mũi tắc"", ""LieuDung"": ""Chưa ghi nhận"", ""CachDung"": ""Chưa ghi nhận"", ""GhiChu"": """", ""score"": 2.0, ""sort_weight"": 3.0}, {""ChuThe"": ""Vị thuốc Hương phụ"", ""QuanHe"": ""Tham gia bài thuốc [Bài thuốc Mũi tắc điều tân] để chữa"", ""DoiTuong"": ""Triệu chứng Mất ngủ"", ""LieuDung"": ""Chưa ghi nhận"", ""CachDung"": ""Chưa ghi nhận"", ""GhiChu"": """", ""score"": 2.0, ""sort_weight"": 3.0}, {""ChuThe"": ""Vị thuốc Hương phụ"", ""QuanHe"": ""Tham gia bài thuốc [Bài thuốc Mũi tắc điều tân] để chữa"", ""DoiTuong"": ""Triệu chứng Chóng mặt"", ""LieuDung"": ""Chưa ghi nhận"", ""CachDung"": ""Chưa ghi nhận"", ""GhiChu"": """", ""score"": 2.0, ""sort_weight"": 3.0}, {""ChuThe"": ""Vị thuốc Hương phụ"", ""QuanHe"": ""Tham gia bài thuốc [Bài thuốc Trước đẻ đơn bi] để chữa"", ""DoiTuong"": ""Bệnh Xích Bạch đới"", ""LieuDung"": ""Chưa ghi nhận"", ""CachDung"": ""Chưa ghi nhận"", ""GhiChu"": """", ""score"": 2.0, ""sort_weight"": 3.0}, {""ChuThe"": ""Vị thuốc Hương phụ"", ""QuanHe"": ""Tham gia bài thuốc [Bài thuốc Trước đẻ đơn bi] để chữa"", ""DoiTuong"": ""Bệnh Sau đẻ"", ""LieuDung"": ""Chưa ghi nhận"", ""CachDung"": ""Chưa ghi nhận"", ""GhiChu"": """", ""score"": 2.0, ""sort_weight"": 3.0}, {""ChuThe"": ""Vị thuốc Hương phụ"", ""QuanHe"": ""Tham gia bài thuốc [Bài thuốc Trước đẻ đơn bi] để chữa"", ""DoiTuong"": ""Bệnh Trước đẻ"", ""LieuDung"": ""Chưa ghi nhận"", ""CachDung"": ""Chưa ghi nhận"", ""GhiChu"": """", ""score"": 2.0, ""sort_weight"": 3.0}, {""ChuThe"": ""Vị thuốc Hương phụ"", ""QuanHe"": ""Tham gia bài thuốc [Bài thuốc Huyết áp cao đậu thảo] để chữa"", ""DoiTuong"": ""Bệnh Huyết áp cao"", ""LieuDung"": ""Chưa ghi nhận"", ""CachDung"": ""Sắc còn $200$ml chia ba lần uống trong ngày"", ""GhiChu"": ""[Nguồn]: CT_VT_VN_T329"", ""score"": 2.0, ""sort_weight"": 3.0}]']","Dựa trên y văn, vị thuốc **Hương phụ** có thể tham gia vào các bài thuốc để chữa các bệnh sau:

*   Đau bụng kinh niên: Tham gia bài thuốc **Đau bụng kinh niên thìa là**.
*   Giới giun, đái dầm, sung huyết, đau bụng, đau nhức, nôn mửa: Tham gia bài thuốc **Đái dầm hương tần**.
*   Cao huyết áp, bệnh phụ khoa: Tham gia bài thuốc **Cao huyết áp Hương phụ**.
*   Khí hư bạch đới, kinh nguyệt không đều, đau bụng: Tham gia bài thuốc **Khí hư bạch đới Hương phụ**.
*   Rong huyết, kinh nguyệt không đều: Tham gia bài thuốc **Kinh nguyệt không đều Hương phụ**.
*   Bạch đới, khí hư: Tham gia bài thuốc **Khí hư bạch đới bạch đồng nữ**. Cách dùng: Sắc uống. Thêm nước vào đun sôi giữ sôi trong nửa giờ lấy ra uống.
*   Bạch đới, khí hư, kinh nguyệt không đều: Tham gia bài thuốc **Khí hư đới hạ ở nữ**. Cách dùng: Sắc uống.
*   Tê thấp, sưng đầu gối, nhức xương: Tham gia bài thuốc **Sưng đau gối Hoàng nàn**. Liều dùng: 2-3g. Cách dùng: Bốn vị tán nhỏ. Sau bữa ăn nửa giờ, uống 2-3g thuốc này, chiêu bằng nước hoặc bằng rượu. Uống xong đi nằm.
*   Mũi tắc, mất ngủ, chóng mặt: Tham gia bài thuốc **Mũi tắc điều tân**.
*   Xích bạch đới, sau đẻ, trước đẻ: Tham gia bài thuốc **Trước đẻ đơn bi**.
*   Huyết áp cao: Tham gia bài thuốc **Huyết áp cao đậu thảo**. Cách dùng: Sắc còn 200ml chia ba lần uống trong ngày.

**Thông tin tham khảo thêm:**

Đối với bệnh Tê thấp, có thể tham khảo bài thuốc **Tễ Thập Mã Tiền** có chứa vị thuốc **Hương phụ tử**. Liều dùng: Mỗi ngày uống 4 viên, tối đa 6 đến 8 viên. Cách dùng: Hoàn 1000 viên. Theo hướng dẫn uống khi nào thấy giật giật mới có kết quả. Một đợt uống 50 viên thì lại nghỉ.","Băng Huyết Sau Đẻ, Băng huyết, Bạch đới, Cao huyết áp, Giới giun, Huyết áp cao, Khí hư, Khí hư bạch đới, Kinh nguyệt không ra, Kinh nguyệt không đều, Mụn nhọt, Phụ khoa, Rong huyết, Sau đẻ, Trước đẻ, Tê thấp, Xích Bạch đới, Động thai, Chóng mặt, Mũi tắc, Mất ngủ, Nhức xương, Nhức đầu, Nôn mửa, Sung huyết, Sưng đầu gối, Đau bụng, Đau bụng kinh niên, Đau nhức, Đái dầm",1.0,0.5360958731901684,0.9999999999,0.0,0.6141869863267786
Bệnh nào có thể chữa bằng bài thuốc chứa quế?,"['[{""ChuThe"": ""Vị thuốc Quế tâm"", ""QuanHe"": ""Tham gia bài thuốc [Bài thuốc Khớp xương đau nhức phòng kỷ] để chữa"", ""DoiTuong"": ""Bệnh Cuộc khí"", ""LieuDung"": ""Chưa ghi nhận"", ""CachDung"": ""Dạng thuốc sắc"", ""GhiChu"": ""[Nguồn]: CT_VT_VN_T531"", ""score"": 2.0}, {""ChuThe"": ""Vị thuốc Quế tâm"", ""QuanHe"": ""Tham gia bài thuốc [Bài thuốc Khớp xương đau nhức phòng kỷ] để chữa"", ""DoiTuong"": ""Bệnh Khớp xương đau nhức"", ""LieuDung"": ""Chưa ghi nhận"", ""CachDung"": ""Dạng thuốc sắc"", ""GhiChu"": ""[Nguồn]: CT_VT_VN_T531"", ""score"": 2.0}, {""ChuThe"": ""Vị thuốc Quế tâm"", ""QuanHe"": ""Tham gia bài thuốc [Bài thuốc Khớp xương đau nhức phòng kỷ] để chữa"", ""DoiTuong"": ""Bệnh Thấp thũng"", ""LieuDung"": ""Chưa ghi nhận"", ""CachDung"": ""Dạng thuốc sắc"", ""GhiChu"": ""[Nguồn]: CT_VT_VN_T531"", ""score"": 2.0}, {""ChuThe"": ""Vị thuốc Quế Thanh Hóa"", ""QuanHe"": ""Tham gia bài thuốc [Bài thuốc Cảm mạo Quế Thanh Hóa] để chữa"", ""DoiTuong"": ""Bệnh Cảm mạo"", ""LieuDung"": ""Chưa ghi nhận"", ""CachDung"": ""Chưa ghi nhận"", ""GhiChu"": """", ""score"": 2.0}, {""ChuThe"": ""Vị thuốc Quế"", ""QuanHe"": ""Tham gia bài thuốc [Bài thuốc Rắn cắn] để chữa"", ""DoiTuong"": ""Bệnh Răng cắn"", ""LieuDung"": ""Ngày $50ml$ rượu hội này, sau đó cứ cách 5 đến 10 phút lại uống 1 lần. Một ngày tối đa uống $150ml$ đến $200ml$."", ""CachDung"": ""Tất cả các vị thuốc tán nhỏ, ngâm với $1,5$ lít rượu $35-40$° trong 10 ngày, lấy ra cho uống. Nếu cần ngay có thể đun cách thủy trong 4 giờ, hoặc nếu cấp cứu thì nấu sôi trong bình có ống lạnh thẳng đứng trong 1 giờ là đem ra dùng được. Ngoài việc uống rượu hội còn dùng bông thấm rượu hội xoa và băng nhẹ vào vết cắn để lấy nọc ra. Tiếp tục ngày nào cũng uống cho đến khi hết đau nhức"", ""GhiChu"": """", ""score"": 2.0, ""sort_weight"": 3.0}, {""ChuThe"": ""Vị thuốc Quế chi"", ""QuanHe"": ""Tham gia bài thuốc [Bài thuốc Phù thũng Tiểu tiện khó khăn Trạch tả] để chữa"", ""DoiTuong"": ""Bệnh Phù thũng"", ""LieuDung"": ""Chưa ghi nhận"", ""CachDung"": ""Chưa ghi nhận"", ""GhiChu"": """", ""score"": 2.0}, {""ChuThe"": ""Vị thuốc Quế chi"", ""QuanHe"": ""Tham gia bài thuốc [Bài thuốc Thủy thũng Trạch tả] để chữa"", ""DoiTuong"": ""Bệnh Thủy thũng"", ""LieuDung"": ""Chưa ghi nhận"", ""CachDung"": ""Chưa ghi nhận"", ""GhiChu"": """", ""score"": 2.0}, {""ChuThe"": ""Vị thuốc Quế chi"", ""QuanHe"": ""Tham gia bài thuốc [Bài thuốc Sơ Hài Phục Linh] để chữa"", ""DoiTuong"": ""Bệnh Phù thũng"", ""LieuDung"": ""Chưa ghi nhận"", ""CachDung"": ""Chưa ghi nhận"", ""GhiChu"": """", ""score"": 2.0}, {""ChuThe"": ""Vị thuốc Quế chi"", ""QuanHe"": ""Tham gia bài thuốc [Bài thuốc Cao Huyết Áp Câu Đằng] để chữa"", ""DoiTuong"": ""Bệnh Cao huyết áp"", ""LieuDung"": ""Chưa ghi nhận"", ""CachDung"": ""Chưa ghi nhận"", ""GhiChu"": """", ""score"": 2.0}, {""ChuThe"": ""Vị thuốc Quế chi"", ""QuanHe"": ""Tham gia bài thuốc [Bài thuốc Đau thần kinh Địa liền] để chữa"", ""DoiTuong"": ""Bệnh Đau dạ dày"", ""LieuDung"": ""Địa liền $2$g, quế chi $1$g"", ""CachDung"": ""Hai vị tán nhỏ chia làm 3 lần uống trong một ngày, mỗi lần $0,5$ hay $1$g bột"", ""GhiChu"": """", ""score"": 2.0}, {""ChuThe"": ""Vị thuốc Quế chi"", ""QuanHe"": ""Tham gia bài thuốc [Bài thuốc Đau thần kinh Địa liền] để chữa"", ""DoiTuong"": ""Bệnh Đau thần kinh"", ""LieuDung"": ""Địa liền $2$g, quế chi $1$g"", ""CachDung"": ""Hai vị tán nhỏ chia làm 3 lần uống trong một ngày, mỗi lần $0,5$ hay $1$g bột"", ""GhiChu"": """", ""score"": 2.0}, {""ChuThe"": ""Vị thuốc Quế chi"", ""QuanHe"": ""Tham gia bài thuốc [Bài thuốc Tễ Thập Mã Tiền] để chữa"", ""DoiTuong"": ""Bệnh Tê thấp"", ""LieuDung"": ""Mỗi ngày uống $4$ viên, tối đa $6$ đến $8$ viên"", ""CachDung"": ""Hoàn $1000$ viên. Theo hướng dẫn uống khi nào thấy giật giật mới có kết quả. Một đợt uống $50$ viên thì lại nghỉ"", ""GhiChu"": ""đau nhức, sưng khớp"", ""score"": 2.0}, {""ChuThe"": ""Vị thuốc Quế chi"", ""QuanHe"": ""Tham gia bài thuốc [Bài thuốc Cảm lạnh tê tán] để chữa"", ""DoiTuong"": ""Bệnh Cam lanh"", ""LieuDung"": ""Chưa ghi nhận"", ""CachDung"": ""Nước $200ml$ sắc còn $100ml$ chia 3 lần uống trong ngày."", ""GhiChu"": """", ""score"": 2.0}, {""ChuThe"": ""Vị thuốc Quế chi"", ""QuanHe"": ""Tham gia bài thuốc [Bài thuốc Tễ thấp tễ tán] để chữa"", ""DoiTuong"": ""Bệnh Tê thấp"", ""LieuDung"": ""Chưa ghi nhận"", ""CachDung"": ""Sắc uống"", ""GhiChu"": """", ""score"": 2.0}, {""ChuThe"": ""Vị thuốc Quế chi"", ""QuanHe"": ""Tham gia bài thuốc [Bài thuốc Cảm mạo Ma hoàng] để chữa"", ""DoiTuong"": ""Bệnh viêm khí quản"", ""LieuDung"": ""Chưa ghi nhận"", ""CachDung"": ""Nước $600ml$, sắc còn $200ml$ chia $3$ lần uống trong ngày"", ""GhiChu"": ""CT_VT_VN_T635. Viêm khí quản, hen suyễn, cảm mạo"", ""score"": 2.0}, {""ChuThe"": ""Vị thuốc Quế chi"", ""QuanHe"": ""Tham gia bài thuốc [Bài thuốc Cảm mạo Ma hoàng] để chữa"", ""DoiTuong"": ""Bệnh Cảm mạo"", ""LieuDung"": ""Chưa ghi nhận"", ""CachDung"": ""Nước $600ml$, sắc còn $200ml$ chia $3$ lần uống trong ngày"", ""GhiChu"": ""CT_VT_VN_T635. Viêm khí quản, hen suyễn, cảm mạo"", ""score"": 2.0}, {""ChuThe"": ""Vị thuốc Quế chi"", ""QuanHe"": ""Tham gia bài thuốc [Bài thuốc Cảm mạo Ma hoàng] để chữa"", ""DoiTuong"": ""Bệnh Hen suyễn"", ""LieuDung"": ""Chưa ghi nhận"", ""CachDung"": ""Nước $600ml$, sắc còn $200ml$ chia $3$ lần uống trong ngày"", ""GhiChu"": ""CT_VT_VN_T635. Viêm khí quản, hen suyễn, cảm mạo"", ""score"": 2.0}, {""ChuThe"": ""Vị thuốc Quế chi"", ""QuanHe"": ""Tham gia bài thuốc [Bài thuốc U cục đơn bi] để chữa"", ""DoiTuong"": ""Kinh Bế"", ""LieuDung"": ""Chưa ghi nhận"", ""CachDung"": ""Chưa ghi nhận"", ""GhiChu"": """", ""score"": 2.0}, {""ChuThe"": ""Vị thuốc Quế chi"", ""QuanHe"": ""Tham gia bài thuốc [Bài thuốc U cục đơn bi] để chữa"", ""DoiTuong"": ""Bệnh U cục"", ""LieuDung"": ""Chưa ghi nhận"", ""CachDung"": ""Chưa ghi nhận"", ""GhiChu"": """", ""score"": 2.0}, {""ChuThe"": ""Vị thuốc Quế chi"", ""QuanHe"": ""Tham gia bài thuốc [Bài thuốc U cục đơn bi] để chữa"", ""DoiTuong"": ""Triệu chứng Đau bụng kinh"", ""LieuDung"": ""Chưa ghi nhận"", ""CachDung"": ""Chưa ghi nhận"", ""GhiChu"": """", ""score"": 2.0}, {""ChuThe"": ""Vị thuốc Quế chi"", ""QuanHe"": ""Tham gia bài thuốc [Bài thuốc Cảm mạo sốt Sắn dây] để chữa"", ""DoiTuong"": ""Triệu chứng Cảm mạo sốt"", ""LieuDung"": ""Chưa ghi nhận"", ""CachDung"": ""Chưa ghi nhận"", ""GhiChu"": """", ""score"": 2.0}, {""ChuThe"": ""Vị thuốc Quế chi"", ""QuanHe"": ""Tham gia bài thuốc [Bài thuốc Thiếu Máu Đương Quy] để chữa"", ""DoiTuong"": ""Bệnh Thiếu máu"", ""LieuDung"": ""Chưa ghi nhận"", ""CachDung"": ""Chưa ghi nhận"", ""GhiChu"": ""Bệnh phụ nữ sau khi đẻ thiếu máu, bổ huyết"", ""score"": 2.0}, {""ChuThe"": ""Vị thuốc Quế chi"", ""QuanHe"": ""Tham gia bài thuốc [Bài thuốc Ho bồ kết] để chữa"", ""DoiTuong"": ""Triệu chứng Ho"", ""LieuDung"": ""Sắc với $600ml$ nước còn $200ml$ chia 3 lần uống trong ngày"", ""CachDung"": ""Chưa ghi nhận"", ""GhiChu"": """", ""score"": 2.0}, {""ChuThe"": ""Vị thuốc Quế chi"", ""QuanHe"": ""Tham gia bài thuốc [Bài thuốc Đau nhức mắt hoa Bạch thược] để chữa"", ""DoiTuong"": ""Triệu chứng Mắt hoa"", ""LieuDung"": ""Chưa ghi nhận"", ""CachDung"": ""Chưa ghi nhận"", ""GhiChu"": ""[Nguồn]: CT_VT_VN_T81"", ""score"": 2.0}, {""ChuThe"": ""Vị thuốc Quế chi"", ""QuanHe"": ""Tham gia bài thuốc [Bài thuốc Đau nhức mắt hoa Bạch thược] để chữa"", ""DoiTuong"": ""Triệu chứng Đau nhức"", ""LieuDung"": ""Chưa ghi nhận"", ""CachDung"": ""Chưa ghi nhận"", ""GhiChu"": ""[Nguồn]: CT_VT_VN_T81"", ""score"": 2.0}, {""ChuThe"": ""Vị thuốc Quế chi"", ""QuanHe"": ""Tham gia bài thuốc [Bài thuốc Đau Khi Thay Kinh Hoắc Sắc] để chữa"", ""DoiTuong"": ""Bệnh Đau bụng"", ""LieuDung"": ""Chưa ghi nhận"", ""CachDung"": ""Nước $300$ ml sắc còn $100$ ml chia thành nhiều lần uống trong ngày"", ""GhiChu"": ""Hoà hán ứng dụng phương Nhật Bản"", ""score"": 2.0}, {""ChuThe"": ""Vị thuốc Quế chi"", ""QuanHe"": ""Tham gia bài thuốc [Bài thuốc Đau Khi Thay Kinh Hoắc Sắc] để chữa"", ""DoiTuong"": ""Triệu chứng Đau Khi Thay Kinh"", ""LieuDung"": ""Chưa ghi nhận"", ""CachDung"": ""Nước $300$ ml sắc còn $100$ ml chia thành nhiều lần uống trong ngày"", ""GhiChu"": ""Hoà hán ứng dụng phương Nhật Bản"", ""score"": 2.0}, {""ChuThe"": ""Vị thuốc Quế chi"", ""QuanHe"": ""Tham gia bài thuốc [Bài thuốc Ngực Bụng Đau Nhói Hoắc Sắc] để chữa"", ""DoiTuong"": ""Bệnh Phong thấp"", ""LieuDung"": ""Chưa ghi nhận"", ""CachDung"": ""Sắc uống. Uống sau khi ăn"", ""GhiChu"": """", ""score"": 2.0}, {""ChuThe"": ""Vị thuốc Quế chi"", ""QuanHe"": ""Tham gia bài thuốc [Bài thuốc Ngực Bụng Đau Nhói Hoắc Sắc] để chữa"", ""DoiTuong"": ""Triệu chứng Chân Tay Tê Dại"", ""LieuDung"": ""Chưa ghi nhận"", ""CachDung"": ""Sắc uống. Uống sau khi ăn"", ""GhiChu"": """", ""score"": 2.0}, {""ChuThe"": ""Vị thuốc Quế tâm"", ""QuanHe"": ""Tham gia bài thuốc [Bài thuốc Khớp xương đau nhức phòng kỷ] để chữa"", ""DoiTuong"": ""Bệnh Thủy thũng"", ""LieuDung"": ""Chưa ghi nhận"", ""CachDung"": ""Dạng thuốc sắc"", ""GhiChu"": ""[Nguồn]: CT_VT_VN_T531"", ""score"": 2.0}]']","Dựa trên y văn, **Quế** có thể được dùng trong bài thuốc sau:

*   **Bài thuốc Rắn cắn**: Dùng để chữa bệnh Rắn cắn.
    *   Liều dùng: Ngày 50ml rượu hội này, sau đó cứ cách 5 đến 10 phút lại uống 1 lần. Một ngày tối đa uống 150ml đến 200ml.
    *   Cách dùng: Tất cả các vị thuốc tán nhỏ, ngâm với 1,5 lít rượu 35-40° trong 10 ngày, lấy ra cho uống. Nếu cần ngay có thể đun cách thủy trong 4 giờ, hoặc nếu cấp cứu thì nấu sôi trong bình có ống lạnh thẳng đứng trong 1 giờ là đem ra dùng được. Ngoài việc uống rượu hội còn dùng bông thấm rượu hội xoa và băng nhẹ vào vết cắn để lấy nọc ra. Tiếp tục ngày nào cũng uống cho đến khi hết đau nhức.

**Thông tin tham khảo thêm:**

Các bài thuốc có chứa **Quế tâm**, **Quế Thanh Hóa**, **Quế chi** được dùng để chữa các bệnh sau:

*   **Bài thuốc Khớp xương đau nhức phòng kỷ**: Dùng để chữa bệnh Cuộc khí, Khớp xương đau nhức, Thấp thũng, Thủy thũng. Cách dùng: Dạng thuốc sắc.
*   **Bài thuốc Cảm mạo Quế Thanh Hóa**: Dùng để chữa bệnh Cảm mạo.
*   **Bài thuốc Phù thũng Tiểu tiện khó khăn Trạch tả**: Dùng để chữa bệnh Phù thũng.
*   **Bài thuốc Thủy thũng Trạch tả**: Dùng để chữa bệnh Thủy thũng.
*   **Bài thuốc Sơ Hài Phục Linh**: Dùng để chữa bệnh Phù thũng.
*   **Bài thuốc Cao Huyết Áp Câu Đằng**: Dùng để chữa bệnh Cao huyết áp.
*   **Bài thuốc Đau thần kinh Địa liền**: Dùng để chữa bệnh Đau dạ dày, Đau thần kinh.
    *   Liều dùng: Địa liền 2g, quế chi 1g.
    *   Cách dùng: Hai vị tán nhỏ chia làm 3 lần uống trong một ngày, mỗi lần 0,5 hay 1g bột.
*   **Bài thuốc Tễ Thập Mã Tiền**: Dùng để chữa bệnh Tê thấp.
    *   Liều dùng: Mỗi ngày uống 4 viên, tối đa 6 đến 8 viên.
    *   Cách dùng: Hoàn 1000 viên. Theo hướng dẫn uống khi nào thấy giật giật mới có kết quả. Một đợt uống 50 viên thì lại nghỉ.
*   **Bài thuốc Cảm lạnh tê tán**: Dùng để chữa bệnh Cam lanh.
    *   Cách dùng: Nước 200ml sắc còn 100ml chia 3 lần uống trong ngày.
*   **Bài thuốc Tễ thấp tễ tán**: Dùng để chữa bệnh Tê thấp. Cách dùng: Sắc uống.
*   **Bài thuốc Cảm mạo Ma hoàng**: Dùng để chữa bệnh viêm khí quản, Cảm mạo, Hen suyễn.
    *   Cách dùng: Nước 600ml, sắc còn 200ml chia 3 lần uống trong ngày.
*   **Bài thuốc U cục đơn bi**: Dùng để chữa Kinh Bế, bệnh U cục, triệu chứng Đau bụng kinh.
*   **Bài thuốc Cảm mạo sốt Sắn dây**: Dùng để chữa triệu chứng Cảm mạo sốt.
*   **Bài thuốc Thiếu Máu Đương Quy**: Dùng để chữa bệnh Thiếu máu.
*   **Bài thuốc Ho bồ kết**: Dùng để chữa triệu chứng Ho.
    *   Liều dùng: Sắc với 600ml nước còn 200ml chia 3 lần uống trong ngày.
*   **Bài thuốc Đau nhức mắt hoa Bạch thược**: Dùng để chữa triệu chứng Mắt hoa, Đau nhức.
*   **Bài thuốc Đau Khi Thay Kinh Hoắc Sắc**: Dùng để chữa bệnh Đau bụng, triệu chứng Đau Khi Thay Kinh.
    *   Cách dùng: Nước 300 ml sắc còn 100 ml chia thành nhiều lần uống trong ngày.
*   **Bài thuốc Ngực Bụng Đau Nhói Hoắc Sắc**: Dùng để chữa bệnh Phong thấp, triệu chứng Chân Tay Tê Dại. Cách dùng: Sắc uống. Uống sau khi ăn.",Răng cắn,1.0,0.5117311140826938,0.9999999999,1.0,0.18883937857319044
Thuốc nào vừa có tính ôn vừa trực tiếp chữa bệnh lở ngứa?,"['[{""ChuThe"": ""Vị thuốc Ké hoa vàng"", ""QuanHe"": ""Thỏa mãn đồng thời"", ""DoiTuong"": ""Ôn và Bệnh Lở ngứa"", ""LieuDung"": ""Chưa ghi nhận"", ""CachDung"": ""Chưa ghi nhận"", ""GhiChu"": """", ""score"": 2.0}, {""ChuThe"": ""Vị thuốc Tía tô"", ""QuanHe"": ""Thỏa mãn đồng thời"", ""DoiTuong"": ""Ôn và Bệnh Lở ngứa"", ""LieuDung"": ""Chưa ghi nhận"", ""CachDung"": ""Chưa ghi nhận"", ""GhiChu"": """", ""score"": 2.0}]']",Hệ thống y văn hiện tại chưa ghi nhận dữ liệu về vấn đề này.,"Ké hoa vàng, Tía tô",1.0,0.0,0.9999999999,1.0,0.23420595888305967
Vị thuốc rau cần tây chứa hoạt chất gì?,"['[{""ChuThe"": ""Vị thuốc Rau cần tây"", ""QuanHe"": ""CO_CHUA_HOAT_CHAT"", ""DoiTuong"": ""Hoạt chất D-Limonen"", ""LieuDung"": ""Chưa ghi nhận"", ""CachDung"": ""Chưa ghi nhận"", ""GhiChu"": """", ""score"": 2.0, ""sort_weight"": 3.0}, {""ChuThe"": ""Vị thuốc Rau cần tây"", ""QuanHe"": ""CO_CHUA_HOAT_CHAT"", ""DoiTuong"": ""Hoạt chất Giaiacola"", ""LieuDung"": ""Chưa ghi nhận"", ""CachDung"": ""Chưa ghi nhận"", ""GhiChu"": """", ""score"": 2.0, ""sort_weight"": 3.0}, {""ChuThe"": ""Vị thuốc Rau cần tây"", ""QuanHe"": ""CO_CHUA_HOAT_CHAT"", ""DoiTuong"": ""Hoạt chất Sedanolit"", ""LieuDung"": ""Chưa ghi nhận"", ""CachDung"": ""Chưa ghi nhận"", ""GhiChu"": """", ""score"": 2.0, ""sort_weight"": 3.0}, {""ChuThe"": ""Vị thuốc Rau cần tây"", ""QuanHe"": ""CO_CHUA_HOAT_CHAT"", ""DoiTuong"": ""Hoạt chất Sedanonit"", ""LieuDung"": ""Chưa ghi nhận"", ""CachDung"": ""Chưa ghi nhận"", ""GhiChu"": """", ""score"": 2.0, ""sort_weight"": 3.0}, {""ChuThe"": ""Vị thuốc Rau cần tây"", ""QuanHe"": ""CO_CHUA_HOAT_CHAT"", ""DoiTuong"": ""Hoạt chất Silinen"", ""LieuDung"": ""Chưa ghi nhận"", ""CachDung"": ""Chưa ghi nhận"", ""GhiChu"": """", ""score"": 2.0, ""sort_weight"": 3.0}, {""ChuThe"": ""Vị thuốc Rau cần tây"", ""QuanHe"": ""CO_CHUA_HOAT_CHAT"", ""DoiTuong"": ""Hoạt chất Stinben"", ""LieuDung"": ""Chưa ghi nhận"", ""CachDung"": ""Chưa ghi nhận"", ""GhiChu"": """", ""score"": 2.0, ""sort_weight"": 3.0}]']","Vị thuốc **Rau cần tây** chứa các hoạt chất sau:

*   Hoạt chất D-Limonen
*   Hoạt chất Giaiacola
*   Hoạt chất Sedanolit
*   Hoạt chất Sedanonit
*   Hoạt chất Silinen
*   Hoạt chất Stinben","D-Limonen, Giaiacola, Sedanolit, Sedanonit, Silinen, Stinben",1.0,0.4139638323254633,0.9999999999,1.0,0.9017514248650851
Vị thuốc chút chít có hoạt chất antraglucozit không?,['Không có dữ liệu'],"Không. Dựa trên dữ liệu y văn hiện tại, không có ghi nhận nào cho thấy chút chít có liên quan hoặc tác dụng tới antraglucozit.","Có, vị thuốc chút chít có hoạt chất antraglucozit",0.0,0.842668969344789,0.0,0.0,0.2429274620950726
Hãy cho biết công năng của đậu khấu.,"['[{""ChuThe"": ""Bài thuốc Trẻ con bú vào lại trớ ra Đậu khấu"", ""QuanHe"": ""BAO_GOM_VI_THUOC"", ""DoiTuong"": ""Vị thuốc Sa nhân"", ""LieuDung"": ""$14$"", ""CachDung"": ""Chưa ghi nhận"", ""GhiChu"": """", ""score"": 2.0}, {""ChuThe"": ""Bài thuốc Trẻ con bú vào lại trớ ra Đậu khấu"", ""QuanHe"": ""BAO_GOM_VI_THUOC"", ""DoiTuong"": ""Vị thuốc Đậu khấu"", ""LieuDung"": ""$14$"", ""CachDung"": ""Chưa ghi nhận"", ""GhiChu"": """", ""score"": 2.0}, {""ChuThe"": ""Bài thuốc Trẻ con bú vào lại trớ ra Đậu khấu"", ""QuanHe"": ""BAO_GOM_VI_THUOC"", ""DoiTuong"": ""Vị thuốc Cam thảo"", ""LieuDung"": ""$8g$"", ""CachDung"": ""Chưa ghi nhận"", ""GhiChu"": """", ""score"": 2.0}, {""ChuThe"": ""Vị thuốc Đậu khấu"", ""QuanHe"": ""CO_VI"", ""DoiTuong"": ""Chát"", ""LieuDung"": ""Chưa ghi nhận"", ""CachDung"": ""Chưa ghi nhận"", ""GhiChu"": """", ""score"": 2.0}, {""ChuThe"": ""Vị thuốc Đậu khấu"", ""QuanHe"": ""CO_VI"", ""DoiTuong"": ""Vị cay"", ""LieuDung"": ""Chưa ghi nhận"", ""CachDung"": ""Chưa ghi nhận"", ""GhiChu"": """", ""score"": 2.0}, {""ChuThe"": ""Vị thuốc Đậu khấu"", ""QuanHe"": ""CO_TINH"", ""DoiTuong"": ""Ôn"", ""LieuDung"": ""Chưa ghi nhận"", ""CachDung"": ""Chưa ghi nhận"", ""GhiChu"": """", ""score"": 2.0}, {""ChuThe"": ""Vị thuốc Đậu khấu"", ""QuanHe"": ""QUY_KINH"", ""DoiTuong"": ""Phe"", ""LieuDung"": ""Chưa ghi nhận"", ""CachDung"": ""Chưa ghi nhận"", ""GhiChu"": """", ""score"": 2.0}, {""ChuThe"": ""Vị thuốc Đậu khấu"", ""QuanHe"": ""QUY_KINH"", ""DoiTuong"": ""Ty"", ""LieuDung"": ""Chưa ghi nhận"", ""CachDung"": ""Chưa ghi nhận"", ""GhiChu"": """", ""score"": 2.0}, {""ChuThe"": ""Vị thuốc Đậu khấu"", ""QuanHe"": ""QUY_KINH"", ""DoiTuong"": ""Vi"", ""LieuDung"": ""Chưa ghi nhận"", ""CachDung"": ""Chưa ghi nhận"", ""GhiChu"": """", ""score"": 2.0}, {""ChuThe"": ""Vị thuốc Đậu khấu"", ""QuanHe"": ""CO_CHUA_HOAT_CHAT"", ""DoiTuong"": ""Hoạt chất Campho"", ""LieuDung"": ""Chưa ghi nhận"", ""CachDung"": ""Chưa ghi nhận"", ""GhiChu"": ""Chưa rõ"", ""score"": 2.0}, {""ChuThe"": ""Vị thuốc Đậu khấu"", ""QuanHe"": ""CO_CHUA_HOAT_CHAT"", ""DoiTuong"": ""Hoạt chất Dbocneola"", ""LieuDung"": ""Chưa ghi nhận"", ""CachDung"": ""Chưa ghi nhận"", ""GhiChu"": ""Chưa rõ"", ""score"": 2.0}, {""ChuThe"": ""Vị thuốc Đậu khấu"", ""QuanHe"": ""CHU_TRI_BENH"", ""DoiTuong"": ""Bệnh Đau dạ dày"", ""LieuDung"": ""$2-4g$"", ""CachDung"": ""Chỉ định lâm sàng"", ""GhiChu"": ""Đau dạ dày, đầy bụng, nôn ọe, ăn không tiêu, và chữa các bệnh về phổi"", ""score"": 2.0}, {""ChuThe"": ""Vị thuốc Đậu khấu"", ""QuanHe"": ""CHU_TRI_BENH"", ""DoiTuong"": ""Bệnh về Phổi"", ""LieuDung"": ""$2-4g$"", ""CachDung"": ""Chỉ định lâm sàng"", ""GhiChu"": ""Đau dạ dày, đầy bụng, nôn ọe, ăn không tiêu, và chữa các bệnh về phổi"", ""score"": 2.0}, {""ChuThe"": ""Vị thuốc Đậu khấu"", ""QuanHe"": ""CHU_TRI_BENH"", ""DoiTuong"": ""Bệnh Dạ dày lạnh đau"", ""LieuDung"": ""Tham khảo liều dùng chung của vị thuốc"", ""CachDung"": ""Chỉ định lâm sàng theo kinh nghiệm"", ""GhiChu"": ""Dạ dày lạnh đau, nôn ra nước chua, nôn mửa, tả lỵ"", ""score"": 2.0}, {""ChuThe"": ""Vị thuốc Đậu khấu"", ""QuanHe"": ""CHU_TRI_BENH"", ""DoiTuong"": ""Bệnh Say rượu"", ""LieuDung"": ""Tham khảo liều dùng chung của vị thuốc"", ""CachDung"": ""Chỉ định lâm sàng theo kinh nghiệm"", ""GhiChu"": ""Say rượu, giải độc cá độc"", ""score"": 2.0}, {""ChuThe"": ""Vị thuốc Đậu khấu"", ""QuanHe"": ""CHU_TRI_TRIEU_CHUNG"", ""DoiTuong"": ""Triệu chứng Nôn ọe"", ""LieuDung"": ""$2-4g$"", ""CachDung"": ""Chỉ định lâm sàng"", ""GhiChu"": ""Đau dạ dày, đầy bụng, nôn ọe, ăn không tiêu, và chữa các bệnh về phổi"", ""score"": 2.0}, {""ChuThe"": ""Vị thuốc Đậu khấu"", ""QuanHe"": ""CHU_TRI_TRIEU_CHUNG"", ""DoiTuong"": ""Triệu chứng Đầy bụng"", ""LieuDung"": ""$2-4g$"", ""CachDung"": ""Chỉ định lâm sàng"", ""GhiChu"": ""Đau dạ dày, đầy bụng, nôn ọe, ăn không tiêu, và chữa các bệnh về phổi"", ""score"": 2.0}, {""ChuThe"": ""Vị thuốc Đậu khấu"", ""QuanHe"": ""CHU_TRI_TRIEU_CHUNG"", ""DoiTuong"": ""Triệu chứng Buồn nôn"", ""LieuDung"": ""Tham khảo liều dùng chung của vị thuốc"", ""CachDung"": ""Nhấm hạt, nuốt nước"", ""GhiChu"": ""Chứng lợm giọng buồn nôn"", ""score"": 2.0}, {""ChuThe"": ""Vị thuốc Đậu khấu"", ""QuanHe"": ""CHU_TRI_TRIEU_CHUNG"", ""DoiTuong"": ""Triệu chứng Nôn ra nước chua"", ""LieuDung"": ""Tham khảo liều dùng chung của vị thuốc"", ""CachDung"": ""Chỉ định lâm sàng theo kinh nghiệm"", ""GhiChu"": ""Dạ dày lạnh đau, nôn ra nước chua, nôn mửa, tả lỵ"", ""score"": 2.0}, {""ChuThe"": ""Vị thuốc Đậu khấu"", ""QuanHe"": ""CHU_TRI_TRIEU_CHUNG"", ""DoiTuong"": ""Triệu chứng Nôn mửa"", ""LieuDung"": ""Tham khảo liều dùng chung của vị thuốc"", ""CachDung"": ""Chỉ định lâm sàng theo kinh nghiệm"", ""GhiChu"": ""Dạ dày lạnh đau, nôn ra nước chua, nôn mửa, tả lỵ"", ""score"": 2.0}, {""ChuThe"": ""Vị thuốc Đậu khấu"", ""QuanHe"": ""CO_CONG_NANG"", ""DoiTuong"": ""Công năng Ôn trung"", ""LieuDung"": ""Chưa ghi nhận"", ""CachDung"": ""Chưa ghi nhận"", ""GhiChu"": """", ""score"": 2.0, ""sort_weight"": 3.0}, {""ChuThe"": ""Vị thuốc Đậu khấu"", ""QuanHe"": ""CO_CONG_NANG"", ""DoiTuong"": ""Triệu chứng Tả lỵ"", ""LieuDung"": ""Tham khảo liều dùng chung của vị thuốc"", ""CachDung"": ""Chỉ định lâm sàng theo kinh nghiệm"", ""GhiChu"": ""Dạ dày lạnh đau, nôn ra nước chua, nôn mửa, tả lỵ"", ""score"": 2.0, ""sort_weight"": 3.0}, {""ChuThe"": ""Vị thuốc Đậu khấu"", ""QuanHe"": ""CO_CONG_NANG"", ""DoiTuong"": ""Công năng Khu hàn"", ""LieuDung"": ""Chưa ghi nhận"", ""CachDung"": ""Chưa ghi nhận"", ""GhiChu"": """", ""score"": 2.0, ""sort_weight"": 3.0}, {""ChuThe"": ""Vị thuốc Đậu khấu"", ""QuanHe"": ""CO_CONG_NANG"", ""DoiTuong"": ""Công năng Hành khí"", ""LieuDung"": ""Chưa ghi nhận"", ""CachDung"": ""Chưa ghi nhận"", ""GhiChu"": """", ""score"": 2.0, ""sort_weight"": 3.0}, {""ChuThe"": ""Vị thuốc Đậu khấu"", ""QuanHe"": ""CO_CONG_NANG"", ""DoiTuong"": ""Công năng Tiêu thực"", ""LieuDung"": ""Chưa ghi nhận"", ""CachDung"": ""Chưa ghi nhận"", ""GhiChu"": """", ""score"": 2.0, ""sort_weight"": 3.0}, {""ChuThe"": ""Vị thuốc Đậu khấu"", ""QuanHe"": ""CO_CONG_NANG"", ""DoiTuong"": ""Công năng Giải độc cá độc"", ""LieuDung"": ""Tham khảo liều dùng chung của vị thuốc"", ""CachDung"": ""Chỉ định lâm sàng theo kinh nghiệm"", ""GhiChu"": ""Say rượu, giải độc cá độc"", ""score"": 2.0, ""sort_weight"": 3.0}, {""ChuThe"": ""Vị thuốc Đậu khấu"", ""QuanHe"": ""CO_CONG_NANG"", ""DoiTuong"": ""Công năng Khai vị"", ""LieuDung"": ""Chưa ghi nhận"", ""CachDung"": ""Chưa ghi nhận"", ""GhiChu"": """", ""score"": 2.0, ""sort_weight"": 3.0}, {""ChuThe"": ""Vị thuốc Đậu khấu"", ""QuanHe"": ""CO_CONG_NANG"", ""DoiTuong"": ""Công năng Khoan trung"", ""LieuDung"": ""Chưa ghi nhận"", ""CachDung"": ""Chưa ghi nhận"", ""GhiChu"": """", ""score"": 2.0, ""sort_weight"": 3.0}, {""ChuThe"": ""Vị thuốc Đậu khấu"", ""QuanHe"": ""CO_CONG_NANG"", ""DoiTuong"": ""Công năng Giải độc"", ""LieuDung"": ""Chưa ghi nhận"", ""CachDung"": ""Chưa ghi nhận"", ""GhiChu"": """", ""score"": 2.0, ""sort_weight"": 3.0}, {""ChuThe"": ""Bài thuốc Trẻ con bú vào lại trớ ra Đậu khấu"", ""QuanHe"": ""CHU_TRI_TRIEU_CHUNG"", ""DoiTuong"": ""Triệu chứng Trẻ con trớ sữa"", ""LieuDung"": ""Chưa ghi nhận"", ""CachDung"": ""Sắc uống"", ""GhiChu"": """", ""score"": 2.0}]']","**Vị thuốc Đậu khấu** có các công năng sau:

*   Ôn trung
*   Khu hàn
*   Hành khí
*   Tiêu thực
*   Giải độc cá độc
*   Khai vị
*   Khoan trung
*   Giải độc

**Vị thuốc Đậu khấu** còn được dùng để điều trị triệu chứng Tả lỵ. Về liều dùng và cách dùng, bạn nên tham khảo ý kiến của thầy thuốc để có chỉ định lâm sàng phù hợp.","Giải độc, Giải độc cá độc, Hành khí, Khai vị, Khoan trung, Khu hàn, Tiêu thực, Táo thấp, Ôn trung, Tả lỵ",1.0,0.5847436525607039,0.9999999999,0.0,0.8955692186470914
"Để chữa bệnh thấp khớp, vị thuốc dây toàn được dùng với liều lượng và cách thức như thế nào?","['[{""ChuThe"": ""Vị thuốc Dây toàn"", ""QuanHe"": ""CHU_TRI_BENH"", ""DoiTuong"": ""Bệnh Thấp khớp"", ""LieuDung"": ""$2-4g$"", ""CachDung"": ""Dùng dưới dạng thuốc sắc, thuốc ngâm rượu, chia làm nhiều lần uống"", ""GhiChu"": ""[Nguồn]: CT_VT_VN_T538"", ""score"": 2.0, ""sort_weight"": 3.0}]']","Để chữa bệnh thấp khớp, bạn có thể sử dụng vị thuốc **Dây toàn** với liều lượng và cách dùng như sau:

*   Liều dùng: 2-4g mỗi ngày.
*   Cách dùng: Dùng dưới dạng thuốc sắc hoặc thuốc ngâm rượu, chia làm nhiều lần uống trong ngày.","Để chữa bệnh thấp khớp, vị thuốc dây toàn có liều dùng: 2-4g và cách dùng: Dùng dưới dạng thuốc sắc, thuốc ngâm rượu, chia làm nhiều lần uống",1.0,0.4807156900546455,0.9999999999,1.0,0.9927983974823396
Bệnh tử cung xuất huyết có thể dùng vị thuốc hoặc bài thuốc nào để chữa?,"['[{""ChuThe"": ""Bệnh Tử cung xuất huyết"", ""QuanHe"": ""Được chữa bằng (ViThuoc)"", ""DoiTuong"": ""Vị thuốc Mào gà trắng"", ""LieuDung"": ""Tham khảo liều dùng chung của vị thuốc"", ""CachDung"": ""Chỉ định lâm sàng theo kinh nghiệm"", ""GhiChu"": ""Tử cung xuất huyết | Hạt mào gà trắng | Chỉ định lâm sàng theo kinh nghiệm | [Nguồn]: CT_VT_VN_T307"", ""score"": 2.0, ""sort_weight"": 3.0}, {""ChuThe"": ""Bệnh Tử cung xuất huyết"", ""QuanHe"": ""Được chữa bằng (ViThuoc)"", ""DoiTuong"": ""Vị thuốc Mào gà đỏ"", ""LieuDung"": ""Hoa mào gà đỏ khô $10$g (nếu dùng tươi dùng $25-30$g)"", ""CachDung"": ""Sấy khô, tán nhỏ. Chia làm nhiều lần uống trong ngày. Mỗi lần uống $1-2$g (kinh nghiệm nhân dân)."", ""GhiChu"": ""CT_VT_VN_T308"", ""score"": 2.0, ""sort_weight"": 3.0}, {""ChuThe"": ""Bệnh Tử cung xuất huyết"", ""QuanHe"": ""Được chữa bằng (ViThuoc)"", ""DoiTuong"": ""Vị thuốc Tề thái"", ""LieuDung"": ""Tham khảo liều dùng chung của vị thuốc"", ""CachDung"": ""Chỉ định lâm sàng theo kinh nghiệm"", ""GhiChu"": ""CT_VT_VN_T655"", ""score"": 2.0, ""sort_weight"": 3.0}]']","Dựa trên y văn, bệnh tử cung xuất huyết có thể được chữa bằng các vị thuốc sau:

*   **Vị thuốc Mào gà trắng:** Tham khảo liều dùng chung của vị thuốc, chỉ định lâm sàng theo kinh nghiệm.
*   **Vị thuốc Mào gà đỏ:** Hoa mào gà đỏ khô 10g (nếu dùng tươi dùng 25-30g). Sấy khô, tán nhỏ. Chia làm nhiều lần uống trong ngày. Mỗi lần uống 1-2g (kinh nghiệm nhân dân).
*   **Vị thuốc Tề thái:** Tham khảo liều dùng chung của vị thuốc, chỉ định lâm sàng theo kinh nghiệm.","Mào gà trắng, Mào gà đỏ, Tề thái",1.0,0.4217619373988563,0.9999999999,1.0,0.47380113073492847
Bệnh nào có thể chữa bằng bài thuốc chứa rễ cỏ xước?,"['[{""ChuThe"": ""Vị thuốc Rễ cỏ xước"", ""QuanHe"": ""Tham gia bài thuốc [Bài thuốc Đau nhức chân tay lá lốt] để chữa"", ""DoiTuong"": ""Bệnh Đau nhức chân tay"", ""LieuDung"": ""Chưa ghi nhận"", ""CachDung"": ""Sắc với $600ml$ nước, cô còn $200ml$, chia 3 lần uống trong ngày"", ""GhiChu"": """", ""score"": 2.0, ""sort_weight"": 3.0}]']","**Rễ cỏ xước** tham gia bài thuốc **Đau nhức chân tay lá lốt** để chữa bệnh Đau nhức chân tay. Cách dùng như sau: Sắc với 600ml nước, cô còn 200ml, chia 3 lần uống trong ngày.",Đau nhức chân tay,1.0,0.6252127084060635,0.9999999999,1.0,0.581948973584515
Vị thuốc bồng bồng tham gia vào bài thuốc để chữa những bệnh gì?,"['[{""ChuThe"": ""Vị thuốc Bồng bồng"", ""QuanHe"": ""Tham gia bài thuốc [Bài thuốc Hen Bồng bồng] để chữa"", ""DoiTuong"": ""Bệnh Hen"", ""LieuDung"": ""Chưa ghi nhận"", ""CachDung"": ""Hái lá đem về, lấy khăn ướt lau sạch lông, thái nhỏ, sao qua cho héo. Ngày dùng sắc với $1bát$ rưỡi nước, cô còn $1bát$. Thêm đường vào, chia 3-4 lần trong một ngày. Nước hơi đắng và tanh, uống nhiều một lúc có thể gây nôn. Nên uống xa bữa cơm hoặc sau bữa cơm. Uống vào có thể thấy mỏi chân, tay, mình mẩy, đi ỉa lỏng (rất hiếm). Kết quả sau 2-3 ngày, có khi sau 7-8 ngày. Có trường hợp có kết quả sau 10 phút"", ""GhiChu"": """", ""score"": 2.0, ""sort_weight"": 3.0}]']","Dựa trên y văn, **Bồng bồng** tham gia vào bài thuốc **Bài thuốc Hen Bồng bồng** để chữa bệnh Hen.

Cách dùng bài thuốc này như sau: Hái lá đem về, lấy khăn ướt lau sạch lông, thái nhỏ, sao qua cho héo. Ngày dùng sắc với 1 bát rưỡi nước, cô còn 1 bát. Thêm đường vào, chia 3-4 lần trong một ngày. Nước hơi đắng và tanh, uống nhiều một lúc có thể gây nôn. Nên uống xa bữa cơm hoặc sau bữa cơm. Uống vào có thể thấy mỏi chân, tay, mình mẩy, đi ỉa lỏng (rất hiếm). Kết quả sau 2-3 ngày, có khi sau 7-8 ngày. Có trường hợp có kết quả sau 10 phút.",Hen,1.0,0.5412913513142941,0.9999999999,1.0,0.2468171903008785
Vị thuốc đậu đỏ nhỏ tham gia vào bài thuốc để chữa những bệnh gì?,"['[{""ChuThe"": ""Vị thuốc Đậu đỏ nhỏ"", ""QuanHe"": ""Tham gia bài thuốc [Bài thuốc Đái ra máu đậu đỏ nhỏ] để chữa"", ""DoiTuong"": ""Bệnh Đái ra máu"", ""LieuDung"": ""Ngày uống $10$ đến $20g$ bột này"", ""CachDung"": ""Tán bột"", ""GhiChu"": ""Đậu đỏ nhỏ, đương quy hai vị bằng nhau"", ""score"": 2.0, ""sort_weight"": 3.0}]']","**Vị thuốc Đậu đỏ nhỏ** được dùng trong bài thuốc **Bài thuốc Đái ra máu đậu đỏ nhỏ** để chữa bệnh **Đái ra máu**. Cách dùng là tán bột, ngày uống 10 đến 20g. Bài thuốc này có hai vị bằng nhau là **Đậu đỏ nhỏ** và **Đương quy**.",Đái ra máu,1.0,0.5645584768115123,0.9999999999,1.0,0.5050174331226768
Bệnh ne moi có thể dùng vị thuốc hoặc bài thuốc nào để chữa?,"['[{""ChuThe"": ""Triệu chứng Ne Moi"", ""QuanHe"": ""Được chữa bằng (ViThuoc)"", ""DoiTuong"": ""Vị thuốc Dưa chuột"", ""LieuDung"": ""Tham khảo liều dùng chung của vị thuốc"", ""CachDung"": ""Miếng dưa chuột tươi. Sát lên môi bị nẻ"", ""GhiChu"": ""CT_VT_VN_T251"", ""score"": 2.0}]']","Hệ thống y văn hiện tại chưa ghi nhận dữ liệu chính xác về vấn đề này. Tuy nhiên, bạn có thể tham khảo thông tin sau đây:

**Thông tin tham khảo thêm:**

Đối với triệu chứng nẻ môi, bạn có thể dùng **Dưa chuột**.
*   Cách dùng: Sát miếng dưa chuột tươi lên môi bị nẻ.
*   Liều dùng: Tham khảo liều dùng chung của vị thuốc.",Dưa chuột,0.75,0.0,0.9999999999,1.0,0.6398530263287426
Bệnh trẻ con đái dầm có thể dùng vị thuốc hoặc bài thuốc nào để chữa?,"['[{""ChuThe"": ""Bệnh Đái dầm"", ""QuanHe"": ""Được chữa bằng (ViThuoc)"", ""DoiTuong"": ""Vị thuốc Đơn đỏ"", ""LieuDung"": ""Tham khảo liều dùng chung của vị thuốc"", ""CachDung"": ""Thuốc sắc"", ""GhiChu"": ""[Nguồn]: CT_VT_VN_T220"", ""score"": 2.0, ""sort_weight"": 3.0}, {""ChuThe"": ""Triệu chứng Đái dầm"", ""QuanHe"": ""Được chữa bằng (ViThuoc)"", ""DoiTuong"": ""Vị thuốc Ô dược"", ""LieuDung"": ""Tham khảo liều dùng chung của vị thuốc"", ""CachDung"": ""Chỉ định lâm sàng theo kinh nghiệm"", ""GhiChu"": ""Đau bụng, ăn không tiêu, nôn mửa, trẻ con có giun, sung huyết, đầu nhức, hay đi đái đêm | Rễ ô dược | Chỉ định lâm sàng theo kinh nghiệm | [Nguồn]: CT_VT_VN_T448"", ""score"": 2.0}, {""ChuThe"": ""Bệnh Trẻ con đái dầm"", ""QuanHe"": ""Được chữa bằng (ViThuoc)"", ""DoiTuong"": ""Vị thuốc Dâu"", ""LieuDung"": ""Tang phiền $6-12g$"", ""CachDung"": ""Chỉ định lâm sàng"", ""GhiChu"": ""CT_VT_VN_T739"", ""score"": 2.0}, {""ChuThe"": ""Triệu chứng Đái dầm"", ""QuanHe"": ""Được chữa bằng (ViThuoc)"", ""DoiTuong"": ""Vị thuốc Hoài sơn"", ""LieuDung"": ""Tham khảo liều dùng chung của vị thuốc"", ""CachDung"": ""Không ghi rõ liều"", ""GhiChu"": ""Chỉ định lâm sàng (không ghi rõ liều). CT_VT_VN_T866"", ""score"": 2.0}, {""ChuThe"": ""Triệu chứng Đái dầm"", ""QuanHe"": ""Được chữa bằng (ViThuoc)"", ""DoiTuong"": ""Vị thuốc Hoài sơn"", ""LieuDung"": ""$8g$"", ""CachDung"": ""Hoài sơn, bạch phục linh tán nhỏ, trộn đều. Mỗi lần cho uống $8g$"", ""GhiChu"": ""Trẻ con"", ""score"": 2.0}, {""ChuThe"": ""Bệnh Đái dầm"", ""QuanHe"": ""Được chữa bằng (ViThuoc)"", ""DoiTuong"": ""Vị thuốc Kê nội kim"", ""LieuDung"": ""Chưa ghi nhận"", ""CachDung"": ""Chưa ghi nhận"", ""GhiChu"": ""[Nguồn]: CT_VT_VN_T378"", ""score"": 2.0, ""sort_weight"": 3.0}, {""ChuThe"": ""Bệnh Đái dầm"", ""QuanHe"": ""Được chữa bằng (ViThuoc)"", ""DoiTuong"": ""Vị thuốc Nhện"", ""LieuDung"": ""Trứng nhện hay con nhện sao vàng hay nướng vàng"", ""CachDung"": ""Có thể dùng riêng hay phối hợp với các vị thuốc khác như ngà hay răng voi, ngưu hoàng, thanh đại, băng phiến"", ""GhiChu"": ""Đái dầm"", ""score"": 2.0, ""sort_weight"": 3.0}, {""ChuThe"": ""Bệnh Đái dầm"", ""QuanHe"": ""Được chữa bằng (ViThuoc)"", ""DoiTuong"": ""Vị thuốc Ngũ bội tử"", ""LieuDung"": ""Ngũ bội tử giã nhỏ. Thêm nước cho dính"", ""CachDung"": ""Đắp vào rốn"", ""GhiChu"": ""CT_VT_VN_T446"", ""score"": 2.0, ""sort_weight"": 3.0}, {""ChuThe"": ""Bệnh Đái dầm"", ""QuanHe"": ""Được chữa bằng (ViThuoc)"", ""DoiTuong"": ""Vị thuốc Chim sẻ"", ""LieuDung"": ""1 con"", ""CachDung"": ""làm sạch, nhồi hạt tiêu vào bụng chim rồi nướng chín ăn"", ""GhiChu"": ""Ăn liên tục 5-7 ngày | [Nguồn]: CT_VT_VN_T1033"", ""score"": 2.0, ""sort_weight"": 3.0}, {""ChuThe"": ""Triệu chứng Đái dầm"", ""QuanHe"": ""Được chữa bằng (BaiThuoc)"", ""DoiTuong"": ""Bài thuốc Đái dầm hương tần"", ""LieuDung"": ""Chưa ghi nhận"", ""CachDung"": ""Chưa ghi nhận"", ""GhiChu"": """", ""score"": 2.0}, {""ChuThe"": ""Bệnh Đái dầm"", ""QuanHe"": ""Được chữa bằng (BaiThuoc)"", ""DoiTuong"": ""Bài thuốc Dị đại đêm tỳ tử"", ""LieuDung"": ""Chưa ghi nhận"", ""CachDung"": ""Sắc còn $100ml$. Lọc bỏ bã. Chia 2,3 lần uống trong ngày"", ""GhiChu"": """", ""score"": 2.0, ""sort_weight"": 3.0}, {""ChuThe"": ""Bệnh Đái dầm"", ""QuanHe"": ""Được chữa bằng (BaiThuoc)"", ""DoiTuong"": ""Bài thuốc Đại Đảm Phục Long Can"", ""LieuDung"": ""Phục long can tán nhỏ $8g$, chu sa $4g$, xạ hương $0,03g$"", ""CachDung"": ""Tất cả tán nhỏ viên bằng hạt đậu xanh. Mỗi tối cho uống 2 đến 4 viên."", ""GhiChu"": ""CT_VT_VN_T1064"", ""score"": 2.0, ""sort_weight"": 3.0}]']","Dựa trên y văn, bệnh trẻ con đái dầm có thể được chữa bằng các vị thuốc và bài thuốc sau:

**Các phương án điều trị trực tiếp:**

*   **Vị thuốc Đơn đỏ:** Tham khảo liều dùng chung của vị thuốc. Dùng thuốc sắc.
*   **Vị thuốc Kê nội kim:** Chưa ghi nhận liều dùng và cách dùng.
*   **Vị thuốc Nhện:** Trứng nhện hay con nhện sao vàng hay nướng vàng. Có thể dùng riêng hay phối hợp với các vị thuốc khác như ngà hay răng voi, ngưu hoàng, thanh đại, băng phiến.
*   **Vị thuốc Ngũ bội tử:** Ngũ bội tử giã nhỏ, thêm nước cho dính. Đắp vào rốn.
*   **Vị thuốc Chim sẻ:** 1 con, làm sạch, nhồi hạt tiêu vào bụng chim rồi nướng chín ăn. Ăn liên tục 5-7 ngày.
*   **Bài thuốc Dị đại đêm tỳ tử:** Sắc còn 100ml. Lọc bỏ bã. Chia 2, 3 lần uống trong ngày.
*   **Bài thuốc Đại Đảm Phục Long Can:** Phục long can tán nhỏ 8g, chu sa 4g, xạ hương 0,03g. Tất cả tán nhỏ viên bằng hạt đậu xanh. Mỗi tối cho uống 2 đến 4 viên.

**Thông tin tham khảo thêm:**

*   Đối với triệu chứng đái dầm nói chung, có thể tham khảo:
    *   **Vị thuốc Dâu:** Tang phiền 6-12g. Chỉ định lâm sàng.
    *   **Vị thuốc Hoài sơn:** Tham khảo liều dùng chung của vị thuốc.
    *   **Vị thuốc Hoài sơn:** Hoài sơn, bạch phục linh tán nhỏ, trộn đều. Mỗi lần cho uống 8g.
*   Đối với triệu chứng đái dầm, có thể tham khảo:
    *   **Vị thuốc Ô dược:** Tham khảo liều dùng chung của vị thuốc. Chỉ định lâm sàng theo kinh nghiệm.
*   **Bài thuốc Đái dầm hương tần:** Chưa ghi nhận liều dùng và cách dùng.",Dâu,1.0,0.4471300851212043,0.9999999999,1.0,0.16872265529590635
"Để chữa bệnh đau răng, vị thuốc vải được dùng với liều lượng và cách thức như thế nào?","['[{""ChuThe"": ""Vị thuốc Vải"", ""QuanHe"": ""CHU_TRI_TRIEU_CHUNG"", ""DoiTuong"": ""Triệu chứng Đau răng"", ""LieuDung"": ""Tham khảo liều dùng chung của vị thuốc | Quả vải, vỏ hạt, hạt muối"", ""CachDung"": ""Sắc lấy nước súc miệng | Để cả vỏ hạt, thêm ít hạt muối, đốt thành than, nghiền nhỏ, xát vào răng thì thấy kết quả"", ""GhiChu"": """", ""score"": 2.0, ""sort_weight"": 3.0}]']","Để chữa đau răng, **Vải** có thể được dùng theo hướng dẫn sau:

*   **Liều dùng:** Tham khảo liều dùng chung của vị thuốc | Quả vải, vỏ hạt, hạt muối.
*   **Cách dùng:**
    *   Sắc lấy nước súc miệng.
    *   Để cả vỏ hạt, thêm ít hạt muối, đốt thành than, nghiền nhỏ, xát vào răng.","Để chữa bệnh đau răng, vị thuốc vải có liều dùng: Tham khảo liều dùng chung của vị thuốc | Quả vải, vỏ hạt, hạt muối và cách dùng: Sắc lấy nước súc miệng | Để cả vỏ hạt, thêm ít hạt muối, đốt thành than, nghiền nhỏ, xát vào răng thì thấy kết quả",1.0,0.48037865993068235,0.9999999999,1.0,0.9940548637915323
Bệnh phổi nóng có thể dùng vị thuốc hoặc bài thuốc nào để chữa?,"['[{""ChuThe"": ""Triệu chứng Phổi nóng"", ""QuanHe"": ""Được chữa bằng (ViThuoc)"", ""DoiTuong"": ""Vị thuốc Sa sâm"", ""LieuDung"": ""$6-12g$"", ""CachDung"": ""Dưới dạng thuốc sắc"", ""GhiChu"": ""[Nguồn]: CT_VT_VN_T834"", ""score"": 2.0}]']","Dựa trên y văn hiện có, đối với triệu chứng phổi nóng, bạn có thể tham khảo thông tin sau:

**Thông tin tham khảo thêm:**

*   **Vị thuốc Sa sâm**: Dùng 6-12g dưới dạng thuốc sắc.",Sa sâm,1.0,0.4444673124239214,0.9999999999,1.0,0.49407306514960225
Bệnh đau thắt bụng có thể dùng vị thuốc hoặc bài thuốc nào để chữa?,"['[{""ChuThe"": ""Triệu chứng Đau thắt bụng"", ""QuanHe"": ""Được chữa bằng (ViThuoc)"", ""DoiTuong"": ""Vị thuốc Rau om"", ""LieuDung"": ""Tham khảo liều dùng chung của vị thuốc"", ""CachDung"": ""Không rõ"", ""GhiChu"": ""CT_VT_VN_T284"", ""score"": 2.0}]']","Hệ thống y văn hiện tại ghi nhận thông tin về phương án hỗ trợ điều trị triệu chứng đau thắt bụng như sau:

**Thông tin tham khảo thêm:**

Đối với triệu chứng đau thắt bụng, bạn có thể tham khảo sử dụng vị thuốc **Rau om**. Về liều dùng và cách dùng, bạn nên tham khảo liều dùng chung của vị thuốc này.",Rau om,1.0,0.4336598543293639,0.9999999999,1.0,0.5717256781128086
Bệnh bạch đới có thể dùng vị thuốc hoặc bài thuốc nào để chữa?,"['[{""ChuThe"": ""Bệnh Bạch đới"", ""QuanHe"": ""Được chữa bằng (ViThuoc)"", ""DoiTuong"": ""Vị thuốc Lộc giác"", ""LieuDung"": ""Ngày uống 2 lần, mỗi lần $4$g"", ""CachDung"": ""Tán nhỏ. Nếu uống được rượu thì dùng rượu mà chiêu thuốc"", ""GhiChu"": ""Lộc giác sao vàng"", ""score"": 2.0, ""sort_weight"": 3.0}, {""ChuThe"": ""Bệnh Xích Bạch đới"", ""QuanHe"": ""Được chữa bằng (ViThuoc)"", ""DoiTuong"": ""Vị thuốc Câu Đằng"", ""LieuDung"": ""Ngày dùng $6-15g$ dưới dạng thuốc sắc"", ""CachDung"": ""dưới dạng thuốc sắc"", ""GhiChu"": ""phụ nữ"", ""score"": 2.0}, {""ChuThe"": ""Bệnh Bạch đới"", ""QuanHe"": ""Được chữa bằng (ViThuoc)"", ""DoiTuong"": ""Vị thuốc Sâm bố chính"", ""LieuDung"": ""Tham khảo liều dùng chung của vị thuốc"", ""CachDung"": ""Sâm bố chính"", ""GhiChu"": ""Chỉ định lâm sàng theo kinh nghiệm"", ""score"": 2.0, ""sort_weight"": 3.0}, {""ChuThe"": ""Bệnh Bạch đới"", ""QuanHe"": ""Được chữa bằng (ViThuoc)"", ""DoiTuong"": ""Vị thuốc Vú bò"", ""LieuDung"": ""Tham khảo liều dùng chung của vị thuốc"", ""CachDung"": ""Rễ, nhựa mủ, toàn cây vú bò"", ""GhiChu"": ""Chỉ định lâm sàng theo kinh nghiệm"", ""score"": 2.0, ""sort_weight"": 3.0}, {""ChuThe"": ""Bệnh Bạch đới"", ""QuanHe"": ""Được chữa bằng (ViThuoc)"", ""DoiTuong"": ""Vị thuốc Quy bản và Cao quy bản"", ""LieuDung"": ""Tham khảo liều dùng chung của vị thuốc"", ""CachDung"": ""Chỉ định lâm sàng theo kinh nghiệm"", ""GhiChu"": ""[Nguồn]: CT_VT_VN_T1018"", ""score"": 2.0, ""sort_weight"": 3.0}, {""ChuThe"": ""Bệnh Bạch đới"", ""QuanHe"": ""Được chữa bằng (ViThuoc)"", ""DoiTuong"": ""Vị thuốc Dâu"", ""LieuDung"": ""Tang phiền $6-12g$"", ""CachDung"": ""Chỉ định lâm sàng"", ""GhiChu"": ""CT_VT_VN_T739"", ""score"": 2.0, ""sort_weight"": 3.0}, {""ChuThe"": ""Bệnh Xích Bạch đới"", ""QuanHe"": ""Được chữa bằng (ViThuoc)"", ""DoiTuong"": ""Vị thuốc Hoàng bá"", ""LieuDung"": ""Tham khảo liều dùng chung của vị thuốc"", ""CachDung"": ""Không ghi rõ liều"", ""GhiChu"": ""Chỉ định lâm sàng (không ghi rõ liều)"", ""score"": 2.0}, {""ChuThe"": ""Bệnh Khí hư bạch đới"", ""QuanHe"": ""Được chữa bằng (ViThuoc)"", ""DoiTuong"": ""Vị thuốc Bướm bạc"", ""LieuDung"": ""$10-20g$ | $6-12g$"", ""CachDung"": ""Sắc uống"", ""GhiChu"": ""Rễ bướm bạc | Cành và thân lá"", ""score"": 2.0}, {""ChuThe"": ""Bệnh Xích Bạch đới"", ""QuanHe"": ""Được chữa bằng (ViThuoc)"", ""DoiTuong"": ""Vị thuốc Rau sam"", ""LieuDung"": ""Mỗi ngày dùng $100g$ rau sam tươi."", ""CachDung"": ""Giã nát rau sam vắt lấy nước, hòa với lòng trắng trứng gà, hấp chín, ăn trong vài ngày."", ""GhiChu"": """", ""score"": 2.0}, {""ChuThe"": ""Bệnh Bạch đới"", ""QuanHe"": ""Được chữa bằng (ViThuoc)"", ""DoiTuong"": ""Vị thuốc Kim anh"", ""LieuDung"": ""Tham khảo liều dùng chung của vị thuốc"", ""CachDung"": ""Dùng dưới hình thức bột hay cao mềm"", ""GhiChu"": ""Di tinh, đái són, tiểu tiện nhiều lần, phụ nữ khí hư, bạch đới, tỳ hư mà hay đi ỉa lỏng. [Nguồn]: CT_VT_VN_T911"", ""score"": 2.0, ""sort_weight"": 3.0}, {""ChuThe"": ""Bệnh Bạch đới khí hư"", ""QuanHe"": ""Được chữa bằng (ViThuoc)"", ""DoiTuong"": ""Vị thuốc Bạc thau"", ""LieuDung"": ""$6-12g$"", ""CachDung"": ""Sắc uống"", ""GhiChu"": """", ""score"": 2.0}, {""ChuThe"": ""Bệnh Xích Bạch đới"", ""QuanHe"": ""Được chữa bằng (ViThuoc)"", ""DoiTuong"": ""Vị thuốc Hạ khô thảo"", ""LieuDung"": ""Hạ khô thảo tán nhỏ, mỗi lần uống $8g$"", ""CachDung"": ""Uống với nước cơm"", ""GhiChu"": ""[Nguồn]: CT_VT_VN_T96"", ""score"": 2.0}, {""ChuThe"": ""Bệnh Bạch đới"", ""QuanHe"": ""Được chữa bằng (ViThuoc)"", ""DoiTuong"": ""Vị thuốc Rau má"", ""LieuDung"": ""$30-40g$ tươi"", ""CachDung"": ""Vò nát vắt lấy nước uống hoặc sắc uống"", ""GhiChu"": ""CT_VT_VN_T649 | CT_VT_VN_T650"", ""score"": 2.0, ""sort_weight"": 3.0}, {""ChuThe"": ""Bệnh Xích Bạch đới"", ""QuanHe"": ""Được chữa bằng (ViThuoc)"", ""DoiTuong"": ""Vị thuốc Bạch biển đậu"", ""LieuDung"": ""Ngày dùng $4$ đến $8g$ bột"", ""CachDung"": ""sao vàng tán nhỏ"", ""GhiChu"": """", ""score"": 2.0}, {""ChuThe"": ""Bệnh Xích Bạch đới"", ""QuanHe"": ""Được chữa bằng (ViThuoc)"", ""DoiTuong"": ""Vị thuốc Kha tử"", ""LieuDung"": ""$3-6$g"", ""CachDung"": ""Liều cầm đi ỉa"", ""GhiChu"": ""còn dùng chữa họ mất tiếng, di tinh, mồ hôi trộm, trĩ, lòi dom, xích bạch đới"", ""score"": 2.0}, {""ChuThe"": ""Bệnh Xích Bạch đới"", ""QuanHe"": ""Được chữa bằng (ViThuoc)"", ""DoiTuong"": ""Vị thuốc Củ nâu"", ""LieuDung"": ""Tham khảo liều dùng chung của vị thuốc"", ""CachDung"": ""Chỉ định lâm sàng theo kinh nghiệm"", ""GhiChu"": ""CT_VT_VN_T456"", ""score"": 2.0}, {""ChuThe"": ""Bệnh Khí hư bạch đới"", ""QuanHe"": ""Được chữa bằng (ViThuoc)"", ""DoiTuong"": ""Vị thuốc Khiếm thực"", ""LieuDung"": ""Tham khảo liều dùng chung của vị thuốc"", ""CachDung"": ""Chỉ định lâm sàng theo kinh nghiệm"", ""GhiChu"": ""CT_VT_VN_T864"", ""score"": 2.0}, {""ChuThe"": ""Bệnh Xích Bạch đới"", ""QuanHe"": ""Được chữa bằng (ViThuoc)"", ""DoiTuong"": ""Vị thuốc Tô mộc"", ""LieuDung"": ""Tham khảo liều dùng chung của vị thuốc"", ""CachDung"": ""Chỉ định lâm sàng theo kinh nghiệm"", ""GhiChu"": ""Lỵ ra máu, chảy máu trong ruột, xích bạch đới | Tô mộc | Chỉ định lâm sàng theo kinh nghiệm | [Nguồn]: CT_VT_VN_T67"", ""score"": 2.0}, {""ChuThe"": ""Bệnh Bạch đới"", ""QuanHe"": ""Được chữa bằng (ViThuoc)"", ""DoiTuong"": ""Vị thuốc Cỏ bợ"", ""LieuDung"": ""Tham khảo liều dùng chung của vị thuốc"", ""CachDung"": ""Sắc đặc uống làm thuốc mát"", ""GhiChu"": ""CT_VT_VN_T253"", ""score"": 2.0, ""sort_weight"": 3.0}, {""ChuThe"": ""Bệnh Bạch đới"", ""QuanHe"": ""Được chữa bằng (ViThuoc)"", ""DoiTuong"": ""Vị thuốc Sim"", ""LieuDung"": ""$10-15g$"", ""CachDung"": ""Sắc uống"", ""GhiChu"": ""Rễ sim, vỏ cây dộp mỗi thứ"", ""score"": 2.0, ""sort_weight"": 3.0}, {""ChuThe"": ""Bệnh Xích Bạch đới"", ""QuanHe"": ""Được chữa bằng (ViThuoc)"", ""DoiTuong"": ""Vị thuốc Huyết dụ"", ""LieuDung"": ""Tham khảo liều dùng chung của vị thuốc"", ""CachDung"": ""Lá cây huyết dụ"", ""GhiChu"": ""Chỉ định lâm sàng theo kinh nghiệm | [Nguồn]: CT_VT_VN_T302"", ""score"": 2.0}, {""ChuThe"": ""Bệnh Bạch đới khí"", ""QuanHe"": ""Được chữa bằng (ViThuoc)"", ""DoiTuong"": ""Vị thuốc Dâm bụt"", ""LieuDung"": ""Tham khảo liều dùng chung của vị thuốc"", ""CachDung"": ""Vỏ rễ dâm bụt sắc với nước. Uống, rửa mụn nhọt"", ""GhiChu"": """", ""score"": 2.0}, {""ChuThe"": ""Bệnh Xích Bạch đới"", ""QuanHe"": ""Được chữa bằng (ViThuoc)"", ""DoiTuong"": ""Vị thuốc Trắc bách diệp"", ""LieuDung"": ""$6-12g$"", ""CachDung"": ""Tham khảo liều dùng chung của vị thuốc"", ""GhiChu"": ""Thuốc cầm máu trong các trường hợp thổ huyết, chảy máu cam, họ ra máu, tiểu tiện ra máu, tử cung xuất huyết, xích bạch đới"", ""score"": 2.0}, {""ChuThe"": ""Triệu chứng Bạch đới"", ""QuanHe"": ""Được chữa bằng (ViThuoc)"", ""DoiTuong"": ""Vị thuốc Tai chuột"", ""LieuDung"": ""$20-30g$"", ""CachDung"": ""Sắc uống hằng ngày"", ""GhiChu"": ""Toàn cây tươi hoặc khô"", ""score"": 2.0}, {""ChuThe"": ""Triệu chứng Khí hư bạch đới"", ""QuanHe"": ""Được chữa bằng (ViThuoc)"", ""DoiTuong"": ""Vị thuốc Xoài"", ""LieuDung"": ""Tham khảo liều dùng chung của vị thuốc"", ""CachDung"": ""Giã vắt lấy nước, rửa"", ""GhiChu"": ""Vỏ thân xoài tươi"", ""score"": 2.0}, {""ChuThe"": ""Bệnh Bạch đới"", ""QuanHe"": ""Được chữa bằng (ViThuoc)"", ""DoiTuong"": ""Vị thuốc Keo nước hoa"", ""LieuDung"": ""Tham khảo liều dùng chung của vị thuốc"", ""CachDung"": ""Sắc lấy nước rửa thụt"", ""GhiChu"": ""Vỏ thân cây Keo nước hoa dùng để sắc nước rửa thụt trị khí hư, bạch đới. Đây là chỉ định trực tiếp từ vị thuốc nên không tạo bài thuốc BT_."", ""score"": 2.0, ""sort_weight"": 3.0}, {""ChuThe"": ""Bệnh Bạch đới"", ""QuanHe"": ""Được chữa bằng (ViThuoc)"", ""DoiTuong"": ""Vị thuốc Nhàu"", ""LieuDung"": ""Tham khảo liều dùng chung của vị thuốc"", ""CachDung"": ""Ăn với muối"", ""GhiChu"": ""Quả nhàu"", ""score"": 2.0, ""sort_weight"": 3.0}, {""ChuThe"": ""Bệnh Bạch đới"", ""QuanHe"": ""Được chữa bằng (BaiThuoc)"", ""DoiTuong"": ""Bài thuốc Bạch đới máu lệ"", ""LieuDung"": ""Hoa hoè $40g$, mẫu lệ (nung rồi tán nhỏ) $40g$"", ""CachDung"": ""Chỉ định lâm sàng (không ghi rõ liều)"", ""GhiChu"": ""Thuốc chữa khí hư, bạch đới | Hoa hoè $40g$, mẫu lệ (nung rồi tán nhỏ) $40g$ | Chỉ định lâm sàng (không ghi rõ liều) | [Nguồn]: CT_VT_VN_T501"", ""score"": 2.0, ""sort_weight"": 3.0}, {""ChuThe"": ""Bệnh Bạch đới khí hư"", ""QuanHe"": ""Được chữa bằng (BaiThuoc)"", ""DoiTuong"": ""Bài thuốc trị người gầy xanh xao giun đất"", ""LieuDung"": ""Chưa ghi nhận"", ""CachDung"": ""Chưa ghi nhận"", ""GhiChu"": """", ""score"": 2.0}, {""ChuThe"": ""Bệnh Bạch đới"", ""QuanHe"": ""Được chữa bằng (BaiThuoc)"", ""DoiTuong"": ""Bài thuốc Bạch đới Xích thước"", ""LieuDung"": ""Chưa ghi nhận"", ""CachDung"": ""Chưa ghi nhận"", ""GhiChu"": """", ""score"": 2.0, ""sort_weight"": 3.0}]']","Bệnh bạch đới có thể được chữa bằng các vị thuốc và bài thuốc sau đây:

**Các vị thuốc:**

*   **Lộc giác:** Tán nhỏ, ngày uống 2 lần, mỗi lần 4g. Nếu uống được rượu thì dùng rượu mà chiêu thuốc. Lưu ý: Lộc giác sao vàng.
*   **Sâm bố chính:** Tham khảo liều dùng chung của vị thuốc.
*   **Vú bò:** Tham khảo liều dùng chung của vị thuốc. Dùng rễ, nhựa mủ, toàn cây.
*   **Quy bản và Cao quy bản:** Tham khảo liều dùng chung của vị thuốc.
*   **Dâu:** Tang phiền 6-12g.
*   **Kim anh:** Tham khảo liều dùng chung của vị thuốc. Dùng dưới hình thức bột hay cao mềm.
*   **Rau má:** 30-40g tươi. Vò nát vắt lấy nước uống hoặc sắc uống.
*   **Cỏ bợ:** Tham khảo liều dùng chung của vị thuốc. Sắc đặc uống làm thuốc mát.
*   **Sim:** 10-15g. Sắc uống. Dùng rễ sim, vỏ cây dộp mỗi thứ.
*   **Keo nước hoa:** Tham khảo liều dùng chung của vị thuốc. Sắc lấy nước rửa thụt.
*   **Nhàu:** Tham khảo liều dùng chung của vị thuốc. Ăn quả nhàu với muối.

**Các bài thuốc:**

*   **Bạch đới máu lệ:** Hoa hoè 40g, mẫu lệ (nung rồi tán nhỏ) 40g.
*   **Bạch đới Xích thước:** Chưa ghi nhận liều dùng và cách dùng.

**Thông tin tham khảo thêm:**

Một số vị thuốc và bài thuốc có thể được dùng trong các trường hợp bệnh liên quan như sau:

*   **Bệnh Xích Bạch đới:**
    *   **Câu Đằng:** Ngày dùng 6-15g dưới dạng thuốc sắc (dùng cho phụ nữ).
    *   **Hoàng bá:** Tham khảo liều dùng chung của vị thuốc.
    *   **Rau sam:** Mỗi ngày dùng 100g rau sam tươi. Giã nát rau sam vắt lấy nước, hòa với lòng trắng trứng gà, hấp chín, ăn trong vài ngày.
    *   **Hạ khô thảo:** Hạ khô thảo tán nhỏ, mỗi lần uống 8g. Uống với nước cơm.
    *   **Bạch biển đậu:** Ngày dùng 4 đến 8g bột, sao vàng tán nhỏ.
    *   **Kha tử:** 3-6g (liều cầm đi ỉa).
    *   **Củ nâu:** Tham khảo liều dùng chung của vị thuốc.
    *   **Tô mộc:** Tham khảo liều dùng chung của vị thuốc.
    *   **Huyết dụ:** Tham khảo liều dùng chung của vị thuốc. Dùng lá cây huyết dụ.
    *   **Trắc bách diệp:** 6-12g. Tham khảo liều dùng chung của vị thuốc.
*   **Bệnh Khí hư bạch đới:**
    *   **Bướm bạc:** 10-20g (rễ bướm bạc) hoặc 6-12g (cành và thân lá). Sắc uống.
    *   **Khiếm thực:** Tham khảo liều dùng chung của vị thuốc.
*   **Bệnh Bạch đới khí:**
    *   **Dâm bụt:** Tham khảo liều dùng chung của vị thuốc. Vỏ rễ dâm bụt sắc với nước. Uống, rửa mụn nhọt.
*   **Triệu chứng Bạch đới:**
    *   **Tai chuột:** 20-30g. Sắc uống hằng ngày. Dùng toàn cây tươi hoặc khô.
*   **Triệu chứng Khí hư bạch đới:**
    *   **Xoài:** Tham khảo liều dùng chung của vị thuốc. Giã vắt lấy nước, rửa. Dùng vỏ thân xoài tươi.
*   **Bài thuốc trị người gầy xanh xao giun đất:** Chưa ghi nhận liều dùng và cách dùng.
*   **Bạc thau:** 6-12g. Sắc uống (dùng cho bệnh Bạch đới khí hư).",Tai chuột,1.0,0.5268905445291733,,1.0,0.19110962459150568
Vị thuốc tắc kè có hoạt chất prolin không?,['Không có dữ liệu'],"Không. Dựa trên dữ liệu y văn hiện tại, không có ghi nhận nào cho thấy tắc kè có liên quan hoặc tác dụng tới prolin.","Có, vị thuốc tắc kè có hoạt chất prolin",0.0,0.8522418696261376,0.0,0.0,0.24248980017655125
"Để chữa bệnh ghẻ, vị thuốc chè vằng được dùng với liều lượng và cách thức như thế nào?","['[{""ChuThe"": ""Vị thuốc chè vằng"", ""QuanHe"": ""CHU_TRI_BENH"", ""DoiTuong"": ""Bệnh Ghẻ"", ""LieuDung"": ""Tham khảo liều dùng chung của vị thuốc"", ""CachDung"": ""Nhân dân thường hái lá quanh năm làm thuốc hay để đun nước tắm ghẻ. Dùng tươi hay phơi khô để dành | Nấu nước tắm"", ""GhiChu"": ""CT_VT_VN_T137"", ""score"": 2.0, ""sort_weight"": 3.0}]']","Để chữa bệnh ghẻ, **chè vằng** được dùng như sau:

*   **Liều dùng và cách dùng:** Tham khảo liều dùng chung của vị thuốc. Nhân dân thường hái lá quanh năm làm thuốc hay để đun nước tắm ghẻ. Dùng tươi hay phơi khô để dành, sau đó nấu nước tắm.","Để chữa bệnh ghẻ, vị thuốc chè vằng có liều dùng: Tham khảo liều dùng chung của vị thuốc và cách dùng: Nhân dân thường hái lá quanh năm làm thuốc hay để đun nước tắm ghẻ. Dùng tươi hay phơi khô để dành | Nấu nước tắm",1.0,0.5366106719216202,0.9999999999,1.0,0.9269516274213014
Bệnh đau mắt có thể dùng vị thuốc hoặc bài thuốc nào để chữa?,"['[{""ChuThe"": ""Triệu chứng Đau mắt"", ""QuanHe"": ""Được chữa bằng (ViThuoc)"", ""DoiTuong"": ""Vị thuốc Cúc hoa"", ""LieuDung"": ""Tham khảo liều dùng chung của vị thuốc"", ""CachDung"": ""Chỉ định lâm sàng theo kinh nghiệm"", ""GhiChu"": ""CT_VT_VN_T622"", ""score"": 2.0}, {""ChuThe"": ""Bệnh Đau mắt"", ""QuanHe"": ""Được chữa bằng (ViThuoc)"", ""DoiTuong"": ""Vị thuốc Rau má lá rau muống"", ""LieuDung"": ""Tham khảo liều dùng chung của vị thuốc"", ""CachDung"": ""Nước sắc dùng nhỏ mắt"", ""GhiChu"": ""Chỉ định lâm sàng theo kinh nghiệm"", ""score"": 2.0, ""sort_weight"": 3.0}, {""ChuThe"": ""Triệu chứng Đau mắt"", ""QuanHe"": ""Được chữa bằng (ViThuoc)"", ""DoiTuong"": ""Vị thuốc Thổ hoàng liên"", ""LieuDung"": ""Tham khảo liều dùng chung của vị thuốc"", ""CachDung"": ""Dùng ngoài"", ""GhiChu"": ""Như hoàng liên bắc | [Nguồn]: CT_VT_VN_T211"", ""score"": 2.0}, {""ChuThe"": ""Bệnh Đau mắt"", ""QuanHe"": ""Được chữa bằng (ViThuoc)"", ""DoiTuong"": ""Vị thuốc Hoàng đằng chân vịt"", ""LieuDung"": ""Tham khảo liều dùng chung của vị thuốc"", ""CachDung"": ""Không ghi rõ"", ""GhiChu"": ""Chỉ định lâm sàng (không ghi rõ liều) | [Nguồn]: CT_VT_VN_T209"", ""score"": 2.0, ""sort_weight"": 3.0}, {""ChuThe"": ""Bệnh Đau mắt"", ""QuanHe"": ""Được chữa bằng (ViThuoc)"", ""DoiTuong"": ""Vị thuốc Vàng đằng"", ""LieuDung"": ""Tham khảo liều dùng chung của vị thuốc"", ""CachDung"": ""Dùng dưới hình thức thuốc bột hay thuốc viên."", ""GhiChu"": ""Thân và rễ cây vàng đằng"", ""score"": 2.0, ""sort_weight"": 3.0}, {""ChuThe"": ""Bệnh Đau mắt"", ""QuanHe"": ""Được chữa bằng (ViThuoc)"", ""DoiTuong"": ""Vị thuốc Mã đề"", ""LieuDung"": ""Chưa ghi nhận"", ""CachDung"": ""Chưa ghi nhận"", ""GhiChu"": """", ""score"": 2.0, ""sort_weight"": 3.0}, {""ChuThe"": ""Bệnh Đau mắt"", ""QuanHe"": ""Được chữa bằng (ViThuoc)"", ""DoiTuong"": ""Vị thuốc Ban miêu"", ""LieuDung"": ""Tham khảo liều dùng chung của vị thuốc"", ""CachDung"": ""Đảm phàn"", ""GhiChu"": ""Chỉ định lâm sàng theo kinh nghiệm"", ""score"": 2.0, ""sort_weight"": 3.0}, {""ChuThe"": ""Bệnh Đau mắt"", ""QuanHe"": ""Được chữa bằng (ViThuoc)"", ""DoiTuong"": ""Vị thuốc Thảo quyết minh"", ""LieuDung"": ""Tham khảo liều dùng chung của vị thuốc"", ""CachDung"": ""Chỉ định lâm sàng theo kinh nghiệm"", ""GhiChu"": ""người ta cho rằng uống thảo quyết minh mắt sẽ sáng ra"", ""score"": 2.0, ""sort_weight"": 3.0}, {""ChuThe"": ""Bệnh Đau mắt"", ""QuanHe"": ""Được chữa bằng (ViThuoc)"", ""DoiTuong"": ""Vị thuốc Mía dò"", ""LieuDung"": ""Tham khảo liều dùng chung của vị thuốc"", ""CachDung"": ""Ngọn hay cành non Mía Dò nướng nóng vắt lấy nước nhỏ vào mắt"", ""GhiChu"": ""CT_VT_VN_T586"", ""score"": 2.0, ""sort_weight"": 3.0}, {""ChuThe"": ""Bệnh Đau mắt"", ""QuanHe"": ""Được chữa bằng (ViThuoc)"", ""DoiTuong"": ""Vị thuốc Nhãn hương"", ""LieuDung"": ""$5-10g$"", ""CachDung"": ""Pha trong một lít nước sôi, dùng nước này để rửa mắt"", ""GhiChu"": ""[Nguồn]: CT_VT_VN_T589"", ""score"": 2.0, ""sort_weight"": 3.0}, {""ChuThe"": ""Bệnh Đau mắt"", ""QuanHe"": ""Được chữa bằng (ViThuoc)"", ""DoiTuong"": ""Vị thuốc Đại bi"", ""LieuDung"": ""Chỉ định lâm sàng theo kinh nghiệm"", ""CachDung"": ""Băng phiến đại bi"", ""GhiChu"": ""Đau bụng, đau ngực, ho lâu ngày, ngạt mũi, đau cổ họng, đau mắt cảm gió, cấm khẩu đau răng"", ""score"": 2.0, ""sort_weight"": 3.0}, {""ChuThe"": ""Bệnh Đau mắt"", ""QuanHe"": ""Được chữa bằng (ViThuoc)"", ""DoiTuong"": ""Vị thuốc Bầu đất"", ""LieuDung"": ""Vài hạt muối"", ""CachDung"": ""Lá rửa sạch, thêm vài hạt muối, giã nhỏ đắp lên mắt đau"", ""GhiChu"": ""Chỉ định lâm sàng"", ""score"": 2.0, ""sort_weight"": 3.0}, {""ChuThe"": ""Bệnh Đau mắt"", ""QuanHe"": ""Được chữa bằng (ViThuoc)"", ""DoiTuong"": ""Vị thuốc Cải cúc"", ""LieuDung"": ""$10-16g$"", ""CachDung"": ""Uống dưới dạng thuốc pha hay thuốc sắc"", ""GhiChu"": ""[Nguồn]: CT_VT_VN_T773"", ""score"": 2.0, ""sort_weight"": 3.0}, {""ChuThe"": ""Bệnh Viêm kết mạc"", ""QuanHe"": ""Được chữa bằng (ViThuoc)"", ""DoiTuong"": ""Vị thuốc Trầu không"", ""LieuDung"": ""Tham khảo liều dùng chung của vị thuốc"", ""CachDung"": ""Nước pha lá trầu không dùng làm thuốc nhỏ mắt"", ""GhiChu"": ""[Nguồn]: CT_VT_VN_T134"", ""score"": 2.0}, {""ChuThe"": ""Bệnh Đau mắt"", ""QuanHe"": ""Được chữa bằng (ViThuoc)"", ""DoiTuong"": ""Vị thuốc Hoàng Đằng"", ""LieuDung"": ""Tham khảo liều dùng chung của vị thuốc | Dùng như hoàng đằng"", ""CachDung"": ""Chỉ định lâm sàng theo kinh nghiệm | `$Panmatin clorua$` chiết từ hoàng đằng"", ""GhiChu"": ""Toàn cây hoàng đằng | [Nguồn]: CT_VT_VN_T208"", ""score"": 2.0, ""sort_weight"": 3.0}, {""ChuThe"": ""Bệnh Đau mắt"", ""QuanHe"": ""Được chữa bằng (ViThuoc)"", ""DoiTuong"": ""Vị thuốc Chó đẻ răng cưa"", ""LieuDung"": ""Tham khảo liều dùng chung của vị thuốc"", ""CachDung"": ""Không rõ"", ""GhiChu"": ""Đau mắt | Chó đẻ răng cưa | Chỉ định lâm sàng | [Nguồn]: CT_VT_VN_T113"", ""score"": 2.0, ""sort_weight"": 3.0}, {""ChuThe"": ""Triệu chứng Mắt đau"", ""QuanHe"": ""Được chữa bằng (ViThuoc)"", ""DoiTuong"": ""Vị thuốc Mào gà trắng"", ""LieuDung"": ""Tham khảo liều dùng chung của vị thuốc"", ""CachDung"": ""Chỉ định lâm sàng theo kinh nghiệm"", ""GhiChu"": ""Phong nhiệt làm mắt đau | Hạt mào gà trắng | Chỉ định lâm sàng theo kinh nghiệm | [Nguồn]: CT_VT_VN_T307"", ""score"": 2.0}, {""ChuThe"": ""Triệu chứng Mắt đau sưng đỏ"", ""QuanHe"": ""Được chữa bằng (ViThuoc)"", ""DoiTuong"": ""Vị thuốc Đại hoàng"", ""LieuDung"": ""Tham khảo liều dùng chung của vị thuốc"", ""CachDung"": ""Đại hoàng tán nhỏ, trộn với mật lợn bôi vào"", ""GhiChu"": ""Bôi ngoài"", ""score"": 2.0}, {""ChuThe"": ""Triệu chứng Đau Mắt Ra Nắng Bị Chói"", ""QuanHe"": ""Được chữa bằng (ViThuoc)"", ""DoiTuong"": ""Vị thuốc Thạch quyết minh"", ""LieuDung"": ""$4g$"", ""CachDung"": ""Sắc với $200g$ nước, để nguội, uống hàng ngày"", ""GhiChu"": ""cúc hoa, cam thảo mỗi vị $4g$. CT_VT_VN_T504"", ""score"": 2.0}, {""ChuThe"": ""Triệu chứng Mắt đau đỏ"", ""QuanHe"": ""Được chữa bằng (ViThuoc)"", ""DoiTuong"": ""Vị thuốc Húng quế"", ""LieuDung"": ""Tham khảo liều dùng chung của vị thuốc"", ""CachDung"": ""Đắp lên mắt"", ""GhiChu"": ""Hạt húng quế"", ""score"": 2.0}, {""ChuThe"": ""Bệnh Trẻ con đau mắt"", ""QuanHe"": ""Được chữa bằng (ViThuoc)"", ""DoiTuong"": ""Vị thuốc Dâu"", ""LieuDung"": ""Tham khảo liều dùng chung của vị thuốc"", ""CachDung"": ""Cả con sâu nướng ăn hoặc ngâm rượu"", ""GhiChu"": ""CT_VT_VN_T739"", ""score"": 2.0}, {""ChuThe"": ""Bệnh Đau mắt đỏ"", ""QuanHe"": ""Được chữa bằng (ViThuoc)"", ""DoiTuong"": ""Vị thuốc Bạch cập"", ""LieuDung"": ""Tham khảo liều dùng chung của vị thuốc"", ""CachDung"": ""Dùng ngoài đắp lên"", ""GhiChu"": ""Dùng theo kinh nghiệm cổ của nhân dân, làm thuốc cầm máu"", ""score"": 2.0}, {""ChuThe"": ""Bệnh Đau mắt hột"", ""QuanHe"": ""Được chữa bằng (ViThuoc)"", ""DoiTuong"": ""Vị thuốc Cam thảo dây"", ""LieuDung"": ""3-5 hạt"", ""CachDung"": ""Giã nát ngâm với 1 lít nước, ngày nhỏ vào mắt 3 lần. Thuốc để lâu không có tác dụng, dùng đến đâu chế đến đó"", ""GhiChu"": """", ""score"": 2.0}, {""ChuThe"": ""Bệnh Đau mắt thường"", ""QuanHe"": ""Được chữa bằng (ViThuoc)"", ""DoiTuong"": ""Vị thuốc Cam thảo dây"", ""LieuDung"": ""3-5 hạt"", ""CachDung"": ""Giã nát ngâm với 1 lít nước, ngày nhỏ vào mắt 3 lần. Thuốc để lâu không có tác dụng, dùng đến đâu chế đến đó"", ""GhiChu"": """", ""score"": 2.0}, {""ChuThe"": ""Triệu chứng Đau mắt đỏ"", ""QuanHe"": ""Được chữa bằng (ViThuoc)"", ""DoiTuong"": ""Vị thuốc Hạ khô thảo"", ""LieuDung"": ""Hạ khô thảo $12g$, cúc hoa $12g$, tang diệp $12g$, bạc hà $4g$, kinh giới $4g$"", ""CachDung"": ""Sắc uống"", ""GhiChu"": ""Chỉ định lâm sàng [Nguồn]: CT_VT_VN_T97"", ""score"": 2.0}, {""ChuThe"": ""Triệu chứng Nhức mắt"", ""QuanHe"": ""Được chữa bằng (ViThuoc)"", ""DoiTuong"": ""Vị thuốc Hạ khô thảo"", ""LieuDung"": ""hạ khô thảo $80g$, hương phụ (củ non) $40g$"", ""CachDung"": ""Sắc uống"", ""GhiChu"": ""[Nguồn]: CT_VT_VN_T95"", ""score"": 2.0}, {""ChuThe"": ""Triệu chứng Đau mắt"", ""QuanHe"": ""Được chữa bằng (ViThuoc)"", ""DoiTuong"": ""Vị thuốc Thăng dược"", ""LieuDung"": ""Tham khảo liều dùng chung của vị thuốc"", ""CachDung"": ""Dùng dưới dạng bột rắc lên vết loét hay thuốc mỡ."", ""GhiChu"": """", ""score"": 2.0}, {""ChuThe"": ""Triệu chứng Đau mắt"", ""QuanHe"": ""Được chữa bằng (ViThuoc)"", ""DoiTuong"": ""Vị thuốc đơn buốt"", ""LieuDung"": ""Tham khảo liều dùng chung của vị thuốc"", ""CachDung"": ""Lá tươi giã nát đắp lên mi mắt"", ""GhiChu"": ""CT_VT_VN_T136 (trang 136, tập 1). Dùng ngoài da."", ""score"": 2.0}, {""ChuThe"": ""Triệu chứng Đau mắt"", ""QuanHe"": ""Được chữa bằng (ViThuoc)"", ""DoiTuong"": ""Vị thuốc Hoàng liên gai"", ""LieuDung"": ""Tham khảo liều dùng chung của vị thuốc"", ""CachDung"": ""Dùng dưới dạng thuốc sắc, mỗi ngày uống 4 đến $6g$. Có thể tán bột mà uống | Sắc lấy nước rửa mắt hoặc nhỏ vào mắt"", ""GhiChu"": """", ""score"": 2.0}, {""ChuThe"": ""Triệu chứng Đau mắt"", ""QuanHe"": ""Được chữa bằng (ViThuoc)"", ""DoiTuong"": ""Vị thuốc Mật động vật (Đởm)"", ""LieuDung"": ""Tham khảo liều dùng chung của vị thuốc"", ""CachDung"": ""Dùng ngoài"", ""GhiChu"": ""CT_VT_VN_T245"", ""score"": 2.0}]']","Bệnh đau mắt có thể được chữa bằng các vị thuốc sau đây:

**Các vị thuốc được ghi nhận trong y văn:**

*   **Rau má lá rau muống:** Nước sắc dùng nhỏ mắt.
*   **Hoàng đằng chân vịt:** Tham khảo liều dùng chung của vị thuốc.
*   **Vàng đằng:** Dùng dưới hình thức thuốc bột hay thuốc viên.
*   **Mã đề:** Chưa ghi nhận liều dùng và cách dùng.
*   **Ban miêu:** Dùng đảm phàn, tham khảo liều dùng chung của vị thuốc.
*   **Thảo quyết minh:** Tham khảo liều dùng chung của vị thuốc.
*   **Mía dò:** Ngọn hay cành non Mía Dò nướng nóng vắt lấy nước nhỏ vào mắt.
*   **Nhãn hương:** 5-10g pha trong một lít nước sôi, dùng nước này để rửa mắt.
*   **Đại bi:** Băng phiến đại bi, chỉ định lâm sàng theo kinh nghiệm.
*   **Bầu đất:** Lá rửa sạch, thêm vài hạt muối, giã nhỏ đắp lên mắt đau.
*   **Cải cúc:** 10-16g, uống dưới dạng thuốc pha hay thuốc sắc.
*   **Hoàng Đằng:** Tham khảo liều dùng chung của vị thuốc, dùng như hoàng đằng. Có thể dùng Panmatin clorua chiết từ hoàng đằng.
*   **Chó đẻ răng cưa:** Tham khảo liều dùng chung của vị thuốc.

**Thông tin tham khảo thêm:**

*   **Triệu chứng đau mắt:**
    *   **Cúc hoa:** Tham khảo liều dùng chung của vị thuốc.
    *   **Thổ hoàng liên:** Dùng ngoài, tham khảo liều dùng chung của vị thuốc.
    *   **Thăng dược:** Dùng dưới dạng bột rắc lên vết loét hay thuốc mỡ, tham khảo liều dùng chung của vị thuốc.
    *   **Đơn buốt:** Lá tươi giã nát đắp lên mi mắt, tham khảo liều dùng chung của vị thuốc.
    *   **Hoàng liên gai:** Dùng dưới dạng thuốc sắc, mỗi ngày uống 4 đến 6g. Có thể tán bột mà uống hoặc sắc lấy nước rửa mắt hoặc nhỏ vào mắt, tham khảo liều dùng chung của vị thuốc.
    *   **Mật động vật (Đởm):** Dùng ngoài, tham khảo liều dùng chung của vị thuốc.
*   **Viêm kết mạc:**
    *   **Trầu không:** Nước pha lá trầu không dùng làm thuốc nhỏ mắt, tham khảo liều dùng chung của vị thuốc.
*   **Mắt đau:**
    *   **Mào gà trắng:** Tham khảo liều dùng chung của vị thuốc.
*   **Mắt đau sưng đỏ:**
    *   **Đại hoàng:** Đại hoàng tán nhỏ, trộn với mật lợn bôi vào.
*   **Đau mắt ra nắng bị chói:**
    *   **Thạch quyết minh:** 4g sắc với 200g nước, để nguội, uống hàng ngày, có thể kết hợp với cúc hoa, cam thảo mỗi vị 4g.
*   **Mắt đau đỏ:**
    *   **Húng quế:** Đắp lên mắt, tham khảo liều dùng chung của vị thuốc.
*   **Trẻ con đau mắt:**
    *   **Dâu:** Cả con sâu nướng ăn hoặc ngâm rượu, tham khảo liều dùng chung của vị thuốc.
*   **Đau mắt đỏ:**
    *   **Bạch cập:** Dùng ngoài đắp lên, tham khảo liều dùng chung của vị thuốc.
    *   **Hạ khô thảo:** Hạ khô thảo 12g, cúc hoa 12g, tang diệp 12g, bạc hà 4g, kinh giới 4g, sắc uống.
*   **Đau mắt hột/Đau mắt thường:**
    *   **Cam thảo dây:** 3-5 hạt giã nát ngâm với 1 lít nước, ngày nhỏ vào mắt 3 lần. Thuốc để lâu không có tác dụng, dùng đến đâu chế đến đó.
*   **Nhức mắt:**
    *   **Hạ khô thảo:** Hạ khô thảo 80g, hương phụ (củ non) 40g, sắc uống.","Cúc hoa, Diếp cá, Dung, Hoàng liên gai, Hạ khô thảo, Mật động vật (Đởm), Mộc tặc, Rau mồng tơi, Sài đất, Thăng dược, Thổ hoàng liên, Tật lê, Tề thái, Đơn buốt",1.0,0.44746342420189694,0.9999999999,0.0,0.36857751224706237
Vị thuốc mẫu đơn bì có vị gì?,"['[{""ChuThe"": ""Vị thuốc Mẫu đơn bì"", ""QuanHe"": ""CO_VI"", ""DoiTuong"": ""Vị cay"", ""LieuDung"": ""Chưa ghi nhận"", ""CachDung"": ""Chưa ghi nhận"", ""GhiChu"": """", ""score"": 2.0, ""sort_weight"": 3.0}, {""ChuThe"": ""Vị thuốc Mẫu đơn bì"", ""QuanHe"": ""CO_VI"", ""DoiTuong"": ""Vị đắng"", ""LieuDung"": ""Chưa ghi nhận"", ""CachDung"": ""Chưa ghi nhận"", ""GhiChu"": """", ""score"": 2.0, ""sort_weight"": 3.0}]']",Vị thuốc **Mẫu đơn bì** có vị cay và đắng.,"Vị cay, Vị đắng",1.0,0.5572102650164407,0.9999999999,1.0,0.9702038046870223
Vị thuốc dừa có chứa hoạt chất strophantilin c không?,['Không có dữ liệu'],"Không. Dựa trên dữ liệu y văn hiện tại, không có ghi nhận nào cho thấy dừa có liên quan hoặc tác dụng tới strophantilin c.","Không, vị thuốc dừa không chứa hoạt chất strophantilin c",0.0,0.847886882278059,0.0,1.0,0.9929018146714172
Bệnh sưng vú có thể dùng vị thuốc hoặc bài thuốc nào để chữa?,"['[{""ChuThe"": ""Bệnh Sưng vú"", ""QuanHe"": ""Được chữa bằng (ViThuoc)"", ""DoiTuong"": ""Vị thuốc Khế"", ""LieuDung"": ""Tham khảo liều dùng chung của vị thuốc"", ""CachDung"": ""Chỉ định lâm sàng theo kinh nghiệm"", ""GhiChu"": """", ""score"": 2.0, ""sort_weight"": 3.0}, {""ChuThe"": ""Bệnh Sưng vú"", ""QuanHe"": ""Được chữa bằng (ViThuoc)"", ""DoiTuong"": ""Vị thuốc chè vằng"", ""LieuDung"": ""Tham khảo liều dùng chung của vị thuốc"", ""CachDung"": ""Chỉ định lâm sàng theo kinh nghiệm"", ""GhiChu"": ""CT_VT_VN_T137"", ""score"": 2.0, ""sort_weight"": 3.0}, {""ChuThe"": ""Bệnh Sưng vú"", ""QuanHe"": ""Được chữa bằng (ViThuoc)"", ""DoiTuong"": ""Vị thuốc Cỏ sữa nhỏ lá"", ""LieuDung"": ""Tham khảo liều dùng chung của vị thuốc"", ""CachDung"": ""Chỉ định lâm sàng theo kinh nghiệm"", ""GhiChu"": ""CT_VT_VN_T215"", ""score"": 2.0, ""sort_weight"": 3.0}, {""ChuThe"": ""Bệnh Sưng vú"", ""QuanHe"": ""Được chữa bằng (ViThuoc)"", ""DoiTuong"": ""Vị thuốc Cỏ bợ"", ""LieuDung"": ""Tham khảo liều dùng chung của vị thuốc"", ""CachDung"": ""Giã cây tươi, bã đắp lên"", ""GhiChu"": ""CT_VT_VN_T253"", ""score"": 2.0, ""sort_weight"": 3.0}, {""ChuThe"": ""Bệnh Sưng vú"", ""QuanHe"": ""Được chữa bằng (ViThuoc)"", ""DoiTuong"": ""Vị thuốc Quít - Trần bì"", ""LieuDung"": ""Ngày dùng $6-12g$"", ""CachDung"": ""Hơ nóng đắp ngoài. Có khi phơi khô sắc uống như vỏ quít."", ""GhiChu"": ""Lá quít"", ""score"": 2.0, ""sort_weight"": 3.0}, {""ChuThe"": ""Bệnh Sưng vú"", ""QuanHe"": ""Được chữa bằng (ViThuoc)"", ""DoiTuong"": ""Vị thuốc Sim"", ""LieuDung"": ""Tham khảo liều dùng chung của vị thuốc"", ""CachDung"": ""Giã nát đắp lên"", ""GhiChu"": ""Lá sim tươi, Ngày 2-3 lần"", ""score"": 2.0, ""sort_weight"": 3.0}, {""ChuThe"": ""Bệnh Sưng vú"", ""QuanHe"": ""Được chữa bằng (ViThuoc)"", ""DoiTuong"": ""Vị thuốc Ích mẫu"", ""LieuDung"": ""Tham khảo liều dùng chung của vị thuốc"", ""CachDung"": ""Thân và quả ích mẫu giã đắp hoặc sắc lấy nước rửa"", ""GhiChu"": ""Chỉ định lâm sàng theo kinh nghiệm"", ""score"": 2.0, ""sort_weight"": 3.0}, {""ChuThe"": ""Bệnh Sưng vú"", ""QuanHe"": ""Được chữa bằng (ViThuoc)"", ""DoiTuong"": ""Vị thuốc Tía tô"", ""LieuDung"": ""$10g$"", ""CachDung"": ""Sắc lấy nước uống, bã đắp vào vú"", ""GhiChu"": """", ""score"": 2.0, ""sort_weight"": 3.0}, {""ChuThe"": ""Bệnh Sưng vú"", ""QuanHe"": ""Được chữa bằng (ViThuoc)"", ""DoiTuong"": ""Vị thuốc Mạn kinh tử"", ""LieuDung"": ""$4$g"", ""CachDung"": ""Hoà với rượu, gạn lấy rượu uống còn bã đắp lên vú"", ""GhiChu"": ""theo Đặc huệ phương ghi lại trong Bản thảo cương mục"", ""score"": 2.0, ""sort_weight"": 3.0}, {""ChuThe"": ""Bệnh Sưng vú"", ""QuanHe"": ""Được chữa bằng (ViThuoc)"", ""DoiTuong"": ""Vị thuốc Ngưu bàng"", ""LieuDung"": ""Tham khảo liều dùng chung của vị thuốc"", ""CachDung"": ""Chỉ định lâm sàng theo kinh nghiệm"", ""GhiChu"": ""Quả ngưu bàng"", ""score"": 2.0, ""sort_weight"": 3.0}, {""ChuThe"": ""Bệnh Sưng vú"", ""QuanHe"": ""Được chữa bằng (ViThuoc)"", ""DoiTuong"": ""Vị thuốc Qua lâu nhân"", ""LieuDung"": ""Tham khảo liều dùng chung của vị thuốc"", ""CachDung"": ""Tham khảo cách dùng chung của vị thuốc"", ""GhiChu"": """", ""score"": 2.0, ""sort_weight"": 3.0}, {""ChuThe"": ""Bệnh Sưng vú"", ""QuanHe"": ""Được chữa bằng (ViThuoc)"", ""DoiTuong"": ""Vị thuốc Xạ can"", ""LieuDung"": ""Tham khảo liều dùng chung của vị thuốc"", ""CachDung"": ""Chỉ định lâm sàng theo kinh nghiệm"", ""GhiChu"": ""tắc tia sữa"", ""score"": 2.0, ""sort_weight"": 3.0}, {""ChuThe"": ""Bệnh Sưng vú"", ""QuanHe"": ""Được chữa bằng (ViThuoc)"", ""DoiTuong"": ""Vị thuốc Nhôi"", ""LieuDung"": ""Tham khảo liều dùng chung của vị thuốc"", ""CachDung"": ""Chỉ định lâm sàng theo kinh nghiệm"", ""GhiChu"": ""CT_VT_VN_T77"", ""score"": 2.0, ""sort_weight"": 3.0}, {""ChuThe"": ""Bệnh Sưng vú"", ""QuanHe"": ""Được chữa bằng (ViThuoc)"", ""DoiTuong"": ""Vị thuốc Bồ công anh Việt Nam"", ""LieuDung"": ""Lá bồ công anh tươi $20-40g$"", ""CachDung"": ""Rửa sạch, thêm ít muối giã nát, vắt lấy nước uống, bã dùng đắp lên nơi vú sưng đau. Thường chỉ dùng $2-3$ lần là đỡ (kinh nghiệm dân gian)."", ""GhiChu"": ""CT_VT_VN_T88"", ""score"": 2.0, ""sort_weight"": 3.0}, {""ChuThe"": ""Bệnh Sưng vú"", ""QuanHe"": ""Được chữa bằng (ViThuoc)"", ""DoiTuong"": ""Vị thuốc Bồ Công Anh Trung Quốc"", ""LieuDung"": ""Tham khảo liều dùng chung của vị thuốc"", ""CachDung"": ""Dùng trong các bệnh sưng vú, mụn nhọt, tiểu tiện khó khăn, ít sữa"", ""GhiChu"": ""[Nguồn]: CT_VT_VN_T89"", ""score"": 2.0, ""sort_weight"": 3.0}, {""ChuThe"": ""Bệnh Sưng vú"", ""QuanHe"": ""Được chữa bằng (ViThuoc)"", ""DoiTuong"": ""Vị thuốc Hạt gấc"", ""LieuDung"": ""Tham khảo liều dùng chung của vị thuốc"", ""CachDung"": ""Giã nhân hạt gấc với một ít rượu ($30$-$40^{circ}$) đắp lên nơi sưng đau."", ""GhiChu"": """", ""score"": 2.0, ""sort_weight"": 3.0}, {""ChuThe"": ""Bệnh Sưng vú"", ""QuanHe"": ""Được chữa bằng (ViThuoc)"", ""DoiTuong"": ""Vị thuốc Bạch chỉ"", ""LieuDung"": ""Tham khảo liều dùng chung của vị thuốc"", ""CachDung"": ""Dùng ngoài, có thể dùng chữa sưng vú, tràng nhạc, ghẻ lở, đỡ đau hút mủ"", ""GhiChu"": """", ""score"": 2.0, ""sort_weight"": 3.0}, {""ChuThe"": ""Bệnh Sưng vú"", ""QuanHe"": ""Được chữa bằng (ViThuoc)"", ""DoiTuong"": ""Vị thuốc Rau má"", ""LieuDung"": ""Tham khảo liều dùng chung của vị thuốc"", ""CachDung"": ""Chỉ định lâm sàng theo kinh nghiệm"", ""GhiChu"": ""CT_VT_VN_T650"", ""score"": 2.0, ""sort_weight"": 3.0}, {""ChuThe"": ""Triệu chứng Vú sưng nứt"", ""QuanHe"": ""Được chữa bằng (ViThuoc)"", ""DoiTuong"": ""Vị thuốc Rau mồng tơi"", ""LieuDung"": ""Tham khảo liều dùng chung của vị thuốc"", ""CachDung"": ""Rau mồng tơi giã đắp"", ""GhiChu"": ""CT_VT_VN_T482"", ""score"": 2.0}, {""ChuThe"": ""Triệu chứng Sưng vú"", ""QuanHe"": ""Được chữa bằng (ViThuoc)"", ""DoiTuong"": ""Vị thuốc Vòi voi"", ""LieuDung"": ""Tham khảo liều dùng chung của vị thuốc"", ""CachDung"": ""Dùng ngoài để đắp theo kinh nghiệm cổ truyền"", ""GhiChu"": ""đinh nhọt giai đoạn chưa có mủ"", ""score"": 2.0}, {""ChuThe"": ""Triệu chứng Sưng vú"", ""QuanHe"": ""Được chữa bằng (ViThuoc)"", ""DoiTuong"": ""Vị thuốc Bạch đồng nữ"", ""LieuDung"": ""Tham khảo liều dùng chung của vị thuốc"", ""CachDung"": ""Không có thông tin"", ""GhiChu"": ""Sưng vú. Rễ bạch đồng nữ. Chỉ định lâm sàng theo kinh nghiệm. Nguồn: CT_VT_VN_T53."", ""score"": 2.0}, {""ChuThe"": ""Triệu chứng Sưng vú"", ""QuanHe"": ""Được chữa bằng (ViThuoc)"", ""DoiTuong"": ""Vị thuốc Na"", ""LieuDung"": ""Quả na điếc giã nhỏ"", ""CachDung"": ""Đắp lên vú bị sưng"", ""GhiChu"": ""[Nguồn]: CT_VT_VN_T641"", ""score"": 2.0}, {""ChuThe"": ""Triệu chứng Sưng vú"", ""QuanHe"": ""Được chữa bằng (ViThuoc)"", ""DoiTuong"": ""Vị thuốc Sài đất"", ""LieuDung"": ""Tham khảo liều dùng chung của vị thuốc"", ""CachDung"": ""Sài đất tươi giã nát đắp lên | Ngày 2-3 lần"", ""GhiChu"": ""CT_VT_VN_T103"", ""score"": 2.0}, {""ChuThe"": ""Bệnh Sưng vú"", ""QuanHe"": ""Được chữa bằng (BaiThuoc)"", ""DoiTuong"": ""Bài thuốc Sưng vú Liên kiều"", ""LieuDung"": ""Chưa ghi nhận"", ""CachDung"": ""Chưa ghi nhận"", ""GhiChu"": """", ""score"": 2.0, ""sort_weight"": 3.0}, {""ChuThe"": ""Bệnh Sưng vú"", ""QuanHe"": ""Được chữa bằng (BaiThuoc)"", ""DoiTuong"": ""Bài thuốc Sung Vu Đại hải"", ""LieuDung"": ""Chưa ghi nhận"", ""CachDung"": ""Chưa ghi nhận"", ""GhiChu"": """", ""score"": 2.0, ""sort_weight"": 3.0}, {""ChuThe"": ""Bệnh Sưng vú"", ""QuanHe"": ""Được chữa bằng (BaiThuoc)"", ""DoiTuong"": ""Bài thuốc Sưng vú bồ kết"", ""LieuDung"": ""Mỗi lần uống $4g$ bột này"", ""CachDung"": ""Chưa ghi nhận"", ""GhiChu"": """", ""score"": 2.0, ""sort_weight"": 3.0}]']","Bệnh sưng vú có thể được chữa bằng các vị thuốc và bài thuốc sau đây:

**Các vị thuốc:**

*   **Khế:** Tham khảo liều dùng chung của vị thuốc, chỉ định lâm sàng theo kinh nghiệm.
*   **Chè vằng:** Tham khảo liều dùng chung của vị thuốc, chỉ định lâm sàng theo kinh nghiệm (CT\_VT\_VN\_T137).
*   **Cỏ sữa nhỏ lá:** Tham khảo liều dùng chung của vị thuốc, chỉ định lâm sàng theo kinh nghiệm (CT\_VT\_VN\_T215).
*   **Cỏ bợ:** Giã cây tươi, bã đắp lên (CT\_VT\_VN\_T253).
*   **Quít - Trần bì:** Ngày dùng 6-12g, hơ nóng đắp ngoài. Có khi phơi khô sắc uống như vỏ quít. (Lá quít)
*   **Sim:** Giã nát đắp lên (Lá sim tươi, Ngày 2-3 lần). Tham khảo liều dùng chung của vị thuốc.
*   **Ích mẫu:** Thân và quả ích mẫu giã đắp hoặc sắc lấy nước rửa. Tham khảo liều dùng chung của vị thuốc, chỉ định lâm sàng theo kinh nghiệm.
*   **Tía tô:** 10g, sắc lấy nước uống, bã đắp vào vú.
*   **Mạn kinh tử:** 4g, hoà với rượu, gạn lấy rượu uống còn bã đắp lên vú (theo Đặc huệ phương ghi lại trong Bản thảo cương mục).
*   **Ngưu bàng:** Tham khảo liều dùng chung của vị thuốc, chỉ định lâm sàng theo kinh nghiệm (Quả ngưu bàng).
*   **Qua lâu nhân:** Tham khảo liều dùng chung và cách dùng chung của vị thuốc.
*   **Xạ can:** Tham khảo liều dùng chung của vị thuốc, chỉ định lâm sàng theo kinh nghiệm (tắc tia sữa).
*   **Nhôi:** Tham khảo liều dùng chung của vị thuốc, chỉ định lâm sàng theo kinh nghiệm (CT\_VT\_VN\_T77).
*   **Bồ công anh Việt Nam:** Lá bồ công anh tươi 20-40g, rửa sạch, thêm ít muối giã nát, vắt lấy nước uống, bã dùng đắp lên nơi vú sưng đau. Thường chỉ dùng 2-3 lần là đỡ (kinh nghiệm dân gian) (CT\_VT\_VN\_T88).
*   **Bồ Công Anh Trung Quốc:** Tham khảo liều dùng chung của vị thuốc, dùng trong các bệnh sưng vú, mụn nhọt, tiểu tiện khó khăn, ít sữa ([Nguồn]: CT\_VT\_VN\_T89).
*   **Hạt gấc:** Tham khảo liều dùng chung của vị thuốc, giã nhân hạt gấc với một ít rượu (30-40°) đắp lên nơi sưng đau.
*   **Bạch chỉ:** Tham khảo liều dùng chung của vị thuốc, dùng ngoài, có thể dùng chữa sưng vú, tràng nhạc, ghẻ lở, đỡ đau hút mủ.
*   **Rau má:** Tham khảo liều dùng chung của vị thuốc, chỉ định lâm sàng theo kinh nghiệm (CT\_VT\_VN\_T650).

**Các bài thuốc:**

*   **Bài thuốc Sưng vú Liên kiều:** Chưa ghi nhận liều dùng và cách dùng.
*   **Bài thuốc Sung Vu Đại hải:** Chưa ghi nhận liều dùng và cách dùng.
*   **Bài thuốc Sưng vú bồ kết:** Mỗi lần uống 4g bột này, chưa ghi nhận cách dùng.

**Thông tin tham khảo thêm:**

*   Đối với triệu chứng vú sưng nứt, có thể dùng **Rau mồng tơi** giã đắp (CT\_VT\_VN\_T482). Tham khảo liều dùng chung của vị thuốc.
*   Đối với triệu chứng sưng vú, có thể dùng:
    *   **Vòi voi:** Dùng ngoài để đắp theo kinh nghiệm cổ truyền (đinh nhọt giai đoạn chưa có mủ). Tham khảo liều dùng chung của vị thuốc.
    *   **Bạch đồng nữ:** Rễ bạch đồng nữ. Chỉ định lâm sàng theo kinh nghiệm. Nguồn: CT\_VT\_VN\_T53. Tham khảo liều dùng chung của vị thuốc.
    *   **Na:** Quả na điếc giã nhỏ đắp lên vú bị sưng ([Nguồn]: CT\_VT\_VN\_T641).
    *   **Sài đất:** Sài đất tươi giã nát đắp lên, ngày 2-3 lần (CT\_VT\_VN\_T103). Tham khảo liều dùng chung của vị thuốc.","Bạch đồng nữ, Na, Sài đất, Vòi voi",1.0,0.4202562946983287,0.9999999999,1.0,0.26546471284684936
Vị thuốc ngô thù du tham gia vào bài thuốc để chữa những bệnh gì?,"['[{""ChuThe"": ""Vị thuốc Ngô thù du"", ""QuanHe"": ""Tham gia bài thuốc [Bài thuốc Non Mua Ngô thù du] để chữa"", ""DoiTuong"": ""Bệnh Non Mua"", ""LieuDung"": ""Chưa ghi nhận"", ""CachDung"": ""Nước $300ml$, sắc còn $100ml$, chia 3 lần uống trong ngày"", ""GhiChu"": ""không ỉa"", ""score"": 2.0, ""sort_weight"": 3.0}, {""ChuThe"": ""Vị thuốc Ngô thù du"", ""QuanHe"": ""Tham gia bài thuốc [Bài thuốc Rối loạn tiêu hóa Thù du] để chữa"", ""DoiTuong"": ""Bệnh Rối loạn tiêu hóa"", ""LieuDung"": ""Chưa ghi nhận"", ""CachDung"": ""Tất cả tán thành bột, trộn đều. Chia 3 lần uống trong ngày"", ""GhiChu"": """", ""score"": 2.0, ""sort_weight"": 3.0}]']","Vị thuốc **Ngô thù du** tham gia vào các bài thuốc sau để chữa bệnh:

*   Bài thuốc **Non Mua Ngô thù du** để chữa bệnh Non Mua. Cách dùng: Nước 300ml, sắc còn 100ml, chia 3 lần uống trong ngày (không ỉa).
*   Bài thuốc **Rối loạn tiêu hóa Thù du** để chữa bệnh Rối loạn tiêu hóa. Cách dùng: Tất cả tán thành bột, trộn đều. Chia 3 lần uống trong ngày.","Non Mua, Rối loạn tiêu hóa",1.0,0.5584829510931884,0.9999999999,1.0,0.5654547555621257
Bệnh vế có thể dùng vị thuốc hoặc bài thuốc nào để chữa?,"['[{""ChuThe"": ""Triệu chứng Vết thương"", ""QuanHe"": ""Được chữa bằng (ViThuoc)"", ""DoiTuong"": ""Vị thuốc Bông"", ""LieuDung"": ""Lá thuốc bỏng tươi"", ""CachDung"": ""Đắp vết thương"", ""GhiChu"": ""[Nguồn]: CT_VT_VN_T132"", ""score"": 2.0}, {""ChuThe"": ""Triệu chứng Vết thương"", ""QuanHe"": ""Được chữa bằng (ViThuoc)"", ""DoiTuong"": ""Vị thuốc Cẩm xà lặc"", ""LieuDung"": ""Tham khảo liều dùng chung của vị thuốc"", ""CachDung"": ""Lá cây này giã nát đắp lên"", ""GhiChu"": """", ""score"": 2.0}, {""ChuThe"": ""Bệnh Tụ máu ở vết thương"", ""QuanHe"": ""Được chữa bằng (ViThuoc)"", ""DoiTuong"": ""Vị thuốc Đỉa"", ""LieuDung"": ""Tham khảo liều dùng chung của vị thuốc"", ""CachDung"": ""Dùng dưới dạng thuốc tiêm, thuốc xoa"", ""GhiChu"": ""Men $hirudin$ (chiết từ đỉa). Dùng dưới dạng thuốc tiêm, thuốc xoa. Nguồn: CT_VT_VN_T1047. Đối tượng: Người. Liều lượng: Tham khảo liều dùng chung của vị thuốc. Cách dùng: Dùng dưới dạng thuốc tiêm, thuốc xoa."", ""score"": 2.0}, {""ChuThe"": ""Triệu chứng Vết loét"", ""QuanHe"": ""Được chữa bằng (ViThuoc)"", ""DoiTuong"": ""Vị thuốc Đơn trăng (Hé mọ)"", ""LieuDung"": ""Tham khảo liều dùng chung của vị thuốc"", ""CachDung"": ""Giã nát, đắp"", ""GhiChu"": ""[Nguồn]: CT_VT_VN_T220"", ""score"": 2.0}, {""ChuThe"": ""Bệnh Vết loét"", ""QuanHe"": ""Được chữa bằng (ViThuoc)"", ""DoiTuong"": ""Vị thuốc Ba chạc"", ""LieuDung"": ""Tham khảo liều dùng chung của vị thuốc"", ""CachDung"": ""Nấu với nước để rửa"", ""GhiChu"": ""Lá và cành tươi"", ""score"": 2.0}, {""ChuThe"": ""Triệu chứng Vết thương"", ""QuanHe"": ""Được chữa bằng (ViThuoc)"", ""DoiTuong"": ""Vị thuốc Sắn thuyền"", ""LieuDung"": ""Tham khảo liều dùng chung của vị thuốc"", ""CachDung"": ""Lá sắn thuyền tươi giã nát đắp lên vết thương"", ""GhiChu"": ""CT_VT_VN_T158, CT_VT_VN_T159"", ""score"": 2.0}, {""ChuThe"": ""Bệnh Vết loét"", ""QuanHe"": ""Được chữa bằng (ViThuoc)"", ""DoiTuong"": ""Vị thuốc Lù lũ đực"", ""LieuDung"": ""Tham khảo liều dùng chung của vị thuốc"", ""CachDung"": ""Dùng rửa ngoài"", ""GhiChu"": ""Nước sắc cây lu lu đực"", ""score"": 2.0}, {""ChuThe"": ""Bệnh Vết loét"", ""QuanHe"": ""Được chữa bằng (ViThuoc)"", ""DoiTuong"": ""Vị thuốc Hàn the"", ""LieuDung"": ""Không kể liều lượng"", ""CachDung"": ""Giã nát, đắp ngoài"", ""GhiChu"": ""CT_VT_VN_T166"", ""score"": 2.0}, {""ChuThe"": ""Bệnh Vết loét"", ""QuanHe"": ""Được chữa bằng (ViThuoc)"", ""DoiTuong"": ""Vị thuốc Thóc lép"", ""LieuDung"": ""Tham khảo liều dùng chung của vị thuốc"", ""CachDung"": ""Ngày dùng $6$ đến $16g$ dưới dạng thuốc sắc hay giã nát, (tươi) vắt lấy nước uống. Dùng ngoài không kể liều lượng"", ""GhiChu"": ""Vết loét vết thương, rắn cắn, phù thũng, lợi tiểu | Rễ thóc lép | [Nguồn]: CT_VT_VN_T159"", ""score"": 2.0}, {""ChuThe"": ""Bệnh Vết loét"", ""QuanHe"": ""Được chữa bằng (ViThuoc)"", ""DoiTuong"": ""Vị thuốc Cúc liên chi dại"", ""LieuDung"": ""Liều nhỏ tăng dần từ $100mg$ đến $2g$"", ""CachDung"": ""Cây cúc liên chỉ dại"", ""GhiChu"": ""[Nguồn]: CT_VT_VN_T114"", ""score"": 2.0}, {""ChuThe"": ""Bệnh Vết loét"", ""QuanHe"": ""Được chữa bằng (ViThuoc)"", ""DoiTuong"": ""Vị thuốc Bàng"", ""LieuDung"": ""Tham khảo liều dùng chung của vị thuốc"", ""CachDung"": ""Rửa ngoài"", ""GhiChu"": ""CT_VT_VN_T217"", ""score"": 2.0}, {""ChuThe"": ""Bệnh Vết loét"", ""QuanHe"": ""Được chữa bằng (ViThuoc)"", ""DoiTuong"": ""Vị thuốc Rau om"", ""LieuDung"": ""Không rõ"", ""CachDung"": ""Giã nát đắp lên vết thương, vết loét"", ""GhiChu"": ""CT_VT_VN_T284"", ""score"": 2.0}, {""ChuThe"": ""Bệnh Vết loét"", ""QuanHe"": ""Được chữa bằng (ViThuoc)"", ""DoiTuong"": ""Vị thuốc Keo nước hoa"", ""LieuDung"": ""Tham khảo liều dùng chung của vị thuốc"", ""CachDung"": ""Giã nát hoặc sắc lấy nước rửa, bã đắp lên"", ""GhiChu"": ""Lá cây Keo nước hoa dùng để giã nát hoặc sắc lấy nước rửa, bã đắp lên vết thương, vết loét. Đây là chỉ định trực tiếp từ vị thuốc nên không tạo bài thuốc BT_."", ""score"": 2.0}, {""ChuThe"": ""Bệnh Vết loét"", ""QuanHe"": ""Được chữa bằng (ViThuoc)"", ""DoiTuong"": ""Vị thuốc Dứa bà"", ""LieuDung"": ""Tham khảo liều dùng chung của vị thuốc"", ""CachDung"": ""Giã nát đắp lên"", ""GhiChu"": ""Lá dứa bà"", ""score"": 2.0}, {""ChuThe"": ""Bệnh Vết loét"", ""QuanHe"": ""Được chữa bằng (ViThuoc)"", ""DoiTuong"": ""Vị thuốc Dung"", ""LieuDung"": ""Tham khảo liều dùng chung của vị thuốc"", ""CachDung"": ""Sắc uống (Ấn Độ)"", ""GhiChu"": ""CT_VT_VN_T430"", ""score"": 2.0}, {""ChuThe"": ""Bệnh Vết loét"", ""QuanHe"": ""Được chữa bằng (ViThuoc)"", ""DoiTuong"": ""Vị thuốc Ổi"", ""LieuDung"": ""Tham khảo liều dùng chung của vị thuốc | $15$g"", ""CachDung"": ""Dùng ngoài để rửa | Sắc với $200$ml nước, nấu cại còn chừng $100$ml, uống trong người"", ""GhiChu"": ""Vỏ rễ và vỏ thân"", ""score"": 2.0}, {""ChuThe"": ""Bệnh Vết loét"", ""QuanHe"": ""Được chữa bằng (ViThuoc)"", ""DoiTuong"": ""Vị thuốc Sim"", ""LieuDung"": ""Tham khảo liều dùng chung của vị thuốc"", ""CachDung"": ""Dùng để rửa"", ""GhiChu"": ""Búp và lá sim non"", ""score"": 2.0}, {""ChuThe"": ""Bệnh Vết loét"", ""QuanHe"": ""Được chữa bằng (ViThuoc)"", ""DoiTuong"": ""Vị thuốc Đại"", ""LieuDung"": ""Dùng như vỏ thân, nhưng với liều thấp hơn"", ""CachDung"": ""Dùng như vỏ thân, nhưng với liều thấp hơn"", ""GhiChu"": ""[Nguồn]: CT_VT_VN_T463"", ""score"": 2.0}, {""ChuThe"": ""Bệnh Vết loét"", ""QuanHe"": ""Được chữa bằng (ViThuoc)"", ""DoiTuong"": ""Vị thuốc Đậu cọc rào"", ""LieuDung"": ""Tham khảo liều dùng chung của vị thuốc"", ""CachDung"": ""Bôi lên vết thương hay vết loét, khi khô sẽ thành một màng che như kiểu màng collodion"", ""GhiChu"": ""Nhựa mủ"", ""score"": 2.0}, {""ChuThe"": ""Bệnh Vết loét"", ""QuanHe"": ""Được chữa bằng (ViThuoc)"", ""DoiTuong"": ""Vị thuốc Bông ổi"", ""LieuDung"": ""Tham khảo liều dùng chung của vị thuốc"", ""CachDung"": ""Giã nát đắp lên vết thương, vết loét"", ""GhiChu"": ""Lá cây bông ổi có tính chất sát trùng lên da, cầm máu"", ""score"": 2.0}, {""ChuThe"": ""Bệnh Vết loét"", ""QuanHe"": ""Được chữa bằng (ViThuoc)"", ""DoiTuong"": ""Vị thuốc Đào lộn hột"", ""LieuDung"": ""Tham khảo liều dùng chung của vị thuốc"", ""CachDung"": ""Dùng chữa"", ""GhiChu"": ""Bôm đào lộn hột. CT_VT_VN_T571"", ""score"": 2.0}, {""ChuThe"": ""Bệnh Vết loét"", ""QuanHe"": ""Được chữa bằng (ViThuoc)"", ""DoiTuong"": ""Vị thuốc Mắm"", ""LieuDung"": ""Cao lỏng mắm 50$\\\\%$ pha với nước 50$\\\\%$"", ""CachDung"": ""Đắp lên vết loét"", ""GhiChu"": ""Cao lỏng mắm 50$\\\\%$ pha với nước 50$\\\\%$ | Đắp lên vết loét | [Nguồn]: CT_VT_VN_T575"", ""score"": 2.0}, {""ChuThe"": ""Bệnh Vết loét"", ""QuanHe"": ""Được chữa bằng (ViThuoc)"", ""DoiTuong"": ""Vị thuốc Cúc áo"", ""LieuDung"": ""Tham khảo liều dùng chung của vị thuốc"", ""CachDung"": ""Nước ép của lá hay nước sắc của lá. Đắp lên vết thương, vết loét"", ""GhiChu"": ""[Nguồn]: CT_VT_VN_T580"", ""score"": 2.0}, {""ChuThe"": ""Bệnh Vết loét"", ""QuanHe"": ""Được chữa bằng (ViThuoc)"", ""DoiTuong"": ""Vị thuốc Muống biển"", ""LieuDung"": ""Tham khảo liều dùng chung của vị thuốc"", ""CachDung"": ""Lá muống biển tươi giã nát. Đắp lên vết thương"", ""GhiChu"": ""CT_VT_VN_T639"", ""score"": 2.0}, {""ChuThe"": ""Bệnh Vết lo loét"", ""QuanHe"": ""Được chữa bằng (ViThuoc)"", ""DoiTuong"": ""Vị thuốc Bò cử ve"", ""LieuDung"": ""Chưa ghi nhận"", ""CachDung"": ""Vỏ cây cạo lấy bột rắc lên"", ""GhiChu"": ""Chỉ định lâm sàng theo kinh nghiệm. Nguồn: CT_VT_VN_T109"", ""score"": 2.0}, {""ChuThe"": ""Bệnh Vết lo loét"", ""QuanHe"": ""Được chữa bằng (ViThuoc)"", ""DoiTuong"": ""Vị thuốc Dây ký ninh"", ""LieuDung"": ""Tham khảo liều dùng chung của vị thuốc"", ""CachDung"": ""Dùng đắp hoặc sắc lấy nước rửa"", ""GhiChu"": ""Vết lở loét"", ""score"": 2.0}, {""ChuThe"": ""Bệnh Vết lo loét"", ""QuanHe"": ""Được chữa bằng (ViThuoc)"", ""DoiTuong"": ""Vị thuốc Núc nác"", ""LieuDung"": ""không kể liều lượng"", ""CachDung"": ""tán bột, rắc lên vết thương"", ""GhiChu"": ""mụn nhọt vỡ lâu ngày không liền miệng"", ""score"": 2.0}, {""ChuThe"": ""Bệnh Vết loét"", ""QuanHe"": ""Được chữa bằng (ViThuoc)"", ""DoiTuong"": ""Vị thuốc Lá tiết dê"", ""LieuDung"": ""Tham khảo liều dùng chung của vị thuốc"", ""CachDung"": ""Dùng giã nát đắp lên"", ""GhiChu"": ""CT_VT_VN_T288"", ""score"": 2.0}, {""ChuThe"": ""Triệu chứng Vết loét"", ""QuanHe"": ""Được chữa bằng (ViThuoc)"", ""DoiTuong"": ""Vị thuốc Dầu rái trắng"", ""LieuDung"": ""Chưa ghi nhận"", ""CachDung"": ""Đắp ngoài"", ""GhiChu"": ""Tham khảo liều dùng chung của vị thuốc"", ""score"": 2.0}, {""ChuThe"": ""Triệu chứng Vết thương"", ""QuanHe"": ""Được chữa bằng (ViThuoc)"", ""DoiTuong"": ""Vị thuốc Đơn trăng (Hé mọ)"", ""LieuDung"": ""Tham khảo liều dùng chung của vị thuốc"", ""CachDung"": ""Giã nát, đắp"", ""GhiChu"": ""[Nguồn]: CT_VT_VN_T220"", ""score"": 2.0}]']",Hệ thống y văn hiện tại chưa ghi nhận dữ liệu về vấn đề này.,Thường sơn,0.0,0.0,0.0,0.0,0.2342279720351018
Bệnh chai chân có thể dùng vị thuốc hoặc bài thuốc nào để chữa?,"['[{""ChuThe"": ""Bệnh Chai chân"", ""QuanHe"": ""Được chữa bằng (ViThuoc)"", ""DoiTuong"": ""Vị thuốc Đào lộn hột"", ""LieuDung"": ""Tham khảo liều dùng chung của vị thuốc"", ""CachDung"": ""Dùng chữa"", ""GhiChu"": ""Bôm đào lộn hột. CT_VT_VN_T571"", ""score"": 2.0, ""sort_weight"": 3.0}, {""ChuThe"": ""Bệnh Chai chân"", ""QuanHe"": ""Được chữa bằng (ViThuoc)"", ""DoiTuong"": ""Vị thuốc Vị thuốc"", ""LieuDung"": ""Tham khảo liều dùng chung của vị thuốc"", ""CachDung"": ""Chưa ghi nhận"", ""GhiChu"": """", ""score"": 2.0, ""sort_weight"": 3.0}, {""ChuThe"": ""Bệnh Chai chân"", ""QuanHe"": ""Được chữa bằng (BaiThuoc)"", ""DoiTuong"": ""Bài thuốc Chai chân Cỏ trói gà"", ""LieuDung"": ""Cây [Cỏ trói gà] ngâm trong $3phần$ rượu"", ""CachDung"": ""Chưa ghi nhận"", ""GhiChu"": ""Chỉ định lâm sàng theo kinh nghiệm | [Nguồn]: CT_VT_VN_T725"", ""score"": 2.0, ""sort_weight"": 3.0}]']","Dựa trên y văn, bệnh chai chân có thể được chữa bằng các vị thuốc và bài thuốc sau:

**Vị thuốc Đào lộn hột:** Dùng chữa bệnh chai chân. Tham khảo liều dùng chung của vị thuốc.

**Bài thuốc Chai chân Cỏ trói gà:** Cây Cỏ trói gà ngâm trong 3 phần rượu. Chỉ định lâm sàng theo kinh nghiệm.","Chai chân Cỏ trói gà, , Đào lộn hột",1.0,0.47338917976359,0.9999999999,1.0,0.5483464259462723
Vị thuốc mâm xôi tham gia vào bài thuốc để chữa những bệnh gì?,"['[{""ChuThe"": ""Vị thuốc Mâm xôi"", ""QuanHe"": ""Tham gia bài thuốc [Bài thuốc Chậm tiêu mâm xôi] để chữa"", ""DoiTuong"": ""Bệnh Chậm tiêu"", ""LieuDung"": ""$15-30g$"", ""CachDung"": ""Sắc hoặc pha uống trước bữa ăn 15-20 phút"", ""GhiChu"": ""Cành lá mâm xôi"", ""score"": 2.0, ""sort_weight"": 3.0}]']","Vị thuốc **Mâm xôi** tham gia vào bài thuốc **Bài thuốc Chậm tiêu mâm xôi** để chữa bệnh Chậm tiêu. Liều dùng là 15-30g cành lá mâm xôi, sắc hoặc pha uống trước bữa ăn 15-20 phút.",Chậm tiêu,1.0,0.5517151337000812,0.9999999999,1.0,0.5727141418955661
Bệnh suy nhược thần kinh có thể dùng vị thuốc hoặc bài thuốc nào để chữa?,"['[{""ChuThe"": ""Bệnh Suy nhược thần kinh"", ""QuanHe"": ""Được chữa bằng (BaiThuoc)"", ""DoiTuong"": ""Bài thuốc Viêm ruột mạn tính Khiếm thực"", ""LieuDung"": ""Ngày uống 3 lần, mỗi lần $3-5g$."", ""CachDung"": ""Tán nhỏ, thêm mật làm thành viên. Uống với nước nóng."", ""GhiChu"": ""CT_VT_VN_T864"", ""score"": 2.0, ""sort_weight"": 3.0}, {""ChuThe"": ""Bệnh Suy nhược thần kinh"", ""QuanHe"": ""Được chữa bằng (BaiThuoc)"", ""DoiTuong"": ""Bệnh Suy nhược thần kinh nhục thung dung"", ""LieuDung"": ""Chưa ghi nhận"", ""CachDung"": ""Chưa ghi nhận"", ""GhiChu"": """", ""score"": 2.0, ""sort_weight"": 3.0}, {""ChuThe"": ""Bệnh Thần kinh suy nhược"", ""QuanHe"": ""Được chữa bằng (BaiThuoc)"", ""DoiTuong"": ""Bệnh Liệt dương (Sâm cau)"", ""LieuDung"": ""Chưa ghi nhận"", ""CachDung"": ""Ngâm trong vòng 7 ngày hay hơn. Mỗi ngày uống hai lần, vào trước hai bữa ăn chính, mỗi lần một chén nhỏ chừng $25-30ml$"", ""GhiChu"": ""CT_VT_VN_T927"", ""score"": 2.0}, {""ChuThe"": ""Triệu chứng Thần kinh suy nhược"", ""QuanHe"": ""Được chữa bằng (ViThuoc)"", ""DoiTuong"": ""Vị thuốc Hồi đầu thảo"", ""LieuDung"": ""4 đến $20$g dưới dạng thuốc sắc"", ""CachDung"": ""Có thể ngâm rượu uống"", ""GhiChu"": ""[Nguồn]: CT_VT_VN_T329"", ""score"": 2.0}, {""ChuThe"": ""Bệnh Suy nhược thần kinh"", ""QuanHe"": ""Được chữa bằng (ViThuoc)"", ""DoiTuong"": ""Vị thuốc Tắc kè"", ""LieuDung"": ""Tham khảo liều dùng chung của vị thuốc"", ""CachDung"": ""Tắc kè mổ bỏ ruột, sấy khô, cắt bỏ đầu, chân ngâm với rượu; mỗi một lít rượu 35-40° ngâm 2 đến 5 con. Ngâm trong một tuần lễ trở lên. Lọc lấy rượu trong mà uống. Ngày uống ($15-30ml$) chừng nửa cốc con. Uống nguyên hoặc pha với mật ong cho ngọt. Có thể thêm ít trần bì hay vỏ cam vào cho thơm. Uống vào buổi tối hay sáng sớm"", ""GhiChu"": ""Suy nhược thần kinh, đau ngang thắt lưng. CT_VT_VN_T971"", ""score"": 2.0, ""sort_weight"": 3.0}, {""ChuThe"": ""Triệu chứng Suy nhược thần kinh"", ""QuanHe"": ""Được chữa bằng (ViThuoc)"", ""DoiTuong"": ""Vị thuốc Đông trùng hạ thảo"", ""LieuDung"": ""Tham khảo liều dùng chung của vị thuốc"", ""CachDung"": ""Chỉ định lâm sàng theo kinh nghiệm"", ""GhiChu"": ""CT_VT_VN_T901"", ""score"": 2.0}, {""ChuThe"": ""Bệnh Thần kinh suy nhược"", ""QuanHe"": ""Được chữa bằng (ViThuoc)"", ""DoiTuong"": ""Vị thuốc Hải sâm"", ""LieuDung"": ""Tham khảo liều dùng chung của vị thuốc"", ""CachDung"": ""Không rõ"", ""GhiChu"": ""Chỉ định lâm sàng theo kinh nghiệm"", ""score"": 2.0}, {""ChuThe"": ""Bệnh Thần kinh suy nhược"", ""QuanHe"": ""Được chữa bằng (ViThuoc)"", ""DoiTuong"": ""Vị thuốc Viễn chí"", ""LieuDung"": ""$3-6g$"", ""CachDung"": ""Dạng thuốc sắc"", ""GhiChu"": ""CT_VT_VN_T749"", ""score"": 2.0}, {""ChuThe"": ""Bệnh Thần kinh suy nhược"", ""QuanHe"": ""Được chữa bằng (ViThuoc)"", ""DoiTuong"": ""Vị thuốc Vông nem"", ""LieuDung"": ""Tham khảo liều dùng chung của vị thuốc"", ""CachDung"": ""Tham khảo cách dùng chung của vị thuốc"", ""GhiChu"": """", ""score"": 2.0}, {""ChuThe"": ""Bệnh Thần kinh suy nhược"", ""QuanHe"": ""Được chữa bằng (ViThuoc)"", ""DoiTuong"": ""Vị thuốc Thạch sùng"", ""LieuDung"": ""Tham khảo liều dùng chung của vị thuốc"", ""CachDung"": ""Uống"", ""GhiChu"": ""Thạch sùng (phơi hay sấy khô tán bột)"", ""score"": 2.0}]']","Dựa trên y văn, bệnh suy nhược thần kinh có thể được chữa bằng các bài thuốc và vị thuốc sau:

**Các bài thuốc và vị thuốc chữa bệnh suy nhược thần kinh:**

*   **Bài thuốc Viêm ruột mạn tính Khiếm thực:** Ngày uống 3 lần, mỗi lần 3-5g. Tán nhỏ, thêm mật làm thành viên. Uống với nước nóng.
*   **Bài thuốc Suy nhược thần kinh nhục thung dung:** Liều dùng và cách dùng chưa được ghi nhận.
*   **Vị thuốc Tắc kè:** Tham khảo liều dùng chung của vị thuốc. Tắc kè mổ bỏ ruột, sấy khô, cắt bỏ đầu, chân ngâm với rượu; mỗi một lít rượu 35-40° ngâm 2 đến 5 con. Ngâm trong một tuần lễ trở lên. Lọc lấy rượu trong mà uống. Ngày uống 15-30ml chừng nửa cốc con. Uống nguyên hoặc pha với mật ong cho ngọt. Có thể thêm ít trần bì hay vỏ cam vào cho thơm. Uống vào buổi tối hay sáng sớm.

**Thông tin tham khảo thêm:**

*   Đối với triệu chứng thần kinh suy nhược, có thể dùng **Vị thuốc Hồi đầu thảo:** 4 đến 20g dưới dạng thuốc sắc. Có thể ngâm rượu uống.
*   Đối với triệu chứng suy nhược thần kinh, có thể dùng **Vị thuốc Đông trùng hạ thảo:** Tham khảo liều dùng chung của vị thuốc. Chỉ định lâm sàng theo kinh nghiệm.
*   Đối với bệnh thần kinh suy nhược, có thể dùng:
    *   **Vị thuốc Hải sâm:** Tham khảo liều dùng chung của vị thuốc.
    *   **Vị thuốc Viễn chí:** 3-6g dạng thuốc sắc.
    *   **Vị thuốc Vông nem:** Tham khảo liều dùng và cách dùng chung của vị thuốc.
    *   **Vị thuốc Thạch sùng:** Tham khảo liều dùng chung của vị thuốc. Uống (Thạch sùng phơi hay sấy khô tán bột).
*   Đối với bệnh Thần kinh suy nhược có thể dùng **Bài thuốc Liệt dương (Sâm cau):** Ngâm trong vòng 7 ngày hay hơn. Mỗi ngày uống hai lần, vào trước hai bữa ăn chính, mỗi lần một chén nhỏ chừng 25-30ml.","Viêm ruột mạn Khiếm thực, Suy nhược thần kinh nhục thung dung, Tắc kè",1.0,0.4233732341166225,0.9999999999,1.0,0.29485058739160164
Vị thuốc lá bách tử tham gia vào bài thuốc để chữa những bệnh gì?,"['[{""ChuThe"": ""Vị thuốc Lá bách tử"", ""QuanHe"": ""Tham gia bài thuốc [Bài thuốc Phù thũng Khương hoạt] để chữa"", ""DoiTuong"": ""Bệnh Phù thũng"", ""LieuDung"": ""Mỗi lần uống $6$ đến $8g$. Ngày thứ $1$ uống $1$ lần, ngày thứ $2$ uống $2$ lần, ngày thứ $3$ uống $3$ lần là đủ."", ""CachDung"": ""Dùng rượu hâm nóng lên mà chiêu thuốc."", ""GhiChu"": ""CT_VT_VN_T682"", ""score"": 2.0, ""sort_weight"": 3.0}]']","Vị thuốc **Lá bách tử** tham gia vào bài thuốc **Phù thũng Khương hoạt** để chữa bệnh phù thũng. Liều dùng là mỗi lần uống 6 đến 8g, ngày thứ 1 uống 1 lần, ngày thứ 2 uống 2 lần, ngày thứ 3 uống 3 lần là đủ. Dùng rượu hâm nóng lên để chiêu thuốc.",Phù thũng,1.0,0.5364587055904105,,1.0,0.416452619806724
Bệnh đường tiêu hóa có thể dùng vị thuốc hoặc bài thuốc nào để chữa?,"['[{""ChuThe"": ""Bệnh về đường tiêu hóa"", ""QuanHe"": ""Được chữa bằng (ViThuoc)"", ""DoiTuong"": ""Vị thuốc Mật lợn"", ""LieuDung"": ""Tham khảo liều dùng chung của vị thuốc"", ""CachDung"": ""null"", ""GhiChu"": ""Chỉ định lâm sàng"", ""score"": 2.0}, {""ChuThe"": ""Bệnh Ngộ độc đường tiêu hóa"", ""QuanHe"": ""Được chữa bằng (ViThuoc)"", ""DoiTuong"": ""Vị thuốc Hoa phấn"", ""LieuDung"": ""Tham khảo liều dùng chung của vị thuốc"", ""CachDung"": ""Lá và rễ sắc uống"", ""GhiChu"": ""Chỉ định lâm sàng theo kinh nghiệm"", ""score"": 2.0}, {""ChuThe"": ""Bệnh Đường tiêu hóa"", ""QuanHe"": ""Được chữa bằng (ViThuoc)"", ""DoiTuong"": ""Vị thuốc Nấm linh chi"", ""LieuDung"": ""$2-5g$"", ""CachDung"": ""Đun nước sôi kỹ (sôi $15-30$ phút) lấy nước uống trong ngày. Nước sắc nấm linh chi có mùi thơm, vị hơi đắng, có thể thêm đường hay mật ong vào cho dễ uống"", ""GhiChu"": """", ""score"": 2.0, ""sort_weight"": 3.0}]']","Dựa trên y văn, đối với bệnh đường tiêu hóa, bạn có thể tham khảo vị thuốc sau:

*   **Nấm linh chi**: Dùng 2-5g, đun nước sôi kỹ (sôi 15-30 phút) lấy nước uống trong ngày. Nước sắc nấm linh chi có mùi thơm, vị hơi đắng, có thể thêm đường hay mật ong vào cho dễ uống.

Thông tin tham khảo thêm:

*   Đối với bệnh về đường tiêu hóa, có thể tham khảo vị thuốc **Mật lợn**. Về liều dùng, bạn cần tham khảo liều dùng chung của vị thuốc.
*   Đối với bệnh ngộ độc đường tiêu hóa, có thể tham khảo vị thuốc **Hoa phấn**. Về liều dùng, bạn cần tham khảo liều dùng chung của vị thuốc. Cách dùng: lá và rễ sắc uống.",Nấm linh chi,1.0,0.42988647964493704,0.9999999999,1.0,0.4105958346131325
Thành phần hóa học của miết giáp gồm những gì?,"['[{""ChuThe"": ""Vị thuốc Miết giáp"", ""QuanHe"": ""CO_CHUA_HOAT_CHAT"", ""DoiTuong"": ""Hoạt chất Iot"", ""LieuDung"": ""Chưa ghi nhận"", ""CachDung"": ""Chưa ghi nhận"", ""GhiChu"": ""Dược tài học-Viện dược học Nam Kinh"", ""score"": 2.0, ""sort_weight"": 3.0}, {""ChuThe"": ""Vị thuốc Miết giáp"", ""QuanHe"": ""CO_CHUA_HOAT_CHAT"", ""DoiTuong"": ""Hoạt chất Keratin"", ""LieuDung"": ""Chưa ghi nhận"", ""CachDung"": ""Chưa ghi nhận"", ""GhiChu"": ""Dược tài học-Viện dược học Nam Kinh"", ""score"": 2.0, ""sort_weight"": 3.0}, {""ChuThe"": ""Vị thuốc Miết giáp"", ""QuanHe"": ""CO_CHUA_HOAT_CHAT"", ""DoiTuong"": ""Hoạt chất Vitamin D"", ""LieuDung"": ""Chưa ghi nhận"", ""CachDung"": ""Chưa ghi nhận"", ""GhiChu"": ""Dược tài học-Viện dược học Nam Kinh"", ""score"": 2.0, ""sort_weight"": 3.0}]']","Thành phần hóa học của **Miết giáp** bao gồm:

*   Hoạt chất Iot (Dược tài học-Viện dược học Nam Kinh)
*   Hoạt chất Keratin (Dược tài học-Viện dược học Nam Kinh)
*   Hoạt chất Vitamin D (Dược tài học-Viện dược học Nam Kinh)","Iot, Keratin, Vitamin D",1.0,0.5809601455874882,0.9999999999,1.0,0.7020466644850539
"Để chữa bệnh ghẻ lở, vị thuốc tùng hương được dùng với liều lượng và cách thức như thế nào?","['[{""ChuThe"": ""Vị thuốc Tùng hương"", ""QuanHe"": ""CHU_TRI_BENH"", ""DoiTuong"": ""Bệnh Ghẻ lở"", ""LieuDung"": ""Tham khảo liều dùng chung của vị thuốc"", ""CachDung"": ""Hiện nay tùng hương thường chỉ thấy hay dùng nấu cao dán nhọt. Hầu như không thấy dùng uống trong"", ""GhiChu"": ""CT_VT_VN_T163"", ""score"": 2.0, ""sort_weight"": 3.0}]']","Để chữa bệnh ghẻ lở, **Tùng hương** được dùng như sau:

*   **Liều dùng:** Tham khảo liều dùng chung của vị thuốc.
*   **Cách dùng:** Hiện nay **Tùng hương** thường chỉ thấy hay dùng nấu cao dán nhọt. Hầu như không thấy dùng uống trong.","Để chữa bệnh ghẻ lở, vị thuốc tùng hương có liều dùng: Tham khảo liều dùng chung của vị thuốc và cách dùng: Hiện nay tùng hương thường chỉ thấy hay dùng nấu cao dán nhọt. Hầu như không thấy dùng uống trong",1.0,0.48618097847602654,0.9999999999,1.0,0.9106447977499817
Thuốc nào vừa có tính ôn vừa trực tiếp chữa bệnh tê thấp?,"['[{""ChuThe"": ""Vị thuốc Hạt gấc"", ""QuanHe"": ""Thỏa mãn đồng thời"", ""DoiTuong"": ""Ôn và Bệnh Tê thấp"", ""LieuDung"": ""Chưa ghi nhận"", ""CachDung"": ""Chưa ghi nhận"", ""GhiChu"": """"}, {""ChuThe"": ""Vị thuốc Tế Tân"", ""QuanHe"": ""Thỏa mãn đồng thời"", ""DoiTuong"": ""Ôn và Bệnh Tê thấp"", ""LieuDung"": ""Chưa ghi nhận"", ""CachDung"": ""Chưa ghi nhận"", ""GhiChu"": """"}]']","Hệ thống y văn hiện tại ghi nhận các vị thuốc có tính ôn và được dùng cho bệnh tê thấp như sau:

**Thông tin tham khảo thêm:**

*   **Hạt gấc** có tính ôn và được dùng cho bệnh tê thấp. Liều dùng và cách dùng chưa được ghi nhận.
*   **Tế Tân** có tính ôn và được dùng cho bệnh tê thấp. Liều dùng và cách dùng chưa được ghi nhận.","Hạt gấc, Tế Tân",1.0,0.4294373130486873,0.9999999999,1.0,0.5509377394880731
